id	name	nbGenes	ICSeco	ICZhou	ICSanchez	ICMazandu
GO:0008150	biological_process	1610	0.00	0.00	0.00	0.00
GO:0043085	positive regulation of catalytic activity	245	0.48	0.49	6.15	18.32
GO:0051091	positive regulation of DNA binding transcription factor activity	42	0.81	0.84	9.43	277.83
GO:0006469	negative regulation of protein kinase activity	42	0.68	0.76	9.22	1097.06
GO:0050789	regulation of biological process	1176	0.09	0.17	1.80	4.47
GO:0051649	establishment of localization in cell	144	0.42	0.41	5.33	7.46
