GO:1903609;negative regulation of inward rectifier potassium channel activity;12.0;1.0;0.9481203125901445;9.628524252492122;1503.7936590381803;9.777073627680469;0.050330620441580154;0.9481203125901445;[CAV1]
GO:0071560;cellular response to transforming growth factor beta stimulus;6.0;1.0;0.8231203125901445;9.628524252492122;97.48528473772916;5.788089581116195;0.003262744749111514;0.6191234829421188;[SFRP1, CLEC3B, CAV1, SOX6, LIMS1]
GO:0030857;negative regulation of epithelial cell differentiation;6.0;0.6634067003016617;0.6548236627409754;8.638125548464245;143.89713366415532;6.139487467954083;0.004816107564726769;0.6370939872166814;[CAV1, EZH2]
GO:0042074;cell migration involved in gastrulation;6.0;0.8259837884571596;0.7361122068187242;9.089527751759436;22.57397290845719;7.212124270218933;7.555305579894227E-4;0.6919486831672181;[RIC8A, MIXL1]
GO:0010628;positive regulation of gene expression;6.0;0.4705935272257725;0.5584170762030307;6.666693530613812;58.797024432214236;2.2471302570788807;0.001967883493859682;0.43803865843940215;[CRTC2, ZNF175, NCF1, MAML1, CCNH, GFI1, CD80, EIF4A3, ARID4A, RORA, IKZF1, GPATCH3, IKZF2, ELK1, YY1, RPS6KA4, MYC, ZXDC, DPF2, TRIM24, EP300, SOX8, SOX6, IER5, ZNF564, IER2, RPS9, RPS7, FLT3LG, PRKAB1, MED6, RUNX2, PIAS2, ERN1, ARMCX3, OLFM1, ILF3, SFRP1, KARS, IL23A, TBL1XR1, CCNE1, RFX4, HOXB4, MAX, NOLC1, RLF, SUPT6H, C3, FXR1, CCNB1, HSPH1, RAD21, HLTF, DVL3, SCAP, NLRP3, HOXC4, RIPK1, CYTL1, BPTF, TFAP2A, ZBTB17, ZNF143, DR1, CREBBP, XBP1, RHBDD1, CAV1, PBX3, EIF2AK3, EAF2, ERLIN2, FLI1, NFKB1, SETX, CDK9, NFKBIA, IL6, STAG1, TFCP2, COPS5, SP1, SP3, MAFF, BCL3, CDK2, NFE2L3, MNAT1, NFE2L1, PHF19, CDKN1C, CIITA, SETD3, ONECUT2, ELL, PTPN22, DDX41, HOXC13, BRCA1, AATF, WDR43, CKS1B, FLCN, NIPBL, LBH, C1QBP, NUP62, TMED2, CTSH, HRAS, ZNF485, SEC13, TBP, KLF13, PEG3, DTX3L, NCOA6, ITGA2, MKL1, ARNT, SENP2, SAFB, TMEM173, PPRC1, ARID1A, SIRT2, GNL3, CREB3, GAL, NCOR1, TFDP1, RBL1, TFDP2, ELF4, IRF4, MTF2, TFEC, POLR1E, MET, HDAC3, ZNF350, HDAC1, WBP2, ROCK2, POLDIP3, THBS1, RELA, ARNTL, SERTAD3, BCLAF1, CLEC3B, RXRA, U2AF2, SERTAD2, TP53INP2, CCL5, TP53INP1, LMNA, TAF1A, POLR2G, GPBP1L1, MTA2, E2F7, E2F8, TBX1, RNF20, ZNF462, CHURC1, YTHDF3, NFYC, ATAD2, ARID3B, DEK, GRHL1, USF2, CD4, NFIA, NFIB, TNIP2, NFIC, CAMK4, MARS, PSMC1, TAF7, KRAS, CAMK1, FAM98A, RAB3GAP1, MIXL1, LIMS1]
GO:0010507;negative regulation of autophagy;7.0;0.7436939687323844;0.7227663496233927;9.117698628726131;217.48068666745357;5.500407508664414;0.007278882862848883;0.6322104610454062;[BECN1, USP36, HERC1, CLEC16A, CHMP4B, PTPN22, MET, SIRT2, RASIP1, EIF4G2]
GO:0072657;protein localization to membrane;5.0;0.5756379274792419;0.5780599756005412;7.585450354983161;29.829169826127035;3.7017275965917853;9.983554695705216E-4;0.4795475332985618;[RAB3B, TRAM1, SYS1, RPL3, NCF1, ROCK2, ITGB2, ZDHHC23, SRP54, ZDHHC24, ZDHHC6, ABCA12, TRAM2, TM9SF4, RPS15, TMED2, BID, RAB8B, RPL19, PEX16, BBS2, UBL4A, GRIPAP1, RPS9, PEX19, FCER1G, RPS7, SSR2, CAV1, RAB3IP, IFT122, RPL23A, RAB11A, GAK, TM9SF1, CDK5, SLMAP, RAB13, TAOK2, CHMP4B, RAB3GAP2, RPL29, VAMP5, RAB3GAP1]
GO:0035987;endodermal cell differentiation;4.0;1.0;0.75;9.628524252492122;21.066225782797595;6.444869117505266;7.050676185779127E-4;0.5795909063862833;[ITGB2, MIXL1]
GO:2000286;receptor internalization involved in canonical Wnt signaling pathway;8.0;1.0;0.875;9.628524252492122;66.79409571189065;8.67846133901236;0.0022355382726935618;0.8188169164668168;[CAV1]
GO:0006065;UDP-glucuronate biosynthetic process;8.0;1.0;0.875;9.628524252492122;847.4108547704801;8.67846133901236;0.028362078688912176;0.8188169164668168;[UGDH, SLC35D1]
GO:1905246;negative regulation of aspartic-type peptidase activity;10.0;0.9326813400603323;0.8815816818910864;9.59573442966913;499.6307270806722;8.67846133901236;0.016722190796928726;0.8590579283277371;[NLRP7]
GO:0045907;positive regulation of vasoconstriction;8.0;0.8933024483968273;0.8216512241984136;9.57973408832269;103.52331479149503;6.280566066213989;0.003464832181136806;0.6961884407023742;[FGA, OXTR, TBXA2R, CAV1, FGG]
GO:0046952;ketone body catabolic process;5.0;0.8933024483968273;0.736892236059334;9.517298617381897;195.6316577686379;8.390779266560578;0.006547615528454911;0.7193458537639684;[OXCT2]
GO:1902895;positive regulation of pri-miRNA transcription by RNA polymerase II;12.0;1.0;0.9481203125901445;9.628524252492122;1721.2385553242598;6.599019797332524;0.0576083054325737;0.7855944919115336;[RELA, GNL3]
GO:0001570;vasculogenesis;4.0;0.8933024483968273;0.6966512241984136;9.292052015870908;21.066225782797595;5.6339389012889365;7.050676185779127E-4;0.5381198974168686;[SGPL1, CAV1, GLMN, CCM2, RASIP1]
GO:1901844;regulation of cell communication by electrical coupling involved in cardiac conduction;8.0;0.8933024483968273;0.8216512241984136;9.474373572664863;47.34252427509125;7.57984905034425;0.0015845116819816402;0.7626338329336335;[CAV1, CALM3, CALM1, CALM2]
GO:0061436;establishment of skin barrier;8.0;1.0;0.875;9.628524252492122;44.874432655588755;6.781341354126479;0.0015019068766151408;0.7217981122146513;[ABCA12, GRHL1, MET]
GO:0030206;chondroitin sulfate biosynthetic process;8.0;1.0;0.875;9.628524252492122;416.1007025877491;6.558197802812269;0.013926516049292044;0.7103865406232063;[CHPF, SLC35D1, CHST12]
GO:0000122;negative regulation of transcription by RNA polymerase II;11.0;0.6073376606709605;0.7360977826651425;8.793202583151634;1836.9481969605868;3.0544438328250214;0.0614810030062249;0.5886333519864981;[CIITA, BTG2, ZNF175, GFI1, OTUD7B, IKZF2, YY1, FLCN, NIPBL, C1QBP, MYC, SAP130, WWC3, EP300, SOX8, LRRFIP1, HIF1AN, CIC, SOX6, ZNF564, DACT1, TLE4, KLF12, PEG3, ZBTB32, ARID1A, SIRT2, DUSP22, EID1, BRMS1, NCOR1, RBL1, TBL1XR1, CCNE1, NFX1, MTF2, HOXB4, TIMELESS, LCOR, PPID, MCPH1, HDAC3, ZNF350, HDAC1, MAX, FOXG1, LRP8, RELA, MTDH, RXRA, BAG3, TPR, HIVEP1, HESX1, SUDS3, MTA2, E2F7, ZNF189, E2F8, BPTF, IRX1, TFAP2A, DR1, CREBBP, UBE2I, WFS1, CAV1, NFKB1, PER2, GFI1B, NFIA, CNOT1, NFIB, NFIC, PKIA, SP3, CDK2, NFE2L3, TAF7, EZH2]
GO:0001960;negative regulation of cytokine-mediated signaling pathway;7.0;0.7140352122741334;0.7079369713942671;8.965230035081857;244.80256319284138;5.8067817141283475;0.008193321482061134;0.6478784521606894;[IL6, HIST1H2BJ, CCL5, CAV1, RFFL]
GO:0032507;maintenance of protein location in cell;5.0;0.6763753087927167;0.6284286662572787;8.412128928167629;43.86076268124676;5.4730085344763;0.0014679802548176633;0.5701309228349632;[CD4, CDK5, GPAA1, CAV1, BCL3]
GO:0010955;negative regulation of protein processing;9.0;0.7192862368539868;0.7558837436072825;9.27570287786938;707.1969765737138;6.039404009397101;0.023669246369964203;0.705096027081865;[NLRP7, NLRC4, A2M, UBE2Z, THBS1, GLG1]
GO:0010952;positive regulation of peptidase activity;9.0;0.7140352122741334;0.7532582313173557;9.377209824211215;435.08389316762396;4.595290077388384;0.014561866354238107;0.6312439734407735;[PRELID1, DIABLO, ROCK2, CAV1, EIF2AK3, TNFRSF10A, NLRC4, HSPE1, TANK, BBC3, NLRP12, KARS, PERP, MYC, ARL6IP5, PSME2, NLRP3, CTSH, MBP, RIPK1, BID]
GO:0010951;negative regulation of endopeptidase activity;10.0;0.7671156992804218;0.7987988615011312;9.446202695698167;500.3238742612354;4.2676852910524925;0.016745389809270216;0.6334906361130068;[SERPINA3, CSTB, SERPINB1, CSTA, ITIH2, CSNK2A1, AMBP, SERPINA10, PLAUR, TNFRSF10A, NLRC4, UBE2Z, THBS1, SERPINB6, AQP1, VIL1, C3, NLRP7, RFFL, A2M]
GO:2001028;positive regulation of endothelial cell chemotaxis;10.0;0.8933024483968273;0.861892236059334;9.55953138100517;483.0357984563073;7.138016298065211;0.01616677347033737;0.7802794972956796;[P2RX4, MET]
GO:0098911;regulation of ventricular cardiac muscle cell action potential;10.0;0.7866048967936545;0.8085434602577476;9.537552474286395;102.35229487303722;7.138016298065211;0.0034256391983155283;0.7802794972956796;[CAV1]
GO:0033674;positive regulation of kinase activity;9.0;0.6073376606709605;0.6999094555157693;8.620883742029738;265.89784403492143;3.4106031799490317;0.008899361547325376;0.5706590304121504;[CDKN1A, NCF1, CCNH, ITGB3, KIF14, CIB1, IGF1R, CKS1B, AKAP13, NEK1, HRAS, PDGFRB, DUSP5, ZFP91, OXSR1, MAPK8IP3, ERN1, KARS, ALS2, IL23A, JTB, LCP2, ADNP, EPHA1, MET, ARHGEF5, VAC14, LRP8, THBS1, STK3, PPP2CA, CCNB1, HSPH1, CCL5, DVL3, NCKAP1L, RIPK1, CSK, ZNF622, CCL19, ECT2, MARK2, MAP3K3, PDE6H, XRCC5, TNFRSF10A, PILRB, CENPE, CD4, CDK5, TAOK2, KRAS, CALM3, CAMK1, CALM1, MNAT1, CALM2, EZH2]
GO:1900085;negative regulation of peptidyl-tyrosine autophosphorylation;11.0;1.0;0.9324289523296623;9.628524252492122;1790.2607340613608;9.777073627680469;0.05991841563897651;0.9324289523296623;[CAV1]
GO:1905098;negative regulation of guanyl-nucleotide exchange factor activity;6.0;0.9326813400603323;0.7894609826203107;9.55953138100517;99.11376152007192;8.16763571524637;0.003317248401482572;0.7408135829017477;[MET]
GO:1903598;positive regulation of gap junction assembly;7.0;1.0;0.8509193652572005;9.628524252492122;133.85571530024345;8.67846133901236;0.004480030328776454;0.7947362817240173;[CAV1]
GO:0006351;transcription, DNA-templated;9.0;0.5708408884191841;0.6816610693898811;8.449869256150476;581.393741231429;1.9872050686257638;0.019458725298619164;0.49786638480429696;[ZNF175, CCNH, GFI1, IKZF1, GPATCH3, IKZF2, ELK1, UBE2L3, MYC, SAP130, ZXDC, DPF2, TRIM24, SOX8, SOX6, IER5, IER2, SAP30BP, CSNK2A1, ZNF282, SND1, EID1, EWSR1, RFX4, HOXB4, ZNF276, ZNF395, ZNF394, FOXG1, ZNF20, CDCA7, RPAP1, ZNF25, RAD21, HLTF, HIVEP1, HESX1, HOXC4, HIVEP2, ZNF264, ZNF143, XBP1, SETDB1, ZNF260, XRCC5, INTS3, PBX3, EAF2, FLI1, SOX30, STAG1, ZNF30, INTS4, INTS7, EZH2, PHF3, SETD5, BTG2, SETD3, ELL, ZNF250, INTS10, ATF7IP2, HOXC13, BRCA1, WDR43, NIPBL, CHAF1B, ZMYM2, SCML1, C1QBP, CIC, ZNF485, TSC22D4, HELLS, COMMD3, BAZ1A, PPRC1, ZFX, MED29, SIRT2, MED28, NCOR1, NFX1, TFEC, MED20, DEPDC1, VGLL4, ZNF350, ZNF69, RELA, ARNTL, SERTAD3, BCLAF1, SERTAD2, GPBP1L1, ZNF462, NFYC, ATAD2, GRHL1, GTF2H4, PER2, GFI1B, NFIA, NFIB, NFIC, MARS, ZNF696, MIXL1, CRTC2, NAB1, ARID4A, YY1, EP300, ZNF326, ZNF688, ZNF564, GTF2I, TLE4, ZNF441, ZBTB32, PIAS2, ERN1, ILF3, BRMS1, ZNF93, TBL1XR1, PSPC1, TIMELESS, ADNP, ZNF550, MAX, RLF, SUPT6H, GTF2E2, ZNF549, ZNF548, NLRP3, SUDS3, ZNF544, BPTF, TRAPPC2, TFAP2A, ZBTB17, DR1, NONO, CNOT10, NFKB1, CDK9, CNOT6, IRAK1BP1, TFCP2, COPS5, CNOT1, SP1, SP3, MAFF, BCL3, CNOT3, ZNF658, NFE2L3, CNOT8, TMEM18, MNAT1, ZNF532, ZNF410, NFE2L1, PHF19, CIITA, ONECUT2, CHD1, AFF4, LBH, ZNF407, NUP62, ZNF768, ZNF525, ZNF524, LRRFIP1, HIF1AN, KLF12, TBP, KLF13, BUD31, MKL1, ARNT, SAFB, ARID1A, CREB3, TFDP1, RBL1, ZNF519, TFDP2, ELF4, IRF4, LCOR, ZNF630, ITGB3BP, GTF3C1, SMARCD2, HDAC3, HDAC1, WBP2, TFPT, POLR2B, RBBP5, TP53INP2, FAM120B, TP53INP1, TAF1A, POLR2G, ASCC3, E2F7, ZNF189, E2F8, TBX1, POLR2J3, CHURC1, EYA2, ARID3B, DEK, USF2, POLR3C, TNIP2, POLR3E, TAF7, MNDA]
GO:1901299;negative regulation of hydrogen peroxide-mediated programmed cell death;10.0;0.8933024483968273;0.861892236059334;9.59462270081644;688.8496181578963;7.9853141584524145;0.023055176795337348;0.8236103492792612;[HSPH1, MET]
GO:0007204;positive regulation of cytosolic calcium ion concentration;11.0;0.6835726970475526;0.7742153008534385;9.097896001429952;290.3013502407617;4.174954806800768;0.00971612493830514;0.645936335304707;[OXTR, CAV1, GPR55, ITPR2, CD4, P2RX4, GNAT2, TBXA2R, CALM3, CCL19, CALM1, CALM2, NTSR1, CCR10, CCR2]
GO:0090090;negative regulation of canonical Wnt signaling pathway;8.0;0.7866048967936545;0.7683024483968273;9.283683766200392;236.99226377157444;4.932886541221878;0.00793191778924446;0.6272680471207706;[TLE4, SFRP1, HDAC1, CAV1, DVL3, KLHL12, DACT1, STK3]
GO:0009617;response to bacterium;5.0;0.7508913569872202;0.6656866903545304;8.935377071932177;27.267803904038782;3.9481280100702625;9.126288572378991E-4;0.49214846190264216;[ANKRD17, FGA, FCER1G, SEH1L, HIST1H2BJ, PPP1R11, CCL20, CAV1, DEFB1, IL27, RNASE3, NLRC4, LYST, VIL1, CD4, IL6, IL23A, BCL3, NLRP3, IL12A, HIST1H2BC, HAVCR2]
GO:0071222;cellular response to lipopolysaccharide;6.0;1.0;0.8231203125901445;9.628524252492122;237.99812851129587;4.786641040901733;0.007965583176863442;0.5679093580234316;[UPF1, XBP1, ABCC2, CCL20, GFI1, CD80, PDCD1LG2, NFKB1, RELA, BCR, IL6, PABPN1, NLRP7, TBXA2R, TNIP2, NLRP3, IL12A, HAVCR2]
GO:0070098;chemokine-mediated signaling pathway;7.0;0.7307253602413294;0.7162820453778652;8.999915593069748;30.19135422731818;5.459585514144159;0.00101047745553359;0.6301228223472235;[CCL20, CCL5, CIB1, CCL19, CCR10, CCR2]
GO:0045087;innate immune response;4.0;0.6799073451904818;0.5899536725952409;8.162187183698695;26.470038109745843;3.422703586883119;8.859283540455166E-4;0.42503722060519694;[NCF1, DEFB1, IL27, LYST, PPP6C, C1QBP, HAVCR2, FGA, FCER1G, DTX3L, WRNIP1, RNASE3, TMEM173, SIRT2, IL23A, ELF4, PSPC1, TRIM14, HIST1H2BC, ANKRD17, COLEC12, HIST1H2BJ, CFH, NLRC4, ZC3HAV1, LILRA2, CORO1A, RELA, C2, C3, PRDX1, SLAMF7, NLRP3, CSK, APOL1, APOBEC3F, APOBEC3H, XRCC5, NONO, NFKB1, ITCH, POLR3C, FES, TREML4, POLR3E, PTX3, SERINC3, TRIM32, CD244, APOBEC3A, C1QC]
GO:0006749;glutathione metabolic process;6.0;0.8436909121759173;0.7449657686781032;9.360260265897443;147.28945980206763;5.71663061713405;0.0049296456676673804;0.6154690682008903;[GSTK1, GSTA5, ALDH5A1, CTNS, CHAC2, MMACHC]
GO:0043066;negative regulation of apoptotic process;7.0;0.5640623033008358;0.6329505169076184;7.792313020693233;81.07407142393629;2.9735683700721314;0.0027134762086319553;0.5029877899877601;[CIB1, UBE2Z, IGF1R, AQP1, MYC, CFL1, SOX8, IER3, PDGFRB, CSNK2A1, FLT3LG, THOC6, SFRP1, CFDP1, VDAC2, ADNP, EPHA1, PPID, CORO1A, MTDH, HSP90B1, HSPH1, BAG3, BAG1, NCKAP1L, RIPK1, NTSR1, TFAP2A, PRELID1, XBP1, UBE2B, WFS1, NONO, RHBDD1, CAV1, TNFRSF10A, NFKB1, SETX, VIL1, NFKBIA, IL6, SON, COPS5, BCL3, HYOU1, MNAT1, CPEB4, AVEN, BTG2, CDKN1A, DOCK8, KIF14, BRCA1, AATF, NUP62, CASP2, CTSH, HRAS, TSC22D4, FGA, DFFA, FCER1G, SPHK2, SPHK1, FGG, PLAUR, YWHAZ, DDB1, ITPKB, CREB3, PTRH2, MET, BECN1, HDAC3, HDAC1, NLRC4, THBS1, RELA, UNG, CLN3, CCL5, LMNA, CCL19, RFFL, SNCB, BID, TBX1, EYA2, SYVN1, ITCH, GPAM, TNIP2, KRAS, ERCC5, PDCD1, TRIM32, MAD2L1]
GO:0070495;negative regulation of thrombin-activated receptor signaling pathway;8.0;1.0;0.875;9.628524252492122;238.42697029648212;8.67846133901236;0.007979936125481077;0.8188169164668168;[MET]
GO:0070374;positive regulation of ERK1 and ERK2 cascade;11.0;0.9326813400603323;0.8987696223598284;9.604993755081928;1178.864923326294;4.330336256014159;0.03945554807418015;0.6538825498434562;[PDGFRB, FGA, CCL20, FGG, GPR55, CIB1, PTPN22, IGF1R, RAP1B, CD4, KARS, CCL5, CCL19, EPHA1, HRAS, MET, HAVCR2]
GO:0071347;cellular response to interleukin-1;6.0;1.0;0.8231203125901445;9.628524252492122;81.6500655361772;5.446340287394138;0.0027327542132076126;0.6016464081682054;[UPF1, ABCC2, CCL20, FGG, RORA, TANK, NFKB1, RELA, YY1, SFRP1, NLRP7, CCL5, CCL19]
GO:0006909;phagocytosis;6.0;0.9326813400603323;0.7894609826203107;9.4949928598676;28.437470009997963;5.618190544320798;9.517765291732001E-4;0.610434838299289;[ITGB3, CDC7, CORO1A, MET, TM9SF4, UNC13D]
GO:0034599;cellular response to oxidative stress;4.0;0.7248374789738407;0.6124187394869203;8.935377071932177;68.67201153720991;4.519578255652688;0.0022983904253524798;0.48113144217596127;[BECN1, PCNA, NCF1, TXNRD1, GPX7, ATP2A2, PYCR1, VRK2, SIRT2, RELA, AQP1, SETX, IL6, CCS, PRDX1, TP53INP1, PXMP2, CDK2, ECT2, NFE2L1, EZH2]
GO:0030036;actin cytoskeleton organization;5.0;0.6347111282356054;0.607596575978723;8.048073876931273;29.6146440060229;3.9779809732199434;9.911754834323397E-4;0.49367514382642164;[NCKAP1, WDR1, EPB41, ROCK2, WIPF2, ARPC1A, CORO1A, AQP1, ABR, CFL1, NCKAP1L, PDGFRB, PDCD6IP, KIF23, BCR, VIL1, NISCH, MKLN1, DIAPH3, PARVG, CDK5, RAB13, TAOK2, ELMO1, KRAS, DOCK2, TRIM32, ARHGEF5, PAFAH1B1]
GO:1903071;positive regulation of ER-associated ubiquitin-dependent protein catabolic process;12.0;1.0;0.9481203125901445;9.628524252492122;6504.6704340352835;7.8311634786251565;0.2177054656038327;0.8486063770733797;[CAV1, UBQLN1]
