id	name	nbGenes	ICSeco	ICZhou	ICSanchez	ICMazandu
GO:0048522	positive regulation of cellular process	728	0.24	0.37	3.90	23.85
GO:0007165	signal transduction	685	0.36	0.43	5.06	19.43
GO:0048523	negative regulation of cellular process	572	0.24	0.37	3.90	23.93
GO:0009966	regulation of signal transduction	471	0.33	0.45	5.35	37.59
GO:0019538	protein metabolic process	380	0.31	0.41	4.91	44.77
GO:0006139	nucleobase-containing compound metabolic process	345	0.29	0.40	5.40	96.28
GO:2000026	regulation of multicellular organismal development	322	0.29	0.39	4.73	23.09
GO:0070887	cellular response to chemical stimulus	296	0.40	0.40	5.31	25.21
GO:0006464	cellular protein modification process	279	0.34	0.49	5.84	147.03
GO:0009967	positive regulation of signal transduction	279	0.44	0.54	6.71	140.23
GO:0071310	cellular response to organic substance	266	0.44	0.47	5.95	41.66
GO:0030154	cell differentiation	249	0.39	0.39	5.18	16.68
GO:0001932	regulation of protein phosphorylation	245	0.50	0.62	7.64	109.03
GO:0050778	positive regulation of immune response	195	0.46	0.52	6.76	78.39
GO:0065003	protein-containing complex assembly	194	0.45	0.48	6.06	36.47
GO:0016477	cell migration	184	0.47	0.48	6.31	17.13
GO:0030334	regulation of cell migration	183	0.48	0.56	7.11	36.74
GO:0032774	RNA biosynthetic process	182	0.53	0.62	8.04	473.34
GO:0001934	positive regulation of protein phosphorylation	179	0.58	0.69	8.60	663.11
GO:0009968	negative regulation of signal transduction	179	0.44	0.54	6.68	140.65
GO:0033554	cellular response to stress	177	0.44	0.42	6.05	25.47
GO:0006955	immune response	164	0.54	0.40	6.57	12.45
GO:0043066	negative regulation of apoptotic process	163	0.56	0.63	7.79	81.07
GO:0043312	neutrophil degranulation	154	1.00	0.90	9.63	132.80
GO:0045944	positive regulation of transcription by RNA polymerase II	151	0.55	0.71	8.36	1463.86
GO:0051707	response to other organism	142	0.42	0.46	6.41	24.63
GO:0045892	negative regulation of transcription, DNA-templated	127	0.56	0.69	8.52	1581.26
GO:0030335	positive regulation of cell migration	126	0.58	0.64	8.22	157.26
GO:0001819	positive regulation of cytokine production	115	0.51	0.54	6.97	44.26
GO:0002237	response to molecule of bacterial origin	107	0.69	0.59	8.74	31.75
GO:0098542	defense response to other organism	103	0.66	0.62	8.42	39.21
GO:0006874	cellular calcium ion homeostasis	95	0.63	0.71	8.83	287.08
GO:0048513	animal organ development	89	0.50	0.45	5.88	11.73
GO:0048468	cell development	85	0.51	0.45	6.51	28.42
GO:1901652	response to peptide	80	0.62	0.60	8.14	43.80
GO:0001818	negative regulation of cytokine production	67	0.51	0.55	7.03	44.36
GO:0030595	leukocyte chemotaxis	65	0.69	0.67	8.77	62.06
GO:0006886	intracellular protein transport	60	0.55	0.65	8.12	90.55
GO:0002819	regulation of adaptive immune response	58	0.52	0.55	7.28	25.62
GO:0043406	positive regulation of MAP kinase activity	56	0.70	0.80	9.37	2605.69
GO:0001666	response to hypoxia	55	0.81	0.70	9.12	21.16
GO:0071222	cellular response to lipopolysaccharide	54	1.00	0.82	9.63	238.00
GO:0002758	innate immune response-activating signal transduction	53	0.63	0.71	8.79	406.89
GO:0050769	positive regulation of neurogenesis	53	0.58	0.64	8.42	270.71
GO:0051091	positive regulation of DNA binding transcription factor activity	46	0.81	0.84	9.43	277.83
GO:0051054	positive regulation of DNA metabolic process	43	0.59	0.65	8.41	301.51
GO:0045766	positive regulation of angiogenesis	43	0.81	0.76	9.30	134.49
GO:0002576	platelet degranulation	42	1.00	0.88	9.63	39.86
GO:0010951	negative regulation of endopeptidase activity	40	0.77	0.80	9.45	500.32
GO:0002690	positive regulation of leukocyte chemotaxis	40	0.75	0.77	9.33	423.36
GO:0050715	positive regulation of cytokine secretion	40	0.69	0.74	9.07	549.48
GO:0042035	regulation of cytokine biosynthetic process	38	0.53	0.59	7.80	134.50
GO:0051384	response to glucocorticoid	33	0.77	0.73	9.22	62.74
GO:0045665	negative regulation of neuron differentiation	31	0.62	0.68	8.73	338.15
GO:0030163	protein catabolic process	30	0.63	0.61	8.35	135.67
GO:0097193	intrinsic apoptotic signaling pathway	30	0.74	0.69	9.07	50.98
GO:0010522	regulation of calcium ion transport into cytosol	28	0.69	0.72	8.85	54.73
GO:0016525	negative regulation of angiogenesis	27	0.81	0.78	9.32	151.11
GO:0030308	negative regulation of cell growth	26	0.69	0.67	8.67	80.89
GO:0032355	response to estradiol	26	0.93	0.76	9.52	74.25
GO:0042108	positive regulation of cytokine biosynthetic process	25	0.63	0.67	8.76	609.34
GO:0050709	negative regulation of protein secretion	24	0.65	0.70	8.75	381.97
GO:0038095	Fc-epsilon receptor signaling pathway	23	0.93	0.84	9.55	78.48
GO:0045471	response to ethanol	22	0.93	0.76	9.52	69.73
GO:0048167	regulation of synaptic plasticity	22	0.67	0.69	8.57	39.26
GO:0006909	phagocytosis	21	0.93	0.79	9.49	28.44
GO:0006919	activation of cysteine-type endopeptidase activity involved in apoptotic process	20	0.93	0.93	9.60	734.49
GO:0032091	negative regulation of protein binding	20	0.70	0.64	8.48	32.72
GO:0050728	negative regulation of inflammatory response	20	0.67	0.69	8.71	126.18
GO:0071260	cellular response to mechanical stimulus	19	1.00	0.79	9.63	56.12
GO:0097191	extrinsic apoptotic signaling pathway	18	0.83	0.74	9.22	51.06
GO:0043330	response to exogenous dsRNA	17	0.93	0.79	9.49	30.96
GO:0006606	protein import into nucleus	17	0.89	0.84	9.55	277.54
GO:0050922	negative regulation of chemotaxis	16	0.65	0.65	8.42	97.54
GO:0030330	DNA damage response, signal transduction by p53 class mediator	16	0.89	0.80	9.49	85.95
GO:0045840	positive regulation of mitotic nuclear division	16	0.71	0.73	9.14	276.06
GO:0045429	positive regulation of nitric oxide biosynthetic process	16	1.00	0.88	9.63	658.64
GO:0045824	negative regulation of innate immune response	15	0.62	0.66	8.46	174.19
GO:0043407	negative regulation of MAP kinase activity	15	0.81	0.85	9.54	2610.18
GO:0050766	positive regulation of phagocytosis	15	0.77	0.76	9.34	175.33
GO:0002711	positive regulation of T cell mediated immunity	15	0.74	0.75	9.27	266.28
GO:0071398	cellular response to fatty acid	15	0.74	0.69	9.00	203.00
GO:0050796	regulation of insulin secretion	15	0.83	0.81	9.53	205.48
GO:0030449	regulation of complement activation	14	0.69	0.72	9.30	245.77
GO:0007565	female pregnancy	13	1.00	0.70	9.63	32.81
GO:0010718	positive regulation of epithelial to mesenchymal transition	13	0.81	0.73	9.38	170.70
GO:0071300	cellular response to retinoic acid	13	1.00	0.82	9.63	200.60
GO:1903901	negative regulation of viral life cycle	13	0.76	0.73	9.04	63.59
GO:0045727	positive regulation of translation	13	0.66	0.71	9.12	1032.69
GO:0022617	extracellular matrix disassembly	13	0.87	0.72	9.38	37.09
GO:0050805	negative regulation of synaptic transmission	12	0.68	0.69	8.78	101.85
GO:0051281	positive regulation of release of sequestered calcium ion into cytosol	12	0.89	0.91	9.59	905.07
GO:0006977	DNA damage response, signal transduction by p53 class mediator resulting in cell cycle arrest	12	1.00	0.93	9.63	888.12
GO:0042036	negative regulation of cytokine biosynthetic process	12	0.63	0.67	8.76	610.46
GO:0006006	glucose metabolic process	11	0.71	0.68	8.57	34.68
GO:0050688	regulation of defense response to virus	11	0.75	0.70	9.19	71.29
GO:0060760	positive regulation of response to cytokine stimulus	10	0.70	0.64	8.44	40.71
GO:2001240	negative regulation of extrinsic apoptotic signaling pathway in absence of ligand	10	1.00	0.92	9.63	570.20
GO:0035264	multicellular organism growth	10	1.00	0.70	9.63	22.58
GO:0002437	inflammatory response to antigenic stimulus	9	0.74	0.66	8.87	27.86
GO:0030816	positive regulation of cAMP metabolic process	9	0.83	0.83	9.53	1396.50
GO:0033280	response to vitamin D	8	0.93	0.82	9.55	74.56
GO:0071333	cellular response to glucose stimulus	8	1.00	0.88	9.63	272.30
GO:0043525	positive regulation of neuron apoptotic process	7	0.84	0.80	9.39	179.36
GO:0042771	intrinsic apoptotic signaling pathway in response to DNA damage by p53 class mediator	7	1.00	0.88	9.63	164.98
GO:0035176	social behavior	7	1.00	0.70	9.63	22.58
GO:0050999	regulation of nitric-oxide synthase activity	7	0.89	0.77	9.41	24.72
GO:0034123	positive regulation of toll-like receptor signaling pathway	7	0.71	0.73	9.09	411.44
GO:0033198	response to ATP	7	0.93	0.79	9.56	115.93
GO:0061037	negative regulation of cartilage development	6	0.83	0.74	9.37	85.27
GO:0044130	negative regulation of growth of symbiont in host	6	1.00	0.85	9.63	102.69
GO:0043278	response to morphine	6	0.93	0.82	9.55	93.34
GO:2000779	regulation of double-strand break repair	6	0.74	0.75	9.27	106.94
GO:0031622	positive regulation of fever generation	6	0.84	0.82	9.45	276.00
GO:0010819	regulation of T cell chemotaxis	6	0.93	0.88	9.57	194.94
GO:0035066	positive regulation of histone acetylation	6	0.81	0.84	9.50	1302.92
GO:0032308	positive regulation of prostaglandin secretion	6	0.89	0.86	9.55	484.67
GO:0045655	regulation of monocyte differentiation	6	0.89	0.82	9.49	139.68
GO:0034116	positive regulation of heterotypic cell-cell adhesion	5	1.00	0.82	9.63	52.09
GO:2000553	positive regulation of T-helper 2 cell cytokine production	5	1.00	0.92	9.63	874.88
GO:0042730	fibrinolysis	5	1.00	0.90	9.63	252.90
GO:0001657	ureteric bud development	5	1.00	0.88	9.63	36.92
GO:0045947	negative regulation of translational initiation	5	0.75	0.77	9.38	1335.45
GO:0051044	positive regulation of membrane protein ectodomain proteolysis	5	1.00	0.90	9.63	964.01
GO:0032922	circadian regulation of gene expression	5	1.00	0.82	9.63	31.18
GO:0060444	branching involved in mammary gland duct morphogenesis	5	0.87	0.78	9.37	53.50
GO:0043367	CD4-positive, alpha-beta T cell differentiation	5	0.78	0.76	9.31	117.17
GO:0071360	cellular response to exogenous dsRNA	5	1.00	0.85	9.63	172.53
GO:2000110	negative regulation of macrophage apoptotic process	5	1.00	0.90	9.63	256.26
GO:1903140	regulation of establishment of endothelial barrier	4	0.89	0.82	9.47	90.35
GO:0045070	positive regulation of viral genome replication	4	0.89	0.82	9.47	85.31
GO:0050996	positive regulation of lipid catabolic process	4	0.72	0.71	8.86	114.23
GO:0050995	negative regulation of lipid catabolic process	4	0.77	0.73	9.07	114.83
GO:0045662	negative regulation of myoblast differentiation	4	0.93	0.79	9.54	114.62
GO:0045345	positive regulation of MHC class I biosynthetic process	3	1.00	0.85	9.63	147.29
GO:0051457	maintenance of protein location in nucleus	3	0.81	0.76	9.29	48.00
GO:0043153	entrainment of circadian clock by photoperiod	3	1.00	0.82	9.63	32.76
GO:0055012	ventricular cardiac muscle cell differentiation	3	1.00	0.85	9.63	47.30
GO:0010829	negative regulation of glucose transmembrane transport	3	0.89	0.80	9.53	65.67
GO:0045630	positive regulation of T-helper 2 cell differentiation	3	1.00	0.96	9.63	2538.19
GO:0070943	neutrophil mediated killing of symbiont cell	3	0.84	0.80	9.53	160.25
GO:0030853	negative regulation of granulocyte differentiation	3	0.87	0.83	9.51	843.04
GO:0060559	positive regulation of calcidiol 1-monooxygenase activity	3	1.00	0.92	9.63	1344.96
GO:0046827	positive regulation of protein export from nucleus	3	0.81	0.80	9.43	516.73
GO:0033189	response to vitamin A	3	0.93	0.82	9.53	42.40
GO:0051097	negative regulation of helicase activity	3	0.87	0.76	9.43	49.94
GO:0003417	growth plate cartilage development	2	1.00	0.82	9.63	33.90
GO:0010193	response to ozone	2	0.93	0.76	9.54	79.60
GO:0035234	ectopic germ cell programmed cell death	2	1.00	0.79	9.63	49.33
GO:0002315	marginal zone B cell differentiation	2	1.00	0.90	9.63	149.81
GO:0001660	fever generation	2	1.00	0.85	9.63	35.73
GO:0014050	negative regulation of glutamate secretion	2	0.93	0.86	9.59	415.45
GO:0033591	response to L-ascorbic acid	2	0.93	0.82	9.55	69.45
GO:1900246	positive regulation of RIG-I signaling pathway	2	1.00	0.90	9.63	756.73
GO:1900245	positive regulation of MDA-5 signaling pathway	2	1.00	0.90	9.63	756.73
GO:2000059	negative regulation of ubiquitin-dependent protein catabolic process	2	0.83	0.83	9.51	1664.75
GO:0060340	positive regulation of type I interferon-mediated signaling pathway	2	1.00	0.88	9.63	527.93
GO:0030850	prostate gland development	2	1.00	0.79	9.63	53.04
GO:0045064	T-helper 2 cell differentiation	2	1.00	0.93	9.63	473.70
GO:0060700	regulation of ribonuclease activity	2	0.80	0.75	9.39	157.94
GO:0030578	PML body organization	1	1.00	0.82	9.63	22.53
GO:0030213	hyaluronan biosynthetic process	1	1.00	0.88	9.63	506.70
GO:0044869	negative regulation by host of viral exo-alpha-sialidase activity	1	1.00	0.92	9.63	511.15
GO:0031076	embryonic camera-type eye development	1	1.00	0.85	9.63	37.01
GO:1901740	negative regulation of myoblast fusion	1	1.00	0.90	9.63	353.26
GO:2000866	positive regulation of estradiol secretion	1	1.00	0.90	9.63	439.70
GO:0039532	negative regulation of viral-induced cytoplasmic pattern recognition receptor signaling pathway	1	0.89	0.82	9.57	651.69
GO:0002812	biosynthetic process of antibacterial peptides active against Gram-negative bacteria	1	1.00	0.90	9.63	215.43
GO:2000173	negative regulation of branching morphogenesis of a nerve	1	1.00	0.85	9.63	148.91
GO:0001869	negative regulation of complement activation, lectin pathway	1	0.93	0.90	9.61	1800.60
GO:0044871	negative regulation by host of viral glycoprotein metabolic process	1	1.00	0.88	9.63	465.76
GO:0060010	Sertoli cell fate commitment	1	1.00	0.79	9.63	42.26
GO:0050689	negative regulation of defense response to virus by host	1	1.00	0.88	9.63	351.97
GO:0033092	positive regulation of immature T cell proliferation in thymus	1	1.00	0.93	9.63	1868.46
