id	name	nbGenes	ICSeco	ICZhou	ICSanchez	ICMazandu
GO:0008150	biological_process	3215	0.00	0.00	0.00	0.00
GO:0065008	regulation of biological quality	550	0.28	0.26	3.48	4.47
GO:0043085	positive regulation of catalytic activity	322	0.48	0.49	6.15	18.32
GO:0032211	negative regulation of telomere maintenance via telomerase	6	1.00	0.92	9.63	1705.74
GO:0050789	regulation of biological process	2242	0.09	0.17	1.80	4.47
GO:0034220	ion transmembrane transport	150	0.45	0.51	6.18	26.33
GO:0035635	entry of bacterium into host cell	4	1.00	0.85	9.63	28.37
