id	name	nbGenes	ICSeco	ICZhou	ICSanchez	ICMazandu
GO:0050789	regulation of biological process	1433	0.09	0.17	1.80	4.47
GO:0044237	cellular metabolic process	1284	0.16	0.21	2.71	13.80
GO:0031323	regulation of cellular metabolic process	872	0.22	0.36	4.01	22.77
GO:0032502	developmental process	364	0.22	0.11	1.89	3.37
GO:0071310	cellular response to organic substance	186	0.44	0.47	5.95	41.66
GO:0006974	cellular response to DNA damage stimulus	131	0.57	0.53	7.47	29.00
GO:0001755	neural crest cell migration	8	0.80	0.72	9.09	22.57
GO:0071526	semaphorin-plexin signaling pathway	5	0.81	0.73	9.09	26.50
