ID;Term;Depth;IC Nuno;IC zhou;IC sanchez;IC resnik;IC RZ;IC Rnormalized;IC Nuno org;Annotated Genes Set number
GO:0006281;DNA repair;7.0;0.6281612110245125;0.6649999707694567;8.781226392104918;180.342582143442;3.582668236575797;0.006035903926554339;0.534137185486798;[SMARCAL1, MDC1, SMARCB1, CCNH, TRRAP, NUDT1, UBE2L6, SMC6, SMC3, BACH1, ALKBH3, ZFYVE26, HERC2, TRIM28, ALKBH1, CHEK1, TRIM25, EPC2, FBXO6, NFRKB, RNF111, WDHD1, AQR, NSMCE2, REV1, NSMCE1, RECQL, SETMAR, CSNK1E, NEIL3, EID3, NEIL1, TP53, UBA52, ASF1A, PAXIP1, PRKDC, CDCA5, XPA, COPS7B, COPS7A, XPC, RAD21, TP53BP1, ATRIP, BARD1, XRCC6, XRCC5, GADD45A, INTS3, XRCC3, XRCC1, CDC7, SETX, NPLOC4, MC1R, TDP1, RAD17, ATM, RPAIN, FEN1, BTG2, SMG1, SETD2, WDR48, CETN2, BRCA1, PRPF19, NIPBL, CHAF1B, CHAF1A, UIMC1, REV3L, UPF1, PARP3, SHPRH, PARP1, NCOA6, PARP2, ACTL6A, PARP9, SIRT1, UCHL5, DDB2, WDR33, DDB1, RAD51C, CINP, PCNA, GPS1, IGHMBP2, UNG, RAD54B, WRN, RECQL5, RNF138, RPS3, RAD54L, PMS2, RPS27A, ORAOV1, PMS1, MBD4, GINS2, MCRS1, GINS4, HUWE1, RPA1, APEX2, RPA2, GTF2H2, MLH1, GTF2H4, APTX, GTF2H5, MLH3, MAD2L2, XAB2, HIST3H2A, TTC5, RFWD3, TAOK1, APEX1, RPA4, TCEA1, RAD1, TRIP13, DCLRE1A, DCLRE1C, UBE2D3, MUM1, BCCIP, CIB1, NUCKS1, PARK7, CDC14B, YY1, HELB, PTTG1, EME2, RUVBL2, RUVBL1, EP300, NBN, PIAS4, SLC30A9, USP7, SUPT16H, FBXO18, LIG1, LIG4, LIG3, CHD1L, RBX1, MORF4L1, MSH2, POLG2, MSH3, FANCD2, TIMELESS, UBE2V2, PPIE, BLM, VCP, RNASEH2A, PSMD14, DDX1, PDS5A, RAD51AP1, ATXN3, UBB, UBR5, ABL1, USP51, DMAP1, FANCI, UVRAG, UBE2B, FANCL, NONO, ISG15, FANCB, FANCE, PALB2, FANCG, CDK9, COPS4, COPS3, CDK7, COPS6, COPS5, UBE2T, CDK2, MNAT1, COPS8, RAD9A, ISY1, MUS81, USP36, MCM8, CEP164, HMGB1, FOXM1, POLB, EXO1, POLL, TOPBP1, POLE, POLH, RFC5, USP47, RBM17, RFC3, RBM14, RFC4, DTX3L, RFC1, USP42, RFC2, ACTR5, ATRX, RAD23A, ACTR8, SMC1A, RAD23B, SFPQ, NSMCE4A, RRM2B, DTL, OTUB1, UHRF1, USP10, PNKP, RNF8, RCHY1, POLD3, TFPT, POLD4, FZR1, MTA1, POLR2A, ASTE1, POLR2B, POLD1, TDG, POLR2C, POLR2D, POLR2E, POLR2G, POLR2H, POLR2I, POLR2J, POLR2K, POLR2L, MUTYH, POLQ, EYA2, POLM, CDC5L, SSRP1, REC8, SMUG1, CUL4A, RAD50, RAD51, ERCC3, POLE2, ERCC1, ERCC2, ERCC8, ERCC5, STUB1, CUL4B]
GO:2000481;positive regulation of cAMP-dependent protein kinase activity;12.0;1.0;0.9481203125901445;9.628524252492122;1426.5997261217476;8.16763571524637;0.0477470089768964;0.8658135829017477;[ATP2B4, ADRB2, SIRT1]
GO:0014068;positive regulation of phosphatidylinositol 3-kinase signaling;8.0;1.0;0.875;9.628524252492122;238.41769229280743;5.602686357784832;0.007979625599047746;0.6615216408886768;[PRR5, BECN1, NCF1, FLT3, UBE3A, CBL, CCL5, PDGFD, FYN, JAK2, NKX3-1, PDGFRB, ANGPT1, SEMA4D, HGF, F2R, IL18, NRG1, SIRT1, DCN, PTK2, SELP, HAX1, NEDD4, KIT, CAT, CD28, F2RL1, PTPN6, TEK, HCST, RGL2, PPARD]
GO:0043506;regulation of JUN kinase activity;12.0;0.8259837884571596;0.8611122068187244;9.517298617381897;561.6084548105569;5.277263957350204;0.018796529567714316;0.7179998367869053;[IL1RN, PTPN22, TNF, DUSP10, MAP3K9, MAP3K4, MAP3K5, MAP4K2, EPHA4, MAP2K4, EDN1, DAXX, DBNL, SYK, RIPK2, AXIN1, TRAF2, MAPK8IP3, MAPK8IP1, ERN1, TIAM1, SFRP1, ZEB2, SFRP2, TRAF6, IL1B, TLR9, TNIK, TLR6, ARHGEF5, GSTP1, AGER, FGD2, PAK1, DVL2, RPS3, DVL3, PTK2B, RIPK1, CCL19, MAP2K7, MAP4K5, SASH1, SPAG9, MAP3K2, FZD5, MLKL, DTNBP1, HIPK3, DNAJA1, CD40LG, TAOK1, PDCD4, PKN1, MAP3K11, MAP3K12]
GO:0035162;embryonic hemopoiesis;6.0;0.9326813400603323;0.7894609826203107;9.4949928598676;36.11381869205153;6.832634648514029;0.0012086970112962418;0.6725415662651573;[FLT3LG, GATA3, STK4, THOC5, HIF1A, GATA1, PBX1, STK3, TGFBR2, TAL1, KIT, SH2B3, ZFPM1]
GO:0007099;centriole replication;6.0;1.0;0.8231203125901445;9.628524252492122;79.09414177220606;6.781341354126479;0.0026472097450095456;0.6699184248047958;[PLK4, CEP135, CENPJ, CETN2, CEP152, CDK2, KIAA0753, SASS6, CEP63, CNTROB, CDK5RAP2]
GO:1903243;negative regulation of cardiac muscle hypertrophy in response to stress;9.0;1.0;0.896240625180289;9.628524252492122;308.04883931045805;7.9853141584524145;0.010310117425764685;0.8046099625986299;[ERRFI1, SMAD3, LMNA, ATP2B4, FOXO1]
GO:0050718;positive regulation of interleukin-1 beta secretion;11.0;1.0;0.9324289523296623;9.628524252492122;998.8167007681584;6.518977089658987;0.033429496098039586;0.7658097438582601;[ORM1, FZD5, RIPK2, CARD8, HMGB1, NOD2, ORM2, P2RX7, PANX1, PYCARD, NLRP12, AIM2, NLRP7, NLRP2, CCL3, CASP1, NLRP3, TLR8, CCL19, LGALS9, NLRP1, TLR4]
GO:0042253;granulocyte macrophage colony-stimulating factor biosynthetic process;7.0;1.0;0.8509193652572005;9.628524252492122;142.6381379570676;9.777073627680469;0.004773970111433118;0.8509193652572005;[IL18]
GO:1901224;positive regulation of NIK/NF-kappaB signaling;8.0;0.9326813400603323;0.8413406700301662;9.571365838652174;238.82315740091596;5.572381008289503;0.007993196151321231;0.6599718239061428;[APP, EDA, NOD1, HMGB1, NOD2, AGER, TNF, RELA, EGFR, IRAK1, RPS3, CCL19, LGALS9, SASH1, TRIM44, HAVCR2, TNFSF14, SPHK1, IL18, ZFP91, TNFRSF10B, RC3H1, EIF2AK2, TNFRSF10A, TRAF2, ACTN4, RC3H2, TIRAP, RHOA, EDAR, NLRP12, PTP4A3, IL23A, TRAF6, IL1B, TRIP6, TLR9, PDCD4, CD27, TLR7, RBCK1, TLR6, COPS8, TLR4, IL18R1, LIMS1, TLR2]
GO:1903249;negative regulation of citrulline biosynthetic process;9.0;1.0;0.896240625180289;9.628524252492122;799.274785542771;9.777073627680469;0.02675100777151051;0.896240625180289;[ATP2B4]
GO:0007257;activation of JUN kinase activity;14.0;1.0;0.9759193652572005;9.628524252492122;8640.54909511404;6.088194173566533;0.2891914022241413;0.7872698984233759;[SPAG9, MAP3K2, MAP4K2, MAP2K4, DAXX, DBNL, SYK, MLKL, RIPK2, AXIN1, MAPK8IP3, ERN1, CD40LG, TAOK1, RIPK1, CCL19, MAP3K9, PKN1, MAP2K7, MAP4K5, MAP3K11, MAP3K5, MAP3K12]
GO:0042531;positive regulation of tyrosine phosphorylation of STAT protein;11.0;1.0;0.9324289523296623;9.628524252492122;1230.2749798860389;5.618190544320798;0.04117619640118775;0.7197434780388068;[CSF1R, CD40, FLT3, SOCS3, CCL5, IL12A, FYN, JAK2, IL6R, LYN, TSLP, IL15, TNFRSF18, STAT3, OSM, IL18, CSHL1, PARP9, PARP14, TNFRSF1A, IL6, ARL2BP, IFNG, IL23A, CLCF1, KIT, IL6ST]
GO:0051092;positive regulation of NF-kappaB transcription factor activity;12.0;0.9326813400603323;0.9144609826203107;9.587702257971866;279.4401483168805;4.8283137373023015;0.009352610284359957;0.6950405016553352;[APP, CD40, EDA, TRADD, ITGB2, CIB1, IL1RAP, TNF, ICAM1, RPS6KA4, IKBKB, PYCARD, TRIM8, RPS6KA5, TRIM5, TRIM25, LGALS9, CD36, TRIM22, PRKCI, PRKCH, RIPK3, RIPK2, SPHK1, IL18, TRAF2, IRAK3, IRAK4, TRAF1, TICAM1, MID2, TIRAP, PSMA6, AIM2, TRAF6, IL1B, CAT, TRAF5, BTK, TLR9, TRIM13, TRIM14, PRKD2, PRKCQ, ADAM8, RBCK1, TLR6, ARHGEF2, CLOCK, S100A9, TLR4, UBA52, CARD11, S100A8, LTF, TLR2, RNF31, MTPN, TRIM52, DHX9, NOD1, NLRC4, BCL10, NOD2, AGER, PRKCZ, RELA, MTDH, PRDX3, DHX33, UBB, IRAK1, IRAK2, RPS3, NLRP3, S100A12, RIPK1, RPS27A, RNF25, EIF2AK2, CFLAR, NFKB1, NFKB2, FER, CD40LG, CTH, CARM1, KRAS, TRIM37, TRIM38, TRIM32, MYD88, HSPA1B, HSPA1A]
GO:0045766;positive regulation of angiogenesis;7.0;0.811012628672052;0.7564256795932265;9.303101852057495;134.49314513679974;4.7081694254602375;0.0045013645317563845;0.5916953686275062;[ITGB1, CD40, BTG1, PDCD6, ITGB2, CIB1, ADM, BRCA1, HMGB1, PIK3C2A, AQP1, ZC3H12A, CTSH, CYP1B1, JAK1, IL10, ANXA1, PDPK1, ANXA3, SPHK1, HGF, CYBB, PRKCA, SIRT1, RHOB, RUNX1, TGFBR2, SFRP2, TMIGD2, STIM1, IL1B, PRKD2, ITGA5, EPHA1, ENG, CX3CR1, FOXC2, C5AR1, PTGS2, THBS1, HIF1A, DLL1, HDAC9, MTDH, C3, C5, RRAS, TBXA2R, ABL1, PTK2B, HMOX1, PLCG1, SASH1, MAP3K3, XBP1, JUP, NOS3, TNFSF12, STAT3, VEGFB, HIPK1, KLF4, HIPK2, PDCL3, LRG1, SP1, ADM2, FGF18, RLN2, AGGF1, GHRL, TEK]
GO:0000462;maturation of SSU-rRNA from tricistronic rRNA transcript (SSU-rRNA, 5.8S rRNA, LSU-rRNA);11.0;1.0;0.9324289523296623;9.628524252492122;360.17083382419077;6.221725566191056;0.0120545936753897;0.7506082871245006;[KRR1, RPS8, MRPS11, HEATR1, NOC4L, PWP2, UTP18, WDR46, BYSL, RPS14, TBL3, MRPS9, EMG1, RPS16, PDCD11, RPS19, BMS1, TSR2, TSR1, NOL10, BTRC, RPS24]
GO:0002479;antigen processing and presentation of exogenous peptide antigen via MHC class I, TAP-dependent;6.0;1.0;0.8231203125901445;9.628524252492122;33.24930607151726;6.518977089658987;0.0011128243517809471;0.6565011041187423;[HLA-H, ITGB5, SNAP23, TAP2, HLA-B, HLA-C, TAP1, HLA-A, HLA-F, TAPBP, HLA-E, VAMP8, IKBKB, ITGAV, CD36, SEC22B, B2M, VAMP3]
GO:0032725;positive regulation of granulocyte macrophage colony-stimulating factor production;6.0;0.9326813400603323;0.7894609826203107;9.523163736834295;64.94897299966192;7.212124270218933;0.0021737836760178982;0.6919486831672181;[SYK, IL23A, DDX58, CD80, IL1B, TLR9, IL18, RASGRP1]
GO:0001666;response to hypoxia;5.0;0.811012628672052;0.6957473261969462;9.117698628726131;21.16160540946;4.1860866471696125;7.082598888462125E-4;0.5043176776701113;[ACAA2, MPL, RORA, PLOD2, ABAT, PLOD1, AQP3, PHB2, AQP1, TXN2, ICAM1, NPEPPS, ALKBH5, PLAU, MYC, NPPA, MYB, CAPN2, LONP1, EP300, AKT1, BNIP3L, ENDOG, PRKCE, CYBA, ACTN4, ATP1B1, SFRP1, ADAM17, DDIT4, ADAM8, RAF1, TP53, EPAS1, ABCB4, PSEN2, ITPR1, ITPR2, FOXO3, AGER, HIF1A, HSP90B1, DPP4, CCNB1, SCFD1, IRAK1, KCNMB1, SCAP, HMOX1, HMOX2, FIS1, EGR1, CREBBP, SMAD3, TGFB3, CAV1, XRCC1, MTHFR, NARFL, NR4A2, BMP2, TBL2, MDM2, NF1, BCL2, HYOU1, MDM4, ATM, CD24, PAM, ADA, ALAS2, CDKN1B, CITED2, SUV39H1, HP1BP3, PTEN, ADM, SLC6A4, MECP2, ALAD, OPA1, FUNDC1, CASP3, CASP1, CD38, ATP7A, DNM1L, NKX3-1, EDN1, ADSL, APAF1, ITGA2, DNMT3A, SIRT4, ARNT, AGTRAP, SIRT1, CBFA2T3, SIRT2, RHOA, TGFBR2, TGFBR3, CCNA2, CREB1, IL1B, CAT, BIRC2, PPARD, TLR2, BECN1, SRC, SRF, CXCR4, PTGS2, THBS1, ASCL2, TM9SF4, CYGB, PDLIM1, CST3, PAK1, UCP3, LMNA, UBQLN1, E2F1, PTK2B, EGLN1, EGLN2, BAD, BNIP3, VEGFB, CFLAR, PML, USF1, HIPK2, SLC8A3, PINK1, ERCC3, ERCC2, STUB1, TEK, P4HB, ZNF354A, KCNK3]
GO:0001701;in utero embryonic development;7.0;1.0;0.8509193652572005;9.628524252492122;22.496195207419138;4.63541007117781;7.529274083310655E-4;0.5879744518658467;[ITGB1, ELL, CHD7, ZFAND5, KEAP1, ADAR, AMOT, FLCN, SIN3A, ZMIZ1, ALKBH1, FLVCR1, SOX8, ATP7A, SOX6, SLC39A1, GABPA, TAPT1, SLC39A3, MBNL1, EDN1, ENDOG, HEG1, NOG, TPM1, ADAM10, LIG4, OCRL, TGFBR1, TGFBR2, ALS2, MSH2, POLG2, SYF2, MYH9, EIF4E2, FOXC1, RNASEH2B, RRN3, NOTCH1, GATA3, ACVR1B, GATA1, ADD1, RIC8A, INPP5B, CCNB2, CCNB1, FUT8, C5, RXRA, GNA12, MGAT1, RBBP6, MSX1, PLCG1, MYH10, WDTC1, SMAD2, BTF3, MBD3, STIL, SMAD3, UBE2B, ANGPT1, NOS3, TGFB3, RARRES2, TIE1, PTCH1, WDR19, EIF2S2, KLF2, MIB1, CUL4A, COPS3, BMP2, MAFG, MAFF, ERCC2, NMT1, CTNNB1, CCM2, APBA3, ZNF335, SEC24C, APBA2, BCL2L1]
GO:0051001;negative regulation of nitric-oxide synthase activity;7.0;1.0;0.8509193652572005;9.628524252492122;123.18001952109483;7.8311634786251565;0.0041227243985507795;0.7514054297404357;[CNR2, CAV1, ATP2B4, NOSIP, GLA]
GO:0032729;positive regulation of interferon-gamma production;6.0;0.8933024483968273;0.7697715367885581;9.427853557029971;65.23665507211369;5.6339389012889365;0.002183412136085803;0.6112402100070131;[TXK, EBI3, CEBPG, PTPN22, IL27, TNFRSF13C, CD3E, RASGRP1, TNF, IL27RA, HSPD1, PYCARD, KLRK1, ABL1, PDE4B, IL12A, SLAMF6, LGALS9, IL12RB1, HRAS, IL6R, CCR2, HLA-DPA1, HAVCR2, IL12RB2, TICAM2, FZD5, RIPK2, SLC11A1, IL18, CD2, IL23A, TNFSF4, IL1B, BCL3, HLA-DPB1, TLR9, TLR8, IRF8, TLR7, ZP3, TLR4, ZFPM1, CD244, IL18R1]
GO:0034105;positive regulation of tissue remodeling;5.0;0.7763722522362496;0.6784271379790451;9.089527751759436;42.28934747447766;6.375876246018314;0.001415386402028971;0.6163036195908642;[B4GALT1, TFRC, SYK, IL15, IL18, PRKCA, EGFR, PPP3CA, IL23A, CA2, TMBIM1, PLEKHM1, SPP1, BAX, ADAM8, PPARGC1B]
GO:0001947;heart looping;7.0;1.0;0.8509193652572005;9.628524252492122;47.98143023837329;5.71663061713405;0.001605895289594654;0.6432681208679463;[NOTCH1, CCDC103, IFT172, SRF, PSEN1, PKD2, HIF1A, DLL1, ARL13B, SUFU, TMED2, NPHP3, BBS7, IFT57, BBS4, MKKS, MEF2C, STIL, SMAD3, SETDB2, MICAL2, MIB1, TGFBR2, AHI1, ENG]
GO:0019885;antigen processing and presentation of endogenous peptide antigen via MHC class I;5.0;0.8436909121759173;0.712086467948879;9.271849308553389;32.556158890958;7.8311634786251565;0.0010896253394395913;0.6907270763441554;[TAP2, TAP1, B2M, TAPBP]
GO:0098736;negative regulation of the force of heart contraction;8.0;1.0;0.875;9.628524252492122;28.25379719464655;9.777073627680469;9.456291653381902E-4;0.875;[ATP2B4]
GO:0070207;protein homotrimerization;7.0;1.0;0.8509193652572005;9.628524252492122;85.45061507946225;6.444869117505266;0.002859955186148837;0.6805102716434839;[PNPT1, MLKL, ARG1, TNFRSF9, ITLN1, SLC1A2, MGST1, HTRA2, PKD2L1, TRAF2, MIF, CLYBL, DISP1, TCL1A, ALOX5AP, ATXN10, CD247]
GO:0051402;neuron apoptotic process;5.0;0.8259837884571596;0.7032329060895001;9.022388448921806;23.44398779513952;6.113511981550823;7.846491732841165E-4;0.6028862989048107;[RB1, APP, PIGT, USP53, DIABLO, MAX, ATN1, PSEN1, POLB, AIFM1, CASP3, AKT2, NLRP1, BID, APAF1, BNIP3, SIAH1, LIG4, CIT, CDK5, BCL2, BAX, ATM, GAPDH, TNFRSF21, BCL2L1]
GO:0035556;intracellular signal transduction;5.0;0.5140152493238541;0.5472486365228473;6.9204740513899115;23.17027026302992;2.4005655013542495;7.75488093814194E-4;0.41300604323788886;[ITSN1, TESK1, ARAF, TESK2, PREX1, SAMD14, AKT2, AKT1, GTSE1, MEF2C, FRS3, BCR, DDIT3, DDIT4, RBCK1, ATF4, NLRX1, FPR1, GATA3, IQGAP3, RHOT2, RHOT1, LARP1, PRKAR2A, SULT1A3, ABCA1, LYN, GSTM2, HACE1, EIF2AK3, AZU1, SETX, MLLT11, COL1A2, DCHS1, ARHGAP1, PRKAG2, ARHGAP6, BBC3, ARHGAP4, IKBKB, SMPD2, JAK2, JAK3, IKBKE, JAK1, DUSP5, SS18, RIPK3, RIPK2, DUSP1, SPHK1, GMIP, SIRT1, SIRT2, DUSP6, CDC42EP4, RAPGEF1, CDC42EP2, CDC42EP1, RAPGEF6, EGFR, STYXL1, NRAS, PLAGL1, STAT4, RICTOR, BID, RPS27A, P2RY12, P2RY11, STAT1, STAT2, STAT3, SPSB2, TAOK2, PKN2, PKN1, LGR4, GPR65, DEFB1, CTGF, STK10, STK11, SESN3, SESN2, NEK1, MAP3K9, MAP3K4, MAP3K5, KCNH3, TICAM2, CISH, KCNH8, ZBTB33, CDC25C, TICAM1, RBX1, PIAS1, MSH2, MAPKAPK3, MAK, MAPKAPK5, SQSTM1, KPNB1, BLK, SHC1, STK39, LY96, FOXO3, KRCC1, FHIT, SAV1, RAP1B, SOCS2, SOCS3, SLC9A3R1, RAP1A, SOCS1, STK38, G3BP1, THEM4, MBP, SOCS4, SOCS5, KL, RABL2A, TNFRSF10B, RABL2B, RFXANK, CORO2A, BMX, NFKB1, NFKB2, SH3BP5L, STK24, PTPRA, STK25, MDM2, MDM4, OGT, BCAR3, PPP1R13B, LRRK2, LRRK1, PTEN, PIK3CD, FOXM1, PIK3CG, ITGAV, NKX3-1, KSR1, APAF1, SH2D3A, SH2D3C, ATRX, NRG1, KSR2, SPTB, TNFRSF1A, ADORA2A, ADORA2B, PIK3C3, LCP2, LCP1, MET, DTL, BIRC2, BIRC3, PPP1R15A, ROCK1, ROCK2, SRC, IL2RG, PPM1F, CDC42, IFI16, CCL5, TIFA, PHKG2, CCL3, SH3BP5, E2F1, CCL2, E2F2, FYN, ZNF622, E2F4, SH2B3, E2F7, SH2B2, E2F8, SH2B1, CDC5L, MCOLN1, MERTK, SNRK, PINK1, IL2RA, IL2RB, CCM2, PTPN6, RASSF1, TRIM28, RASSF5, LGALS9, PAQR3, NSMCE1, ANK2, MIF, BTK, TRIB3, TRIB1, TP53, RIN2, PAXIP1, PIK3R2, PIK3R1, KALRN, PIK3R5, RRAS, PCBP4, STK38L, PAG1, STAT5A, STAT5B, XBP1, RAB27A, RAB27B, PTK2, NET1, MC1R, WNK1, PPP1R1C, CALM3, CALM1, RGL1, CD24, CALM2, RGL2, CD40, CETN2, AKR1B1, BRCA1, RAB22A, AKAP13, PPP3CA, PPP3CB, AKAP11, UIMC1, CCR9, CTSH, CCR7, CD36, CCR6, CCR4, SPTAN1, CCR2, DBNL, MINK1, IL18, GAB2, NR5A1, LAT2, RAP2A, GAL, IL1B, KIT, DEPDC1, ARHGEF3, TAX1BP3, ARHGEF1, ARHGEF2, DEPDC5, ARHGEF7, ARHGEF5, ARHGEF6, PCNA, RELA, CAMKK2, RELB, PAK1, PERP, PAK2, BCAP31, MAP3K3, MAP3K1, PLEKHA1, MYO9B, MOS, MAD2L2, ITCH, RIT1, TFAP4, STK17B, CAPS, PLVAP, RTKN, CD80, PEBP1, IGF1R, EP300, SNIP1, PDGFRB, FBXW11, ACOT11, ERN1, DOK2, RAF1, CARD11, DIABLO, NPR2, PSEN2, HTRA2, PSEN1, RASGRP2, PLD1, RASGRP1, RASGRP4, RASGRP3, PLD2, SPTA1, CCNB1, SHARPIN, IRAK1, IRAK2, ECT2, PRNP, CNOT10, GNAQ, FGF18, GNAS, FGF13, LSM14A, YWHAE, PRR5, DYRK2, DDX3X, MAST4, PRKCSH, MAST3, YWHAB, PLEK, ATP2A2, TNFAIP3, TRIAP1, PPP1R9B, RASGEF1A, ARHGEF11, ARHGEF12, DDX58, PDPK1, PLA2G4B, PLA2G4C, ARHGEF18, IRAK3, IRAK4, MASTL, PJA2, CCNA2, ALS2, IRF3, NDUFS4, IRF7, GNB1L, ZP3, RALA, RALB, RAP1GDS1, ASB13, AURKA, GNG2, RAB40B, PABPN1, RAB40C, MKNK1, MKNK2, PTK2B, ARFGEF2, EGF, BNIP3, MAPK14, MAPK13, TNIP2, ASB8, CARM1, ASB6, ASB7, RANGRF, KRAS, TEK, ASB3, ASB1, RB1, NCKAP1, CYFIP1, MYC, STMN1, CYP1B1, PRKCI, PRKCH, WSB1, DAPK1, PRKCE, DAPK2, PRKCD, DAPK3, PRKCA, PASK, NISCH, DEPDC1B, ADCY9, PRKD3, LGALS12, PRKD2, PRKCQ, RPL26, UBA52, PRKDC, MAPKAP1, XPA, BCL10, PRKCZ, ABR, PPP3R1, PPP4C, PLCG2, HMOX1, PLEK2, PLCG1, PLK3, HOMER2, PLK1, RDX, NFATC3, NFATC1, BRAF, CYLD, MYOM1, ITK, BTG2, CDKN1A, CDKN1B, CHM, ADM, ING4, IFIH1, AIFM1, PEA15, TEAD2, NFAM1, TMEM173, CIT, ITPKB, PLCB3, CEP63, PLCB1, GAS6, PLCB2, EXOC1, HBEGF, GPS1, ADCY4, GPS2, ADCY3, TANK, ADCY7, CHN2, CHN1, ZNF346, GPR155, WWOX, GSN, CCL20, CARD9, SYNJ2BP, HIPK1, HIPK2, ABI2, CLCF1, ADM2, PLCD1, RAB3B, DGKE, DGKD, DGKB, DGKA, RAB3D, IL5RA, IRS2, PARK7, AHR, TNF, CDC14B, RAB43, PYCARD, NRBP2, FGF6, ZFP36, GRAP2, CFL1, NBN, STK32B, IFNAR2, MAP2K3, USP8, RAB2B, MAP2K4, MAP2K1, MAP2K2, IGFBP5, RPS6, NRBP1, RAB30, MELK, RAB31, RAB36, RAB37, RAB34, DGKQ, RAB35, FKBP8, RAB38, TNIK, IFNAR1, CSF1R, DNMT1, RAB5B, RAB5C, CUL2, CUL1, ITPR1, ITPR2, ITPR3, TBXA2R, ABL1, DVL2, DVL3, RAB6A, MAP2K7, RAB6B, MAP2K5, MCL1, MOAP1, RAB4A, RAB4B, TNK2, DHCR24, CNOT4, CNOT6, IRAK1BP1, CNOT7, BCL6, CNOT1, CNOT2, RCAN3, BCL3, CNOT3, CDK2, PLEKHM1, NF1, BCL2, CNOT8, MAP3K14, MAP3K11, BCL2L2, BCL2L1, MAP3K12, TRADD, ADRA1D, PIK3C2A, ADRA1A, TREM1, TLK2, TLK1, PHACTR4, GPX1, TRAF2, ADRA2C, ADRA2A, TFDP1, TFDP2, TRAF6, IL3RA, SOS1, SOS2, RNF31, HDAC4, CX3CR1, NFAT5, CEBPB, RAB1B, NLRC5, NOD1, NOD2, TTN, RAB21, FZR1, RAB20, RAB24, RAB28, BAK1, FNIP1, CTNNAL1, WASF2, ANGPT1, PLCL1, PLCL2, CDC42BPB, CDC42BPA, TPCN2, PML, CUL4A, P2RX4, RAB15, DNAJA3, RAB13, RAB18, OXTR, TRAF3IP2, CALML4, RAPGEFL1, RPS6KA4, RPS6KA3, RPS6KA5, PPP2R1A, RPS6KA2, CHEK1, ARL6IP5, BTRC, PDK2, SOX4, PDK1, PTGDR, TIAM2, TIAM1, CARHSP1, KARS, RRAGC, AKAP9, ANP32A, NLK, CRHR1, NUAK1, NUAK2, INPP5A, PDCD10, INPP5D, TP53BP2, RALGDS, CCR10, SPTBN1, TRPM4, SRPK2, FIS1, XCR1, SETDB1, GADD45A, SIAH2, NMI, SRPK1, CCDC88A, ATM, GDI1, GDI2, PRPF19, HINT1, CAMKV, NKIRAS1, C1QBP, TNFAIP8L3, CLIC2, HRAS, RAB8A, RALGPS1, RAB8B, RALGPS2, VAV3, MAP4K2, EDN1, PRMT1, RHOH, TYK2, RHOC, GFRA2, VAV1, RAB33A, RHOA, TOPORS, VAV2, RHOB, TLR9, TLR8, TLR7, RHOU, SGK3, AVP, TLR4, RHOQ, PTGER4, SP100, PTGER2, WAS, CXCR4, CXCR6, AIF1, PPP2CA, CXCR3, MAP4K5, MAP4K3, MAP4K4, DMRT1, MLH1, RAB11A, BATF, RAB11B, AXL, CAMK4, CAMK1, KBTBD7, SIPA1, TJP2, SIRPG, AMOT, DOCK10, DOCK11, ARHGDIA, ARHGDIB, RALBP1, HGF, TSC2, ATP1B1, KCTD9, TIPRL, ELMO1, PDE9A, CLEC16A, CSF2RB, ADRB2, STK4, CSF2RA, STK3, SDCBP, ZMAT1, UBB, ZMAT3, ZMAT4, RIPK1, MARK3, PDZD8, MARK2, SMAD2, RHBDD3, MLKL, IFT122, NFKBIA, SELP, FER, ARHGAP30, DLG5, DNAJC10, NMUR1, DOCK5, MCTP1, DOCK9, DOCK8, DOCK7, CXCL1, PKD2, POLB, CASP9, FLCN, SPRED1, CASP8, CASP3, CASP4, FLOT1, BLNK, CASP2, TMEM109, CAMK1D, OXSR1, TGFBR1, TGFBR3, RBL2, ZAP70, LATS2, RASA3, DDAH2, RASA2, ITGB1BP1, DOCK2, MCTP2, CAMK1G, CAMK2D, RGS19, RGS14, TUFT1, USP10, NCALD, MAPK9, MUC1, MAPK7, RASD1, GNA12, MAPK1, NCAM1, MAPK6, CAMK2G, MAPK4, MAPK3, NOS3, BAD, LIMK2, LIMK1, TSHR, RPS6KB1, RPS6KB2, BAX]
GO:0140199;negative regulation of adenylate cyclase-activating adrenergic receptor signaling pathway involved in heart process;11.0;1.0;0.9324289523296623;9.628524252492122;664.6059319467631;9.083926447120524;0.02224376243575177;0.8969813732811862;[ATP2B4]
GO:0070723;response to cholesterol;6.0;0.9326813400603323;0.7894609826203107;9.523163736834295;80.91680144162417;6.686031174322154;0.002708212523857764;0.665044257777226;[SMAD2, ABCA1, ABCA2, OSBPL7, HMGCS1, PTCH1, LRP8, AACS, TGFBR1, TGFBR2, PMVK, CCL3, DAG1]
GO:0033138;positive regulation of peptidyl-serine phosphorylation;10.0;0.9326813400603323;0.8815816818910864;9.59573442966913;778.6672313762616;5.152100814396198;0.026061291479152104;0.6787196871063318;[BCAR3, APP, HSP90AB1, DOCK7, ARAF, ARRB1, PARK7, ARRB2, TNF, TRIM6, TCL1A, AKT1, HSP90AA1, RIPK2, AXIN1, MIF, GFRA2, SFRP2, HAX1, IFNG, AKAP9, MTCP1, PRKD2, AVP, GAS6, RAF1, CD44, PFN2, CREBL2, STK4, PTGS2, EGFR, HDAC6, BAG4, PAK1, PDCD10, SMYD3, FNIP1, SNCA, ANGPT1, CAV1, ATP2B4, OSM, BRAF, MAD2L2, IL6, PINK1, CAPRIN2, BCL2, SPRY2, CAMK1, EIF4G1]
