id	name	nbGenes	ICSeco	ICZhou	ICSanchez	ICMazandu
GO:0044281	small molecule metabolic process	104	0.25	0.25	3.26	6.41
GO:0044238	primary metabolic process	579	0.19	0.22	2.60	6.41
GO:0071704	organic substance metabolic process	606	0.15	0.20	2.26	6.41
GO:0031323	regulation of cellular metabolic process	427	0.22	0.36	4.01	22.77
GO:0048522	positive regulation of cellular process	352	0.24	0.37	3.90	23.85
GO:0043269	regulation of ion transport	27	0.41	0.50	6.00	14.08
GO:0006355	regulation of transcription, DNA-templated	258	0.40	0.60	6.84	245.35
GO:0044267	cellular protein metabolic process	236	0.34	0.46	5.57	80.87
GO:0034645	cellular macromolecule biosynthetic process	212	0.47	0.53	6.91	102.76
GO:0032268	regulation of cellular protein metabolic process	196	0.37	0.51	6.13	70.76
GO:0006351	transcription, DNA-templated	180	0.57	0.68	8.45	581.39
GO:0051641	cellular localization	180	0.37	0.31	4.44	5.67
GO:0006357	regulation of transcription by RNA polymerase II	178	0.44	0.63	7.11	248.57
GO:0046907	intracellular transport	146	0.46	0.48	6.38	29.65
GO:0042221	response to chemical	145	0.32	0.29	4.12	6.14
GO:0010628	positive regulation of gene expression	141	0.47	0.56	6.67	58.80
GO:0035556	intracellular signal transduction	131	0.51	0.55	6.92	23.17
GO:0016192	vesicle-mediated transport	130	0.52	0.51	6.57	10.99
GO:0065003	protein-containing complex assembly	123	0.45	0.48	6.06	36.47
GO:0010033	response to organic substance	123	0.35	0.37	4.75	9.28
GO:0015031	protein transport	120	0.48	0.59	6.99	54.46
GO:0045893	positive regulation of transcription, DNA-templated	118	0.52	0.67	8.14	1208.12
GO:0045595	regulation of cell differentiation	111	0.34	0.42	5.25	23.33
GO:0006508	proteolysis	108	0.55	0.57	7.34	47.86
GO:0045944	positive regulation of transcription by RNA polymerase II	93	0.55	0.71	8.36	1463.86
GO:0045892	negative regulation of transcription, DNA-templated	87	0.56	0.69	8.52	1581.26
GO:0032269	negative regulation of cellular protein metabolic process	82	0.47	0.59	7.45	289.39
GO:0006886	intracellular protein transport	81	0.55	0.65	8.12	90.55
GO:0050776	regulation of immune response	80	0.38	0.44	5.64	22.45
GO:0001101	response to acid chemical	19	0.51	0.45	6.31	9.28
GO:0010033	response to organic substance	123	0.35	0.37	4.75	9.28
GO:1901700	response to oxygen-containing compound	80	0.39	0.39	5.14	9.28
GO:0050776	regulation of immune response	80	0.38	0.44	5.64	22.45
GO:0007610	behavior	19	0.48	0.24	4.72	3.37
GO:0032501	multicellular organismal process	76	0.33	0.16	3.12	3.37
GO:0002684	positive regulation of immune system process	74	0.41	0.45	5.71	22.61
GO:0043066	negative regulation of apoptotic process	69	0.56	0.63	7.79	81.07
GO:0051603	proteolysis involved in cellular protein catabolic process	67	0.65	0.65	8.27	49.65
GO:0006887	exocytosis	65	0.67	0.66	8.38	37.08
GO:0006468	protein phosphorylation	64	0.57	0.64	8.18	177.76
GO:0006468	protein phosphorylation	64	0.57	0.64	8.18	177.76
GO:0001934	positive regulation of protein phosphorylation	63	0.58	0.69	8.60	663.11
GO:0000122	negative regulation of transcription by RNA polymerase II	61	0.61	0.74	8.79	1836.95
GO:0031329	regulation of cellular catabolic process	51	0.43	0.51	6.41	39.60
GO:0042176	regulation of protein catabolic process	25	0.59	0.62	8.21	56.79
GO:0006974	cellular response to DNA damage stimulus	60	0.57	0.53	7.47	29.00
GO:0006366	transcription by RNA polymerase II	59	0.60	0.72	8.61	583.88
GO:0010942	positive regulation of cell death	58	0.54	0.56	7.33	41.78
GO:0045055	regulated exocytosis	57	0.69	0.69	8.57	38.47
GO:0008284	positive regulation of cell proliferation	56	0.56	0.57	7.27	43.45
GO:0007346	regulation of mitotic cell cycle	56	0.49	0.53	6.68	14.24
GO:0030163	protein catabolic process	54	0.63	0.61	8.35	135.67
GO:0051223	regulation of protein transport	52	0.49	0.57	7.04	29.14
GO:0060627	regulation of vesicle-mediated transport	52	0.48	0.53	6.81	26.12
GO:1903827	regulation of cellular protein localization	52	0.48	0.53	6.86	25.72
GO:0080135	regulation of cellular response to stress	51	0.46	0.52	6.64	26.18
GO:0016567	protein ubiquitination	49	0.69	0.74	9.00	153.79
GO:0045860	positive regulation of protein kinase activity	38	0.63	0.73	9.00	1094.92
GO:0043410	positive regulation of MAPK cascade	28	0.66	0.75	9.17	1017.24
GO:0033365	protein localization to organelle	48	0.50	0.54	7.01	29.83
GO:0001818	negative regulation of cytokine production	19	0.51	0.55	7.03	44.36
GO:0001819	positive regulation of cytokine production	36	0.51	0.54	6.97	44.26
GO:0008285	negative regulation of cell proliferation	46	0.56	0.57	7.31	43.61
GO:0019221	cytokine-mediated signaling pathway	46	0.60	0.63	7.60	26.50
GO:0043408	regulation of MAPK cascade	45	0.60	0.70	8.65	157.04
GO:0051640	organelle localization	45	0.49	0.45	6.08	7.87
GO:0045087	innate immune response	44	0.68	0.59	8.16	26.47
GO:0050767	regulation of neurogenesis	44	0.47	0.56	7.34	60.46
GO:0045786	negative regulation of cell cycle	43	0.51	0.54	7.10	42.35
GO:0043254	regulation of protein complex assembly	42	0.50	0.54	6.88	27.32
GO:0006281	DNA repair	41	0.63	0.66	8.78	180.34
GO:0007186	G-protein coupled receptor signaling pathway	40	0.55	0.57	7.20	23.17
GO:0034728	nucleosome organization	17	0.71	0.65	8.68	36.42
GO:0032984	protein-containing complex disassembly	26	0.61	0.55	7.66	35.41
GO:0051707	response to other organism	40	0.42	0.46	6.41	24.63
GO:0014070	response to organic cyclic compound	39	0.45	0.47	5.96	13.32
GO:0032956	regulation of actin cytoskeleton organization	24	0.56	0.63	7.72	34.12
GO:0070507	regulation of microtubule cytoskeleton organization	18	0.61	0.65	8.24	33.71
GO:0033044	regulation of chromosome organization	37	0.44	0.54	6.49	19.19
GO:0071345	cellular response to cytokine stimulus	37	0.67	0.63	8.21	61.60
GO:0007169	transmembrane receptor protein tyrosine kinase signaling pathway	37	0.58	0.64	7.56	28.11
GO:0043547	positive regulation of GTPase activity	36	0.93	0.79	9.52	49.34
GO:0070646	protein modification by small protein removal	36	0.71	0.73	9.06	201.50
GO:0045596	negative regulation of cell differentiation	36	0.44	0.51	6.50	82.79
GO:0016050	vesicle organization	36	0.58	0.54	7.25	18.35
GO:0070925	organelle assembly	36	0.61	0.55	7.53	37.31
GO:0008380	RNA splicing	36	0.72	0.74	9.18	117.48
GO:0010923	negative regulation of phosphatase activity	6	0.79	0.79	9.36	265.75
GO:0042326	negative regulation of phosphorylation	30	0.58	0.66	8.18	181.49
GO:0030335	positive regulation of cell migration	35	0.58	0.64	8.22	157.26
GO:0051259	protein complex oligomerization	35	0.78	0.68	9.09	40.42
GO:0006417	regulation of translation	35	0.52	0.61	8.02	212.82
GO:0048468	cell development	34	0.51	0.45	6.51	28.42
GO:0051052	regulation of DNA metabolic process	34	0.47	0.56	7.17	70.58
GO:0043687	post-translational protein modification	33	0.65	0.67	8.51	151.15
GO:0051276	chromosome organization	33	0.55	0.52	6.96	18.35
GO:0003006	developmental process involved in reproduction	32	0.43	0.34	5.07	14.49
GO:0006518	peptide metabolic process	26	0.56	0.57	7.65	56.97
GO:0006672	ceramide metabolic process	6	0.71	0.71	9.18	101.21
GO:2001233	regulation of apoptotic signaling pathway	31	0.59	0.64	8.44	61.17
GO:0072657	protein localization to membrane	31	0.58	0.58	7.59	29.83
GO:0007264	small GTPase mediated signal transduction	30	0.74	0.69	8.74	26.43
GO:0000226	microtubule cytoskeleton organization	29	0.58	0.58	7.66	30.31
GO:0050727	regulation of inflammatory response	28	0.53	0.59	7.40	31.59
GO:0051090	regulation of DNA binding transcription factor activity	28	0.72	0.77	9.22	255.34
GO:0001558	regulation of cell growth	28	0.58	0.58	7.66	26.25
GO:0071214	cellular response to abiotic stimulus	26	0.59	0.54	7.66	24.78
GO:1903311	regulation of mRNA metabolic process	25	0.60	0.65	8.36	73.29
GO:0006897	endocytosis	25	0.63	0.61	8.09	26.36
GO:0016569	covalent chromatin modification	25	0.54	0.56	7.38	32.64
GO:0090305	nucleic acid phosphodiester bond hydrolysis	24	0.61	0.63	8.36	112.25
GO:0034660	ncRNA metabolic process	24	0.46	0.58	7.25	115.08
GO:0023014	signal transduction by protein phosphorylation	24	0.72	0.74	9.15	203.92
GO:0097190	apoptotic signaling pathway	24	0.70	0.64	8.53	23.17
GO:0046649	lymphocyte activation	23	0.55	0.52	7.16	18.06
GO:0050900	leukocyte migration	23	0.60	0.59	8.02	26.94
GO:0006888	ER to Golgi vesicle-mediated transport	23	1.00	0.82	9.63	49.13
GO:0000956	nuclear-transcribed mRNA catabolic process	23	0.69	0.74	9.30	714.77
GO:0001666	response to hypoxia	21	0.81	0.70	9.12	21.16
GO:0032535	regulation of cellular component size	21	0.60	0.55	7.84	25.54
GO:0031667	response to nutrient levels	20	0.52	0.51	6.57	9.40
GO:0006914	autophagy	20	0.67	0.59	8.40	37.75
GO:0019932	second-messenger-mediated signaling	20	0.65	0.65	8.32	26.43
GO:0030036	actin cytoskeleton organization	20	0.63	0.61	8.05	29.61
GO:0043122	regulation of I-kappaB kinase/NF-kappaB signaling	19	0.79	0.74	9.26	45.07
GO:0045637	regulation of myeloid cell differentiation	19	0.62	0.63	8.47	67.17
GO:0060249	anatomical structure homeostasis	19	0.63	0.57	7.52	10.43
GO:0022900	electron transport chain	19	0.71	0.61	8.48	29.76
GO:0002237	response to molecule of bacterial origin	19	0.69	0.59	8.74	31.75
GO:0050792	regulation of viral process	19	0.60	0.59	7.74	14.20
GO:0071363	cellular response to growth factor stimulus	19	0.77	0.67	8.94	60.39
GO:0048002	antigen processing and presentation of peptide antigen	19	0.70	0.55	8.09	8.95
GO:0010469	regulation of signaling receptor activity	18	0.59	0.62	7.95	48.62
GO:0030111	regulation of Wnt signaling pathway	18	0.59	0.62	7.99	41.85
GO:0034976	response to endoplasmic reticulum stress	18	0.68	0.59	8.28	29.00
GO:1901342	regulation of vasculature development	18	0.58	0.58	7.71	27.38
GO:0030336	negative regulation of cell migration	17	0.58	0.64	8.21	158.04
GO:0016042	lipid catabolic process	17	0.51	0.51	6.88	43.15
GO:0016055	Wnt signaling pathway	16	0.59	0.65	7.65	28.58
GO:0050878	regulation of body fluid levels	16	0.58	0.49	7.01	8.64
GO:0006310	DNA recombination	16	0.61	0.66	8.53	149.04
GO:0044772	mitotic cell cycle phase transition	16	0.84	0.67	9.04	28.43
GO:0030705	cytoskeleton-dependent intracellular transport	16	0.60	0.59	7.89	33.20
GO:0034599	cellular response to oxidative stress	15	0.72	0.61	8.94	68.67
GO:0030099	myeloid cell differentiation	15	0.69	0.60	8.15	21.07
GO:0007565	female pregnancy	14	1.00	0.70	9.63	32.81
GO:0050804	modulation of chemical synaptic transmission	14	0.52	0.58	7.24	27.32
GO:0030522	intracellular receptor signaling pathway	14	0.65	0.62	7.99	23.17
GO:0006470	protein dephosphorylation	14	0.76	0.73	9.22	177.17
GO:0032465	regulation of cytokinesis	13	0.59	0.62	8.14	31.80
GO:0001701	in utero embryonic development	13	1.00	0.85	9.63	22.50
GO:1901214	regulation of neuron death	13	0.67	0.63	8.47	13.83
GO:0030855	epithelial cell differentiation	13	0.55	0.52	6.96	21.07
GO:0043393	regulation of protein binding	13	0.59	0.55	7.49	9.33
GO:0030182	neuron differentiation	12	0.58	0.54	7.21	21.07
GO:0007249	I-kappaB kinase/NF-kappaB signaling	12	1.00	0.82	9.63	26.43
GO:0046488	phosphatidylinositol metabolic process	12	0.68	0.69	8.80	147.20
GO:0043244	regulation of protein complex disassembly	12	0.61	0.59	7.71	15.89
GO:0016482	cytosolic transport	12	0.71	0.64	8.53	33.20
GO:0046578	regulation of Ras protein signal transduction	12	0.70	0.72	8.71	46.46
GO:1901222	regulation of NIK/NF-kappaB signaling	12	0.84	0.77	9.34	45.07
GO:0008360	regulation of cell shape	11	0.68	0.66	8.69	41.78
GO:1905952	regulation of lipid localization	11	0.51	0.51	6.78	10.45
GO:0007268	chemical synaptic transmission	11	0.74	0.72	8.66	23.17
GO:0001959	regulation of cytokine-mediated signaling pathway	11	0.61	0.63	8.11	55.11
GO:0009306	protein secretion	11	0.57	0.66	7.92	130.29
GO:0006486	protein glycosylation	10	0.62	0.66	8.59	174.08
GO:0070374	positive regulation of ERK1 and ERK2 cascade	10	0.93	0.90	9.60	1178.86
GO:1901796	regulation of signal transduction by p53 class mediator	10	0.72	0.71	9.12	45.07
GO:0045444	fat cell differentiation	10	0.87	0.68	9.29	21.07
GO:0006479	protein methylation	9	0.59	0.67	8.39	206.80
GO:0002009	morphogenesis of an epithelium	9	0.51	0.51	6.34	13.50
GO:0061640	cytoskeleton-dependent cytokinesis	9	0.80	0.65	8.82	12.42
GO:0008203	cholesterol metabolic process	8	0.80	0.72	9.22	82.65
GO:0050773	regulation of dendrite development	8	0.76	0.78	9.51	86.24
GO:0045815	positive regulation of gene expression, epigenetic	8	0.78	0.74	9.08	79.85
GO:0016485	protein processing	8	0.65	0.65	8.32	99.81
GO:0051897	positive regulation of protein kinase B signaling	8	1.00	0.88	9.63	238.42
GO:0007229	integrin-mediated signaling pathway	7	1.00	0.82	9.63	26.50
GO:0018107	peptidyl-threonine phosphorylation	7	0.77	0.78	9.31	337.99
GO:0006368	transcription elongation from RNA polymerase II promoter	7	1.00	0.90	9.63	477.15
GO:0042391	regulation of membrane potential	7	0.52	0.46	6.44	8.64
GO:0030856	regulation of epithelial cell differentiation	7	0.56	0.57	7.76	54.42
GO:0043620	regulation of DNA-templated transcription in response to stress	7	0.63	0.73	8.89	277.57
GO:0000060	protein import into nucleus, translocation	7	1.00	0.90	9.63	93.44
GO:0022405	hair cycle process	6	0.87	0.63	8.94	9.53
GO:0010611	regulation of cardiac muscle hypertrophy	6	0.79	0.74	9.26	47.01
GO:0051146	striated muscle cell differentiation	6	0.74	0.66	8.78	21.76
GO:0035264	multicellular organism growth	6	1.00	0.70	9.63	22.58
GO:1901888	regulation of cell junction assembly	6	0.75	0.67	8.94	27.32
GO:0031098	stress-activated protein kinase signaling cascade	6	0.80	0.72	9.19	55.43
GO:0070588	calcium ion transmembrane transport	5	0.71	0.75	9.08	116.68
GO:1901522	positive regulation of transcription from RNA polymerase II promoter involved in cellular response to chemical stimulus	5	0.71	0.81	9.26	1467.90
GO:0060964	regulation of gene silencing by miRNA	5	0.74	0.74	9.16	63.20
GO:0001954	positive regulation of cell-matrix adhesion	5	0.87	0.76	9.34	50.26
GO:0009743	response to carbohydrate	5	0.63	0.57	8.10	27.32
GO:0006497	protein lipidation	5	0.65	0.68	8.67	151.15
GO:0007517	muscle organ development	5	0.78	0.64	8.75	27.68
GO:1904837	beta-catenin-TCF complex assembly	5	1.00	0.79	9.63	40.42
GO:2000379	positive regulation of reactive oxygen species metabolic process	5	0.78	0.71	9.25	112.72
GO:0001755	neural crest cell migration	4	0.80	0.72	9.09	22.57
GO:0033619	membrane protein proteolysis	4	0.81	0.73	9.26	49.65
GO:0032768	regulation of monooxygenase activity	4	0.73	0.66	8.80	22.93
GO:0007163	establishment or maintenance of cell polarity	4	0.60	0.42	6.77	7.39
GO:0048015	phosphatidylinositol-mediated signaling	4	0.93	0.82	9.51	26.43
GO:0051085	chaperone cofactor-dependent protein refolding	3	1.00	0.79	9.63	21.14
GO:0032007	negative regulation of TOR signaling	3	0.89	0.82	9.52	239.49
GO:0048709	oligodendrocyte differentiation	3	0.89	0.74	9.34	23.15
GO:0002062	chondrocyte differentiation	3	0.89	0.70	9.45	21.07
GO:0006783	heme biosynthetic process	3	0.83	0.76	9.46	646.21
GO:0060218	hematopoietic stem cell differentiation	3	1.00	0.79	9.63	45.53
GO:2000352	negative regulation of endothelial cell apoptotic process	3	1.00	0.90	9.63	129.93
GO:0000244	spliceosomal tri-snRNP complex assembly	2	1.00	0.88	9.63	66.60
GO:0015813	L-glutamate transmembrane transport	2	0.87	0.87	9.55	441.02
GO:0033234	negative regulation of protein sumoylation	2	0.93	0.88	9.59	528.62
GO:2000630	positive regulation of miRNA metabolic process	2	0.93	0.84	9.58	378.47
GO:0032332	positive regulation of chondrocyte differentiation	2	0.89	0.80	9.57	229.71
GO:1903061	positive regulation of protein lipidation	2	0.93	0.86	9.60	1090.84
GO:0045746	negative regulation of Notch signaling pathway	2	0.93	0.82	9.56	188.11
GO:0090207	regulation of triglyceride metabolic process	2	0.79	0.72	9.22	42.30
GO:0043248	proteasome assembly	2	0.87	0.76	9.31	44.52
GO:0045663	positive regulation of myoblast differentiation	2	0.93	0.79	9.54	114.26
GO:0045779	negative regulation of bone resorption	2	1.00	0.85	9.63	83.01
GO:1990182	exosomal secretion	2	1.00	0.85	9.63	38.47
GO:0038061	NIK/NF-kappaB signaling	2	1.00	0.82	9.63	26.43
GO:1903373	positive regulation of endoplasmic reticulum tubular network organization	2	1.00	0.85	9.63	89.86
GO:0018193	peptidyl-amino acid modification	52	0.39	0.54	6.24	151.15
GO:0018126	protein hydroxylation	2	0.71	0.71	8.97	151.15
GO:0072321	chaperone-mediated protein transport	2	0.89	0.82	9.47	57.35
GO:0035196	production of miRNAs involved in gene silencing by miRNA	2	1.00	0.92	9.63	119.56
GO:0071277	cellular response to calcium ion	2	1.00	0.82	9.63	78.50
GO:0043297	apical junction assembly	1	1.00	0.82	9.63	56.14
GO:1901838	positive regulation of transcription of nucleolar large rRNA by RNA polymerase I	1	1.00	0.95	9.63	1713.72
GO:0045104	intermediate filament cytoskeleton organization	1	0.83	0.70	9.27	28.23
GO:0034497	protein localization to phagophore assembly site	1	1.00	0.79	9.63	29.83
GO:0043278	response to morphine	1	0.93	0.82	9.55	93.34
GO:0035646	endosome to melanosome transport	1	1.00	0.82	9.63	33.20
GO:0050862	positive regulation of T cell receptor signaling pathway	1	1.00	0.88	9.63	365.09
GO:0071550	death-inducing signaling complex assembly	1	0.93	0.76	9.49	40.42
GO:0019076	viral release from host cell	1	0.84	0.77	9.39	33.81
GO:1990000	amyloid fibril formation	1	1.00	0.79	9.63	65.11
GO:0044546	NLRP3 inflammasome complex assembly	1	1.00	0.82	9.63	44.52
GO:0000413	protein peptidyl-prolyl isomerization	1	0.93	0.86	9.57	156.19
GO:0046627	negative regulation of insulin receptor signaling pathway	1	0.89	0.80	9.52	294.35
GO:0006117	acetaldehyde metabolic process	1	0.89	0.70	9.34	30.57
GO:0010744	positive regulation of macrophage derived foam cell differentiation	1	1.00	0.82	9.63	113.86
GO:0001913	T cell mediated cytotoxicity	1	0.93	0.79	9.55	37.17
GO:0010989	negative regulation of low-density lipoprotein particle clearance	1	1.00	0.82	9.63	57.61
GO:1902993	positive regulation of amyloid precursor protein catabolic process	1	0.87	0.78	9.43	177.27
GO:1901026	ripoptosome assembly involved in necroptotic process	1	1.00	0.82	9.63	41.12
GO:1902895	positive regulation of pri-miRNA transcription by RNA polymerase II	1	1.00	0.95	9.63	1721.24
GO:0014029	neural crest formation	1	1.00	0.82	9.63	35.88
GO:0023035	CD40 signaling pathway	1	1.00	0.82	9.63	26.50
GO:1900169	regulation of glucocorticoid mediated signaling pathway	1	0.89	0.77	9.41	41.85
GO:0097527	necroptotic signaling pathway	1	1.00	0.79	9.63	23.17
GO:1903527	positive regulation of membrane tubulation	1	1.00	0.85	9.63	66.12
GO:0060368	regulation of Fc receptor mediated stimulatory signaling pathway	1	0.84	0.74	9.45	67.48
