ID;Term;Depth;IC Nuno;IC zhou;IC sanchez;IC resnik;IC RZ;IC Rnormalized;IC Nuno org;Annotated Genes Set number
GO:0036496;regulation of translational initiation by eIF2 alpha dephosphorylation;10.0;0.9326813400603323;0.8815816818910864;9.608321545174602;674.6262540571083;9.083926447120524;0.022579133599080606;0.8797934328124444;[PPP1R15A]
GO:0036498;IRE1-mediated unfolded protein response;6.0;1.0;0.8231203125901445;9.628524252492122;55.46397693329154;5.825829909099042;0.0018563293936187412;0.6210535250702663;[ZBTB17, XBP1, WFS1, EDEM1, SYVN1, ARFGAP1, YIF1A, ERN1, EXTL2, CTDSP2, LMNA, DNAJB11, SSR1, TPP1, HYOU1, TLN1, SULT1A3]
GO:0060123;regulation of growth hormone secretion;9.0;0.8933024483968273;0.8428918493787028;9.510741216835738;106.7634718148897;7.212124270218933;0.003573277320757824;0.7650689957573628;[CHD7]
GO:1902310;positive regulation of peptidyl-serine dephosphorylation;10.0;1.0;0.9152410118609203;9.628524252492122;773.3300010362153;9.083926447120524;0.02588265918286621;0.8797934328124444;[PPP1R15A]
GO:1990090;cellular response to nerve growth factor stimulus;6.0;0.9326813400603323;0.7894609826203107;9.5544162803384;97.48528473772916;5.9928839937622085;0.003262744749111514;0.6295966787287501;[USP8, EIF4A3, RAB35, RAPGEF1, PTEN, CIB1, BPTF]
GO:1901223;negative regulation of NIK/NF-kappaB signaling;8.0;1.0;0.875;9.628524252492122;239.1998693179246;6.686031174322154;0.008005804360164796;0.7169239451870815;[CYLD, NLRP12, RASSF2, CPNE1, NLRP3, RELA]
GO:1900138;negative regulation of phospholipase A2 activity;8.0;1.0;0.875;9.628524252492122;83.36451349999537;8.67846133901236;0.002790135243653613;0.8188169164668168;[ANXA1]
GO:1903408;positive regulation of sodium:potassium-exchanging ATPase activity;11.0;1.0;0.9324289523296623;9.628524252492122;1737.6104827170566;9.777073627680469;0.05815625910863255;0.9324289523296623;[DNM2]
GO:0002244;hematopoietic progenitor cell differentiation;4.0;0.811012628672052;0.655506314336026;8.935377071932177;21.066225782797595;5.395046993006588;7.050676185779127E-4;0.5259029541176994;[AGPAT5, SFRP1, COL24A1, XRCC5, SIN3A, HYAL2, KIT, HOXB4, PAPD4, PTPN6, MIXL1]
GO:0072583;clathrin-dependent endocytosis;7.0;0.8436909121759173;0.7727648213451592;9.223059144383958;30.046907922432062;6.558197802812269;0.0010056429677022863;0.6863059058804069;[GAK, AP2S1, CLTA, FNBP1L, PICALM]
GO:0071493;cellular response to UV-B;8.0;1.0;0.875;9.628524252492122;82.44278777713699;7.697632086000634;0.0027592859132088378;0.7686572628545723;[CDKN1A, HYAL2]
GO:0048489;synaptic vesicle transport;7.0;0.7671156992804218;0.7344772148974115;9.292052015870908;108.01043080855717;5.459585514144159;0.003615011916085639;0.6301228223472235;[TOR1A, SYT15, SYTL3, DNM2, RPH3A, P2RX7, AP3M1, TRIM9, SYNJ1, CDK5, BLOC1S1, AP3S2, SPG11]
GO:0098976;excitatory chemical synaptic transmission;8.0;1.0;0.875;9.628524252492122;25.73829654599903;7.697632086000634;8.61437622431563E-4;0.7686572628545723;[SSH1]
GO:0048488;synaptic vesicle endocytosis;6.0;0.8933024483968273;0.7697715367885581;9.427853557029971;55.00680757199006;6.599019797332524;0.0018410283465216937;0.6605944919115335;[KIAA1109, SYNJ1, CDK5, DENND1A]
GO:0071257;cellular response to electrical stimulus;5.0;1.0;0.7902410118609202;9.628524252492122;37.20981579086828;7.292166977892469;0.0012453790478602876;0.6631627702307852;[PTEN]
GO:0051402;neuron apoptotic process;5.0;0.8259837884571596;0.7032329060895001;9.022388448921806;23.44398779513952;6.113511981550823;7.846491732841165E-4;0.6028862989048107;[POLB, PIGT, CDK5, DIABLO, MAX, CASP3, BID, GAPDH, CIT]
GO:0034063;stress granule assembly;7.0;1.0;0.8509193652572005;9.628524252492122;107.30488678463786;7.069023426578259;0.0035913979925534566;0.7124295520356204;[ATXN2, EIF2S1, PUM2, C9orf72]
GO:0060591;chondroblast differentiation;4.0;1.0;0.75;9.628524252492122;21.066225782797595;8.16763571524637;7.050676185779127E-4;0.6676932703116032;[RARA]
GO:2000370;positive regulation of clathrin-dependent endocytosis;9.0;1.0;0.896240625180289;9.628524252492122;226.36966561352764;8.16763571524637;0.0075763889886123065;0.8139338954918922;[WASL, PICALM, DNM2]
GO:1903898;negative regulation of PERK-mediated unfolded protein response;9.0;1.0;0.896240625180289;9.628524252492122;384.78934721132015;8.16763571524637;0.012878553163233311;0.8139338954918922;[PPP1R15A]
GO:0048008;platelet-derived growth factor receptor signaling pathway;8.0;0.7763722522362496;0.7631861261181248;9.186691500213083;31.002284443533863;6.280566066213989;0.0010376185600805164;0.6961884407023742;[BCR, PDGFRB, SGPL1, ABL1, RAPGEF1, PTEN]
GO:0006612;protein targeting to membrane;10.0;0.811012628672052;0.8207473261969463;9.414950152194063;149.73401455281405;4.753193106834193;0.0050114627152184205;0.6583195283905053;[PEX16, TRAM1, RPS9, PEX19, RPL3, NCF1, RPS7, SSR2, RAB3IP, ZDHHC23, SRP54, ZDHHC12, ZDHHC24, ZDHHC6, RPL23A, RPS15, SEC61A2, TAOK2, CHMP4B, SSR1, RPL29, RAB8B, RPL19]
GO:0051895;negative regulation of focal adhesion assembly;8.0;1.0;0.875;9.628524252492122;270.76229412472316;7.069023426578259;0.009062170314110184;0.7365101867784198;[RCC2, PTEN, THBS1]
GO:0052501;positive regulation by organism of apoptotic process in other organism involved in symbiotic interaction;10.0;0.8436909121759173;0.837086467948879;9.59953671561887;492.85104632609745;8.67846133901236;0.01649528098338966;0.8590579283277371;[GAPDH]
GO:0048010;vascular endothelial growth factor receptor signaling pathway;8.0;0.8259837884571596;0.7879918942285797;9.186691500213083;31.002284443533863;5.572381008289503;0.0010376185600805164;0.6599718239061428;[CYFIP2, NCKAP1, BMPR2, NCF1, ROCK2, NCF2, ITGB3, PDCD6, VAV1, VAV2, ELMO1, NCKAP1L, ITGAV]
GO:0005999;xylulose biosynthetic process;7.0;1.0;0.8509193652572005;9.628524252492122;171.81603384806527;9.083926447120524;0.005750528028503347;0.8154717862087246;[TALDO1]
GO:0071481;cellular response to X-ray;7.0;1.0;0.8509193652572005;9.628524252492122;60.39874674087868;7.379178354882098;0.0020214916980741903;0.728290889492758;[NIPBL, SFRP1, XRCC6, XRCC5, DNM2]
GO:0071245;cellular response to carbon monoxide;5.0;1.0;0.7902410118609202;9.628524252492122;234.8296146911994;9.777073627680469;0.007859535870782117;0.7902410118609202;[DNM2]
GO:0048015;phosphatidylinositol-mediated signaling;7.0;0.9326813400603323;0.8172600352873667;9.510741216835738;26.42836680105094;5.649939242635378;8.845336528452411E-4;0.6398575208746181;[PDGFRB, GSN, C1QBP, PIK3C3, SIRT2, PIK3CG, EXOC1, IGF1R]
GO:0006606;protein import into nucleus;9.0;0.8933024483968273;0.8428918493787028;9.551563211355994;277.5355368998559;5.288437257948329;0.009288864654271135;0.6666915524892495;[NUP107, SYK, NUP153, RGPD1, IPO4, NUP93, NCKIPSD, IPO8, IPO9, NUP62, LMNA, HEATR3, KPNA4, TNPO1, TNPO2, RAE1, KPNB1, TNPO3]
GO:0006607;NLS-bearing protein import into nucleus;10.0;1.0;0.9152410118609203;9.628524252492122;278.22868408041535;6.481236761676141;0.009312063666612497;0.7466917612613706;[NCKIPSD, KPNA4, TNPO1, TNPO2, RGPD1, KPNB1, IPO4]
GO:0051897;positive regulation of protein kinase B signaling;8.0;1.0;0.875;9.628524252492122;238.41769229280743;4.7664383335842135;0.007979625599047746;0.6187558780415471;[PDGFRB, ITGB1, IGFBP5, ANGPT1, CD80, PARK7, THBS1, VAV1, PIK3CG, TGFBR1, STK3, MTDH, BAG4, C1QBP, KIT, CPNE1, CCL19, TEK, MET, HBEGF]
GO:0048490;anterograde synaptic vesicle transport;10.0;1.0;0.9152410118609203;9.628524252492122;439.1991285038257;7.004484905440688;0.014699599577469427;0.7734506956670166;[AP3M1, BLOC1S1, AP3S2]
GO:0051898;negative regulation of protein kinase B signaling;8.0;1.0;0.875;9.628524252492122;238.79440420981607;6.063501560976162;0.00799223380789131;0.6850877518099798;[FLCN, PDCD6, HYAL2, RAPGEF1, PTEN, CIB1, TRIB3, MTM1]
GO:0048017;inositol lipid-mediated signaling;6.0;0.8933024483968273;0.7697715367885581;9.4949928598676;26.42836680105094;5.602686357784832;8.845336528452411E-4;0.6096419534788213;[PDGFRB, GSN, C1QBP, PIK3C3, PLD1, SIRT2, PIK3CG, EXOC1, IGF1R]
GO:1904754;positive regulation of vascular associated smooth muscle cell migration;9.0;1.0;0.896240625180289;9.628524252492122;244.58802208207217;7.212124270218933;0.008186140984158152;0.7650689957573628;[IGFBP5, ATP7A, SSH1]
GO:0060389;pathway-restricted SMAD protein phosphorylation;8.0;1.0;0.875;9.628524252492122;180.75330000196035;7.212124270218933;0.006049650283656873;0.7438283705770736;[TGFBR1]
GO:0002223;stimulatory C-type lectin receptor signaling pathway;11.0;1.0;0.9324289523296623;9.628524252492122;628.1099736002739;5.618190544320798;0.02102227555412486;0.7197434780388068;[CREBBP, FCER1G, RPS6KA5, SYK, EP300, KRAS, HRAS, NFKB1, RELA, CARD11]
GO:0042953;lipoprotein transport;8.0;1.0;0.875;9.628524252492122;68.44752614357394;7.138016298065211;0.0022908771012512216;0.7400384854347593;[MIA3, ZDHHC17]
GO:0000045;autophagosome assembly;6.0;1.0;0.8231203125901445;9.628524252492122;62.10424204613046;5.769740442447999;0.0020785730910948433;0.618185107137305;[BECN1, NSFL1C, GABARAPL1, TP53INP2, TP53INP1, UBQLN1, PIK3C3, ULK1, ATG5]
GO:0046085;adenosine metabolic process;9.0;0.8653626801206646;0.8289219652406215;9.54514264355307;443.46863639021404;7.474488534686424;0.01484249616411921;0.7784863164434164;[ADK, ACPP]
GO:0071277;cellular response to calcium ion;6.0;1.0;0.8231203125901445;9.628524252492122;78.50383844342444;5.433268205826786;0.0026274528238337297;0.6009779013089371;[ITPKB, ENDOG, PPIF, CPNE1, CPNE3, CPNE2, ECT2, ARID1A, RASGRP2, TUBG1, PKD2]
GO:0098711;iron ion import across plasma membrane;10.0;0.8933024483968273;0.861892236059334;9.533214072687796;266.397951560906;7.697632086000634;0.008916099696152526;0.8088982747154926;[STEAP3, ARHGAP1, PICALM]
GO:0048268;clathrin coat assembly;6.0;0.8436909121759173;0.7449657686781032;9.310070521373587;44.51706700895919;6.781341354126479;0.0014899461700306506;0.6699184248047958;[CLTCL1, AP2S1, CLTA, PICALM]
GO:0071276;cellular response to cadmium ion;6.0;1.0;0.8231203125901445;9.628524252492122;78.50383844342444;6.139487467954083;0.0026274528238337297;0.6370939872166814;[GSN, NCF1, MT1G, ATP7A]
GO:2000134;negative regulation of G1/S transition of mitotic cell cycle;9.0;0.7980440201809971;0.7952626352707877;9.394909401310617;355.88113835876356;5.244474134527214;0.011911021428637128;0.6644432763129993;[BTG2, CDKN1A, PCNA, PTEN, PKD2, CCNB1, CASP2, EP300, GTSE1, E2F7, E2F8, DACT1, CNOT10, CNOT4, CNOT6, TFDP1, RBL1, CNOT7, TFDP2, CNOT1, CTDSP2, RFWD3, CNOT3, CDK2, CNOT8, EZH2]
GO:0060391;positive regulation of SMAD protein signal transduction;8.0;1.0;0.875;9.628524252492122;234.98809543662418;7.292166977892469;0.007864840078708074;0.747921758369865;[NUP93, TGFBR1]
GO:0098719;sodium ion import across plasma membrane;9.0;1.0;0.896240625180289;9.628524252492122;255.84958837647977;7.069023426578259;0.008563055473280314;0.757750811958709;[SLC9A6, SLC9A8]
GO:0048261;negative regulation of receptor-mediated endocytosis;8.0;0.8259837884571596;0.7879918942285797;9.392135474427892;175.26533825665737;6.832634648514029;0.005865973142886497;0.7244212536750128;[LRPAP1, ATXN2, PICALM]
GO:2000379;positive regulation of reactive oxygen species metabolic process;6.0;0.7763722522362496;0.7113064387082693;9.253830803050711;112.71770282919289;5.299736813202263;0.0037725600743465397;0.5941490996802742;[PDGFRB, CDKN1A, P2RX4, RIPK3, NNT, ITGB2, PTX3, RIPK1, PARK7, PKD2, THBS1, DNM2]
GO:2000378;negative regulation of reactive oxygen species metabolic process;6.0;0.7763722522362496;0.7113064387082693;9.253830803050711;113.12708673636307;5.905872616772578;0.003786261785297929;0.6251469128630576;[BCR, TFAP2A, BECN1, G6PD, CAV1, CTNS, BRCA1, PARK7, AATF, SIRT2, ATG5]
GO:0060134;prepulse inhibition;6.0;1.0;0.8231203125901445;9.628524252492122;45.20359748329822;7.212124270218933;0.0015129237271694644;0.6919486831672181;[ADORA2A, PTEN]
GO:1903432;regulation of TORC1 signaling;8.0;0.8933024483968273;0.8216512241984136;9.446202695698167;46.45640819702609;6.409777797693995;0.0015548541743014947;0.7027963346592216;[SEC13, SEH1L, CLEC16A, C9orf72]
GO:0033198;response to ATP;6.0;0.9326813400603323;0.7894609826203107;9.56398573135455;115.93137747960115;6.375876246018314;0.0038801188727762915;0.6491829203200885;[P2RX7, P2RX4, PTEN, HSP90B1, SSH1]
GO:0033197;response to vitamin E;7.0;0.9326813400603323;0.8172600352873667;9.541512875502493;57.68202331572161;7.292166977892469;0.00193056540992653;0.7238411236270654;[BECN1, CAT]
GO:1901017;negative regulation of potassium ion transmembrane transporter activity;10.0;0.7866048967936545;0.8085434602577476;9.418803721510052;728.707892328508;7.004484905440688;0.024389197361709854;0.7734506956670166;[CAV1, PTEN, OXSR1]
GO:0060378;regulation of brood size;3.0;0.8933024483968273;0.6447715367885581;9.427853557029971;52.655132693119924;9.083926447120524;0.0017623199046958948;0.6626727335416686;[SH3PXD2B]
GO:0071260;cellular response to mechanical stimulus;5.0;1.0;0.7902410118609202;9.628524252492122;56.1235610070294;5.420364800990877;0.00187840507897962;0.5674387198563348;[PTGER4, MTPN, CD40, MAP3K1, ITGA2, TNFRSF10B, TNFRSF10A, NFKB1, AQP1, BAG3, NPPA, CASP2, TLR7, LTBR]
GO:2000146;negative regulation of cell motility;6.0;0.5781283279524737;0.6121844765663813;8.01908634005802;116.39406446339459;4.247644540169047;0.0038956045897326065;0.5403450519100613;[PTGER4, MCTP1, PTEN, WAS, MIA3, WASL, PTPRK, THBS1, ABR, FLCN, RRAS, TBXA2R, ADORA3, HYAL2, TP53INP1, ARHGDIB, TIMP1, CLASP1, RNF20, STARD13, IGFBP5, JUP, SERPINF1, IDH2, RHOB, BCR, NISCH, SFRP1, EPHA1]
GO:2001237;negative regulation of extrinsic apoptotic signaling pathway;9.0;0.8436909121759173;0.8180860812682478;9.50592193039979;358.6811287979994;5.152100814396198;0.012004734588810557;0.6597193004257005;[FGA, EYA2, TRADD, FGG, TNFRSF10B, TNFRSF10A, BRCA1, PARK7, THBS1, RELA, TGFBR1, LMNA, TMBIM1, RIPK1, ITGAV, BIRC6, RFFL]
GO:2001238;positive regulation of extrinsic apoptotic signaling pathway;9.0;0.8653626801206646;0.8289219652406215;9.54514264355307;358.11284317915005;5.8650506222523235;0.011985714580571521;0.6961795867550195;[TNFRSF12A, CAV1, PTEN, G0S2, STK4, THBS1, STK3, CYLD, SFRP1, HYAL2, RIPK1, LTBR, BID]
GO:0033189;response to vitamin A;7.0;0.9326813400603323;0.8172600352873667;9.533214072687796;42.3983228833862;6.781341354126479;0.0014190337108936392;0.6977174774718518;[ABCB4, CAT, RARA]
GO:0046092;deoxycytidine metabolic process;9.0;0.8653626801206646;0.8289219652406215;9.541512875502493;399.2486070631531;9.777073627680469;0.013362491577985136;0.896240625180289;[TK2]
GO:2001235;positive regulation of apoptotic signaling pathway;8.0;0.6997970393407541;0.724898519670377;9.176539128749065;291.4603159253591;4.6590798152637145;0.009754914476767216;0.6132655584219551;[HRK, YWHAB, PTEN, PARK7, STK4, THBS1, BBC3, STK3, BCLAF1, HYAL2, TP53INP1, TP53BP2, CASP2, CTSH, PLAGL2, RIPK1, BID, GSN, FBXO18, RPS7, TNFRSF12A, RIPK3, CAV1, ATPIF1, PLAUR, G0S2, YWHAZ, TGFBR1, CYLD, SFRP1, TFDP1, TFDP2, ADORA2A, PPIF, LTBR, SERINC3]
GO:1902750;negative regulation of cell cycle G2/M phase transition;8.0;0.7763722522362496;0.7631861261181248;9.249034630787218;106.68287692346017;5.69953618377475;0.003570579882272371;0.6664745454937787;[FANCI, GPR132, FZR1, H2AFY, RAD21, TAOK2, DONSON, TOPBP1, BRCA1, CDK5RAP3]
GO:0002281;macrophage activation involved in immune response;6.0;0.9326813400603323;0.7894609826203107;9.541512875502493;81.79914540449643;7.379178354882098;0.0027377437822370863;0.7004918368257019;[SUCNR1, SYK, HAVCR2]
GO:0002283;neutrophil activation involved in immune response;7.0;0.9326813400603323;0.8172600352873667;9.548481544818586;82.20461051260416;3.594988720963838;0.002751314334510546;0.5347672556313635;[SERPINA3, PYGB, GPI, SIGLEC9, FRMPD3, RAB3D, ITGB2, HK3, PSMD7, ACTR1B, PSMD2, LAMP2, CPNE1, TIMP2, CTSH, ITGAV, CPNE3, CAPN1, GUSB, SNAP29, CAP1, ACTR2, SERPINB1, FCER1G, DBNL, SYK, PLAUR, COMMD3, RNASE3, TMEM173, SCAMP1, UNC13D, SERPINB6, VAMP8, ACLY, CAT, TMBIM1, ALDOC, DOCK2, ALDOA, ACPP, SLC27A2, DNASE1L3, KPNB1, CSTB, PDXK, RAB5C, CLEC12A, UBR4, IQGAP2, LILRA2, PLD1, C3, RAP1B, COMMD9, CYB5R3, ALDH3B1, PSMB1, NCKAP1L, RAB6A, AP1M1, CTSA, XRCC6, TMEM30A, RAB4B, GSN, JUP, XRCC5, HSPA6, SURF4, LILRB3, NFKB1, FABP5, VAPA, IMPDH1, IMPDH2, RAB18, PTX3, MNDA, DEGS1, MAN2B1, PTPN6]
GO:0006641;triglyceride metabolic process;7.0;0.8436909121759173;0.7727648213451592;9.318369324188282;85.59385656069774;5.500407508664414;0.0028647493496168257;0.6322104610454062;[FABP5, GPAM, CAV1, CAT, DDHD2, MGLL]
GO:0003374;dynamin family protein polymerization involved in mitochondrial fission;8.0;1.0;0.875;9.628524252492122;46.126504921393284;7.57984905034425;0.0015438126085597365;0.7626338329336335;[MX2, DNM2]
GO:0006886;intracellular protein transport;8.0;0.5537205960740763;0.6518602980370382;8.117066748418225;90.55259897265384;3.0436717358431102;0.0030307139955665606;0.5306535141162272;[RAB3B, VPS29, AHCYL1, RPL3, NUP107, NCF1, PDCD6, RAB3D, ZDHHC6, TBC1D3C, IPO4, RAB43, RPH3A, RPS15, IPO8, IPO9, LAMP2, LONP2, ARFIP1, HOMER3, KPNA4, TBC1D22A, SIL1, VPS18, GSTK1, RPS9, RPS7, COG3, AP1B1, TOMM34, TBC1D2B, MYO7A, SYTL3, BCR, NUP93, RAB35, CHMP4B, RAB38, RPL29, SLC27A2, KPNB1, ACOT4, RTN2, COPB2, COPA, RAB5C, VPS26B, HSP90B1, NCKIPSD, CLTCL1, VPS11, SSR1, RAB6A, TBC1D15, VPS16, AP1M1, CTSA, RAB4B, PMM1, RAB3IP, PMM2, NUP153, RAB27B, TIMM44, NFKBIA, POLA2, PAN3, NPLOC4, CDK5, BCL3, HYOU1, CD24, ARF3, ARF4, TRAM1, YWHAB, SRP54, CLTA, SEC61A2, AP1G2, AP1G1, NUP62, XPO5, KIF13B, TMED2, TMED1, AP3S2, EVI5L, TNPO1, TMED7, TNPO2, ARL5A, TNPO3, RAB8B, TMED4, GRIPAP1, TMED9, SEC13, SYK, SSR2, TBC1D8, ZDHHC12, RHOB, ACOX2, AGPS, CAT, SLU7, ARF5, RABGAP1, TOMM40, RAB1B, ZDHHC23, HSD17B4, ZDHHC24, DERL2, TRAK1, RGPD1, NAPG, STX11, ARNTL, RAB21, AP3M1, RAB20, GGA3, RAB40C, LMNA, AP2S1, HEATR3, STX5, MFN2, RAB28, BID, RAE1, RPL19, PEX16, TIMM8B, PEX19, AGK, SYVN1, RPL23A, RAB11A, ARCN1, SPCS2, SNX17, VPS41, RAB13, TAOK2, RAB18, RUNDC1, RAB3GAP2, VPS45, SEC24C]
GO:0006401;RNA catabolic process;7.0;0.5945822691631375;0.6482104998387692;8.775746926340293;532.6118641417924;4.304802954008995;0.01782603977326812;0.5710671885190304;[HBS1L, FEN1, SMG1, RPL3, RNH1, EIF4A3, PPP2R2A, CASC3, SMG5, PPP2CA, RPS15, DHX34, POLR2G, EXOSC3, DCPS, RPL19, UPF2, UPF1, RPS9, RPS7, PAPD4, CNOT10, RPL23A, RNASE3, LSM5, SND1, PNRC1, ERN1, CNOT4, CNOT6, PAN3, CNOT7, XRN1, CNOT1, CSDE1, CNOT3, MRTO4, XRN2, SKIV2L, ETF1, CNOT8, DCP1A, RPL29, DCP2]
GO:0032924;activin receptor signaling pathway;8.0;0.8436909121759173;0.7968454560879586;9.427853557029971;29.903672154863813;6.518977089658987;0.0010008489954655988;0.7083807915285978;[BMPR2, TGFBR1]
GO:0048681;negative regulation of axon regeneration;11.0;0.7866048967936545;0.8257314007264895;9.463444502132672;878.9066493445661;7.212124270218933;0.02941621458893199;0.8012573229067359;[PTEN, LRIG2]
GO:0032928;regulation of superoxide anion generation;7.0;0.8933024483968273;0.7975705894556142;9.405380701177911;29.554879433861746;6.781341354126479;9.891752169867288E-4;0.6977174774718518;[SYK, ITGB2, AATF]
GO:0070365;hepatocyte differentiation;5.0;1.0;0.7902410118609202;9.628524252492122;24.20171999872632;7.212124270218933;8.100097882234571E-4;0.659069382437994;[ANXA1, ITGA2, E2F7, E2F8]
GO:0051607;defense response to virus;6.0;0.8653626801206646;0.7558016526504768;9.485423408851448;78.89111305633469;4.573066940603674;0.0026404145566033123;0.5569871686019774;[BECN1, ZNF175, CD40, DDX41, ZC3HAV1, LYST, RELA, HYAL2, NLRP3, IFNAR2, DDX17, APOBEC3F, DTX3L, APOBEC3H, MX2, TMEM173, UNC13D, ITCH, ILF3, IL6, CNOT7, GPAM, POLR3B, POLR3C, IL23A, POLR3E, DDIT4, TLR7, SERINC3, APOBEC3A, EXOC1]
GO:0050999;regulation of nitric-oxide synthase activity;6.0;0.8933024483968273;0.7697715367885581;9.405380701177911;24.724602712185703;6.039404009397101;8.275102020790521E-4;0.6319757144917204;[SCARB1, CAV1, KRAS, WASL, CALM1, DNM2]
GO:0071456;cellular response to hypoxia;6.0;1.0;0.8231203125901445;9.628524252492122;103.24589989147204;5.104244793218563;0.0034555473540902374;0.5841516286869992;[ENDOG, SUV39H1, PTEN, RORA, AQP3, SIRT2, AQP1, NPEPPS, SFRP1, CCNB1, TBL2, MYC, LMNA, UBQLN1, HYOU1, ATP7A, KCNK3]
GO:0019722;calcium-mediated signaling;7.0;0.7192862368539868;0.710562483684194;8.712233520617966;27.814661162170232;4.835431205071165;9.309316775279788E-4;0.598203541955087;[PRNP, MCTP1, CCL20, SPHK1, EIF2AK3, ATP2A2, DEFB1, CALML4, P2RX4, RCAN3, NMUR1, CALM3, CALM1, CALM2, CCR10, SULT1A3, CCR2]
GO:0051603;proteolysis involved in cellular protein catabolic process;6.0;0.6519675769143192;0.6491041010473041;8.270400768338927;49.64990487012002;3.4509241545253704;0.001661737633989536;0.49960073433695684;[CCNF, BUB1B, UBE3A, UBE2Z, UBE2L3, PSMD8, PSMD7, PSMD4, PSMD2, CDC26, LONP2, SKP2, C18orf25, USP8, RNF44, FBXO18, ARRDC1, KCTD2, TRPC4AP, KCTD5, RNF40, KCTD10, TBL1XR1, CHMP4B, ANAPC5, UBR4, ANAPC11, HSP90B1, CCNB1, RNF213, UBD, UBR5, USP51, CTSA, XBP1, UBE2I, TOR1A, SDF2L1, UBE2B, KLHL25, WFS1, EDEM1, RHBDD1, ERLIN2, BTBD6, MARCH6, NSFL1C, CYLD, RNF103, NPLOC4, CDC16, FBXL3, USP36, USP37, USP38, PPP1R11, USP32, USP34, KIF14, OTUD7B, TRIM9, CTSO, CTSK, CTSH, USP46, SEC13, PDCD6IP, DTX3L, RAD23A, VPS37A, SIRT2, DDB1, PSMA1, MAN1B1, USP41, DERL3, VPS4B, RNF38, USP12, DERL2, NEDD8, PSMB10, PSMA7, ARNTL, FZR1, PSMB5, TP53INP2, PSMB1, UBQLN1, RFFL, RNF20, LRRC29, SYVN1, FBXL15, FBXL16, KBTBD4, ITCH, SPSB1, FAP, PSMC1, TRIM32, MAD2L1]
GO:2001244;positive regulation of intrinsic apoptotic signaling pathway;9.0;0.7671156992804218;0.7797984748205;9.413412872875176;596.4251749563025;5.75172193694532;0.019961813857978603;0.6903839525180965;[BCLAF1, FBXO18, RPS7, RIPK3, CAV1, PLAGL2, PARK7, SERINC3, BID]
GO:0030501;positive regulation of bone mineralization;7.0;0.9326813400603323;0.8172600352873667;9.55953138100517;171.85898464291293;6.221725566191056;0.005751965552953692;0.6690987000520388;[TFAP2A, P2RX7, BMPR2, TMEM119, FAM20C]
GO:2000158;positive regulation of ubiquitin-specific protease activity;10.0;1.0;0.9152410118609203;9.628524252492122;498.23042437157306;9.083926447120524;0.0166753239254458;0.8797934328124444;[TANK]
GO:0003382;epithelial cell morphogenesis;6.0;0.8653626801206646;0.7558016526504768;9.36615998802463;47.452274261266446;6.409777797693995;0.0015881849152503491;0.6509166472493662;[VSIG1, HRH2, COL4A4, MET]
GO:0006893;Golgi to plasma membrane transport;7.0;0.8933024483968273;0.7975705894556142;9.510741216835738;32.11060110714162;5.845247994956144;0.0010747129213912287;0.6498456195510879;[BBS2, ARF3, ARFGEF2, ARF4, SYS1, COMMD1, VAMP5, ARF5, EXOC1, DNM2]
GO:0060317;cardiac epithelial to mesenchymal transition;6.0;0.7980440201809971;0.722142322680643;9.0094850440859;24.75510523691153;6.481236761676141;8.285310941311355E-4;0.6545710619905948;[OLFM1, SPRY1, TGFBR1]
GO:0006897;endocytosis;5.0;0.6324783794010864;0.6064802015614634;8.088079211544972;26.35802846831835;3.582668236575797;8.821794921490709E-4;0.47345883209051776;[ITGB1, SCARB1, DGKD, TFRC, SH3KBP1, NCF2, WIPF2, ITGB3, DENND1A, ITGB2, STON1, CLTA, UBE3A, WASL, FNBP1L, RABEPK, PIK3CG, KIAA1109, ANKFY1, ITGAV, SCARF1, HRAS, CAP1, FCER1G, DBNL, ANXA1, SYK, FNBP1, UNC13D, NME1, DNM2, RUFY1, GAK, ADORA2A, RARA, PIK3C3, RIN3, AMPH, RHOU, DOCK2, MET, CSNK1G2, CSNK1G1, C9orf72, COLEC12, CD163L1, WAS, LRP8, CORO1A, AGER, TM9SF4, HSP90B1, CLN3, HSPH1, CLTCL1, AP2S1, APOL1, AMBP, CAV1, CDC7, MARCH3, MIB1, EHD4, SYNJ1, CDK5, SNX17, CD9, HYOU1, PICALM]
GO:1904706;negative regulation of vascular smooth muscle cell proliferation;7.0;1.0;0.8509193652572005;9.628524252492122;80.8833163751231;6.8867018697843045;0.0027070918088165762;0.7031056191423581;[CDKN1A, PTEN]
GO:0006898;receptor-mediated endocytosis;6.0;0.6799073451904818;0.6630739851853854;8.48339194818912;28.437470009997963;4.178651668682095;9.517765291732001E-4;0.536816753253722;[COLEC12, ITGB1, SCARB1, CD163L1, TFRC, ITGB2, CLTA, FNBP1L, RABEPK, LRP8, AGER, HSP90B1, CLN3, HSPH1, CLTCL1, AP2S1, APOL1, SCARF1, CAP1, FCER1G, DBNL, AMBP, SYK, CAV1, DNM2, GAK, SYNJ1, SNX17, CD9, HYOU1, PICALM]
GO:0006654;phosphatidic acid biosynthetic process;8.0;1.0;0.875;9.628524252492122;659.6112576846374;6.139487467954083;0.022076595183113425;0.6889736746265369;[AGPAT5, PLA2G12A, GPAM, DGKA, PLD1]
GO:0048208;COPII vesicle coating;6.0;1.0;0.8231203125901445;9.628524252492122;62.43707956725794;5.6339389012889365;0.0020897128633926582;0.6112402100070131;[TRAPPC2, TRAPPC3, SEC13, TRAPPC2L, PDCD6, RAB1B, KLHL12, PPP6C, TFG, TBC1D20, TRAPPC6B, COL7A1, TMED2, STX5, SEC24C]
GO:0006412;translation;7.0;0.8653626801206646;0.7836007053175329;9.510741216835738;402.5585345733233;4.39257856489138;0.01347327187300917;0.5755560373415389;[HBS1L, RPL3, MRPS16, MRPS36, RRBP1, MRPL37, RPS15, RPL36AL, HARS, RPL19, RPL39L, RPS9, NDUFA7, MRPS24, RPS7, MRPS18B, MRPS18A, SARS, RPL23A, RPL3L, COPS5, TNIP1, RPL7L1, RPL22L1, RPL29, MRRF, CPEB4]
GO:0006646;phosphatidylethanolamine biosynthetic process;8.0;0.8933024483968273;0.8216512241984136;9.54514264355307;660.9975520457573;7.004484905440688;0.022122993207796184;0.7332096838060964;[CHKB, CHKA]
GO:0006888;ER to Golgi vesicle-mediated transport;6.0;1.0;0.8231203125901445;9.628524252492122;49.13394272044514;4.493869898942481;0.001644468845175705;0.5529370282083849;[DCTN6, DCTN5, COPB2, ARF4, COPA, DCTN2, DCTN4, PDCD6, RAB1B, GOSR1, DCTN3, KLHL12, TEX261, MIA3, RAB43, ACTR1A, SPAST, TFG, CAPZB, TMED2, STX5, TMED1, TMED7, TMED4, TRAPPC2, TRAPPC3, TMED9, TRAPPC2L, COG4, COG3, DDHD2, COG1, DYNLL2, SPTB, ARFGAP1, YIF1A, ARCN1, TBC1D20, TMEM115, VAPA, TRAPPC6B, GOLGB1, COL7A1, HYOU1, SEC24C, SEC22C]
GO:0046034;ATP metabolic process;10.0;0.6519675769143192;0.7412248003180799;9.106334870075816;1262.3387643731025;4.99795013456894;0.04224934241243719;0.6708364141712261;[GPI, STOML2, TPI1, ADPGK, ATP5J, CTNS, ATP5I, BPGM, COX5B, ATP5O, ATP5F1, ATP5L, HK3, ATP6V0A2, FAM20C, ALDOC, CYC1, ALDOA, GAPDH]
