GO:0051593;response to folic acid;7.0;0.8653626801206646;0.7836007053175329;9.446202695698167;113.95729645358138;7.379178354882098;0.003814048157392989;0.728290889492758;[GSN]
GO:0000738;DNA catabolic process, exonucleolytic;8.0;1.0;0.875;9.628524252492122;682.1166149099337;8.16763571524637;0.022829829235937557;0.7926932703116032;[XRN2]
GO:1904179;positive regulation of adipose tissue development;6.0;1.0;0.8231203125901445;9.628524252492122;84.15966440839325;8.16763571524637;0.0028167482289683326;0.7408135829017477;[SH3PXD2B]
GO:0045401;positive regulation of interleukin-3 biosynthetic process;8.0;1.0;0.875;9.628524252492122;833.6113263844036;9.777073627680469;0.027900220892599446;0.875;[SYK]
GO:0051091;positive regulation of DNA binding transcription factor activity;11.0;0.811012628672052;0.8379352666656883;9.431813958246067;277.8307104044464;4.2636448815154875;0.00929874384583087;0.650471949850128;[MTPN, CRTC2, CD40, TRADD, ITGB2, CEBPG, PTEN, CIB1, NLRC4, PARK7, LRP8, AGER, RELA, STK3, MTDH, RPS6KA4, RPS6KA5, EP300, NLRP3, RIPK1, CYTL1, UBE2I, JUP, RIPK3, BUD31, SPHK1, IRAK4, TMEM173, PPRC1, NFKB1, IL6, COPS5, KIT, CAT, TRIM14, KRAS, TRIM32, ARHGEF5, CARD11]
GO:0000731;DNA synthesis involved in DNA repair;8.0;0.7671156992804218;0.7585578496402109;9.369013057007038;574.6870345922199;5.8067817141283475;0.019234257863048946;0.6719590869034888;[RFC5, CDKN2D, RFC3, WRN, NPLOC4, RFC4, PCNA, RFC1, POLE2, WRNIP1]
GO:0051092;positive regulation of NF-kappaB transcription factor activity;12.0;0.9326813400603323;0.9144609826203107;9.587702257971866;279.4401483168805;4.8283137373023015;0.009352610284359957;0.6950405016553352;[MTPN, CD40, RIPK3, SPHK1, TRADD, ITGB2, CIB1, NLRC4, IRAK4, AGER, NFKB1, RELA, MTDH, RPS6KA4, RPS6KA5, CAT, TRIM14, NLRP3, RIPK1, KRAS, TRIM32, CARD11]
GO:0051090;regulation of DNA binding transcription factor activity;10.0;0.7192862368539868;0.7748841302879137;9.223059144383958;255.33763090554476;3.793137346993279;0.00854592071745993;0.6092222321850824;[CRTC2, CD40, GFI1, TRADD, ITGB2, PTEN, CIB1, PARK7, PKD2, RPS6KA4, RPS6KA5, ADORA3, EP300, CDK5RAP3, HAVCR2, RIPK3, SYK, BUD31, SPHK1, COMMD1, IRAK4, TMEM173, PPRC1, BRMS1, KIT, CAT, TRIM14, ARHGEF5, CARD11, MTPN, CEBPG, NLRC4, LRP8, AGER, RELA, STK3, MTDH, NLRP2, NLRP3, RIPK1, CYTL1, PRNP, UBE2I, JUP, WFS1, NFKB1, NFKBIA, CYLD, ITCH, NLRP12, IL6, COPS5, KRAS, TRIM32, EZH2]
GO:0045893;positive regulation of transcription, DNA-templated;10.0;0.5159906454948852;0.673236334608363;8.141425192250265;1208.1179641469014;2.4745772039531437;0.04043462102441837;0.5417910051506925;[ZNF175, CCNK, MAML1, CCNH, GFI1, ZNF292, IKZF1, GPATCH3, IKZF2, ELK1, RPS6KA4, RPS6KA5, MYC, ZXDC, DPF2, TRIM24, SOX8, SOX6, IER5, ATXN7L3, IER2, CDK5RAP3, DDX17, MEF2B, FLT3LG, MED6, RUNX2, RUNX1, SFRP1, KARS, IL23A, RFX4, HOXB4, PAXIP1, NOLC1, HSPH1, RAD21, HLTF, SCAP, HOXC4, ZBED1, ZNF143, CREBBP, XBP1, XRCC6, JUP, PBX3, EIF2AK3, EAF2, ERLIN2, FLI1, SETX, STAG1, CDKN1C, ARF4, CD40, SETD3, ELL, HOXC13, BRCA1, AATF, WDR43, MED12, NIPBL, ING2, HYAL2, MLX, HRAS, TEAD2, ZNF485, SEC13, NCOA6, SIRT7, TMEM173, PPRC1, SIRT2, GNL3, GAL, MTF2, TFEC, RARA, MAPRE3, ZNF350, HEATR1, GPS2, RELA, ARNTL, SERTAD3, BCLAF1, RXRA, SERTAD2, PLAGL2, GPBP1L1, ZNF462, NFYC, ATAD2, GRHL1, NFIA, NFIB, TTC5, NFIC, CAMK4, MARS, PSMC1, CAMK1, MIXL1, CRTC2, NCF1, CD80, ARID4A, RORA, YEATS4, UBE3A, PARK7, YY1, EP300, ZNF564, MAP3K5, PIAS2, ARMCX3, ILF3, TBL1XR1, CCNE1, MAX, RLF, SUPT6H, BCL2L12, MED30, DVL3, NLRP3, RIPK1, CYTL1, BPTF, TFAP2A, ZBTB17, DR1, NFKB1, CDK9, NFKBIA, IL6, TFCP2, COPS5, CNOT7, SP1, SP3, MAFF, BCL3, CDK2, NFE2L3, MNAT1, NFE2L1, PHF19, PICALM, CIITA, BMPR2, ONECUT2, CHD8, CHD7, DDX41, LDB2, PKD2, CKS1B, FLCN, LBH, SIN3A, NUP62, ARHGEF11, TBP, KLF13, RBM15, PPP1R12A, PEG3, DTX3L, RFC1, MKL1, ARNT, SENP2, SAFB, ARID1A, ZFP90, TGFBR1, DNM2, CREB3, TFDP1, RBL1, TFDP2, ELF4, IRF4, ZNF516, EAPP, MET, HDAC3, HDAC1, WBP2, CEBPG, TP53INP2, TP53INP1, MTA2, E2F7, E2F8, TBX1, RNF20, CHURC1, ARID3B, USF2, CD4, KLF6, TNIP1, TNIP2, ASXL2, TAF7, TAF4]
GO:0044320;cellular response to leptin stimulus;6.0;1.0;0.8231203125901445;9.628524252492122;109.38485831558611;7.379178354882098;0.003661012767841448;0.7004918368257019;[PTEN]
GO:0018032;protein amidation;7.0;0.6954798709641801;0.6986593007392905;8.781226392104918;151.15475272427284;9.777073627680469;0.005059013543235805;0.8509193652572005;[PAM]
GO:0030148;sphingolipid biosynthetic process;7.0;0.6913464685778243;0.6965925995461126;8.992535485772125;238.8284648682076;5.288437257948329;0.007993373787475071;0.6213702925661609;[ELOVL5, SPHK2, AGK, SPHK1, ELOVL6, SGPP2, ALDH3A2, P2RX7, UGT8, SGPL1, VAPA, ALDH3B1, DEGS1, CSNK1G2]
GO:0065002;intracellular protein transmembrane transport;9.0;0.7763722522362496;0.7844267512984139;9.223059144383958;167.43526304983118;5.788089581116195;0.005603907572324205;0.6922437955322635;[PEX16, BCR, SEC61A2, RTN2, TOMM40, AGK, SRP54, TIMM44, HYOU1]
GO:0045652;regulation of megakaryocyte differentiation;7.0;0.8933024483968273;0.7975705894556142;9.461470167828956;68.9575807315309;5.845247994956144;0.0023079481692908138;0.6498456195510879;[HDAC1, RBBP5, SIN3A, H3F3A, EP300, CIB1, THBS1, TNRC6A, RUNX1]
GO:0075044;autophagy of host cells involved in interaction with symbiont;6.0;0.9326813400603323;0.7894609826203107;9.523163736834295;40.524811843842954;8.16763571524637;0.0013563289824505948;0.7408135829017477;[ULK1, ATG5]
GO:0002924;negative regulation of humoral immune response mediated by circulating immunoglobulin;10.0;0.8933024483968273;0.861892236059334;9.592156608321247;508.9965303178644;7.9853141584524145;0.017035655802601874;0.8236103492792612;[PTPN6]
GO:0045429;positive regulation of nitric oxide biosynthetic process;8.0;1.0;0.875;9.628524252492122;658.6394256443023;6.166155715036245;0.02204406883931546;0.6903374900225189;[P2RX4, ITGB2, PTX3, PKD2, DNM2]
GO:1905049;negative regulation of metallopeptidase activity;10.0;0.8933024483968273;0.861892236059334;9.59573442966913;499.6307270806722;7.9853141584524145;0.016722190796928726;0.8236103492792612;[TIMP2, TIMP1, PICALM]
GO:0038095;Fc-epsilon receptor signaling pathway;8.0;0.9326813400603323;0.8413406700301662;9.5544162803384;78.4757768553383;4.989581884898423;0.002626513627734276;0.6301674496329921;[FCER1G, MAP3K1, SYK, LCP2, CALM1, NFKB1, VAV1, RELA, CARD11, VAV2]
GO:0008203;cholesterol metabolic process;6.0;0.7980440201809971;0.722142322680643;9.223059144383958;82.64786032185484;5.058574756385375;0.0027661495067272364;0.581816060879476;[HSD3B7, STARD3, SCARB1, G6PD, GGPS1, ERLIN2, ACLY, SQLE, EBP, NSDHL, RXRA, CYB5R3, SOAT1, SNX17, CAT, FDXR, SCAP, APOL1, SCARF1, NFE2L1]
GO:0045666;positive regulation of neuron differentiation;8.0;0.6181399273706679;0.684069963685334;8.712233520617966;337.32148776029015;3.9481280100702625;0.011289846625707336;0.576907450041722;[BMPR2, FOXG1, TWF2, PTEN, TRAK1, LRP8, CYB5D2, RAB21, NCKIPSD, CPNE1, TIMP2, DVL3, ECT2, SCARF1, MARK2, ACTR2, TMEM30A, SEMA4D, TNFRSF12A, SERPINF1, RAB11A, NME1, SETX, FES, RUFY3, CAPRIN1, RAPGEF1, RARA, CAMK1, ADNP, TRIM32, PAFAH1B1, EZH2]
GO:0045663;positive regulation of myoblast differentiation;6.0;0.9326813400603323;0.7894609826203107;9.541512875502493;114.26328322821418;6.7325511899570465;0.00382428925936973;0.6674232935401965;[BTG1, FLT3LG, HIF1AN, MAP3K5]
GO:0007595;lactation;6.0;1.0;0.8231203125901445;9.628524252492122;25.956233089099676;5.9928839937622085;8.687317623989867E-4;0.6295966787287501;[OXTR, PPAT, CAV1, ABCB4, CAD, ATP7A, USF2, PAM, NME1]
GO:0038096;Fc-gamma receptor signaling pathway involved in phagocytosis;10.0;1.0;0.9152410118609203;9.628524252492122;384.64074149301706;4.886724499458715;0.01287357946357817;0.6651483300191682;[CYFIP2, NCKAP1, ACTR2, SYK, WIPF2, ARPC1A, WAS, WASL, VAV1, VAV2, NCKIPSD, ARPC2, ELMO1, ABL1, NCKAP1L]
GO:0045669;positive regulation of osteoblast differentiation;6.0;0.9326813400603323;0.7894609826203107;9.56398573135455;169.86351353303945;5.734022359845919;0.005685178930713632;0.6163584827319739;[IL6, BMPR2, TMEM119, FAM20C, RUNX2]
GO:0045667;regulation of osteoblast differentiation;5.0;0.8259837884571596;0.7032329060895001;9.405380701177911;40.22549681874724;5.067543426368135;0.001346311177926675;0.5493954183502558;[HEMGN, BMPR2, IGFBP5, SEMA4D, RUNX2, PIAS2, SFRP1, TWSG1, IL6, CDK6, RASSF2, TMEM119, FAM20C]
GO:0048935;peripheral nervous system neuron development;5.0;1.0;0.7902410118609202;9.628524252492122;34.232648149996464;7.474488534686424;0.0011457359261972313;0.6724867031240476;[ONECUT2, RUNX1]
GO:0045425;positive regulation of granulocyte macrophage colony-stimulating factor biosynthetic process;8.0;1.0;0.875;9.628524252492122;833.6113263844036;9.083926447120524;0.027900220892599446;0.839552420951524;[SYK, CD80]
GO:0110053;regulation of actin filament organization;8.0;0.6281612110245125;0.6890806055122563;8.465373442686442;54.28302931840981;4.22799754278525;0.0018168041397325012;0.5912199909600306;[PTGER4, MTPN, NCKAP1, GMFB, WDR1, ROCK2, WIPF2, ARPC1A, TWF2, WAS, WASL, IQGAP2, CORO1A, PREX1, BAG4, CAPZB, CFL1, SH3PXD2B, PPFIA1, ABL1, NCKAP1L, ARFIP1, CLASP1, S100A10, VASP, ACTR2, GSN, SWAP70, SSH3, SPTB, TGFBR1, CIT, SSH1, VIL1, SFRP1, ARPC2, CDC42EP4, MYADM, EPHA1, MET, ARHGEF5, C9orf72]
GO:0043249;erythrocyte maturation;4.0;0.8933024483968273;0.6966512241984136;9.377209824211215;39.55885145263534;7.138016298065211;0.0013239991574647877;0.6150384854347593;[HBZ, G6PD]
GO:0043491;protein kinase B signaling;6.0;1.0;0.8231203125901445;9.628524252492122;26.42836680105094;6.250713103064308;8.845336528452411E-4;0.6427820713687392;[SETX, CD40, CCL5, PTEN, SIRT2]
GO:0045670;regulation of osteoclast differentiation;8.0;0.8259837884571596;0.7879918942285797;9.485423408851448;139.67875005531917;5.587418885654044;0.0046749220616377945;0.6607408616538982;[SFRP1, RASSF2, IL23A, CAMK4, GPR55, LILRB3]
GO:0043011;myeloid dendritic cell differentiation;6.0;0.8933024483968273;0.7697715367885581;9.4949928598676;91.1712242271392;6.8867018697843045;0.003051418826107602;0.6753065664753021;[IRF4, CAMK4, UBD, LTBR]
GO:0033630;positive regulation of cell adhesion mediated by integrin;5.0;0.9326813400603323;0.7565816818910864;9.4949928598676;34.61675044652454;6.943860283624253;0.0011585914843924019;0.6453503496879909;[SYK, CCL5, CIB1, NCKAP1L, PTPN6]
GO:0035810;positive regulation of urine volume;5.0;0.9326813400603323;0.7565816818910864;9.510741216835738;23.90496242438734;7.138016298065211;8.000775792748091E-4;0.6552794972956795;[ADORA2A, HYAL2]
GO:0048709;oligodendrocyte differentiation;5.0;0.8933024483968273;0.736892236059334;9.34084218004034;23.145667324477426;6.518977089658987;7.746646556020492E-4;0.623621803389518;[CDKN2C, CDK5, SOX8, TSPAN2, CSK]
GO:0044344;cellular response to fibroblast growth factor stimulus;6.0;1.0;0.8231203125901445;9.628524252492122;97.48528473772916;6.444869117505266;0.003262744749111514;0.6527112189764278;[SETX, TBX1, SFRP1, CCL5, HYAL2]
GO:0038083;peptidyl-tyrosine autophosphorylation;10.0;1.0;0.9152410118609203;9.628524252492122;522.6399477532146;5.905872616772578;0.017492288705884526;0.7172676121338334;[SYK, FES, ABL1, CSK, IGF1R]
GO:0048701;embryonic cranial skeleton morphogenesis;6.0;1.0;0.8231203125901445;9.628524252492122;46.18089108149027;6.280566066213989;0.0015456328643938164;0.6443087532925187;[TBX1, TFAP2A, EIF4A3, RUNX2, TGFBR1]
GO:0009306;protein secretion;8.0;0.5696777571895439;0.659838878594772;7.923776160253697;130.2874189859313;4.786641040901733;0.004360602662394617;0.6197890454332871;[RAB3B, STEAP3, SUCNR1, ANXA1, RAB3D, FGG, MIA3, NLRC4, BTN3A2, PARK7, GAL, SNX19, GPAM, NLRP3, LCP2, ITGAV, CCL19, CARD11, PAFAH1B1, RAB8B]
GO:0044351;macropinocytosis;7.0;0.8653626801206646;0.7836007053175329;9.405380701177911;29.536082298666074;7.8311634786251565;9.88546093788053E-4;0.7514054297404357;[DOCK2, DNM2]
GO:1990314;cellular response to insulin-like growth factor stimulus;8.0;1.0;0.875;9.628524252492122;388.66587636398185;7.57984905034425;0.013008297105323164;0.7626338329336335;[PTEN]
GO:0002902;regulation of B cell apoptotic process;9.0;0.7369933605727446;0.7647373054666613;9.117698628726131;22.875998380894767;6.8867018697843045;7.656390787466303E-4;0.7484268790654467;[PTEN]
GO:0030593;neutrophil chemotaxis;9.0;1.0;0.896240625180289;9.628524252492122;130.2972973825895;5.382624473008031;0.004360933283440787;0.671508291047556;[CXCL6, PREX1, FCER1G, SYK, CCL20, CCL5, ITGB2, NCKAP1L, CCL19, VAV1, PIK3CG]
GO:0032532;regulation of microvillus length;8.0;0.8653626801206646;0.8076813400603323;9.446202695698167;49.286089413540054;7.8311634786251565;0.0016495610580704579;0.7754860644832351;[VIL1, TWF2]
GO:0010764;negative regulation of fibroblast migration;8.0;0.9326813400603323;0.8413406700301662;9.567899630675686;202.31180315966054;7.8311634786251565;0.006771193982951902;0.7754860644832351;[HYAL2]
GO:0030111;regulation of Wnt signaling pathway;6.0;0.5902001590945054;0.6182203921373972;7.99439372746765;41.8512380110395;4.069963362931594;0.0014007232725606145;0.5312584282431182;[HDAC1, CHD8, USP34, KLHL12, APCDD1, STK4, ARNTL, STK3, PPP2CA, MED12, RNF213, UBR5, ABL1, DVL3, EMD, DACT1, TLE4, USP8, CSNK2A1, JUP, CAV1, SENP2, NFKB1, RUNX1, CYLD, DEPDC1B, SFRP1, TBL1XR1, GNAQ, RAPGEF1, TAX1BP3]
GO:0033622;integrin activation;5.0;1.0;0.7902410118609202;9.628524252492122;40.42272244673708;7.57984905034425;0.0013529121422039536;0.6778748447945537;[TLN1]
GO:0032534;regulation of microvillus assembly;8.0;0.8933024483968273;0.8216512241984136;9.461470167828956;72.33391722527347;7.9853141584524145;0.00242095111323081;0.7833693374183408;[PLD1]
GO:1905461;positive regulation of vascular associated smooth muscle cell apoptotic process;10.0;1.0;0.9152410118609203;9.628524252492122;149.5070754231924;7.9853141584524145;0.005003867266781941;0.8236103492792612;[MFN2, STK4]
GO:0061099;negative regulation of protein tyrosine kinase activity;11.0;0.8653626801206646;0.8651102923899945;9.55953138100517;2158.5537617243776;6.481236761676141;0.07224485183265184;0.7638797017301124;[ERRFI1, SH3BP5L, CAV1, HYAL2, FGFR1OP, CHMP6]
GO:0007179;transforming growth factor beta receptor signaling pathway;8.0;0.7586651285174919;0.754332564258746;9.05316010758856;29.903672154863813;5.2552850506314295;0.0010008489954655988;0.6437555218850388;[DUSP22, TWSG1, FUT8, COL1A2, BMPR2, PTPRK, TGFBR1]
GO:0045600;positive regulation of fat cell differentiation;6.0;0.9326813400603323;0.7894609826203107;9.541512875502493;114.26328322821418;5.71663061713405;0.00382428925936973;0.6154690682008903;[SFRP1, XBP1, ASXL2, SH3PXD2B, STK4, METRNL, STK3]
GO:0051291;protein heterooligomerization;6.0;0.8933024483968273;0.7697715367885581;9.405380701177911;42.032160359171186;5.113634533568402;0.00140677858073304;0.5846318204451575;[HBZ, RRM1, SEPT11, XRCC6, CPSF6, JUP, RIPK3, YWHAB, TRADD, IKZF1, HSD17B8, PRKAB1, GCHFR, BAG4, COL1A2, NUP62, RIPK1, HRAS, S100A10]
GO:0009117;nucleotide metabolic process;7.0;0.4444416221570314;0.5731401763357162;7.314889323311491;170.44217484987414;3.7109655375767217;0.005704546204226714;0.5406983154264199;[GPI, ADPGK, ADK, RORA, PARK7, NADSYN1, NUDT3, GPHN, AQP1, HK3, NNT, FLAD1, PPAT, NPPA, TK2, NUDT15, G6PD, TPI1, ACOT7, DCAKD, DCXR, CAD, TALDO1, BPGM, ATP5F1, COASY, NME1, ACLY, KARS, MTHFD1, ADORA2A, IMPAD1, MTHFD2L, FAM20C, ALDOC, ALDOA, ACPP, GAPDH, CARD11, PRPS2, STOML2, PNKP, AK2, ADCY4, ATP5J, AK3, ATP5I, COX5B, ATP5O, ATP5L, UNG, PRPSAP1, SULT1A1, ATP6V0A2, PDE6B, CYC1, SULT1A3, RRM1, DUT, IDH2, CTNS, NMNAT3, RPIA, SMUG1, UCK2, IMPDH1, IMPDH2, TJP2]
GO:0051289;protein homotetramerization;7.0;1.0;0.8509193652572005;9.628524252492122;85.45061507946225;5.433268205826786;0.002859955186148837;0.6287769539759931;[VASP, CRTC2, GPX3, DCXR, ATPIF1, PKD2, ACACA, GLS, RXRA, ALDH5A1, IMPDH2, PPAT, CAT, ALDOA, ACPP]
GO:0051045;negative regulation of membrane protein ectodomain proteolysis;9.0;1.0;0.896240625180289;9.628524252492122;966.2736676900156;7.697632086000634;0.032340310067742455;0.7898978880348613;[TIMP2, LRIG2, TIMP1]
GO:0010592;positive regulation of lamellipodium assembly;9.0;1.0;0.896240625180289;9.628524252492122;310.04759849733875;6.8867018697843045;0.010377014096983099;0.7484268790654467;[NCKAP1, ARPC2, TWF2, ATP7A, DNM2]
GO:0033690;positive regulation of osteoblast proliferation;6.0;1.0;0.8231203125901445;9.628524252492122;63.05258358394898;7.379178354882098;0.0021103132289136558;0.7004918368257019;[ABL1, TMEM119, SOX8, ITGAV]
GO:0045618;positive regulation of keratinocyte differentiation;8.0;0.9326813400603323;0.8413406700301662;9.57973408832269;360.6004015365146;7.069023426578259;0.012068970920135338;0.7365101867784198;[H2AFY]
GO:0010591;regulation of lamellipodium assembly;8.0;0.8933024483968273;0.8216512241984136;9.461470167828956;72.62159929772238;6.343086423195323;0.0024305795732986186;0.6993857346658935;[NCKAP1, BIN3, ARPC2, CAPZB, TWF2, WAS, ATP7A, SSH3, SSH1, DNM2]
GO:0006094;gluconeogenesis;7.0;1.0;0.8509193652572005;9.628524252492122;174.6088252776196;5.926926025970411;0.005844000244301424;0.6540226378555745;[PER2, GPI, CRTC2, TPI1, G6PC3, SLC25A10, ALDOC, BPGM, ALDOA, GAPDH]
GO:0045616;regulation of keratinocyte differentiation;7.0;0.8259837884571596;0.7639112594857803;9.461470167828956;71.48722327515921;6.113511981550823;0.002392613028695569;0.663564652301091;[ERRFI1, H2AFY, ROCK2, CTSK, GRHL1, AQP3, RUNX1]
GO:0007186;G-protein coupled receptor signaling pathway;5.0;0.5508212674310002;0.5656516455764204;7.20077601654407;23.17027026302992;2.605416804911955;7.75488093814194E-4;0.4234821484283897;[CXCL6, OXTR, AHCYL1, DGKD, DGKA, DEFB1, PIK3CG, HEBP1, AKAP13, PREX1, GPR132, GNAT2, RGS1, ADORA3, NPPA, OR56B1, HOMER3, CCR2, PDGFRB, ARHGEF11, ANXA1, SPHK2, SPHK1, RHOC, VAV1, VAV2, RHOB, SFRP1, GAL, ADORA2A, SPNS1, ARHGEF1, DAGLB, GPRC5D, ARHGEF5, XPR1, PTGER4, SUCNR1, RGS19, ROCK2, ADCY4, IQGAP2, CRHR1, RIC8A, C3, ABR, GNG2, TBXA2R, HRH2, CCL5, GRK6, CCL19, ECT2, NTSR1, CCR10, SULT1A3, SLC12A2, CCL20, CAV1, GPR55, TSHR, BAIAP3, GPR180, GNAQ, GNB2, PNOC, NMUR1, CALM3, PTPN6, CALM1, CALM2]
GO:0006098;pentose-phosphate shunt;11.0;1.0;0.9324289523296623;9.628524252492122;549.7873240273956;7.212124270218933;0.018400886958728914;0.8012573229067359;[RPIA, G6PD, TALDO1]
GO:0030182;neuron differentiation;4.0;0.5833093054345528;0.5416546527172764;7.212610474191073;21.066225782797595;4.296434704338478;7.050676185779127E-4;0.4697198705845162;[MTPN, PIGT, RYK, ROM1, PAPD4, RORA, RUNX2, RUNX1, PPP1CC, SFRP1, HERC1, CDK5, CASP3, DDIT4, XRN2, SOX8, ATP7A, IER2, PAFAH1B1]
GO:0007187;G-protein coupled receptor signaling pathway, coupled to cyclic nucleotide second messenger;6.0;0.6997970393407541;0.6730188322605215;8.578702127993445;26.976932752798508;4.347727998726029;9.028936615729279E-4;0.5454633246350222;[PTGER4, ANXA1, ADCY4, CRHR1, TSHR, RIC8A, AKAP13, GNG2, GNAT2, ADORA2A, RGS1, TBXA2R, HRH2, GNAQ]
GO:0061086;negative regulation of histone H3-K27 methylation;11.0;0.9326813400603323;0.8987696223598284;9.59953671561887;804.8473500351352;8.390779266560578;0.026937516490087493;0.8615337942327104;[H2AFY, MTF2, SUPT6H]
GO:0031274;positive regulation of pseudopodium assembly;9.0;0.9326813400603323;0.8625812952104552;9.571365838652174;200.71212349518538;7.212124270218933;0.006717654144200148;0.7650689957573628;[CDC42EP4, KIT]
GO:0031032;actomyosin structure organization;6.0;0.7192862368539868;0.682763431017138;8.763526815005518;32.01253927882412;5.16195311083921;0.001071430880247358;0.5871028347338303;[PDGFRB, ITGB1, PDCD6IP, RTKN, WDR1, EPB41, MYH9, KIF23]
GO:0008277;regulation of G-protein coupled receptor protein signaling pathway;6.0;0.5383299095163034;0.5922852673482962;7.5335785242763205;41.8512380110395;4.8942717050940985;0.0014007232725606145;0.5734135951955668;[PDE6H, MGRN1, YWHAB, RASGRP4, C3, RGS1, CCL5, GRK6, PDE6B, CALM1, ACPP, MET, MGLL, METAP2]
GO:0042102;positive regulation of T cell proliferation;9.0;0.7763722522362496;0.7844267512984139;9.424925297250882;564.8543510249671;5.212725436212633;0.018905166792893686;0.6628196464047262;[TFRC, CD80, EBI3, CORO1A, AGER, HLA-DMB, CCL5, NCKAP1L, IL12A, CCL19, IL12RB1, CCR2, HLA-DPA1, HAVCR2, ANXA1, SYK, PDCD1LG2, CCDC88B, CD4, IL6, GPAM, IL23A, HLA-DPB1, CD24, CARD11]
GO:0000302;response to reactive oxygen species;4.0;0.7090535922965819;0.604526796148291;8.781226392104918;25.335607989987928;4.595290077388384;8.479599988580431E-4;0.4850033482604845;[BECN1, PCNA, NCF1, PARK7, PTPRK, PKD2, RELA, AQP1, CASP3, HYAL2, ABL1, KPNA4, CCL19, ECT2, MAP3K5, PDGFRB, ANXA1, TXNRD1, RHOB, MAPK13, DNM2, SETX, IL6, PXMP2, CDK2, CAT, PPIF, SDC1, EZH2]
GO:0043434;response to peptide hormone;6.0;0.6696747006330769;0.657957662906683;8.712233520617966;71.32532737153224;4.149452513989832;0.0023871945184980284;0.5353235071248601;[ERRFI1, BTG2, OXTR, BTG1, MAX, ABCB4, ADCY4, PTEN, CRHR1, RELA, RAP1B, PPAT, NPPA, SCAP, CSK, CYC1, TIMP1, RAB8B, EIF2B4, XBP1, ABCC2, ANXA1, IGFBP5, CAV1, CAD, TSHR, NFKB1, RNF40, GAL, SP1, MARS, RAB13, CAT, TRIB3, TEK]
GO:0033209;tumor necrosis factor-mediated signaling pathway;7.0;0.8933024483968273;0.7975705894556142;9.510741216835738;30.19135422731818;5.395046993006588;0.00101047745553359;0.6268223193749;[CD40, TNFRSF12A, CD70, TRADD, TNFRSF10B, TNFRSF10A, RELA, NFKBIA, BAG4, KARS, RIPK1, LTBR, LIMS1]
GO:0045860;positive regulation of protein kinase activity;10.0;0.6281612110245125;0.7293216173731766;9.003430535177193;1094.9224192180604;3.5309668621989068;0.03664606800502658;0.5958148214005239;[CDKN1A, CD40, CCNK, NCF1, CCNH, ITGB3, KIF14, CIB1, PARK7, PKD2, PIK3CG, CKS1B, AKAP13, RASSF2, NEK1, HRAS, MAP3K5, PDGFRB, DUSP5, MAP4K2, DBNL, RIPK3, SYK, ZFP91, OXSR1, MAPK8IP3, TGFBR1, ERN1, KARS, ALS2, IL23A, KIT, MADD, RAPGEF1, JTB, MTCP1, LCP2, MAPRE3, ADNP, ARHGEF5, STK4, LRP8, THBS1, AGER, STK3, PPP2CA, CCNB1, HSPH1, CCL5, ABL1, DVL3, NCKAP1L, RIPK1, CSK, CCL19, ECT2, MARK2, MAP3K3, PRNP, XRCC6, MAP3K1, PDE6H, ANGPT1, XRCC5, TNFRSF10B, TNFRSF10A, PILRB, P2RX7, CENPE, CCDC88A, CD4, CDK5, TAOK2, KRAS, CALM3, CAMK1, CALM1, MNAT1, CD24, CALM2, EZH2]
GO:0051056;regulation of small GTPase mediated signal transduction;7.0;0.6799073451904818;0.6908730378524415;8.647694999480395;45.070113835906206;4.018171853803189;0.001508456149618737;0.5564088607247961;[ITGB1, DENND1A, KIF14, ARHGAP1, FLCN, AKAP13, PREX1, RASGEF1A, PSD4, NUP62, ARHGDIB, TIMP2, HRAS, PDGFRB, ARHGEF11, RHOC, GMIP, VAV1, VAV2, RHOB, DNM2, BCR, ITPKB, DEPDC1B, ALS2, MADD, RAPGEF1, ARHGEF1, RHOU, MET, ARHGEF5, RASGRP4, ABR, ARHGAP21, RHOT2, RHOT1, ABL1, MFN2, ECT2, A2M, ARFGEF2, STARD13, GPR55, MYO9B, ARHGAP26, ARHGAP25, ARHGAP30, KRAS, SPRY1]
GO:0051295;establishment of meiotic spindle localization;7.0;0.9326813400603323;0.8172600352873667;9.577230958104572;112.08033072751472;8.16763571524637;0.0037512278037010217;0.7686126355688037;[MYH9]
GO:0032355;response to estradiol;5.0;0.9326813400603323;0.7565816818910864;9.523163736834295;74.25476231829794;4.940791720728991;0.0024852400698459885;0.542913330229313;[PDGFRB, OXTR, ENDOG, PCNA, ANXA1, ITGA2, ABCB4, PTEN, CD4, SFRP1, CASP3, CAT, RARA, PAM, EZH2]
GO:0030178;negative regulation of Wnt signaling pathway;7.0;0.6835726970475526;0.6927057137809769;8.781226392104918;188.91844949246428;4.7018998124466425;0.006322930488946581;0.591374740326424;[TLE4, HDAC1, CAV1, CHD8, KLHL12, APCDD1, STK4, STK3, MED12, CYLD, SFRP1, RNF213, RAPGEF1, DVL3, TAX1BP3, EMD, DACT1]
GO:0035627;ceramide transport;6.0;0.8436909121759173;0.7449657686781032;9.223059144383958;35.67391733827648;7.379178354882098;0.0011939739088709061;0.7004918368257019;[GLTP, ABCA12]
GO:0046718;viral entry into host cell;7.0;0.7671156992804218;0.7344772148974115;8.935377071932177;28.374411874040543;5.346256828837156;9.496660301113433E-4;0.6243271881103005;[ITGB1, VPS18, SCARB1, GYPA, TFRC, SIVA1, ITGB3, ITGA2, CD80, NUP153, VAMP8, ITCH, CLDN9, HYAL2, NCAM1, ITGAV, XPR1]
GO:0045629;negative regulation of T-helper 2 cell differentiation;13.0;1.0;0.9625549647676366;9.628524252492122;2589.4439345822343;8.390779266560578;0.08666635814222527;0.8916598066706847;[ANXA1]
GO:0042119;neutrophil activation;6.0;0.8933024483968273;0.7697715367885581;9.4949928598676;20.951462914457938;3.578594911188161;7.012266086544604E-4;0.5061298227699893;[SERPINA3, PYGB, CXCL6, GPI, SIGLEC9, FRMPD3, RAB3D, ITGB2, HK3, PREX1, PSMD7, ACTR1B, PSMD2, LAMP2, CPNE1, TIMP2, CTSH, ITGAV, CPNE3, CAPN1, GUSB, SNAP29, CAP1, ACTR2, SERPINB1, FCER1G, DBNL, SYK, PLAUR, COMMD3, RNASE3, TMEM173, SCAMP1, UNC13D, SERPINB6, VAMP8, ACLY, CAT, TMBIM1, ALDOC, DOCK2, ALDOA, ACPP, SLC27A2, DNASE1L3, KPNB1, CSTB, PDXK, RAB5C, CLEC12A, UBR4, IQGAP2, LILRA2, PLD1, C3, RAP1B, COMMD9, CYB5R3, CCL5, ALDH3B1, PSMB1, NCKAP1L, RAB6A, AP1M1, CTSA, XRCC6, TMEM30A, RAB4B, GSN, JUP, XRCC5, HSPA6, SURF4, LILRB3, NFKB1, FABP5, VAPA, IMPDH1, IMPDH2, RAB18, PTX3, MNDA, DEGS1, MAN2B1, PTPN6]
GO:0045627;positive regulation of T-helper 1 cell differentiation;13.0;1.0;0.9625549647676366;9.628524252492122;2605.164725512912;7.9853141584524145;0.08719251886688177;0.8709243021859774;[ANXA1, CD80, CCL19]
GO:0006068;ethanol catabolic process;7.0;1.0;0.8509193652572005;9.628524252492122;292.83912655610527;7.292166977892469;0.009801062027729285;0.7238411236270654;[SULT1A1, ALDH3B1, SULT1A3]
GO:1905007;positive regulation of epithelial to mesenchymal transition involved in endocardial cushion formation;8.0;1.0;0.875;9.628524252492122;277.7728422204446;8.16763571524637;0.009296807049790315;0.7926932703116032;[TGFBR1]
GO:0043687;post-translational protein modification;7.0;0.6467165523344657;0.6742776414244334;8.507933057105237;151.15475272427284;3.8799197600437285;0.005059013543235805;0.5493386422205575;[PRKCSH, SERPINA10, CCNF, MIA3, MSLN, PSMD8, PSMD7, PSMD4, PSMD2, TIMP1, SKP2, FGA, IGFBP5, ESCO1, FGG, COMMD1, RABGGTA, SUMF1, DDB1, PSMA1, PSME2, FAM20C, RAB38, ITIH2, GPS1, RAB1B, COPS7B, NEDD8, COPS7A, PSMB10, PSMA7, HSP90B1, C3, TGOLN2, PSMB5, RBBP5, UBD, PSMB1, RBBP7, APOL1, ATG5, KLHL25, WFS1, FEM1B, RHBDD1, FBXL15, FBXL16, BTBD6, RAB11A, IL6, SPSB1, COPS5, PSMC1, ASB8, RAB13, STT3A, CALU, FBXL3, ASB3, KBTBD8]
