GO:0010922;positive regulation of phosphatase activity;9.0;0.7586651285174919;0.775573189439035;9.267510906954792;265.2783726737478;6.311337724880743;0.008878628398354923;0.7190027299379095;[PDGFRB, PPP1R15A, PPP1R12A, RIPK3, ITGA2, FCRL3, CALM3, CALM1, CALM2]
GO:0030512;negative regulation of transforming growth factor beta receptor signaling pathway;8.0;0.8933024483968273;0.8216512241984136;9.537552474286395;374.7458266990886;5.54296712308321;0.012542405570270547;0.6584675964488075;[ONECUT2, SNX25, CAV1, LEMD3, GLG1, TGFBR1, DNM2]
GO:0060168;positive regulation of adenosine receptor signaling pathway;8.0;1.0;0.875;9.628524252492122;237.90608858864195;8.67846133901236;0.007962502683482768;0.8188169164668168;[ACPP]
GO:0006002;fructose 6-phosphate metabolic process;5.0;0.8653626801206646;0.7229223519212526;9.34084218004034;72.82688802824934;7.57984905034425;0.0024374504023614934;0.6778748447945537;[TALDO1]
GO:0006486;protein glycosylation;7.0;0.6181399273706679;0.6599893289425345;8.590536585640447;174.0766208890209;4.3090134865453384;0.005826187842367879;0.5712825153487487;[GALNT12, DPAGT1, GALNT11, DERL3, FUT11, RPN1, TRAK1, GALNT10, FUT4, FUT8, PGM3, MGAT3, MGAT1, MGEA5, ST6GAL1, SDF2L1, PMM1, SLC35C2, GALNT1, COG3, SLC35C1, PMM2, SYVN1, ALG2, DOLK, ALG1, GBGT1, DPM3, TMEM115, DOLPP1, MGAT4B, STT3A, MAN1B1, B4GALT7]
GO:0006006;glucose metabolic process;6.0;0.7090535922965819;0.6776471087384355;8.572471578242808;34.676020684410545;5.040875179285974;0.0011605752059146955;0.5809109036834981;[GPI, CRTC2, G6PD, TPI1, IGFBP5, ADPGK, DCXR, BPGM, PER2, NISCH, HK3, G6PC3, ALDH5A1, FABP5, SLC25A10, ALDOC, ALDOA, GAPDH, PDK1]
GO:0009749;response to glucose;7.0;0.8933024483968273;0.7975705894556142;9.405380701177911;32.95598622603122;4.917261223318797;0.001103007200523252;0.6023883328937558;[ERN1, EIF2B4, XBP1, ENDOG, GPAM, SIN3A, SERPINF1, CASP3, PTEN, THBS1, AACS, NME1]
GO:0032526;response to retinoic acid;5.0;0.9326813400603323;0.7565816818910864;9.4949928598676;43.78950961223322;5.123113277522946;0.0014655954787213788;0.5522372631225753;[TBX1, PDGFRB, CDKN2D, SERPINF1, TWF2, ZNF35, AQP3, AQP1, SETX, RXRA, SYNJ1, RARA, CTSH, TEAD2]
GO:0010738;regulation of protein kinase A signaling;7.0;0.9326813400603323;0.8172600352873667;9.523163736834295;45.070113835906206;6.599019797332524;0.001508456149618737;0.6883935445785896;[AKAP11, AKAP7, PJA2]
GO:0018230;peptidyl-L-cysteine S-palmitoylation;10.0;1.0;0.9152410118609203;9.628524252492122;467.1984371929297;6.686031174322154;0.015636711241551894;0.7571649570480019;[ZDHHC23, ZDHHC12, ZDHHC24, ZDHHC6]
GO:0019322;pentose biosynthetic process;6.0;0.8259837884571596;0.7361122068187242;9.360260265897443;135.4172465659101;8.390779266560578;0.004532293374951417;0.7522251544931926;[G6PD, TALDO1]
GO:0016055;Wnt signaling pathway;7.0;0.5916390046238794;0.6467388675691402;7.647522783625538;28.581916314885376;4.0633408221711;9.566110170045473E-4;0.558718803867703;[VPS29, CHD8, USP34, PTEN, KLHL12, APCDD1, MED12, GNG2, GNAT2, RNF138, MYC, GRK6, AP2S1, DVL3, MARK2, DACT1, TLE4, CSNK2A1, UBE2B, RYK, SENP2, DDB1, CYLD, SFRP1, CCNE1, SDC1, TAX1BP3, CALM1, CD24, MET, CSNK1G2, TNRC6A, CSNK1G1]
GO:0010734;negative regulation of protein glutathionylation;9.0;1.0;0.896240625180289;9.628524252492122;446.489693504691;9.083926447120524;0.014943608226965869;0.8607930461318132;[G6PD]
GO:0030100;regulation of endocytosis;6.0;0.5902001590945054;0.6182203921373972;8.152617732682543;44.90533409728707;4.321752512322768;0.0015029411200592913;0.5441349370523758;[SCARB1, LRPAP1, CD151, MCTP1, RAB5C, SIRPG, STON1, PTEN, WASL, C2, RAB21, C3, ABR, ATXN2, RAB20, AP2S1, ABL1, ANKFY1, NCKAP1L, CSK, ITGAV, CCL19, CD300LF, SH3GL1, ATG5, FCER1G, TOR1A, RAB4B, ANGPT1, SYK, ITGA2, CAV1, ARFGAP1, MIB1, DNM2, BCR, RUFY1, EHD4, SYNJ1, SNX17, RAPGEF1, PTX3, DOCK2, SMAP1, CBLL1, PICALM]
GO:0048041;focal adhesion assembly;8.0;1.0;0.875;9.628524252492122;92.53238439646684;6.599019797332524;0.0030969756320103773;0.712474179321389;[ITGA2, RCC2, TAOK2, TESK2, PTPRK]
GO:0017148;negative regulation of translation;8.0;0.6493065804076676;0.6996532902038338;9.081980546124052;1114.6737408694362;4.99795013456894;0.03730712696566269;0.6305954023103058;[UPF1, BTG2, IGFBP5, YTHDF3, EIF4A3, EIF2AK3, CNOT10, EIF2S1, FXR1, EIF4ENIF1, ILF3, CNOT7, XRN1, CNOT1, CAPRIN1, TPR, CNOT3, RARA, EIF4E2, CNOT8, GAPDH, TNRC6A, CPEB4]
GO:0060155;platelet dense granule organization;6.0;1.0;0.8231203125901445;9.628524252492122;22.861654980906852;7.697632086000634;7.651590180572567E-4;0.7167775754447168;[BLOC1S1, RAB38]
GO:0061002;negative regulation of dendritic spine morphogenesis;12.0;1.0;0.9481203125901445;9.628524252492122;1979.5057838953023;7.9853141584524145;0.06625227714743111;0.8564896500084854;[PTEN]
GO:0042989;sequestering of actin monomers;12.0;1.0;0.9481203125901445;9.628524252492122;480.51094201236833;7.474488534686424;0.016082268797382004;0.8303660038532719;[GSN, TWF2]
GO:1903690;negative regulation of wound healing, spreading of epidermal cells;8.0;1.0;0.875;9.628524252492122;396.72827980217687;8.390779266560578;0.013278138492707536;0.8041048419030481;[PTEN, CLASP1]
GO:0038066;p38MAPK cascade;11.0;1.0;0.9324289523296623;9.628524252492122;290.6144555783003;7.8311634786251565;0.009726604292176047;0.8329150168128974;[MAP3K5]
GO:0038061;NIK/NF-kappaB signaling;6.0;1.0;0.8231203125901445;9.628524252492122;26.42836680105094;6.8867018697843045;8.845336528452411E-4;0.6753065664753021;[PPP4C, RIPK3, NFKB1, RELA]
GO:0038063;collagen-activated tyrosine kinase receptor signaling pathway;8.0;1.0;0.875;9.628524252492122;57.50475921673876;7.474488534686424;0.0019246325400609058;0.7572456912631272;[SYK]
GO:0042742;defense response to bacterium;6.0;0.7866048967936545;0.7164227609869718;9.193206181234276;69.6526388451159;4.021331414093558;0.0023312111388408135;0.5287713881179241;[ANKRD17, FGA, CXCL6, FCER1G, SEH1L, HIST1H2BJ, PPP1R11, SYK, CCL20, DEFB1, RNASE3, NLRC4, LYST, P2RX7, CD4, IL6, IL23A, BCL3, NLRP3, IL12A, HIST1H2BC, HAVCR2]
GO:0042744;hydrogen peroxide catabolic process;6.0;0.9326813400603323;0.7894609826203107;9.55953138100517;235.80375524332874;6.481236761676141;0.007892139478392308;0.6545710619905948;[HBZ, GPX3, PRDX1, CAT]
GO:0051453;regulation of intracellular pH;10.0;0.7192862368539868;0.7748841302879137;9.242861771680136;143.07278219841277;5.407625775213448;0.004788517263036519;0.6917872454856517;[CLN3, RAB20, SLC9A6, VPS33A, SLC9A8, ATP6V0A2, RAB38, CLCN3, GPR89B, TM9SF4]
GO:0032515;negative regulation of phosphoprotein phosphatase activity;10.0;0.8653626801206646;0.8479223519212526;9.5525383455142;1090.4524045737035;5.788089581116195;0.03649646063763195;0.7112441822128948;[PPP1R15A, PPP1R14B, PPP1R11, ROCK2, PPME1, PHACTR2, NCKAP1L, MASTL]
GO:0031669;cellular response to nutrient levels;5.0;0.5537205960740763;0.5671013098979585;7.6544432264701125;58.45336087306237;4.4540636485420615;0.0019563813838119923;0.5180220339825032;[BECN1, CDKN1A, SEH1L, BMPR2, MAX, ABCB4, CLEC16A, COMT, AQP3, HSP90B1, WRN, LAMP2, FADS1, ATG5, MAP3K5, GABARAPL1, XBP1, EIF2AK3, USF2, EIF2S1, SSH1, SFRP1, TBL2, P2RX4, MARS, PIK3C3, ULK1, CPEB4]
GO:0032516;positive regulation of phosphoprotein phosphatase activity;10.0;0.8653626801206646;0.8479223519212526;9.5525383455142;1089.2705050571928;6.832634648514029;0.036456903524454846;0.7646622655359331;[PDGFRB, PPP1R15A, PPP1R12A, FCRL3, CALM3, CALM1, CALM2]
GO:0016042;lipid catabolic process;4.0;0.5127202928476964;0.5063601464238482;6.883086519318291;43.14795622097559;4.114113147544524;0.0014441232640765526;0.4603959376912539;[SCARB1, ECHS1, ABCD3, HSD17B4, ETFA, GDPD3, ETFB, PLD1, GBA2, PLD3, SGPL1, CPT2, SCARF1, HIBCH, HSD3B7, PLA2G12A, ACOT7, SPHK1, DDHD2, SIRT2, GALC, ALDH3A2, BSCL2, ACOX2, FABP5, SNX17, TBL1XR1, PNPLA6, DAGLB, HRASLS, SLC27A2, MGLL, PAFAH1B1]
GO:0032753;positive regulation of interleukin-4 production;6.0;0.9326813400603323;0.7894609826203107;9.523163736834295;64.94897299966192;6.686031174322154;0.0021737836760178982;0.665044257777226;[IRF4, RARA, NLRP3, HAVCR2]
GO:0030335;positive regulation of cell migration;7.0;0.5846489169746516;0.6432438237445264;8.22453031427283;157.26390226612122;3.6656062881777913;0.005263481280523835;0.5383786413027378;[CXCL6, SCARB1, GPI, CD40, BMPR2, ONECUT2, DOCK8, ITGB3, PDCD6, CIB1, MIA3, CXCL14, IGF1R, PREX1, NIPBL, C1QBP, CTSH, IL12A, ITGAV, CPNE3, ATP7A, GTSE1, HRAS, GPSM3, CCR2, SEMA6B, PDGFRB, ANXA1, IGFBP5, ITGA2, SPHK1, SWAP70, TGFBR1, RHOB, PTP4A1, CREB3, KARS, IL23A, RUFY3, KIT, MYADM, EPHA1, MAPRE1, MET, CBLL1, HBEGF, CD151, ROCK2, CD99L2, THBS1, CORO1A, BAG4, CCL5, ABL1, NCKAP1L, CCL19, CLASP1, MAP3K3, XBP1, ANGPT1, SEMA4D, CCL20, SEMA4B, RAB11A, SSH1, VIL1, IL6, P2RX4, SP1, FGFR1OP, TEK, TRIM32]
GO:0032754;positive regulation of interleukin-5 production;6.0;0.8933024483968273;0.7697715367885581;9.427853557029971;65.23665507211369;7.212124270218933;0.002183412136085803;0.6919486831672181;[RARA, NLRP3]
GO:0061037;negative regulation of cartilage development;6.0;0.8259837884571596;0.7361122068187242;9.36615998802463;85.27219906913868;6.558197802812269;0.002853983762847292;0.6585068532133508;[RARA, TGFBR1]
GO:0006464;cellular protein modification process;6.0;0.33881133730344803;0.4925259812418685;5.842712558201993;147.0276183392271;1.7630686329010112;0.004920882069548126;0.41328372446777834;[GMFB, MAML1, TESK2, PSMD8, PSMD7, PSMD4, PSMD2, MYC, CDK5RAP3, CSNK2A1, ATG10, PRKAB1, RC3H2, BCR, PSME2, ANAPC13, CDCA3, RPN1, COPS7B, COPS7A, MTMR6, ANAPC11, C3, RHOT1, RNF213, PPP4C, BLOC1S1, SULT1A3, ATG5, CREBBP, PMM1, EDEM1, PMM2, EIF2AK3, LNPEP, CDC7, ERLIN2, SETX, CYLD, RNF103, PAM, EZH2, PIGS, ARF4, BTG2, SMG1, PIGU, WDR48, PIGT, SETD3, BTG1, SERPINA10, MED12, TRIM9, UBL5, TRIM7, PBK, TIMP1, PCMTD1, DUSP5, ANXA1, RIPK3, SIRT7, JOSD1, SIRT2, CIT, SUMF1, DDB1, ITPKB, PSMA1, PIGA, MED20, RARA, RNF166, HBEGF, GPS1, GPS2, PSMA7, RNF135, PSMB5, RNF138, PSMB1, APOL1, EGLN2, MBD6, SYVN1, GTF2H4, SPSB1, TTLL3, PSMC1, RFWD3, TAOK2, RAB3B, RAB3D, IL5RA, STK19, YEATS4, PARK7, YY1, PPP1CB, PPP1CC, NPEPPS, FNTB, CFL1, NEK1, C18orf25, MAP3K5, USP8, RNF44, FBXO18, IGFBP5, VPS33B, VRK1, VRK2, CDC25A, PIAS2, RNF40, MINPP1, ILF3, ANAPC5, RAB38, FKBP4, CSNK1G2, CSNK1G1, UBR4, PKMYT1, RLF, HSP90B1, MTM1, STK35, MED30, STK38, UBR5, ABL1, MBP, RAB6A, DR1, TOR1A, SDF2L1, AMBP, WFS1, BRPF3, BTBD6, MARCH6, NFKB1, MARCH3, CDK9, CNOT4, COPS5, CDK6, CDK5, UBLCP1, YEATS2, PTPRA, CDK2, FGFR1OP, MNAT1, BMPR2, PTEN, PTPN22, MSLN, PIK3CG, DUSP14, PPP6C, SIN3A, SUMO3, PGM3, TRIM69, ITGAV, HIF1AN, ATP7A, PPP1R12A, KSR1, DTX3L, ZFP91, DUSP28, RAD23A, SPTB, RABGGTA, PTP4A1, DUSP22, DUSP23, CTDSP2, PIK3C3, ETF1, BIRC6, MET, GAPDH, PPP1R15A, BECN1, HDAC3, ITIH2, HDAC1, ROCK2, MGRN1, RAB1B, RNF38, GLRX, NLRC4, IL2RG, PPM1G, FZR1, RBBP5, CCL5, SAP18, CSK, RBBP7, RFFL, RNF20, ANGPT1, FEM1B, FBXL15, FBXL16, P2RX7, SNRK, DOLPP1, TSPAN17, RAB13, MGAT4B, ASXL2, CCM2, PTPN6, TRIM32, TRIM33, METAP2, OXTR, CCNK, CCNH, CCNF, ZDHHC5, ZDHHC6, PPP2R2A, UBE2L3, RPS6KA4, HERC4, RPS6KA5, RASSF2, HERC1, RPS6KA2, CDC26, TRIM24, CPNE3, SKP2, SEPHS1, ATXN7L3, EPHB4, PDK1, ST6GAL1, ESCO1, ARRDC1, SLC35C2, COG3, NSMCE2, PAQR3, SLC35C1, ALG2, ALG1, GBGT1, KARS, KCTD10, TRIB3, ULK1, EPHA1, CBLL1, PAXIP1, FUT11, MYCBP2, LIAS, TGOLN2, NUAK1, HLTF, STK38L, ZBED1, SETDB1, BCL11A, MSRA, KLHDC8A, CDC16, CALU, FBXL3, CALM1, PPP1R11, FASTKD1, GPAA1, SUV39H1, OTUD7B, MIA3, BRCA1, PTPRK, AKAP13, ZMYM2, CTSH, HRAS, VKORC1, MAP4K2, SYK, PARP2, PRMT3, ZDHHC12, COMMD1, GFRA2, ZDHHC17, GAK, PDIK1L, KIT, FASTKD5, FAM20C, TLR7, PTGER4, CSTA, PCNA, DERL3, ZDHHC23, ZDHHC24, DERL2, NEDD8, TRAK1, PPP2CA, PDPR, MGAT3, MGAT1, UBL4A, MAP3K3, MAP3K1, DOHH, RAB11A, MIB1, PER2, ITCH, CAMK4, KBTBD2, CAMK1, KBTBD8, GALNT12, DPAGT1, GALNT11, CRTC2, ARID4A, BUB1B, UBE3A, UBE2Z, GALNT10, IGF1R, PPME1, EP300, TGM6, SBF1, PDGFRB, SSU72, TRPC4AP, ERN1, DPM3, BRMS1, TBL1XR1, CCNE1, PPIF, PPID, HIST1H2BC, DTX2, KLHL12, STK4, RASGRP4, FUT4, STK3, VCPIP1, CCNB1, FUT8, UBD, GRK6, NLRP3, USP51, RIPK1, SUDS3, MARK2, MGEA5, UBE2I, UBE2B, KLHL25, CBX4, RHBDD1, DOLK, KLHL24, CLK4, SSH3, EIF2S1, CLK3, SSH1, CLK1, NFKBIA, IL6, PAN3, TMEM115, MAN2B2, FES, UBE2T, STT3A, MAN2B1, USP36, USP37, USP38, PRKCSH, MAST3, USP32, YWHAB, USP34, USP39, GPHN, SENP6, POLB, RASGEF1A, USP46, FGA, FGG, CAD, PPP2R5D, OXSR1, IRAK4, SENP2, MASTL, TGFBR1, PJA2, IRF4, MAN1B1, USP41, B4GALT7, THOP1, HIST1H2BO, HIST1H2BJ, USP12, THBS1, PSMB10, TFPT, PABPN1, RAB40C, MKNK2, NCAM1, MTA2, EYA2, GALNT1, MAPK13, POLE4, WEE1, TNIP1, TNIP2, ASB8, POLE3, KRAS, FAM98A, TAF5, TEK, ASB3, OTUD1]
GO:0006468;protein phosphorylation;7.0;0.5708408884191841;0.6363398094667926;8.175090588534603;177.75756772840523;2.970244267288293;0.005949385820444992;0.5028177952168079;[OXTR, CCNK, GMFB, MAML1, CCNH, IL5RA, BUB1B, TESK2, STK19, IGF1R, RPS6KA4, RPS6KA5, RASSF2, RPS6KA2, MYC, CFL1, TRIM24, NEK1, CPNE3, EPHB4, PDK1, MAP3K5, PDGFRB, CSNK2A1, PAQR3, VRK1, VRK2, PRKAB1, ERN1, BCR, ILF3, KARS, CCNE1, TRIB3, ULK1, EPHA1, CSNK1G2, CSNK1G1, PKMYT1, STK4, RASGRP4, STK3, NUAK1, CCNB1, STK35, STK38, GRK6, ABL1, STK38L, MBP, RIPK1, MARK2, SULT1A3, EIF2AK3, CDC7, ERLIN2, CLK4, EIF2S1, CLK3, NFKB1, SETX, CLK1, CDK9, PAN3, CDK6, CDK5, PTPRA, FES, CDK2, FGFR1OP, CALM1, MNAT1, SMG1, BMPR2, FASTKD1, MAST3, YWHAB, PIK3CG, AKAP13, ZMYM2, RASGEF1A, PBK, CTSH, ITGAV, HRAS, DUSP5, MAP4K2, KSR1, RIPK3, SYK, CAD, OXSR1, IRAK4, MASTL, GFRA2, SPTB, TGFBR1, CIT, GAK, ITPKB, PDIK1L, KIT, FASTKD5, RARA, FAM20C, PIK3C3, TLR7, BIRC6, MET, HBEGF, PTGER4, ROCK2, GPS1, GPS2, IL2RG, PABPN1, CCL5, MKNK2, NCAM1, CSK, MAP3K3, MAP3K1, ANGPT1, GTF2H4, MAPK13, P2RX7, SNRK, WEE1, TNIP2, CAMK4, TAOK2, CCM2, KRAS, PTPN6, CAMK1, TEK]
GO:0006469;negative regulation of protein kinase activity;10.0;0.6835726970475526;0.7570273603846966;9.223059144383958;1097.0598301796;4.243684138952949;0.03671760522636433;0.6322632160784685;[CDKN1C, ERRFI1, CDKN1A, GMFB, GPS1, PTEN, GPS2, CIB1, PTPN22, PARK7, DUSP14, IGF1R, PPP2CA, PREX1, CASP3, HYAL2, NUP62, STK38, ABL1, CDK5RAP3, CDKN2D, DUSP5, CDKN2C, H2AFY, CAV1, PAQR3, DUSP22, SFRP1, CDK6, SH3BP5L, QARS, ADORA2A, GNAQ, PKIA, TAF7, FGFR1OP, CRIPAK, TRIB3, SPRY1, PTPN6, EPHA1, CHMP6]
GO:0010719;negative regulation of epithelial to mesenchymal transition;6.0;0.8259837884571596;0.7361122068187242;9.434368238051164;171.1659509920613;6.481236761676141;0.005728770340349481;0.6545710619905948;[PPP2CA, SFRP1, PTEN]
GO:0031658;negative regulation of cyclin-dependent protein serine/threonine kinase activity involved in G1/S transition of mitotic cell cycle;13.0;1.0;0.9625549647676366;9.628524252492122;3330.314475181895;7.8311634786251565;0.11146262839589782;0.8630410292508717;[CDKN2D, CDKN2C, CDK6, PTEN]
GO:0009968;negative regulation of signal transduction;6.0;0.43649654099988644;0.5413685830900877;6.680044863788677;140.65047919891595;2.686163805600486;0.0047074449615745265;0.460490854527945;[ERRFI1, PDCD6, EIF4A3, CIB1, RORA, GPATCH3, PARK7, IGF1R, PREX1, RASSF2, RGS1, MYC, WWC3, CPNE1, HOMER3, EPHB4, CDK5RAP3, TLE4, PDGFRB, IGFBP5, ARRDC1, PAQR3, SLC35C1, LEMD3, RUNX2, PIAS2, SFRP1, TWSG1, RFX4, DDIT4, PPIF, MYADM, VDAC2, TRIB3, EPHA1, LRPAP1, KLHL12, APCDD1, STK4, AGER, GLG1, STK3, MTM1, BCL2L12, RNF213, HSPH1, TMEM127, STK38, ABL1, DVL3, NLRP3, RIPK1, CD300LF, PRNP, PRELID1, XBP1, UBE2B, AMBP, WFS1, NONO, CAV1, IFT122, TNFRSF10B, TNFRSF10A, ARHGAP25, NFKBIA, CYLD, IL6, NPLOC4, CNOT7, QARS, CNOT1, BCL3, CALM3, CRIPAK, HYOU1, CALM1, CALM2, EZH2, ITGB1, ONECUT2, YWHAB, SH3KBP1, CHD8, TRADD, PTEN, OTUD7B, PTPN22, BRCA1, PKD2, DUSP14, MED12, FLCN, ING2, LBH, C1QBP, HYAL2, NUP62, PBK, TIMP2, ITGAV, HIF1AN, EMD, DACT1, FGA, DUSP5, PVRIG, FCRL3, FGG, PLAUR, SENP2, TGFBR1, DNM2, DUSP22, CREB3, NCOR1, IRF4, KIT, TMBIM1, RAPGEF1, TAX1BP3, BIRC6, CHMP6, MET, PAFAH1B1, PPP1R15A, HDAC3, RGS19, HIST1H2BJ, HDAC1, MGRN1, GPS1, CLEC12B, GPS2, LILRA2, THBS1, TANK, RELA, ARNTL, PPP2CA, SNX25, CCL5, LMNA, UBQLN1, MFN2, CSK, RFFL, BID, CDKN2D, EYA2, RYK, SYVN1, P2RX7, ITCH, NLRP12, PIK3IP1, TNIP1, SPRY1, PTPN6, TEK, TRIM32, TRIM33]
GO:0032508;DNA duplex unwinding;7.0;0.7980440201809971;0.7499413753476991;9.223059144383958;23.726073882073138;5.734022359845919;7.940903407527885E-4;0.64415753539903;[XRCC6, ANXA1, FBXO18, XRCC5, CHD8, GINS4, CHD1, GTF2H4, SETX, WRN, RAD51, ASCC3, MCM6, MCM2]
GO:0010951;negative regulation of endopeptidase activity;10.0;0.7671156992804218;0.7987988615011312;9.446202695698167;500.3238742612354;4.2676852910524925;0.016745389809270216;0.6334906361130068;[SERPINA3, CSTB, CSTA, ITIH2, SERPINA10, NLRC4, PARK7, UBE2Z, THBS1, AQP1, C3, BCL2L12, NLRP7, TIMP2, TIMP1, RFFL, A2M, CDKN2D, SERPINB1, CSNK2A1, AMBP, SERPINF1, PLAUR, TNFRSF10B, TNFRSF10A, SERPINB6, VIL1, ADORA2A, COL7A1, BIRC6, GAPDH, PICALM]
GO:0032981;mitochondrial respiratory chain complex I assembly;7.0;1.0;0.8509193652572005;9.628524252492122;91.11357555959822;5.618190544320798;0.003049489377085438;0.638233890966345;[NDUFA7, NDUFB7, NDUFS8, NDUFA11, NDUFB10, NDUFS7, NDUFS6, NUBPL, NDUFA10, BCS1L, TAZ, FOXRED1]
GO:0032743;positive regulation of interleukin-2 production;6.0;0.8933024483968273;0.7697715367885581;9.427853557029971;65.23665507211369;6.409777797693995;0.002183412136085803;0.6509166472493662;[CD4, ANXA1, IRF4, CD80, GLMN, ABL1, CARD11, CCR2, RUNX1]
GO:0060179;male mating behavior;5.0;0.7586651285174919;0.6695735761196662;8.712233520617966;21.23537850411422;8.16763571524637;7.107290079328145E-4;0.7079342821725234;[PTEN]
GO:1903232;melanosome assembly;7.0;1.0;0.8509193652572005;9.628524252492122;62.72328125453724;8.16763571524637;0.0020992917763011008;0.7686126355688037;[RAB38]
GO:0006470;protein dephosphorylation;7.0;0.7586651285174919;0.7302519295159464;9.223059144383958;177.1697810635027;4.458953633836253;0.005929713129744359;0.5789504614541361;[PPP1R15A, PTEN, PTPN22, PPP2R2A, PTPRK, MTMR6, PPM1G, DUSP14, MTM1, PPP1CB, PPP2CA, PPP1CC, PPP6C, PDPR, PPP4C, SBF1, DUSP5, PPP1R12A, EYA2, SSU72, DUSP28, PPP2R5D, SSH3, CDC25A, SSH1, PTP4A1, DUSP22, DUSP23, MINPP1, UBLCP1, PTPRA, CTDSP2, PTPN6]
GO:0007565;female pregnancy;3.0;1.0;0.6981203125901445;9.628524252492122;32.8060485501291;5.299736813202263;0.0010979889214459554;0.4691490996802742;[CLIC5, OXTR, ABCC2, AMBP, IGFBP5, SPHK2, ITGA2, CAD, LNPEP, COMT, ADIPOR2, CRHR1, BYSL, NPPA, PNOC, RARA, KRAS]
GO:0061028;establishment of endothelial barrier;6.0;0.8933024483968273;0.7697715367885581;9.405380701177911;35.449043474319204;6.641579411751319;0.0011864475830175945;0.6627709925721352;[RAP1B, RAPGEF1, MYADM, MSN, TJP2]
GO:0032736;positive regulation of interleukin-13 production;6.0;0.8933024483968273;0.7697715367885581;9.427853557029971;65.23665507211369;7.069023426578259;0.002183412136085803;0.6846304993685643;[IRF4, RARA, NLRP3]
GO:0031641;regulation of myelination;6.0;0.8933024483968273;0.7697715367885581;9.405380701177911;42.055147161688105;6.250713103064308;0.001407547928326502;0.6427820713687392;[EIF2AK3, KIF14, PTEN, RARA, SIRT2]
GO:0031642;negative regulation of myelination;7.0;1.0;0.8509193652572005;9.628524252492122;207.08553610705889;7.9853141584524145;0.006930966528620597;0.7592887026755414;[EIF2AK3, PTEN]
GO:1905143;eukaryotic translation initiation factor 2 complex assembly;5.0;1.0;0.7902410118609202;9.628524252492122;40.42272244673708;9.777073627680469;0.0013529121422039536;0.7902410118609202;[CDC123]
GO:0090336;positive regulation of brown fat cell differentiation;7.0;1.0;0.8509193652572005;9.628524252492122;143.10318807846457;7.57984905034425;0.004789534920478337;0.738553198190834;[METRNL]
GO:0008584;male gonad development;5.0;1.0;0.7902410118609202;9.628524252492122;50.96471695749156;5.2552850506314295;0.001705743211299806;0.5589965337459591;[PDGFRB, RRM1, SFRP1, CSDE1, RNF38, H3F3A, KIT, SOX8, MEA1, TGFBR1]
GO:0030031;cell projection assembly;4.0;0.6729672293956388;0.5864836146978194;8.124446855715847;35.515967283127445;3.9749552523034066;0.0011886874626708887;0.45327939645711923;[SPAG16, CYFIP2, NCKAP1, GALNT11, ONECUT2, FNBP1L, BAG4, TMEM107, ABL1, NEK1, NCKAP1L, SNAP29, NEFH, BBS2, ACTR2, SEPT11, DBNL, GSN, IFT122, EMP3, WDR34, DYNLL2, SEPT2, VAV2, P2RX7, CCDC88A, PARVG, TTLL3, TMEM138, RFX4, CENPJ, KIT, CCDC65, RHOU, FXYD5, CLUAP1]
GO:0007257;activation of JUN kinase activity;14.0;1.0;0.9759193652572005;9.628524252492122;8640.54909511404;6.088194173566533;0.2891914022241413;0.7872698984233759;[ERN1, MAP4K2, DBNL, SYK, RIPK1, CCL19, MAPK8IP3, MAP3K5]
GO:0090330;regulation of platelet aggregation;9.0;0.8259837884571596;0.8092325194088689;9.533214072687796;97.23557350837086;6.943860283624253;0.0032543871389904074;0.7513499630073597;[SYK, FGG, CD9]
GO:0007254;JNK cascade;11.0;1.0;0.9324289523296623;9.628524252492122;290.6144555783003;5.926926025970411;0.009726604292176047;0.735532224928036;[PTGER4, MAP4K2, GPS1, GPS2, IRAK4, MAP3K5]
GO:0045762;positive regulation of adenylate cyclase activity;12.0;0.8933024483968273;0.8947715367885583;9.589303539338841;6276.064729494611;7.697632086000634;0.21005423840463325;0.8417775754447168;[TIMP2, TSHR]
GO:0045766;positive regulation of angiogenesis;7.0;0.811012628672052;0.7564256795932265;9.303101852057495;134.49314513679974;4.7081694254602375;0.0045013645317563845;0.5916953686275062;[ITGB1, CD40, BTG1, PDCD6, ITGB2, CIB1, BRCA1, THBS1, MTDH, AQP1, C3, RRAS, TBXA2R, ABL1, CTSH, MAP3K3, XBP1, ANXA1, JUP, SPHK1, RHOB, RUNX1, PDCL3, SP1, TEK, EPHA1]
GO:0007016;cytoskeletal anchoring at plasma membrane;6.0;1.0;0.8231203125901445;9.628524252492122;66.89368938276097;7.474488534686424;0.002238871583229107;0.7053660038532718;[JUP, TLN1]
GO:0046855;inositol phosphate dephosphorylation;8.0;0.9326813400603323;0.8413406700301662;9.590783924509275;336.6569207659842;7.138016298065211;0.011267604166479381;0.7400384854347593;[SYNJ1, PTEN]
GO:0046856;phosphatidylinositol dephosphorylation;8.0;1.0;0.875;9.628524252492122;218.1540246804484;6.686031174322154;0.007301418880178951;0.7169239451870815;[SYNJ1, PTEN, MTMR6, MTM1]
GO:0018394;peptidyl-lysine acetylation;9.0;0.6696747006330769;0.7310779754968275;8.884083777544626;313.638027190515;5.076593261888053;0.010497182514167671;0.6558578406789737;[DR1, CREBBP, CRTC2, ESCO1, BRPF3, YEATS4, POLE4, YEATS2, IRF4, BLOC1S1, POLE3, EP300, TAF5]
GO:0019483;beta-alanine biosynthetic process;8.0;0.8653626801206646;0.8076813400603323;9.523163736834295;476.973390255232;9.083926447120524;0.015963870123660538;0.839552420951524;[DPYD]
GO:0001701;in utero embryonic development;7.0;1.0;0.8509193652572005;9.628524252492122;22.496195207419138;4.63541007117781;7.529274083310655E-4;0.5879744518658467;[ITGB1, ELL, CHD7, RIC8A, FLCN, CCNB1, FUT8, RXRA, SIN3A, SOX8, MGAT1, ATP7A, SOX6, MBNL1, ENDOG, UBE2B, ANGPT1, TGFBR1, MIB1, ALS2, MAFF, MYH9, CCM2, EIF4E2, APBA3, SEC24C]
GO:0032689;negative regulation of interferon-gamma production;6.0;0.8933024483968273;0.7697715367885581;9.427853557029971;65.25422870398782;6.343086423195323;0.002184000309729388;0.647506047256038;[PRNP, C1QBP, RARA, PDCD1LG2, HAVCR2]
GO:0031114;regulation of microtubule depolymerization;9.0;0.8259837884571596;0.8092325194088689;9.420884887713877;74.89162891543653;6.444869117505266;0.0025065554217094913;0.7258315315665724;[MAP1S, CIB1, CLASP1]
GO:0070723;response to cholesterol;6.0;0.9326813400603323;0.7894609826203107;9.523163736834295;80.91680144162417;6.686031174322154;0.002708212523857764;0.665044257777226;[LRP8, AACS, TGFBR1]
GO:0071805;potassium ion transmembrane transport;9.0;0.8259837884571596;0.8092325194088689;9.456673995565463;120.6235085317852;4.695669262696007;0.004037160276449102;0.636377369645515;[SLC12A2, KCNG1, KCNK6, KCND1, KCNK12, KCNA3, PKD2L1, ATP1B2, PKD2, MTMR6, AQP1, SLC9A6, SLC9A8, KCNN3, KCNK3]
GO:0090344;negative regulation of cell aging;5.0;0.8653626801206646;0.7229223519212526;9.34084218004034;80.6841056931466;6.686031174322154;0.002700424406568797;0.6321649570480018;[BCL2L12, MAP3K3, FZR1, CDK6, RBL1, ABL1, PTEN]
GO:0007264;small GTPase mediated signal transduction;6.0;0.7369933605727446;0.6916169928765168;8.741221057491218;26.42836680105094;4.015022244900292;8.845336528452411E-4;0.5284487369119741;[RAB3B, BCAR3, NCKAP1, CDKN1A, RTKN, DOCK8, RAB3D, ARHGAP1, PARK7, RAB43, DOCK11, RASGEF1A, ARHGDIB, CFL1, HRAS, RAB8B, ARHGEF11, USP8, DBNL, KSR1, RHOC, VAV1, VAV2, RHOB, NISCH, ALS2, CDC42EP4, RAB35, ELMO1, RAPGEF1, TAX1BP3, ARHGEF1, RAB38, RHOU, DOCK2, KPNB1, RAB5C, RGS19, ROCK2, RAB1B, WAS, RASGRP2, PLD1, RASGRP4, RAB21, RAP1B, ABR, RHOT2, RHOT1, RAB20, RRAS, RAB40C, RAB28, RAB6A, RAB4B, SETDB1, RAB27B, MYO9B, RAB11A, COL1A2, ARHGAP30, RAB13, CDK2, RAB18, KRAS, RGL1]
GO:0007268;chemical synaptic transmission;7.0;0.7369933605727446;0.7194160455435727;8.663443356448536;23.173347188538074;3.922001705478042;7.755910757418987E-4;0.5514907148670789;[PTEN, SLC1A4, HTR3B, GLS, SSH1, ALS2, SYPL1, CDK5, ADORA2A, HRH2, PNOC, VDAC3, MBP, AMPH, NPTX1, SNCB, APBA3, SPG11, KCNK3, NTSR1, PAFAH1B1]
GO:0045773;positive regulation of axon extension;11.0;0.8933024483968273;0.8790801765280758;9.582004236857228;1257.908905926367;6.113511981550823;0.04210107903683872;0.7450742393735527;[BMPR2, TNFRSF12A, RUFY3, TWF2, ADNP, RAB11A, PAFAH1B1]
GO:0007265;Ras protein signal transduction;7.0;0.7586651285174919;0.7302519295159464;8.935377071932177;27.526979089716047;4.2636448815154875;9.213032174599934E-4;0.5689623627776663;[RAB3B, NCKAP1, CDKN1A, RTKN, RAB3D, ARHGAP1, PARK7, RAB43, ARHGDIB, CFL1, HRAS, RAB8B, ARHGEF11, USP8, DBNL, KSR1, RHOC, RHOB, NISCH, ALS2, CDC42EP4, RAB35, ELMO1, RAPGEF1, TAX1BP3, ARHGEF1, RAB38, RHOU, KPNB1, RAB5C, ROCK2, RAB1B, WAS, RASGRP2, PLD1, RAB21, RAP1B, RHOT2, RHOT1, RAB20, RRAS, RAB40C, RAB28, RAB6A, RAB4B, SETDB1, RAB27B, MYO9B, RAB11A, COL1A2, RAB13, CDK2, RAB18, KRAS]
GO:0007266;Rho protein signal transduction;8.0;0.9326813400603323;0.8413406700301662;9.523163736834295;29.60642063139588;5.334422371190153;9.9090025448413E-4;0.6478026081386739;[ARHGEF11, RTKN, ROCK2, ARHGAP1, WAS, MYO9B, RHOC, RHOB, RHOT2, RHOT1, COL1A2, CDC42EP4, ARHGDIB, CFL1, TAX1BP3, ARHGEF1, RHOU]
