ID;Term;Depth;IC Nuno;IC zhou;IC sanchez;IC resnik;IC RZ;IC Rnormalized;IC Nuno org;Annotated Genes Set number
GO:0021915;neural tube development;5.0;1.0;0.7902410118609202;9.628524252492122;33.009488292418915;6.409777797693995;0.0011047978665365144;0.618037346520142;[SEMA3C, PKD2, DACT1]
GO:0006281;DNA repair;7.0;0.6281612110245125;0.6649999707694567;8.781226392104918;180.342582143442;3.582668236575797;0.006035903926554339;0.534137185486798;[USP36, DCLRE1A, FEN1, BTG2, SMG1, WDR48, DCLRE1C, CCNH, MUM1, CIB1, BRCA1, PARK7, SMC6, YY1, POLB, NIPBL, CHAF1B, CHAF1A, EXO1, EP300, TOPBP1, POLH, RFC5, UPF1, AQR, RFC3, RFC4, FBXO18, DTX3L, RFC1, NCOA6, PARP2, NSMCE2, RAD23A, DDB1, NEIL3, RAD51C, MSH3, TIMELESS, PCNA, PAXIP1, PNKP, GPS1, COPS7B, COPS7A, XPC, UNG, RAD51AP1, TFPT, FZR1, WRN, POLR2B, RNF138, RAD21, UBR5, ABL1, POLR2E, RAD54L, POLR2G, USP51, POLR2I, POLR2K, FANCI, POLQ, XRCC6, UBE2B, EYA2, XRCC5, INTS3, NONO, GINS4, APEX2, CDC5L, CDC7, FANCE, GTF2H4, SETX, CDK9, SMUG1, HIST3H2A, COPS5, RAD51, NPLOC4, TTC5, UBE2T, POLE2, RFWD3, CDK2, ERCC5, MNAT1]
GO:0008380;RNA splicing;8.0;0.7248374789738407;0.7374187394869203;9.182237149863703;117.47952805794706;3.8501476017100584;0.003931934079388465;0.5718967274016261;[EIF4A3, DDX42, DDX41, CASC3, USP39, EFTUD2, UBL5, PTBP1, RAVER1, PCF11, C1QBP, ARL6IP4, DHX16, ZNF326, RBM5, DDX17, AQR, MBNL1, RBM15, BUD31, TFIP11, THOC2, SRRM1, THOC6, ERN1, PRPF4, PSPC1, PRPF3, ZNF638, SNRPG, CD2BP2, SLU7, SF1, SF3B5, SF3B2, WBP4, DDX23, SUPT6H, PPP2CA, RNF113A, PABPN1, U2AF2, POLR2B, POLR2E, SAP18, SNRPB2, POLR2G, POLR2I, SMNDC1, DCPS, SF3B1, POLR2K, SPEN, PRPF38A, GPKOW, WTAP, CPSF3, NONO, CPSF2, CDC5L, CWC15, LSM5, SON, ACIN1]
GO:0031087;deadenylation-independent decapping of nuclear-transcribed mRNA;7.0;0.9326813400603323;0.8172600352873667;9.56398573135455;114.44564401843101;7.9853141584524145;0.0038303927109042315;0.7592887026755414;[DCP1A, PNRC1, PNRC2]
GO:1990090;cellular response to nerve growth factor stimulus;6.0;0.9326813400603323;0.7894609826203107;9.5544162803384;97.48528473772916;5.9928839937622085;0.003262744749111514;0.6295966787287501;[USP8, EIF4A3, RAB35, RAPGEF1, PTEN, CDC5L, CIB1, BPTF]
GO:0006366;transcription by RNA polymerase II;10.0;0.6039883530135606;0.7172351883677006;8.613793447804714;583.8786478812184;3.2909128387363804;0.01954189288791682;0.5835384474769965;[TCERG1, ZNF175, CCNK, CCNH, ZNF292, ARID4A, ELK1, MYC, TRIM24, EP300, IER2, GTF2I, MEF2B, ZBTB32, RUNX1, RFX4, MAX, RPAP1, SUPT6H, GTF2E2, RAD21, HLTF, HIVEP1, HOXC4, ZBED1, HIVEP2, TFAP2A, ZBTB17, ZNF143, XBP1, INTS3, PBX3, EAF2, NFXL1, FLI1, NFKB1, CDK9, STAG1, TFCP2, COPS5, SP1, MAFF, NFE2L3, INTS4, INTS7, INTS6, MNAT1, ZNF136, INTS8, NFE2L1, BMPR2, ONECUT2, ELL, THRA, INTS10, HOXC13, BRCA1, AFF4, HYAL2, ZNF768, MKL2, KLF11, TBP, KLF13, MKL1, ARNT, CREB3, NCOR1, TFDP1, TFDP2, ELF4, IRF4, NFX1, TFEC, MED20, ZNF516, LCOR, WBP2, CEBPE, CEBPG, RELA, ARNTL, POLR2B, TAF1A, POLR2E, PLAGL2, POLR2G, POLR2I, POLR2K, TCFL5, POLR2J3, NFYC, CDC5L, ARID3B, DEK, GRHL1, USF2, GTF2H4, GFI1B, KLF6, NFIA, NFIB, NFIC, TAF7, TAF5, TAF4, SSBP3, MIXL1]
GO:0045944;positive regulation of transcription by RNA polymerase II;11.0;0.5461734764479651;0.7055156905536448;8.363590748376499;1463.8556817380634;2.718315475161805;0.048993932283191266;0.5714437321440341;[CRTC2, ZNF175, CCNK, MAML1, CCNH, GFI1, ZNF292, ARID4A, RORA, YEATS4, UBE3A, IKZF1, PARK7, IKZF2, ELK1, YY1, RPS6KA4, RPS6KA5, MYC, DPF2, EP300, SOX8, SOX6, IER5, HMGN3, ZNF564, IER2, CDK5RAP3, DDX17, MEF2B, FLT3LG, MED6, RUNX2, PIAS2, RUNX1, ARMCX3, SFRP2, IL23A, TBL1XR1, RFX4, HOXB4, PAXIP1, MAX, RLF, SUPT6H, BCL2L12, HSPH1, RAD21, HLTF, SCAP, NLRP3, HOXC4, ZBED1, RIPK1, CYTL1, PPARGC1B, TFAP2A, ZBTB17, ZNF143, DR1, CREBBP, XBP1, XRCC6, JUP, PBX3, EAF2, ERLIN2, FLI1, NFKB1, SETX, CDK9, NFKBIA, BCL9, IL6, STAG1, TFCP2, COPS5, CNOT7, SP1, SP3, MAFF, BCL3, MNAT1, NFE2L1, ARF4, CIITA, CD40, SETD3, BMPR2, ONECUT2, ELL, THRA, CHD8, CHD7, DDX41, HOXC13, BRCA1, LDB2, AATF, PKD2, MED12, FLCN, NIPBL, SIN3A, HYAL2, MLX, HRAS, TEAD2, ZNF485, MKL2, KLF13, RBM15, PPP1R12A, PEG3, NCOA6, MKL1, ARNT, SENP2, SAFB, TMEM173, PPRC1, SIRT2, GNL3, CREB3, GAL, TFDP1, RBL1, TFDP2, ELF4, IRF4, MTF2, TFEC, RARA, EAPP, MET, HDAC3, ZNF350, HDAC1, WBP2, CEBPE, CEBPG, GPS2, RELA, ARNTL, RXRA, PLAGL2, MTA2, E2F7, E2F8, TBX1, ZNF462, NFYC, ATAD2, CDC5L, ARID3B, GRHL1, USF2, POMC, KLF6, NFIA, TNIP1, NFIB, TNIP2, TTC5, NFIC, PSMC1, ASXL2, TAF7, CAMK1, TAF4, SSBP3, MIXL1]
GO:0000398;mRNA splicing, via spliceosome;11.0;0.8259837884571596;0.845420846558242;9.4949928598676;356.66873027722005;4.19357731889877;0.011937381421361158;0.6468886914394342;[EIF4A3, DDX42, DDX41, CASC3, USP39, EFTUD2, UBL5, PTBP1, RAVER1, PCF11, DHX16, RBM5, DDX17, AQR, RBM15, BUD31, TFIP11, SRRM1, PRPF4, PSPC1, PRPF3, SNRPG, CD2BP2, SLU7, SF1, SF3B5, SF3B2, WBP4, DDX23, RNF113A, PABPN1, U2AF2, POLR2B, POLR2E, SNRPB2, POLR2G, POLR2I, SMNDC1, DCPS, SF3B1, POLR2K, SPEN, PRPF38A, GPKOW, CPSF3, NONO, CPSF2, CDC5L, CWC15, LSM5]
GO:0051443;positive regulation of ubiquitin-protein transferase activity;11.0;0.9326813400603323;0.8987696223598284;9.597752593825367;659.8486212060837;6.280566066213989;0.022084539526562936;0.7536173930320365;[FZR1, ARRDC3, PTEN, TRIB3, MASTL, UBE2L3]
GO:0072422;signal transduction involved in DNA damage checkpoint;8.0;0.7980440201809971;0.7740220100904985;9.446202695698167;87.74070743780808;5.514393750639154;0.002936602516433358;0.6570063528532206;[BTG2, CDKN1A, PCNA, CDC5L, CNOT10, BRCA1, CNOT4, CNOT6, CCNB1, FZR1, TFDP1, CNOT7, TFDP2, CNOT1, CNOT3, CDK2, CASP2, EP300, CNOT8, GTSE1, E2F7, E2F8]
GO:0000184;nuclear-transcribed mRNA catabolic process, nonsense-mediated decay;10.0;0.8933024483968273;0.861892236059334;9.57851383191746;717.2549128915896;4.989581884898423;0.0240058764469685;0.6704084614939124;[UPF2, UPF1, RPS9, SMG1, RPL3, RPS7, EIF4A3, RPL23A, PPP2R2A, UPF3A, RPSA, CASC3, SMG5, PNRC1, PNRC2, PPP2CA, RPS15, DHX34, SKIV2L, ETF1, DCP1A, RPL29, DCP2, RPL19]
GO:0071352;cellular response to interleukin-2;6.0;1.0;0.8231203125901445;9.628524252492122;81.6500655361772;9.777073627680469;0.0027327542132076126;0.8231203125901445;[CDC5L]
GO:1990646;cellular response to prolactin;8.0;1.0;0.875;9.628524252492122;462.69925393661634;9.777073627680469;0.015486127626965131;0.875;[CDC5L]
GO:0031651;negative regulation of heat generation;5.0;0.9326813400603323;0.7565816818910864;9.510741216835738;50.18507644284984;9.777073627680469;0.0016796493449056573;0.7902410118609202;[ARRDC3]
GO:0071878;negative regulation of adenylate cyclase-activating adrenergic receptor signaling pathway;10.0;0.9326813400603323;0.8815816818910864;9.584072489921288;527.6667667498839;8.67846133901236;0.01766053181385966;0.8590579283277371;[ARRDC3, ATP2B4]
GO:0090327;negative regulation of locomotion involved in locomotory behavior;5.0;1.0;0.7902410118609202;9.628524252492122;71.01036791753914;9.083926447120524;0.002376653109017985;0.7547934328124444;[ARRDC3]
GO:0140074;cardiac endothelial to mesenchymal transition;5.0;1.0;0.7902410118609202;9.628524252492122;23.145667324477426;9.777073627680469;7.746646556020492E-4;0.7902410118609202;[SEMA3C]
GO:0006351;transcription, DNA-templated;9.0;0.5708408884191841;0.6816610693898811;8.449869256150476;581.393741231429;1.9872050686257638;0.019458725298619164;0.49786638480429696;[TCERG1, ZNF175, CCNK, CCNH, GFI1, ZNF292, IKZF1, GPATCH3, IKZF2, ELK1, UBE2L3, MYC, SAP130, ZXDC, DPF2, TRIM24, CPNE1, SOX8, TRIM27, SOX6, IER5, ATXN7L3, IER2, DDX17, ZNF18, SAP30BP, MEF2B, CSNK2A1, ZNF282, RFX1, ZNF12, SND1, THAP1, RUNX1, EID1, EWSR1, RFX4, HOXB4, TRIB3, BCORL1, ASF1B, SF1, ZNF276, ZNF395, ZNF274, ZNF394, PAXIP1, FOXG1, MYCBP2, ZNF20, CDCA7, ZNF23, RPAP1, ZNF25, COMMD9, RAD21, HLTF, HIVEP1, HESX1, HOXC4, ZBED1, HIVEP2, PPARGC1B, ZNF264, ZNF143, XBP1, XRCC6, ZNF263, SETDB1, ZNF260, XRCC5, BCL11A, INTS3, PBX3, EAF2, ZNF35, FLI1, SOX30, STAG1, ZNF30, ZNF813, INTS4, INTS7, INTS6, RCOR3, ZNF136, INTS8, EZH2, CC2D1B, PHF3, SETD5, BTG2, SETD3, ELL, ZNF250, TCF25, SUV39H1, INTS10, ATF7IP2, HOXC13, BRCA1, WASL, WDR43, NIPBL, CHAF1B, ING2, ZMYM2, SCML1, C1QBP, HYAL2, MLX, SPIN1, CIC, JARID2, ZNF485, BRD3, TSC22D4, HELLS, COMMD3, BAZ1A, COMMD1, SIRT7, PPHLN1, PPRC1, ZFX, MED29, SIRT2, MED28, NCOR2, NCOR1, NFX1, TFEC, MED20, DEPDC1, VGLL4, ZNF234, ZNF350, HEATR1, GPS2, ZNF2, ZNF69, RELA, ARNTL, SERTAD3, BCLAF1, SERTAD2, TCEAL3, PLAGL2, GPBP1L1, DEDD, ZNF101, ZNF585A, ZNF462, ZNF581, NFYC, ATAD2, GRHL1, GTF2H4, PER2, ZNF33A, GFI1B, NFIA, NFIB, NFIC, MARS, PKN2, ZNF213, ZNF696, MIXL1, ZNF212, ZNF331, CRTC2, NAB1, ARID4A, UBP1, ZBTB20, YEATS4, YY1, EP300, ZNF326, ZNF688, ZNF564, GTF2I, TLE4, ZNF441, ZNF561, ZNF680, ZBTB32, SARS, PIAS2, ERN1, ILF3, BRMS1, ZNF93, TBL1XR1, PSPC1, TIMELESS, ADNP, ZNF550, MAX, RLF, SUPT6H, GTF2E2, ZNF549, ZNF548, NLRP3, SUDS3, ZNF544, ZNF302, BPTF, TRAPPC2, TFAP2A, ZBTB17, DR1, CBX4, NONO, NFXL1, CNOT10, NFKB1, CDK9, CNOT6, IRAK1BP1, TFCP2, COPS5, CNOT7, CNOT1, SP1, SP4, SP3, MAFF, BCL3, CNOT3, ZFP64, ZNF658, NFE2L3, ZNF777, CNOT8, TMEM18, MNAT1, ZNF654, BRWD1, ZNF532, ZNF410, NFE2L1, ZSCAN2, ZNF652, PHF19, NFKBIB, PHTF2, CIITA, BMPR2, ONECUT2, THRA, CHD9, CHD8, CDCA7L, CHD7, CHD1, AFF4, LBH, SIN3A, ZNF407, NUP62, ZNF768, ZNF525, ZNF524, ZNF766, LRRFIP1, HIF1AN, MKL2, KLF11, KLF12, TBP, KLF13, RFC1, EED, BUD31, MKL1, ARNT, SAFB, ARID1A, ZFP90, CREB3, TFDP1, RBL1, ZNF519, TFDP2, ELF4, IRF4, POLR1B, ZNF638, ZNF516, LCOR, ZNF511, ZNF630, ITGB3BP, GTF3C1, SMARCD2, HDAC3, HDAC1, WBP2, CEBPE, CEBPG, CXXC5, TFPT, POLR2B, RBBP5, TP53INP2, FAM120B, TP53INP1, TAF1A, POLR2E, SAP18, POLR2G, ASCC3, RBBP7, POLR2I, E2F6, E2F7, POLR2K, ZNF189, E2F8, TCFL5, TBX1, POLR2J3, SPEN, CHURC1, EYA2, CDC5L, ARID3B, DEK, USF2, PNRC1, MAPK13, PNRC2, KLF6, POLR3B, POLR3C, TNIP2, POLR3E, ASXL2, TAF7, MNDA, TAF5, TAF4, SSBP3, TRIM33]
GO:1905312;positive regulation of cardiac neural crest cell migration involved in outflow tract morphogenesis;8.0;1.0;0.875;9.628524252492122;891.2837590880857;8.67846133901236;0.029830465313372006;0.8188169164668168;[SEMA3C]
GO:0000209;protein polyubiquitination;10.0;0.7671156992804218;0.7987988615011312;9.223059144383958;155.4032479663248;4.243684138952949;0.005201206855589802;0.6322632160784685;[ANAPC13, CCNF, UBE3A, BRCA1, FBXO41, ANAPC11, UBE2L3, NPEPPS, FZR1, ZNRF2, RNF213, RNF138, CDC26, UBR5, TRIM69, TRIM27, RFFL, SKP2, C18orf25, RNF20, MYLIP, UBE2B, DTX3L, SYVN1, ZFP91, UBE4A, FBXL15, LNPEP, FBXL16, MARCH6, RC3H2, ITCH, SPSB1, UBE2T, CDC16, FBXL3, ANAPC5, TRIM32, THOP1, RNF166]
GO:0044344;cellular response to fibroblast growth factor stimulus;6.0;1.0;0.8231203125901445;9.628524252492122;97.48528473772916;6.444869117505266;0.003262744749111514;0.6527112189764278;[SETX, TBX1, SFRP1, CCL5, HYAL2, CDC5L]
GO:0006355;regulation of transcription, DNA-templated;9.0;0.4043225613388953;0.5984019058497367;6.838723401371219;245.35026186902695;1.5478292109445575;0.008211652463856259;0.4753966830094131;[ZNF175, NUP107, MAML1, ZNF292, GPATCH3, ELK1, MYC, ZXDC, IER5, IER2, CDK5RAP3, DDX17, ZNF18, SAP30BP, MEF2B, CSNK2A1, ZNF282, RFX1, ZNF12, HCFC2, SND1, MED6, RC3H2, EID1, EWSR1, RFX4, HOXB4, ASF1B, SF1, ZNF276, ZNF395, ZNF274, ZNF394, MEPCE, ZNF20, CDCA7, NOLC1, ZNF23, ZNF25, MTDH, HSPH1, RAD21, HESX1, HOXC4, PPARGC1B, ZNF264, ZNF143, CREBBP, ZNF263, JUP, ZNF260, H3F3A, FZD6, PBX3, EIF2AK3, ERLIN2, ZNF35, FLI1, SOX30, SETX, CYLD, QARS, PKIA, ZNF30, ZNF136, PAM, EZH2, CDKN1C, SETD5, ARF4, BTG2, CDKN1A, SETD3, BTG1, ELL, ZNF250, TCF25, ATF7IP2, HOXC13, ZNF45, WDR43, MED12, NIPBL, CHAF1B, ING2, SPIN1, CIC, JARID2, TEAD2, HAVCR2, ZNF485, BRD3, HELLS, RIPK3, SPHK1, BAZ1A, SIRT7, TMEM173, MED29, SIRT2, MED28, GNL3, NCOR2, NCOR1, MTF2, MED20, RARA, ZNF234, ZNF350, GPS2, ZNF69, BCLAF1, UBN1, PLAGL2, DEDD, ZNF101, ZNF462, EGLN2, ZNF581, ATAD2, GTF2H4, ZNF33A, CENPF, NFIA, NFIB, NFIC, PSMC1, PKN2, ZNF213, ZNF696, MIXL1, ZNF212, LIMS1, ZNF331, NCF1, NAB1, GMNN, UBP1, ZBTB20, RORA, YEATS4, PARK7, YY1, ADORA3, ZNF207, ZNF326, ZNF688, HMGN3, FADS1, ZNF564, GTF2I, MAP3K5, TLE4, ZNF441, ZNF561, ZNF680, ZBTB32, SARS, LEMD3, PIAS2, ARMCX3, ILF3, ADNP, ZNF550, MAX, RLF, GTF2E2, BCL2L12, MED30, BAG3, TPR, ZNF549, ZNF548, ABL1, DVL3, ZNF544, ZNF302, TRAPPC2, ZBTB17, DR1, WFS1, NFKB1, CDK9, BCL9, CNOT6, IRAK1BP1, TFCP2, COPS5, CNOT7, CDK5, YEATS2, CNOT1, SP1, SP4, SP3, MAFF, BCL3, CNOT3, CDK2, ZFP64, ZNF658, NFE2L3, ZNF777, CNOT8, MNAT1, ZNF654, ZNF532, ZNF410, NFE2L1, ZNF652, CIITA, BMPR2, ONECUT2, TRADD, CDCA7L, ITGB2, PTEN, LBH, SIN3A, ZNF407, ZNF768, ZNF525, ZNF524, ZNF766, HIF1AN, PPP1R12A, PEG3, DTX3L, RFC1, ZFP91, ARNT, ZFP90, DUSP22, TFDP1, ZNF519, TFDP2, ADORA2A, ZNF638, ZNF516, LCOR, ZNF511, MET, ZNF630, GTF3C1, MTPN, SMARCD2, HDAC3, HDAC1, WBP2, CEBPE, CEBPG, NLRC4, CXXC5, LRP8, DNAJB1, RBBP5, DNAJB5, TP53INP2, TP53INP1, SAP18, ASCC3, ZNF622, RBBP7, E2F6, E2F7, POLR2K, E2F8, IRX1, TBX1, RNF20, SEMA4D, CDC5L, FBXL15, PNRC1, PNRC2, KLF6, POLR3C, ASXL2, MNDA, TRIM32, TRIM33, TCERG1, CCNK, CCNH, GFI1, IKZF1, IKZF2, UBE2L3, TIAL1, RPS6KA4, RPS6KA5, SAP130, DPF2, TRIM24, CPNE1, SOX8, FBXO5, TRIM27, SOX6, ATXN7L3, SFMBT2, FLT3LG, RUNX2, THAP1, RUNX1, THAP6, SFRP1, TWSG1, SFRP2, KARS, IL23A, BOLA3, XRN2, TRIM14, TRIB3, ANKRA2, BCORL1, PAXIP1, FOXG1, MYCBP2, GMCL1, COMMD9, HLTF, HIVEP1, SCAP, ZBED1, HIVEP2, XBP1, XRCC6, SETDB1, XRCC5, BCL11A, EAF2, STAG1, GOLGB1, ZNF813, RCOR3, CC2D1B, AHCTF1, CD40, SUV39H1, OTUD7B, BRCA1, WASL, PTPRK, AATF, ZMYM2, SCML1, C1QBP, HYAL2, MLX, HRAS, TSC22D4, HBZ, SEC13, SYK, NCOA6, TSC22D3, PRMT3, TSC22D2, COMMD3, COMMD1, PPHLN1, PPRC1, ZFX, VAV1, MLF2, TOX4, GAL, NFX1, CSDE1, TFEC, KIT, DEPDC1, MAPRE3, VGLL4, ARHGEF5, PCNA, HEATR1, NEDD8, ZNF2, PRICKLE1, TRAK1, RELA, ARNTL, PPP2CA, SERTAD3, RXRA, SERTAD2, TCEAL3, GPBP1L1, SCAND1, APBB3, ZNF585A, NFYC, GRHL1, PER2, ITCH, NLRP12, GFI1B, HIST3H2A, TTC5, CAMK4, MARS, CAMK1, MEGF8, CRTC2, CD80, ARID4A, CIB1, UBE3A, WWC3, EP300, SNIP1, PDE8A, SSU72, ERN1, BRMS1, ZNF93, TBL1XR1, PSPC1, CCNE1, TIMELESS, PPID, CARD11, SUPT6H, AGER, STK3, NLRP2, NLRP3, RIPK1, CYTL1, SUDS3, BPTF, TFAP2A, PRNP, UBE2I, CBX4, NONO, CAV1, NFXL1, CNOT10, NFKBIA, IL6, BRWD1, ZSCAN2, PHF19, PICALM, USP36, PHTF2, THRA, YWHAB, CHD9, CHD8, CHD7, DDX41, LDB2, PKD2, CHD1, AFF4, CKS1B, FLCN, NUP62, GATAD1, LRRFIP1, DACT1, ARHGEF11, MKL2, KLF11, KLF12, TBP, KLF13, RBM15, H2AFY, EED, BUD31, MKL1, IRAK4, SENP2, SAFB, ARID1A, TGFBR1, DNM2, CREB3, RBL1, SETBP1, ELF4, IRF4, CAT, EAPP, ITGB3BP, MCPH1, USP13, CAMK2D, TFPT, FAM120B, TAF1A, MTA2, ZNF189, TCFL5, SPEN, CHURC1, EYA2, ATP2B4, ARID3B, DEK, USF2, MAPK13, POMC, CD4, TNIP1, TNIP2, TAF7, KRAS, TAF5, TAF4, SSBP3]
GO:0048843;negative regulation of axon extension involved in axon guidance;12.0;1.0;0.9481203125901445;9.628524252492122;2931.023726508963;6.558197802812269;0.09809872637615838;0.7835068532133509;[SEMA6B, SEMA4D, SEMA3C, SEMA4B]
GO:1904568;cellular response to wortmannin;6.0;1.0;0.8231203125901445;9.628524252492122;197.49275496556956;9.777073627680469;0.006609904776757478;0.8231203125901445;[CDC5L]
GO:0001755;neural crest cell migration;6.0;0.7980440201809971;0.722142322680643;9.089527751759436;22.57397290845719;5.825829909099042;7.555305579894227E-4;0.6210535250702663;[TBX1, SEMA6B, LAMA5, SEMA4D, SEMA3C, SEMA4B, CFL1, SOX8]
GO:0001756;somitogenesis;5.0;1.0;0.7902410118609202;9.628524252492122;43.80328827915336;5.845247994956144;0.0014660566383032007;0.5891672661548076;[SEMA3C, EP300, MIB1]
GO:0031146;SCF-dependent proteasomal ubiquitin-dependent protein catabolic process;10.0;1.0;0.9152410118609203;9.628524252492122;350.55619955642163;6.063501560976162;0.011732800519056534;0.7253287636709003;[AMN1, LRRC29, FBXO18, CCNF, KIF14, FBXL3, FBXL15, FBXL16, SKP2]
GO:0030433;ubiquitin-dependent ERAD pathway;10.0;0.9326813400603323;0.8815816818910864;9.600353375525426;603.0491029665483;5.557565922504363;0.02018351076733335;0.6994551915910392;[SEC13, WFS1, EDEM1, DERL3, SYVN1, DERL2, UBE4A, ERLIN2, MARCH6, HSP90B1, RNF103, NPLOC4, PSMC1, UBQLN1, MAN1B1]
GO:0071526;semaphorin-plexin signaling pathway;6.0;0.811012628672052;0.7286266269261705;9.089527751759436;26.50247477320489;6.166155715036245;8.87013979980389E-4;0.6384578026126634;[SEMA6B, SEMA4D, SEMA3C, SEMA4B, MET]
