id	name	nbGenes	ICSeco	ICZhou	ICSanchez	ICMazandu
GO:0007165	signal transduction	464	0.36	0.43	5.06	19.43
GO:0048522	positive regulation of cellular process	463	0.24	0.37	3.90	23.85
GO:0009966	regulation of signal transduction	290	0.33	0.45	5.35	37.59
GO:0048869	cellular developmental process	223	0.32	0.29	4.16	13.85
GO:0019538	protein metabolic process	216	0.31	0.41	4.91	44.77
GO:2001141	regulation of RNA biosynthetic process	210	0.40	0.55	6.54	148.11
GO:0070887	cellular response to chemical stimulus	188	0.40	0.40	5.31	25.21
GO:0009967	positive regulation of signal transduction	177	0.44	0.54	6.71	140.23
GO:0050776	regulation of immune response	166	0.38	0.44	5.64	22.45
GO:0006464	cellular protein modification process	158	0.34	0.49	5.84	147.03
GO:0032270	positive regulation of cellular protein metabolic process	149	0.47	0.59	7.41	288.49
GO:0006996	organelle organization	136	0.39	0.39	5.17	14.95
GO:0065003	protein-containing complex assembly	131	0.45	0.48	6.06	36.47
GO:0043312	neutrophil degranulation	118	1.00	0.90	9.63	132.80
GO:0035066	positive regulation of histone acetylation	2	0.81	0.84	9.50	1302.92
GO:0001934	positive regulation of protein phosphorylation	116	0.58	0.69	8.60	663.11
GO:0051241	negative regulation of multicellular organismal process	110	0.35	0.42	4.99	23.69
GO:0033554	cellular response to stress	109	0.44	0.42	6.05	25.47
GO:0009968	negative regulation of signal transduction	104	0.44	0.54	6.68	140.65
GO:0051707	response to other organism	99	0.42	0.46	6.41	24.63
GO:0043066	negative regulation of apoptotic process	96	0.56	0.63	7.79	81.07
GO:0045597	positive regulation of cell differentiation	87	0.45	0.51	6.57	82.53
GO:0045944	positive regulation of transcription by RNA polymerase II	85	0.55	0.71	8.36	1463.86
GO:0045087	innate immune response	83	0.68	0.59	8.16	26.47
GO:0030335	positive regulation of cell migration	80	0.58	0.64	8.22	157.26
GO:0008285	negative regulation of cell proliferation	74	0.56	0.57	7.31	43.61
GO:0032496	response to lipopolysaccharide	71	0.89	0.74	9.45	64.41
GO:0032269	negative regulation of cellular protein metabolic process	71	0.47	0.59	7.45	289.39
GO:0001819	positive regulation of cytokine production	68	0.51	0.54	6.97	44.26
GO:0002768	immune response-regulating cell surface receptor signaling pathway	65	0.68	0.66	8.81	76.40
GO:0043065	positive regulation of apoptotic process	62	0.56	0.63	7.81	80.91
GO:0045596	negative regulation of cell differentiation	61	0.44	0.51	6.50	82.79
GO:0034613	cellular protein localization	59	0.45	0.48	6.33	26.83
GO:0051129	negative regulation of cellular component organization	58	0.42	0.50	5.99	44.00
GO:0022409	positive regulation of cell-cell adhesion	57	0.59	0.59	7.66	36.23
GO:0000122	negative regulation of transcription by RNA polymerase II	54	0.61	0.74	8.79	1836.95
GO:0071417	cellular response to organonitrogen compound	54	0.53	0.56	7.37	128.53
GO:1901652	response to peptide	54	0.62	0.60	8.14	43.80
GO:0045786	negative regulation of cell cycle	53	0.51	0.54	7.10	42.35
GO:0007204	positive regulation of cytosolic calcium ion concentration	51	0.68	0.77	9.10	290.30
GO:0030595	leukocyte chemotaxis	51	0.69	0.67	8.77	62.06
GO:0050708	regulation of protein secretion	47	0.54	0.62	7.86	96.15
GO:0071222	cellular response to lipopolysaccharide	45	1.00	0.82	9.63	238.00
GO:0006366	transcription by RNA polymerase II	38	0.60	0.72	8.61	583.88
GO:0043406	positive regulation of MAP kinase activity	37	0.70	0.80	9.37	2605.69
GO:0001933	negative regulation of protein phosphorylation	37	0.61	0.70	8.76	664.69
GO:0045765	regulation of angiogenesis	37	0.70	0.68	8.82	44.94
GO:0043547	positive regulation of GTPase activity	35	0.93	0.79	9.52	49.34
GO:0002758	innate immune response-activating signal transduction	30	0.63	0.71	8.79	406.89
GO:0002690	positive regulation of leukocyte chemotaxis	29	0.75	0.77	9.33	423.36
GO:0050729	positive regulation of inflammatory response	26	0.66	0.68	8.59	125.85
GO:0001666	response to hypoxia	26	0.81	0.70	9.12	21.16
GO:0050715	positive regulation of cytokine secretion	25	0.69	0.74	9.07	549.48
GO:0000302	response to reactive oxygen species	24	0.71	0.60	8.78	25.34
GO:0051928	positive regulation of calcium ion transport	23	0.70	0.73	8.85	69.31
GO:0051384	response to glucocorticoid	19	0.77	0.73	9.22	62.74
GO:0045665	negative regulation of neuron differentiation	19	0.62	0.68	8.73	338.15
GO:0032355	response to estradiol	16	0.93	0.76	9.52	74.25
GO:0042108	positive regulation of cytokine biosynthetic process	16	0.63	0.67	8.76	609.34
GO:0014074	response to purine-containing compound	15	0.71	0.65	8.80	47.95
GO:0050709	negative regulation of protein secretion	15	0.65	0.70	8.75	381.97
GO:0050728	negative regulation of inflammatory response	14	0.67	0.69	8.71	126.18
GO:0071260	cellular response to mechanical stimulus	14	1.00	0.79	9.63	56.12
GO:0001776	leukocyte homeostasis	14	0.75	0.67	8.65	18.82
GO:0043330	response to exogenous dsRNA	13	0.93	0.79	9.49	30.96
GO:0050766	positive regulation of phagocytosis	13	0.77	0.76	9.34	175.33
GO:0045840	positive regulation of mitotic nuclear division	12	0.71	0.73	9.14	276.06
GO:0050869	negative regulation of B cell activation	11	0.76	0.75	9.16	160.50
GO:0045429	positive regulation of nitric oxide biosynthetic process	11	1.00	0.88	9.63	658.64
GO:0070301	cellular response to hydrogen peroxide	10	1.00	0.82	9.63	361.03
GO:0032526	response to retinoic acid	10	0.93	0.76	9.49	43.79
GO:0045824	negative regulation of innate immune response	10	0.62	0.66	8.46	174.19
GO:0033273	response to vitamin	9	0.67	0.66	8.44	22.82
GO:0071398	cellular response to fatty acid	9	0.74	0.69	9.00	203.00
GO:0006024	glycosaminoglycan biosynthetic process	9	0.76	0.70	9.16	237.50
GO:0000060	protein import into nucleus, translocation	9	1.00	0.90	9.63	93.44
GO:0045471	response to ethanol	8	0.93	0.76	9.52	69.73
GO:0050805	negative regulation of synaptic transmission	8	0.68	0.69	8.78	101.85
GO:0002711	positive regulation of T cell mediated immunity	8	0.74	0.75	9.27	266.28
GO:0006954	inflammatory response	7	0.68	0.59	8.12	11.94
GO:0050999	regulation of nitric-oxide synthase activity	7	0.89	0.77	9.41	24.72
GO:0010883	regulation of lipid storage	7	0.79	0.68	9.12	20.47
GO:0006006	glucose metabolic process	6	0.71	0.68	8.57	34.68
GO:0086004	regulation of cardiac muscle cell contraction	6	0.71	0.75	9.31	77.56
GO:0045672	positive regulation of osteoclast differentiation	6	0.93	0.86	9.59	840.78
GO:0051770	positive regulation of nitric-oxide synthase biosynthetic process	6	1.00	0.85	9.63	147.29
GO:0097421	liver regeneration	5	1.00	0.82	9.63	47.22
GO:0035176	social behavior	5	1.00	0.70	9.63	22.58
GO:0071333	cellular response to glucose stimulus	5	1.00	0.88	9.63	272.30
GO:0010460	positive regulation of heart rate	5	0.78	0.76	9.25	94.36
GO:0044130	negative regulation of growth of symbiont in host	4	1.00	0.85	9.63	102.69
GO:0043278	response to morphine	4	0.93	0.82	9.55	93.34
GO:1903140	regulation of establishment of endothelial barrier	4	0.89	0.82	9.47	90.35
GO:0071223	cellular response to lipoteichoic acid	4	1.00	0.82	9.63	155.88
GO:0045071	negative regulation of viral genome replication	4	0.89	0.82	9.47	85.24
GO:0050995	negative regulation of lipid catabolic process	4	0.77	0.73	9.07	114.83
GO:0010875	positive regulation of cholesterol efflux	4	1.00	0.90	9.63	184.01
GO:0050691	regulation of defense response to virus by host	4	0.89	0.80	9.47	72.39
GO:0032308	positive regulation of prostaglandin secretion	4	0.89	0.86	9.55	484.67
GO:0042311	vasodilation	3	0.79	0.77	9.15	40.37
GO:0010829	negative regulation of glucose transmembrane transport	3	0.89	0.80	9.53	65.67
GO:0051000	positive regulation of nitric-oxide synthase activity	3	1.00	0.85	9.63	123.23
GO:0042416	dopamine biosynthetic process	3	0.93	0.84	9.59	507.85
GO:0060559	positive regulation of calcidiol 1-monooxygenase activity	3	1.00	0.92	9.63	1344.96
GO:2000279	negative regulation of DNA biosynthetic process	3	0.80	0.77	9.43	829.32
GO:0033574	response to testosterone	3	0.93	0.76	9.53	91.04
GO:2000121	regulation of removal of superoxide radicals	3	0.83	0.76	9.49	93.21
GO:1901841	regulation of high voltage-gated calcium channel activity	2	0.89	0.88	9.53	231.63
GO:0006809	nitric oxide biosynthetic process	2	1.00	0.82	9.63	241.10
GO:0032375	negative regulation of cholesterol transport	2	0.80	0.77	9.27	149.43
GO:0071316	cellular response to nicotine	2	1.00	0.79	9.63	116.91
GO:0015012	heparan sulfate proteoglycan biosynthetic process	2	1.00	0.88	9.63	495.00
GO:0072679	thymocyte migration	2	0.89	0.82	9.53	31.85
GO:1900127	positive regulation of hyaluronan biosynthetic process	2	1.00	0.90	9.63	589.77
GO:0046827	positive regulation of protein export from nucleus	2	0.81	0.80	9.43	516.73
GO:0002925	positive regulation of humoral immune response mediated by circulating immunoglobulin	2	0.89	0.86	9.59	508.67
GO:0042559	pteridine-containing compound biosynthetic process	2	0.73	0.66	9.19	354.18
GO:2000010	positive regulation of protein localization to cell surface	2	1.00	0.85	9.63	73.71
GO:2000347	positive regulation of hepatocyte proliferation	1	1.00	0.85	9.63	189.10
GO:0010956	negative regulation of calcidiol 1-monooxygenase activity	1	1.00	0.92	9.63	1348.07
GO:0090266	regulation of mitotic cell cycle spindle assembly checkpoint	1	0.87	0.88	9.55	280.44
GO:0043392	negative regulation of DNA binding	1	0.76	0.67	8.87	32.53
GO:0048711	positive regulation of astrocyte differentiation	1	0.93	0.88	9.59	472.10
GO:2000304	positive regulation of ceramide biosynthetic process	1	0.93	0.86	9.60	909.79
GO:0014050	negative regulation of glutamate secretion	1	0.93	0.86	9.59	415.45
GO:0008053	mitochondrial fusion	1	0.93	0.76	9.52	60.85
GO:0061048	negative regulation of branching involved in lung morphogenesis	1	0.93	0.82	9.56	172.03
GO:2000630	positive regulation of miRNA metabolic process	1	0.93	0.84	9.58	378.47
GO:0002876	positive regulation of chronic inflammatory response to antigenic stimulus	1	1.00	0.90	9.63	533.68
GO:2000866	positive regulation of estradiol secretion	1	1.00	0.90	9.63	439.70
GO:0045083	negative regulation of interleukin-12 biosynthetic process	1	1.00	0.88	9.63	836.02
GO:0045994	positive regulation of translational initiation by iron	1	1.00	0.92	9.63	1474.06
GO:0006198	cAMP catabolic process	1	1.00	0.93	9.63	5918.16
GO:0010693	negative regulation of alkaline phosphatase activity	1	1.00	0.92	9.63	315.72
GO:0060693	regulation of branching involved in salivary gland morphogenesis	1	0.87	0.76	9.37	94.00
GO:0035509	negative regulation of myosin-light-chain-phosphatase activity	1	1.00	0.93	9.63	1252.16
GO:2000173	negative regulation of branching morphogenesis of a nerve	1	1.00	0.85	9.63	148.91
GO:1901671	positive regulation of superoxide dismutase activity	1	1.00	0.90	9.63	578.38
GO:0050996	positive regulation of lipid catabolic process	1	0.72	0.71	8.86	114.23
GO:0032800	receptor biosynthetic process	1	0.83	0.74	9.32	73.96
GO:0048566	embryonic digestive tract development	1	0.93	0.76	9.49	33.61
GO:0051798	positive regulation of hair follicle development	1	0.83	0.74	9.38	137.71
GO:0071803	positive regulation of podosome assembly	1	1.00	0.88	9.63	306.35
GO:0033092	positive regulation of immature T cell proliferation in thymus	1	1.00	0.93	9.63	1868.46
