id	name	nbGenes	ICSeco	ICZhou	ICSanchez	ICMazandu
GO:0008150	biological_process	6226	0.00	0.00	0.00	0.00
GO:0043433	negative regulation of DNA binding transcription factor activity	73	0.81	0.84	9.47	278.01
GO:0051091	positive regulation of DNA binding transcription factor activity	132	0.81	0.84	9.43	277.83
GO:0050789	regulation of biological process	4293	0.09	0.17	1.80	4.47
GO:0065009	regulation of molecular function	1223	0.33	0.29	4.10	4.47
GO:0051179	localization	1907	0.26	0.13	2.57	3.37
GO:0046718	viral entry into host cell	46	0.77	0.73	8.94	28.37
