id	name	nbGenes	ICSeco	ICZhou	ICSanchez	ICMazandu
GO:0031323	regulation of cellular metabolic process	2060	0.22	0.36	4.01	22.77
GO:0016043	cellular component organization	1567	0.28	0.26	3.74	11.45
GO:0006355	regulation of transcription, DNA-templated	1242	0.40	0.60	6.84	245.35
GO:0006351	transcription, DNA-templated	815	0.57	0.68	8.45	581.39
GO:0002376	immune system process	719	0.38	0.19	3.93	3.37
GO:0032270	positive regulation of cellular protein metabolic process	532	0.47	0.59	7.41	288.49
GO:0042981	regulation of apoptotic process	491	0.45	0.55	6.60	16.23
GO:0042127	regulation of cell proliferation	468	0.45	0.48	6.03	12.04
GO:0006508	proteolysis	452	0.55	0.57	7.34	47.86
GO:0051726	regulation of cell cycle	424	0.41	0.45	5.89	12.04
GO:0016310	phosphorylation	416	0.53	0.56	6.88	24.41
GO:0097711	ciliary basal body-plasma membrane docking	35	1.00	0.79	9.63	21.39
GO:0022402	cell cycle process	397	0.40	0.32	4.60	7.39
GO:0032269	negative regulation of cellular protein metabolic process	379	0.47	0.59	7.45	289.39
GO:0010564	regulation of cell cycle process	301	0.42	0.50	6.22	14.24
GO:0006974	cellular response to DNA damage stimulus	298	0.57	0.53	7.47	29.00
GO:1903047	mitotic cell cycle process	291	0.50	0.45	5.87	11.32
GO:0016567	protein ubiquitination	252	0.69	0.74	9.00	153.79
GO:0045786	negative regulation of cell cycle	238	0.51	0.54	7.10	42.35
GO:0055086	nucleobase-containing small molecule metabolic process	199	0.38	0.48	6.63	107.58
GO:0045664	regulation of neuron differentiation	165	0.51	0.60	7.72	62.26
GO:0006753	nucleoside phosphate metabolic process	165	0.42	0.53	7.26	168.50
GO:0043687	post-translational protein modification	141	0.65	0.67	8.51	151.15
GO:0051098	regulation of binding	128	0.50	0.45	6.36	6.77
GO:0071214	cellular response to abiotic stimulus	125	0.59	0.54	7.66	24.78
GO:1902749	regulation of cell cycle G2/M phase transition	79	0.70	0.70	8.68	19.40
GO:0006977	DNA damage response, signal transduction by p53 class mediator resulting in cell cycle arrest	31	1.00	0.93	9.63	888.12
GO:0007265	Ras protein signal transduction	95	0.76	0.73	8.94	27.53
GO:0043434	response to peptide hormone	93	0.67	0.66	8.71	71.33
GO:0007088	regulation of mitotic nuclear division	84	0.59	0.64	8.17	54.97
GO:0032388	positive regulation of intracellular transport	82	0.61	0.63	8.04	60.38
GO:0045732	positive regulation of protein catabolic process	82	0.70	0.70	9.03	231.05
GO:0048589	developmental growth	79	0.55	0.40	6.36	12.22
GO:0007051	spindle organization	60	0.69	0.67	8.69	44.52
GO:0001578	microtubule bundle formation	22	0.84	0.74	9.31	33.20
GO:0051054	positive regulation of DNA metabolic process	77	0.59	0.65	8.41	301.51
GO:0006260	DNA replication	74	0.73	0.72	9.27	254.20
GO:0048545	response to steroid hormone	73	0.69	0.64	8.94	60.25
GO:0001701	in utero embryonic development	67	1.00	0.85	9.63	22.50
GO:0019886	antigen processing and presentation of exogenous peptide antigen via MHC class II	58	1.00	0.79	9.63	42.20
GO:1903046	meiotic cell cycle process	58	0.49	0.44	6.09	19.36
GO:1901796	regulation of signal transduction by p53 class mediator	56	0.72	0.71	9.12	45.07
GO:0051302	regulation of cell division	53	0.56	0.53	7.28	12.04
GO:0071103	DNA conformation change	52	0.67	0.63	8.24	21.24
GO:0048469	cell maturation	48	0.70	0.55	8.24	25.22
GO:0031570	DNA integrity checkpoint	35	0.75	0.73	9.22	53.07
GO:0031577	spindle checkpoint	13	0.79	0.74	9.29	53.07
GO:0090224	regulation of spindle organization	23	0.72	0.74	9.03	52.96
GO:0046605	regulation of centrosome cycle	29	0.72	0.73	9.19	52.96
GO:0071897	DNA biosynthetic process	44	0.71	0.71	9.25	573.30
GO:0045471	response to ethanol	43	0.93	0.76	9.52	69.73
GO:0007281	germ cell development	40	0.87	0.68	9.34	71.68
GO:0071456	cellular response to hypoxia	39	1.00	0.82	9.63	103.25
GO:0006368	transcription elongation from RNA polymerase II promoter	35	1.00	0.90	9.63	477.15
GO:0002244	hematopoietic progenitor cell differentiation	35	0.81	0.66	8.94	21.07
GO:0014066	regulation of phosphatidylinositol 3-kinase signaling	34	0.89	0.80	9.43	45.07
GO:0090329	regulation of DNA-dependent DNA replication	34	0.62	0.69	8.66	151.84
GO:0033273	response to vitamin	34	0.67	0.66	8.44	22.82
GO:0035335	peptidyl-tyrosine dephosphorylation	33	0.89	0.82	9.53	179.25
GO:0006513	protein monoubiquitination	30	0.87	0.85	9.57	155.40
GO:0090263	positive regulation of canonical Wnt signaling pathway	29	0.83	0.79	9.42	236.53
GO:0051289	protein homotetramerization	29	1.00	0.85	9.63	85.45
GO:0008584	male gonad development	28	1.00	0.79	9.63	50.96
GO:0006338	chromatin remodeling	26	0.70	0.60	8.24	17.51
GO:0031100	animal organ regeneration	24	0.89	0.70	9.29	28.09
GO:0098813	nuclear chromosome segregation	24	0.77	0.58	8.71	18.72
GO:0051445	regulation of meiotic cell cycle	21	0.55	0.57	7.53	25.89
GO:0007224	smoothened signaling pathway	20	0.78	0.71	8.87	26.50
GO:0048146	positive regulation of fibroblast proliferation	20	0.89	0.77	9.43	63.75
GO:0044380	protein localization to cytoskeleton	19	0.64	0.64	8.34	32.77
GO:0001947	heart looping	19	1.00	0.85	9.63	47.98
GO:0010569	regulation of double-strand break repair via homologous recombination	16	0.84	0.82	9.52	184.48
GO:0007062	sister chromatid cohesion	16	0.75	0.67	8.80	32.57
GO:0043029	T cell homeostasis	15	1.00	0.85	9.63	22.00
GO:0000083	regulation of transcription involved in G1/S transition of mitotic cell cycle	15	0.89	0.86	9.54	264.07
GO:0006270	DNA replication initiation	15	0.80	0.75	9.41	149.04
GO:0048538	thymus development	13	1.00	0.79	9.63	35.89
GO:0010862	positive regulation of pathway-restricted SMAD protein phosphorylation	12	1.00	0.92	9.63	1012.56
GO:0015949	nucleobase-containing small molecule interconversion	12	0.77	0.71	9.27	109.53
GO:0006760	folic acid-containing compound metabolic process	12	0.73	0.69	9.33	232.08
GO:0008643	carbohydrate transport	12	0.55	0.57	6.95	14.73
GO:0051383	kinetochore organization	11	0.93	0.76	9.49	38.76
GO:0016572	histone phosphorylation	11	0.71	0.73	9.20	367.80
GO:0008631	intrinsic apoptotic signaling pathway in response to oxidative stress	10	0.87	0.78	9.52	52.93
GO:0006271	DNA strand elongation involved in DNA replication	10	0.78	0.76	9.42	149.74
GO:0071392	cellular response to estradiol stimulus	10	1.00	0.82	9.63	338.17
GO:0006266	DNA ligation	10	0.78	0.74	9.36	149.04
GO:0098534	centriole assembly	9	0.84	0.71	9.34	67.08
GO:0021915	neural tube development	9	1.00	0.79	9.63	33.01
GO:1904668	positive regulation of ubiquitin protein ligase activity	8	1.00	0.95	9.63	754.34
GO:0010529	negative regulation of transposition	8	0.87	0.72	9.27	41.76
GO:0030214	hyaluronan catabolic process	7	1.00	0.88	9.63	501.28
GO:0080111	DNA demethylation	7	0.87	0.83	9.54	342.03
GO:0000578	embryonic axis specification	7	0.79	0.64	8.75	24.59
GO:0051315	attachment of mitotic spindle microtubules to kinetochore	7	0.89	0.70	9.29	27.92
GO:0002903	negative regulation of B cell apoptotic process	7	0.84	0.84	9.47	155.02
GO:0036120	cellular response to platelet-derived growth factor stimulus	7	1.00	0.82	9.63	97.49
GO:0000921	septin ring assembly	6	1.00	0.85	9.63	107.16
GO:0007077	mitotic nuclear envelope disassembly	6	1.00	0.82	9.63	74.08
GO:0016554	cytidine to uridine editing	6	1.00	0.90	9.63	133.94
GO:0002052	positive regulation of neuroblast proliferation	6	1.00	0.88	9.63	501.00
GO:0071732	cellular response to nitric oxide	5	1.00	0.82	9.63	346.50
GO:0060707	trophoblast giant cell differentiation	5	1.00	0.79	9.63	42.29
GO:0071459	protein localization to chromosome, centromeric region	5	0.80	0.75	9.12	34.72
GO:0007100	mitotic centrosome separation	4	1.00	0.75	9.63	26.82
GO:0090399	replicative senescence	4	1.00	0.75	9.63	26.14
GO:0051256	mitotic spindle midzone assembly	4	1.00	0.79	9.63	55.95
GO:0051661	maintenance of centrosome location	4	1.00	0.82	9.63	46.02
GO:0031915	positive regulation of synaptic plasticity	4	0.87	0.81	9.45	41.66
GO:0044320	cellular response to leptin stimulus	4	1.00	0.82	9.63	109.38
GO:1905340	regulation of protein localization to kinetochore	3	0.89	0.77	9.38	29.06
GO:0000727	double-strand break repair via break-induced replication	3	1.00	0.92	9.63	521.72
GO:2000373	positive regulation of DNA topoisomerase (ATP-hydrolyzing) activity	3	1.00	0.85	9.63	112.16
GO:1900195	positive regulation of oocyte maturation	2	0.93	0.86	9.59	598.41
GO:0071163	DNA replication preinitiation complex assembly	2	0.87	0.78	9.39	77.23
GO:0000022	mitotic spindle elongation	2	1.00	0.75	9.63	36.99
GO:0072708	response to sorbitol	2	0.93	0.76	9.47	29.40
GO:0090521	glomerular visceral epithelial cell migration	2	1.00	0.85	9.63	24.97
GO:0010216	maintenance of DNA methylation	2	1.00	0.85	9.63	149.04
GO:0071332	cellular response to fructose stimulus	2	1.00	0.88	9.63	222.43
GO:1905463	negative regulation of DNA duplex unwinding	2	0.89	0.82	9.55	116.67
GO:0010994	free ubiquitin chain polymerization	2	1.00	0.85	9.63	46.13
GO:0006975	DNA damage induced protein phosphorylation	2	1.00	0.88	9.63	212.05
GO:1904172	positive regulation of bleb assembly	2	1.00	0.90	9.63	200.31
GO:0090129	positive regulation of synapse maturation	1	0.93	0.82	9.57	185.50
GO:0071314	cellular response to cocaine	1	1.00	0.85	9.63	537.10
GO:2001178	positive regulation of mediator complex assembly	1	1.00	0.85	9.63	140.38
GO:0019088	immortalization of host cell by virus	1	1.00	0.88	9.63	54.80
GO:0045870	positive regulation of single stranded viral RNA replication via double stranded DNA intermediate	1	1.00	0.90	9.63	106.56
GO:0071373	cellular response to luteinizing hormone stimulus	1	1.00	0.88	9.63	601.18
