GO:0045087;innate immune response;4.0;0.6799073451904818;0.5899536725952409;8.162187183698695;26.470038109745843;3.422703586883119;8.859283540455166E-4;0.42503722060519694;[SPON2, APP, FCN3, NCF1, NCF2, DEFB1, PRDM1, IPO7, HERC5, GRAP2, TRIM25, TRIM27, VSIG4, B2M, TRIM21, MAP3K5, KRT1, WRNIP1, RNASE3, MR1, MID2, ADAM15, IL23A, PSPC1, BTK, TRIM14, SERPING1, MATR3, CLEC4E, TRIM10, CFB, NAIP, S100A8, HIST1H2BC, ANKRD17, NLRX1, CFH, CFI, ZC3HAV1, GATA3, CORO1A, AGER, C2, C3, CLEC7A, PRDX1, NLRP2, ABL1, SLAMF7, NLRP3, SRPK2, XRCC6, APOBEC3F, APOBEC3H, XRCC5, NONO, DEFA4, SIGLEC10, SH2D1B, KIR2DS5, NFKB1, ANKHD1, NFKB2, TREML1, BST2, CYLD, FER, FES, TREML4, SERINC3, APOBEC3A, CRISP3, HMGB3, IL27, ADAR, LYST, TREM1, PIK3CG, PPP6C, TRIM4, TRIM5, C1QBP, TNFAIP8L2, JAK3, IKBKE, CAMP, HAVCR2, FGA, MAP4K2, CR2, FCER1G, ANXA1, CR1, DTX3L, SYK, RIPK2, ARG1, TUBB, IRAK4, TYK2, TMEM173, SIRT2, SFPQ, ELF4, TLR8, TLR7, TLR10, LTF, COLEC12, C1QA, HIST1H2BJ, SRC, UNC93B1, CEBPG, DEFB123, NLRC4, LILRA2, RELA, RNF135, IFI16, SUSD4, PTK2B, CSK, APOL1, PPP1R14B, MX2, MX1, GZMB, KIR3DL1, ITCH, POLR3B, POLR3C, AXL, POLR3E, POLR3F, SARM1, F2RL1, PTX3, PTPN6, TBKBP1, TRIM32, CD244, LGR4, C1QC]
GO:0070374;positive regulation of ERK1 and ERK2 cascade;11.0;0.9326813400603323;0.8987696223598284;9.604993755081928;1178.864923326294;4.330336256014159;0.03945554807418015;0.6538825498434562;[APP, PTEN, CIB1, PTPN22, ARRB1, ARRB2, ADRA1A, IGF1R, NPTN, TNFAIP8L3, LGALS9, HRAS, PDE8A, EPHB4, HAVCR2, PDGFRB, FGA, MAP2K1, FBXW7, RIPK2, FGG, F2R, PRKCA, KARS, KIT, RAPGEF1, PRKD2, EPHA1, MET, CD44, CCL3L1, SHC1, SRC, AGER, EGFR, RAP1B, RAP1A, CCL7, CCL5, PDGFD, P2RY1, ABL1, CCL3, GCNT2, CCL2, PTK2B, CCL19, CD74, ANGPT1, CCL20, RYK, GPR55, ABCA7, CD4, BMP2, AXL, F2RL1, TEK]
GO:0097039;protein linear polyubiquitination;11.0;1.0;0.9324289523296623;9.628524252492122;157.60047254366168;8.67846133901236;0.00527474598481953;0.8762458687964789;[RNF31, RBCK1]
GO:0006508;proteolysis;5.0;0.5517781253862416;0.5661300745540411;7.338517941704937;47.85814540089318;2.5985281439167696;0.001601769057033345;0.42312986198474045;[CYFIP2, CCNF, PREP, UBE2L3, PSMD8, PSMD7, PSMD4, CAPNS2, PSMD2, CDC26, MYC, ANPEP, ZC3H12A, CPNE1, DAG1, LONP2, PSMD1, TRIM25, SKP2, FBXO8, ATXN7L3, NFRKB, ARRDC1, YOD1, ARMC8, ASRGL1, SFRP1, KCTD10, UQCRC1, PSME2, YME1L1, RBCK1, CFB, RNF121, CFI, COPS7B, COPS7A, GATA3, UBE2J2, HIF1A, ANAPC11, C2, C3, RHOT1, RNF213, C2orf40, AMZ2, CTSA, XBP1, ST14, HACE1, EDEM1, SIAH2, PLK1, LNPEP, ERLIN2, AZU1, PGA3, PGA5, ABTB2, CYLD, ABTB1, RNF103, NPLOC4, CDC16, FBXL3, FBXL4, CTRC, WDR48, PPP1R11, TGFB1I1, KIF14, OTUD7B, PCSK9, BRCA1, PCSK6, TRIM9, CTSO, IMMP2L, CASP10, ADAMTSL4, CTSK, SUFU, UIMC1, ADAMTSL2, CTSH, OLR1, CTSG, CTSF, CTSE, CTSB, SEC13, MME, RIPK2, JOSD1, SIRT1, SIRT2, SUPT3H, DDB2, DDB1, PSMA6, PSMA4, PSMA1, MMP23A, MPND, DLD, RNF165, PCYOX1, C1QA, DERL3, GPS1, TMPRSS3, DERL2, WDR20, NEDD8, TANK, PSMA7, RELA, ARNTL, PCNP, PSMB6, AMN1, PPP2CB, ADAM28, PSMB4, PSMB5, PERP, PSMB1, ADAM23, RANBP2, MBD6, RANBP3, LRRC29, USP9Y, MCRS1, SYVN1, UBE2G1, PRSS36, PSMB9, KBTBD4, RNF145, ITCH, SPSB1, SPCS2, PSMC6, FAP, PSMC1, NEDD4, UBAP1, C1QC, MAD2L1, FCN3, PDCD6, UBE2D3, BUB1B, UBE3A, PARK7, UBE2Z, CNDP2, YY1, NPEPPS, CAPN6, PLAU, CAPN2, PMPCB, CAPN1, GGT1, C18orf25, FBXW4, USP8, MYLIP, RNF44, FBXO18, FBXW11, FBXW7, UBE2E1, UBE4A, ADAM10, KCTD2, TRPC4AP, KCTD5, CDC25A, RNF40, ADAM18, ADAM15, TBL1XR1, CHMP4C, DPEP2, CHMP4B, PLAA, ANAPC5, DPEP3, ENY2, PSMD11, PSMD13, KLHL15, UBR4, PSEN2, PSEN1, UBR1, HSP90B1, DPP3, VCPIP1, ATXN3, CCNB1, COP1, DPP7, DPP8, UBD, BTBD3, UBR5, BTBD2, NLRP3, TASP1, USP51, RIPK1, SMAD2, UBE2I, TOR1A, SDF2L1, UBE2B, KLHL25, WFS1, RHBDD2, RHBDD1, ISG15, DHCR24, BTBD6, MARCH6, NFKB1, SMAD7, NFKBIA, NSFL1C, COPS5, MDM2, RNF181, TPP1, USP36, USP37, USP38, RNPEPL1, USP32, CCDC47, USP34, NGLY1, PTEN, TNFAIP3, ARRB1, ECE2, ARRB2, TNFAIP1, USP39, SENP6, POLB, CASP9, SENP7, CASP8, ADAMTS3, SCRN1, ADAMTS1, CASP6, CASP3, RNPEP, CASP1, CASP2, USP30, PGPEP1, USP46, FGA, USP48, PDCD6IP, USP49, DTX3L, RHBDF2, FGG, ATP6AP2, RAD23A, VPS37A, PPP2R5C, SENP2, MMP8, RAD23B, TGFBR1, ESPL1, UBE2R2, TRAF6, MYH9, TRIM58, PIK3C3, MAN1B1, USP41, THOP1, BIRC2, BIRC3, PAPPA2, LTF, USP13, BECN1, STOML2, RNF34, VPS4B, HM13, RNF38, USP12, FGL2, RNF6, RNF7, SPG7, RCHY1, LRP8, PARL, PSMB10, TFPT, CLN3, FZR1, ZNRF2, RMND5A, IFI16, TP53INP2, UBQLN1, NRIP3, RFFL, SEC11A, SEC11C, RNF20, MBTPS1, ATE1, BAD, AMFR, FBXL19, GZMB, FBXL15, FBXL16, FBXL13, CHFR, CAPN13, P2RX7, CAPN11, XPNPEP1, TNIP1, TNIP2, XPNPEP2, TNIP3, ASXL2, ERCC8, TRIM38, TRIM32, OTUD1, METAP2]
GO:0071347;cellular response to interleukin-1;6.0;1.0;0.8231203125901445;9.628524252492122;81.6500655361772;5.446340287394138;0.0027327542132076126;0.6016464081682054;[CD40, CCL3L1, RORA, TFPI, TANK, HIF1A, RELA, YY1, CCL7, NLRP7, CCL5, HYAL2, ZC3H12A, CCL3, CCL2, CCL19, GBP2, NKX3-1, UPF1, ABCC2, CCL20, FGG, NFKB1, MAPK13, SFRP1]
GO:0016540;protein autoprocessing;7.0;1.0;0.8509193652572005;9.628524252492122;102.5832240862455;7.138016298065211;0.00343336819125881;0.7159578506919597;[CAPN2, CASP1, PCSK9, CTSE]
GO:0071346;cellular response to interferon-gamma;6.0;1.0;0.8231203125901445;9.628524252492122;81.6500655361772;5.266214121163619;0.0027327542132076126;0.5924347476504533;[ACTR2, GSN, CCL3L1, CCL20, DAPK1, WAS, VPS26B, RAB43, RAB20, CCL7, CCL5, CDC42EP4, CCL3, CDC42EP2, CASP1, CCL2, CCL19, LGALS9, IL12RB1, GBP2, GAPDH, HLA-DPA1]
GO:0036258;multivesicular body assembly;7.0;1.0;0.8509193652572005;9.628524252492122;62.72328125453724;6.375876246018314;0.0020992917763011008;0.6769819729871445;[PDCD6IP, VTA1, VPS4B, CHMP4C, CHMP4B, VPS37A, VPS37B, CHMP6, VPS25, RAB11A, CHMP5]
GO:0007095;mitotic G2 DNA damage checkpoint;11.0;1.0;0.9324289523296623;9.628524252492122;857.7571147403349;6.7325511899570465;0.028708358699073767;0.7767319332797141;[FANCI, TAOK2, DONSON, TOPBP1, NBN, CDK5RAP3]
GO:0050717;positive regulation of interleukin-1 alpha secretion;11.0;1.0;0.9324289523296623;9.628524252492122;998.8167007681584;8.390779266560578;0.033429496098039586;0.8615337942327104;[P2RX7, PANX1, CASP1]
GO:0050718;positive regulation of interleukin-1 beta secretion;11.0;1.0;0.9324289523296623;9.628524252492122;998.8167007681584;6.518977089658987;0.033429496098039586;0.7658097438582601;[FZD5, RIPK2, P2RX7, PANX1, NLRP12, NLRP7, NLRP2, CCL3, CASP1, NLRP3, TLR8, CCL19, LGALS9]
GO:0015031;protein transport;7.0;0.4793097133439409;0.590574221929171;6.989466922876863;54.45792783373929;2.578890050578526;0.0018226578356421344;0.4828039223744382;[IPO13, VPS29, RPL3, NUP107, TFRC, RBPJ, AKT2, AP1S1, HOMER3, VPS35, MLYCD, VPS18, GSTK1, ACOT8, PRKCI, ATG10, SCAMP1, SYTL4, SYTL3, SCAMP3, SCAMP2, BCR, RUFY1, NUP93, CTAGE5, UNC50, MAP1A, ACOT2, RPL29, RPL28, VPS25, ACOT4, SAR1B, VPS26A, VPS26B, ABCB9, GATA3, PPP3R1, VPS11, VTI1A, SSR1, VPS16, ABCA1, PMM1, RAB3IP, PMM2, NPLOC4, HYOU1, ARF3, ARF4, LRSAM1, DENND1A, SRP54, ARHGAP1, CLTA, CHM, LYST, AP3S2, ANXA1, SSR2, SSR3, VAMP8, AFTPH, LSG1, AGPS, EXOC4, EXOC3, VAMP5, ARF5, PAFAH1B1, EXOC1, TIMM13, GGA3, SNX25, LMAN2, ASNA1, AP2S1, STX5, MFN2, CCL19, BID, RPL19, AGK, SYVN1, SNX22, ARCN1, DHRS4, CENPF, SNX19, SNX17, SNX14, TAOK2, SNX15, UBAP1, RAB3B, DGKD, NCF1, PDCD6, RAB3D, CSE1L, UBE2D3, PARK7, IPO7, IPO4, RAB43, RPH3A, EIF4ENIF1, IPO8, IPO9, LAMP2, KPNA4, KPNA5, RPS9, RPS7, VPS33A, VPS33B, STX7, TAP2, TAP1, RPSA, CLIP3, RINT1, CLIP1, RAB36, RAB35, RAB38, SLC27A2, KPNB1, RAB5C, HSP90B1, MTM1, RAP1A, CLTCL1, RAB6A, EVI5, AP1M1, MCL1, TOR1A, RAB4B, DAB2, CDK5, BCL3, PLEKHM1, PLEKHF2, SFT2D3, ARRB1, ARRB2, GPR89B, AP1G2, AP1G1, TLK1, ITGAV, EVI5L, TNPO1, TNPO2, SNAP29, ARL5A, TNPO3, EIF5A, PDCD6IP, DTX3L, VPS13C, VPS13D, VPS13B, VPS37A, VPS37B, ARFGAP1, ARL4A, RPL37A, LCP2, SFT2D2, SEC22C, LRP1, UNC93B1, VPS4B, RAB1B, NLRC4, RAB21, AP3M2, SELENBP1, AP3M1, RAB20, VPS53, VPS52, VPS54, RAB28, SEC23B, RPL23A, MCM3AP, RAB15, VPS41, RAB13, RAB18, RUNDC1, VPS45, SEC24C, AHCYL1, ARL6IP1, TRAF3IP2, ZDHHC6, IFIT1, PEX26, RPS15, LONP2, BCAP29, ARFIP1, TRIM27, TBC1D22A, SIL1, GOLGA7, ARL11, C16orf70, ARRDC1, COG5, COG4, COG3, AP1B1, COG1, MYO7A, ANK3, DOPEY2, KIF20A, STX1A, BLZF1, MACF1, TBC1D9B, SYNGR1, SCFD1, RAB11FIP1, SNX2, SCFD2, VPS8, ATP6V0A2, RAB11FIP2, SPTBN1, ATP6V1C1, SEC31A, RAB11FIP5, BBS2, CTSA, XBP1, EGR2, RAB27B, POLA2, RPS27, CD24, TRAM1, AHCTF1, HIP1, GDI1, MIA3, TRAM2, SERP1, SEC61G, XPO5, KIF13B, TMED2, TMED1, TMED7, RAB8A, BBS4, TMED5, RAB8B, TMED4, GRIPAP1, TMED9, SEC13, SYK, BTN3A1, ZDHHC12, BTN3A2, COMMD1, ZDHHC17, AP3B2, RHOB, GAL, CTTN, SLU7, NAPA, RABGAP1, TOMM40, STX17, STX16, ZDHHC23, HSD17B4, ZDHHC24, DERL2, PRICKLE1, TRAK1, RGPD1, NAPG, STX11, ARNTL, LMNA, HEATR3, ATP6V0E2, RAE1, PEX16, RANBP2, CD74, MON2, PEX19, RANBP3, AKR1C3, PEX13, RAB11A, YIF1A, PEX14, SPCS2, TTC8, GPAM, NEDD4, RAB3GAP2, F2RL1, COPG2, APBA3, APBA2, SRP19, STEAP3, SYS1, BCCIP, TBC1D3C, TOMM34, TSC2, TBC1D2B, CHMP4C, CHMP4B, PPID, CARD11, RTN2, COPB2, COPA, SUCNR1, COPB1, PSEN1, NCKIPSD, NLRP3, ATP6V1H, ECT2, TBC1D17, TBC1D15, ATP6V1F, DNAJC19, SMAD2, VTA1, IDH1, ASPSCR1, NUP153, TIMM44, HOOK3, NFKBIA, PAN3, AMACR, TMEM115, HOOK2, ATG16L2, COPE, RTP4, TTC26, YWHAB, RPGR, SEC61A2, NUP62, JAGN1, DYNLT1, RHBDF2, FGG, TBC1D8, SENP2, DNM2, PEX7, TBC1D3, ACOX2, ACOX1, PEX6, EHHADH, GORASP1, CAT, MYH9, ACOX3, CHMP6, CHMP5, GOSR2, GOSR1, RRBP1, RAB40B, RAB40C, TIMM8B, ARFGEF2, MBTPS1, MX2, GDAP1]
GO:0042771;intrinsic apoptotic signaling pathway in response to DNA damage by p53 class mediator;8.0;1.0;0.875;9.628524252492122;164.97679920792456;6.409777797693995;0.005521625000009403;0.7027963346592216;[CDKN1A, IFI16, BCL3, DDIT4, EP300, SIRT1]
GO:1902715;positive regulation of interferon-gamma secretion;10.0;1.0;0.9152410118609203;9.628524252492122;753.5029195149353;7.8311634786251565;0.02521906460756386;0.8157270763441555;[ABL1, PTPN22, LGALS9, CD244]
GO:0001666;response to hypoxia;5.0;0.811012628672052;0.6957473261969462;9.117698628726131;21.16160540946;4.1860866471696125;7.082598888462125E-4;0.5043176776701113;[ALAS2, SUV39H1, HP1BP3, PTEN, MPL, RORA, PLOD2, ABAT, AQP3, AQP1, TXN2, MECP2, ALAD, NPEPPS, ALKBH5, PLAU, MYC, FUNDC1, CASP3, NPPA, CAPN2, CASP1, EP300, ATP7A, NKX3-1, BNIP3L, ENDOG, ITGA2, PRKCE, SIRT4, ARNT, AGTRAP, SIRT1, SIRT2, SFRP1, DDIT4, CAT, BIRC2, PPARD, BECN1, SRC, ABCB4, PSEN2, ITPR2, PTGS2, THBS1, AGER, HIF1A, TM9SF4, HSP90B1, PDLIM1, CCNB1, PAK1, SCFD1, UCP3, KCNMB1, LMNA, UBQLN1, E2F1, SCAP, PTK2B, CREBBP, EGLN2, BAD, CAV1, NR4A2, SLC8A3, BMP2, TBL2, MDM2, NF1, HYOU1, TEK, P4HB, CD24, ZNF354A, PAM, KCNK3]
GO:0030308;negative regulation of cell growth;6.0;0.6913464685778243;0.6687935468790567;8.673012807464685;80.89021177018715;4.623782033182691;0.0027073225914839173;0.5595807407949613;[CDKN1A, BMPR2, BTG1, SEMA3C, SERPINE2, EI24, FHL1, WFDC1, RNF6, ACVR1B, ADIPOR2, ING1, RTN4, PPP2CA, TCHP, FLCN, SERTAD3, PAK1, STK11, SERTAD2, CCDC85B, HYAL2, NPPA, RBBP7, MSX1, SEMA6B, CDKN2D, G6PD, CDKN2C, SEMA4D, SEMA4B, IFRD1, EAF2, SIRT1, BST2, SFRP1, GAL, SFRP2, PSRC1, CDK5, ADAM15, NME6, NOV, SCGB3A1, ULK2, FGF13, SIPA1, PPARD]
GO:0007409;axonogenesis;8.0;0.6873818243518346;0.7186909121759173;8.667113085337498;64.60914726719044;4.956792062075433;0.0021624100145753813;0.6284905765689417;[TOP2B, APP, C12orf57, PITPNA, PTEN, RTN4, STK11, STMN1, NRCAM, NPTX1, NEFH, RAB8A, NTNG2, RYK, MAP1S, COL25A1, OMG, ANK3, GP5, NR4A2, LRFN3, ZEB2, LRFN4, ALS2, CDK5, NFIB, TAOK2, MAP1A, PAFAH1B1, PICALM]
GO:2000510;positive regulation of dendritic cell chemotaxis;10.0;0.9326813400603323;0.8815816818910864;9.593432932680852;509.141903474748;7.697632086000634;0.01704052131133542;0.8088982747154926;[C1QBP, IL12A, LGALS9]
GO:0019885;antigen processing and presentation of endogenous peptide antigen via MHC class I;5.0;0.8436909121759173;0.712086467948879;9.271849308553389;32.556158890958;7.8311634786251565;0.0010896253394395913;0.6907270763441554;[TAP2, TAP1, B2M, TAPBP]
GO:0090737;telomere maintenance via telomere trimming;8.0;1.0;0.875;9.628524252492122;185.09737597092234;9.083926447120524;0.00619504259692348;0.839552420951524;[NBN]
GO:0032720;negative regulation of tumor necrosis factor production;7.0;0.8933024483968273;0.7975705894556142;9.461470167828956;85.92712208559752;5.926926025970411;0.002875903446815721;0.6540226378555745;[IL10, ERRFI1, TNFAIP3, PTPN22, ARRB2, POMC, AXL, BCL3, ZC3H12A, RARA, GHRL, BPI, TRIM27, LGALS9, HAVCR2]
GO:0010499;proteasomal ubiquitin-independent protein catabolic process;8.0;1.0;0.875;9.628524252492122;190.80819184730524;6.518977089658987;0.006386178464905405;0.7083807915285978;[PSMB6, PSMA6, PSMB4, PSMB5, PSMA4, PSMA1, KLHL25, PSMB1, PSMB10, PSMA7, PSMB9]
GO:0070206;protein trimerization;6.0;0.8933024483968273;0.7697715367885581;9.405380701177911;42.032160359171186;5.8650506222523235;0.00140677858073304;0.6230592741648748;[CD74, PNPT1, ARG1, TNFRSF9, ITLN1, PKD2L1, CLYBL, TRIM6, COL1A2, TRIM4, NUP62, TRIM27, TRIM21]
GO:2001184;positive regulation of interleukin-12 secretion;10.0;1.0;0.9152410118609203;9.628524252492122;753.5029195149353;8.67846133901236;0.02521906460756386;0.8590579283277371;[LGALS9]
GO:0090503;RNA phosphodiester bond hydrolysis, exonucleolytic;8.0;0.8436909121759173;0.7968454560879586;9.466005322994347;231.13671471601307;6.166155715036245;0.007735937832006836;0.6903374900225189;[PNPT1, DIS3, ISG20L2, ISG20, CNOT6, PAN3, CNOT7, XRN1, CNOT1, XRN2, ZC3H12A, CNOT8, EXOSC3, DCPS, DCP2]
GO:1902041;regulation of extrinsic apoptotic signaling pathway via death domain receptors;9.0;0.8259837884571596;0.8092325194088689;9.485423408851448;64.8607677845634;5.734022359845919;0.0021708315268480906;0.6894787953221185;[SP100, RNF34, TRADD, PTEN, TNFAIP3, BRCA1, PARK7, STK4, THBS1, STK3, SCRT2, CASP8, RIPK1, RFFL, FGA, FEM1B, DAPK1, NOS3, FGG, TNFRSF10B, TNFRSF10A, SFRP1, SFRP2, MADD, TMBIM1, NF1, BCL2L1]
GO:0038027;apolipoprotein A-I-mediated signaling pathway;6.0;1.0;0.8231203125901445;9.628524252492122;26.50247477320489;8.16763571524637;8.87013979980389E-4;0.7408135829017477;[ABCA1, ITGB3, ITGAV, ABCA7]
GO:2001181;positive regulation of interleukin-10 secretion;10.0;1.0;0.9152410118609203;9.628524252492122;753.5029195149353;8.390779266560578;0.02521906460756386;0.8443458537639685;[LGALS9]
GO:1902044;regulation of Fas signaling pathway;6.0;0.8933024483968273;0.7697715367885581;9.405380701177911;41.8512380110395;9.083926447120524;0.0014007232725606145;0.7876727335416686;[SP100, TMBIM1]
GO:1904469;positive regulation of tumor necrosis factor secretion;10.0;1.0;0.9152410118609203;9.628524252492122;775.9675723657698;7.292166977892469;0.025970936321606315;0.7881627702307852;[FZD5, LGALS9, HAVCR2]
GO:0009967;positive regulation of signal transduction;6.0;0.44130843764162375;0.5437745314109563;6.712834686611667;140.23187634019237;2.4492930892588385;0.004693434700611163;0.44837727507861835;[CYFIP2, MAML1, ITSN1, ABAT, RBPJ, GPR174, TFG, ZC3H12A, VPS35, CDK5RAP3, PRKCI, CSNK2A1, PRKCE, PRKCD, PRKCA, RC3H2, NUP93, DEPDC1B, PRKD2, RBCK1, ATF4, SEH1L, SHOX2, GATA3, PLA2G6, HIF1A, MTDH, C3, PDGFD, CREBBP, GSTM2, AFAP1L2, JAG1, JUP, FZD5, STARD10, ABCA7, MLLT11, CYLD, ARL2BP, TREML4, EZH2, CDKN1C, HRK, GPR27, TGFB1I1, ARHGAP1, ARHGAP6, BBC3, ING2, TRIM6, JPH2, CASP10, TRIM5, TIMP2, SPIN1, IKBKE, HAVCR2, DUSP5, FCRL2, RIPK3, GPR35, RIPK2, SPHK1, FCRL3, ATPIF1, SIRT1, ITPKB, ZEB2, RAPGEF1, GAS8, PAFAH1B1, HBEGF, RNF165, PPARD, CRB2, GPS2, EGFR, BCLAF1, CHN2, GCNT2, PLAGL2, CCL19, BID, APOL3, CDKN2B, P2RY10, GSN, CCL20, BIK, GPR55, G0S2, NR1H3, SULF2, CLCF1, TAOK2, LGR4, LIMS1, NCF1, IRS2, PARK7, STK11, CDH2, GRAP2, PIM2, MAP3K9, MAP3K5, USP8, MAP2K1, FBXO18, IGFBP5, RPS7, FBXW7, IGFBP3, F2R, MADD, S100A8, ANKRD17, KHDRBS1, SHC1, RAP1B, SOCS2, BAG4, RAP1A, UBR5, ABL1, DVL3, CD300LF, MCL1, BDNF, NEK6, TNFRSF10B, TNFRSF10A, NFKB1, CHERP, CXCL10, CXCL11, DAB2, CDK5, STK24, RHEB, NF1, PDCL, SERINC3, MAP3K11, BCL2L1, RAD9A, BCAR3, ITGB1, BMPR2, NUMA1, ITGB3, TRADD, LRRK1, PTEN, PTPN22, ARRB1, ARRB2, ADRA1A, PIK3CG, PTBP1, ADAMTS3, ITGAV, NEO1, NKX3-1, KSR1, SH2D3A, ITGA1, SH2D3C, ZFP91, ARNT, NRG1, ADRA2C, DUSP22, TFDP1, TFDP2, ADORA2A, ADORA2B, TRAF6, ITGA5, ACPP, MET, BIRC2, BIRC3, NLGN3, RNF31, BECN1, HDAC3, NLGN2, WBP2, SRC, CXXC5, MLLT3, P2RY8, CCL7, CCL5, TP53INP1, P2RY1, SH3BP2, CCL3, E2F1, CCL2, CSK, ZNF622, SH2B3, SH2B2, TBX1, ANGPT1, SEMA4D, GZMB, FBXL15, P2RX7, P2RX5, P2RX4, VAPA, TRIM39, TSPAN17, ASXL2, PTPN6, TRIM38, FCGR2B, TRIM32, APP, TRAF3IP2, GFI1, RASSF2, PPP2R1B, ARL6IP5, CPNE1, TRIM25, IL12A, LGALS9, SKP2, EPHB4, RSAD2, SLC35C2, MAPK8IP3, MAPK8IP1, SFRP1, TWSG1, SFRP2, KARS, IL23A, EPHA1, NAIP, STX1A, MACF1, PDCD10, TP53BP2, NTSR1, PAG1, TRPM4, XBP1, TNFSF14, GADD45B, GDF1, PUM2, BST2, CALM3, CALM1, CD24, CALM2, CD40, HIP1, SECTM1, AKAP13, C1QBP, HYAL2, CTSH, TNFAIP8L3, HRAS, TMED4, MAP4K2, SEC13, DBNL, TNFRSF12A, SYK, IL15, ZDHHC13, RHOC, ZDHHC17, VAV1, NOV, KIT, TLR7, ARHGEF5, CD44, AVPI1, SLC20A1, TUBD1, RFNG, RELA, ARNTL, PAK1, MSX1, DISC1, PAK2, MAP4K3, MAP3K3, CD74, GDF11, MAP3K1, RYK, GDF15, AKR1C3, SORBS3, MPP7, PPP1CA, MOS, NLRP12, AXL, NEDD4, CTNNB1, F2RL1, GHRL, CD86, CD80, CIB1, UBE3A, IGF1R, EP300, PDE8A, IL6R, TGM2, PDGFRB, MID2, ERN1, TBL1XR1, PPIF, CARD11, CCL3L1, CLEC16A, PSEN1, STK4, AGER, RASGRP4, RTN4, STK3, UBD, CAMTA1, RIPK1, ECT2, SMAD2, UBE2I, CAV2, CAV1, BMP6, SSH1, SELP, IL6, BMP2, DLG5, IL7R, LSM14A, CXCL9, EDA, YWHAB, USP34, TNFAIP3, PKD2, FLCN, SPRED1, LASP1, CASP8, RASGEF1A, NUP62, NPTN, CASP1, CASP2, DACT1, FGA, BUD31, FGG, ATP6AP2, PLAUR, IRAK4, YWHAZ, TGFBR1, SFPQ, HSH2D, ALS2, CAT, PDE5A, LTF, ACVR1B, THBS1, PTK2B, SASH1, TCF7L2, PDE6H, EGF, PDE6G, BAD, SOD1, CD4, TNIP2, BAX, KRAS, TEK, LTBR]
GO:1904903;ESCRT III complex disassembly;6.0;1.0;0.8231203125901445;9.628524252492122;38.04764185170599;7.474488534686424;0.0012734203321220245;0.7053660038532718;[VTA1, VPS4B, CHMP5]
GO:0098586;cellular response to virus;6.0;0.7763722522362496;0.7113064387082693;8.999915593069748;28.654098265158677;6.375876246018314;9.59026881920657E-4;0.6491829203200885;[TRIM6, BAD, ZC3H12A, IL12A, ADAR, CCL19, LGALS9, TMEM173, LGALS8, LSM14A, IKBKE, BCL2L1]
GO:0032834;positive regulation of CD4-positive, CD25-positive, alpha-beta regulatory T cell differentiation involved in immune response;13.0;1.0;0.9625549647676366;9.628524252492122;3627.31071452397;9.083926447120524;0.1214028252474149;0.9271073857191605;[LGALS9]
GO:0001556;oocyte maturation;4.0;1.0;0.75;9.628524252492122;79.08984218955116;6.8867018697843045;0.0026470658418474595;0.6021862538851576;[CCNB1, PTK2B, FBXO5, REC8]
GO:0032956;regulation of actin cytoskeleton organization;7.0;0.559792591703537;0.630815661108969;7.718981747607684;34.11626247365944;3.9689311377000256;0.0011418406023505395;0.553890688213353;[NCKAP1, GMFB, WIPF2, FHOD1, AVIL, TESK1, PREX1, ARHGDIB, CFL1, STMN1, PPFIA1, ARFIP1, TRIM27, PDGFRB, TMOD1, SWAP70, PRKCE, TMOD3, PRKCD, SFRP1, MYADM, FSCN1, EPHA1, PFN1, PHLDB2, PFN2, MAGEL2, SDC4, TWF2, IQGAP2, CORO1A, ACTR3B, BAG4, ABL1, NCKAP1L, SPTBN1, S100A10, VASP, ARPC4, SSH3, SSH1, VIL1, BST2, CCDC88A, FER, ARPC2, CDK5, FES, PAM, WDR1, ARPC1A, WASL, ARHGAP6, TRIOBP, LMOD3, AKAP13, CAPZB, TMSB4X, SH3PXD2B, HRAS, BBS4, ACTR2, TIGD5, MKKS, PLEKHG2, RHOH, RHOC, SPTB, TGFBR1, CIT, RHOB, CTTN, CDC42EP4, CDC42EP2, RHOU, MET, ARHGEF5, C9orf72, PTGER4, MTPN, LRP1, ROCK2, SYNPO2, WAS, ADD3, ADD1, PPM1F, PAK1, PTK2B, CLASP1, JAM3, GSN, LIMK1, SORBS3, DLC1, TAOK2, ALMS1, F2RL1, TEK]
GO:0010824;regulation of centrosome duplication;9.0;0.7866048967936545;0.7895430735771163;9.474373572664863;54.56804827344474;6.063501560976162;0.0018263434676571142;0.706328376990269;[PDCD6IP, ROCK2, CENPJ, VPS4B, NUP62, CCNF, CHMP4C, CHMP4B, BRCA1, CEP76, MDM1, CHMP5]
GO:0046597;negative regulation of viral entry into host cell;8.0;0.9326813400603323;0.8413406700301662;9.548481544818586;84.95196338807416;6.832634648514029;0.002843265762795464;0.7244212536750128;[IFITM3, FCN3, GSN, TRIM5, TRIM25, PTX3, TRIM10, MID2]
GO:0031860;telomeric 3' overhang formation;8.0;1.0;0.875;9.628524252492122;149.73527442675106;8.390779266560578;0.005011504882065279;0.8041048419030481;[RAD50, NBN]
GO:0050727;regulation of inflammatory response;6.0;0.5272636092234699;0.5867521172018795;7.400047131651798;31.586589572713706;3.8007227183825356;0.00105717472691369;0.517489449159909;[PROS1, RORA, PARK7, METRNL, NPPA, ZC3H12A, VPS35, GGT1, TGM2, SERPINF1, PRKCD, BCR, KARS, IL23A, BTK, SERPING1, TBC1D23, CFB, S100A8, SUCNR1, NLRX1, CFH, CCL3L1, CFI, LPL, GATA3, AGER, PLA2G7, C2, IL22RA2, C3, ABR, NLRP7, NLRP3, A2M, SOCS5, SIGLEC10, NFKB1, NFKBIA, IL6, TNFSF4, CUEDC2, OTUD7B, WFDC1, TNFAIP3, PIK3CG, C1QBP, HYAL2, TMSB4X, PBK, CASP1, TNFAIP8L2, GPSM3, CCR2, IL10, CR2, FCER1G, ANXA1, CR1, IL15, ITGA2, VAMP8, PSMA6, ADORA2A, NOV, ADORA2B, TLR7, TLR10, ZP3, DNASE1L3, MGLL, BIRC2, MCPH1, BIRC3, PPARD, PTGER4, C1QA, GPS2, PTGS2, RELA, EGFR, NT5E, PSMB4, MAPK7, CNR2, CCL5, CCL3, SUSD4, SNCA, NR1H3, MAPK13, PER1, NLRP12, FABP4, TNIP1, IL2RA, GHRL, TEK, FCGR2B, C1QC]
GO:0016485;protein processing;6.0;0.6519675769143192;0.6491041010473041;8.320191432841943;99.81063536400724;4.720827822332161;0.0033405721418933456;0.564543666965156;[CYFIP2, STOML2, HM13, PSEN2, PCSK9, ECE2, PSEN1, PCSK6, CLN3, IMMP2L, CASP8, ADAMTS3, IFI16, PLAU, PERP, CASP3, CAPN2, CASP1, CASP2, CTSH, LONP2, PMPCB, CTSG, CTSE, GGT1, SEC11A, SEC11C, FGA, MME, BAD, RIPK2, RHBDF2, FGG, ATP6AP2, ADAM10, DHCR24, P2RX7, SPCS2, UQCRC1, YME1L1, PIK3C3, METAP2]
GO:0071404;cellular response to low-density lipoprotein particle stimulus;6.0;1.0;0.8231203125901445;9.628524252492122;56.74958382123113;7.004484905440688;0.0018993574991869968;0.6813299963962409;[ITGB1, ABCA1, FCER1G, SYK, ITGB2, CD9, SREBF2, SOCS5]
GO:1903265;positive regulation of tumor necrosis factor-mediated signaling pathway;8.0;1.0;0.875;9.628524252492122;305.68887294206377;7.57984905034425;0.01023113147524637;0.7626338329336335;[CPNE1, CASP1, TRIM32]
GO:1904354;negative regulation of telomere capping;9.0;0.9326813400603323;0.8625812952104552;9.59462270081644;613.9683692311381;7.697632086000634;0.02054896878250754;0.7898978880348613;[RAD50, ERCC1, NBN]
GO:0046598;positive regulation of viral entry into host cell;8.0;0.9326813400603323;0.8413406700301662;9.548481544818586;85.02443603688559;7.57984905034425;0.0028456913571300335;0.7626338329336335;[CD74, CD4, P4HB, LGALS9, TRIM38, TRIM21]
GO:2001190;positive regulation of T cell activation via T cell receptor contact with antigen bound to MHC molecule on antigen presenting cell;9.0;1.0;0.896240625180289;9.628524252492122;413.7426732268016;9.083926447120524;0.013847594928669781;0.8607930461318132;[HLA-DMB, LGALS9]
GO:0006303;double-strand break repair via nonhomologous end joining;9.0;0.8933024483968273;0.8428918493787028;9.548481544818586;368.8093148901945;5.8067817141283475;0.012343715862540626;0.693199712083778;[POLQ, DCLRE1A, UVRAG, XRCC6, DCLRE1C, PAXIP1, XRCC5, POLM, BRCA1, RAD50, ERCC1, UIMC1, NBN]
GO:0045944;positive regulation of transcription by RNA polymerase II;11.0;0.5461734764479651;0.7055156905536448;8.363590748376499;1463.8556817380634;2.718315475161805;0.048993932283191266;0.5714437321440341;[ATF2, APP, ZNF175, CCNK, PID1, MAML1, CCNH, GFI1, ZNF292, IKZF1, IKZF2, RBPJ, ELK1, IKZF3, IKZF4, RPS6KA4, RPS6KA5, MYC, ZC3H12A, DPF2, EPC1, SOX8, SOX6, PKNOX1, IER5, IER2, CDK5RAP3, HOXA5, DDX17, MEF2B, FLT3LG, RFX3, MED6, RUNX2, RUNX1, SFRP2, IL23A, RFX4, HOXB4, PRKD2, ATF4, PAXIP1, SHOX2, RTF1, GATA3, ZNF24, HIF1A, PLAC8, PPP3R1, HSPH1, RAD21, HLTF, SCAP, HOXC4, ZBED1, PPARGC1B, ZNF143, CREBBP, XBP1, XRCC6, EGR2, JAG1, JUP, FZD5, PBX3, EAF2, NFATC3, MICAL2, NFATC1, ERLIN2, FLI1, SETX, MLLT10, STAG1, TNFSF8, ARF4, CD40, GMEB1, SETD3, ELL, HOXC13, BRCA1, AATF, HOXC10, MED12, NIPBL, PPP3CB, HYAL2, MLX, HRAS, TEAD2, GABPA, ZNF485, IL10, NCOA6, RIPK2, TMEM173, PPRC1, SIRT1, SIRT2, SREBF2, GNL3, ZEB2, GAL, MTF1, MTF2, TFEC, RARA, NCOA7, PPARD, FOXC1, ZNF350, NFIX, SATB2, GPS2, RELA, EGFR, ARNTL, RXRA, STAT4, PLAGL2, MSX1, ZNF345, ZNF462, CDKN2B, DMRT1, NFYC, MCRS1, NR1H2, ATAD2, NR1H3, GRHL1, BATF, PER1, PSMC6, NFIA, NFIB, TTC5, NFIC, PSMC1, FOSB, CTNNB1, F2RL1, CAMK1, AGRN, MIXL1, CRTC2, CCNT2, CCNT1, FHOD1, ARID4A, RORA, YEATS4, UBE3A, PARK7, AHR, NR3C1, YY1, SALL2, STK16, NFATC2IP, EP300, HMGN3, ZNF564, SLC30A9, LMO2, MITF, GTF2F2, PIAS2, ARMCX3, PRPF6, TBL1XR1, MAX, INSIG1, RLF, SUPT6H, BCL2L12, NLRP3, NDN, CAMTA1, RIPK1, CYTL1, TFAP2A, ESRRA, SMAD2, ZBTB17, DR1, POU2F1, ZBTB16, RFXANK, NFKB1, BMP6, SMAD7, NFKB2, CDK9, NFKBIA, NR4A2, DRAP1, BCL9, CDK8, CXCL10, AHI1, IL6, BMP2, CDK7, TFCP2, COPS5, CNOT7, SP1, MAFG, SP3, MAFF, BCL3, MNAT1, NFE2L1, CIITA, BMPR2, THRB, ONECUT2, THRA, CHD8, CHD7, ARRB1, DDX41, LDB2, PKD2, FLCN, SIN3A, ZNF649, NKX3-1, MKL2, KLF10, KLF13, RBM15, PPP1R12A, PEG3, H2AFZ, MKL1, ATRX, ARNT, NRG1, SENP2, SAFB, CREB3, SFPQ, TFDP1, RBL1, TFDP2, ELF4, IRF4, THRAP3, TRAF6, EAPP, MET, GTF2A2, HDAC3, HDAC1, WBP2, CEBPE, PLAG1, CEBPG, TAF1L, ACVR1B, MAPK7, ABLIM3, IFI16, P2RY1, E2F1, MTA2, E2F7, E2F8, TBX1, TCF7L2, CNBP, FOXJ2, CDC5L, ARID3B, USF2, KLF1, POMC, KLF6, MEIS1, KLF5, TNIP1, TNIP2, TNIP3, ASXL2, TAF7, TAF4, SSBP3]
GO:0045824;negative regulation of innate immune response;7.0;0.6240278086381567;0.6629332695762788;8.460919092337061;174.18841360624353;5.970411137910149;0.005829929444006407;0.6562464685024372;[CR1, NLRX1, ARG1, NR1H2, CLEC12B, TNFAIP3, NR1H3, TRAFD1, SERPINB9, ADAR, ARRB2, NMI, CNOT7, IFI16, SERPING1, LGALS9, A2M, HAVCR2]
GO:0043524;negative regulation of neuron apoptotic process;8.0;0.7866048967936545;0.7683024483968273;9.245532000236016;179.62959498689688;4.864418741944418;0.006012040888071555;0.6237666006816429;[BTG2, LRP1, ITSN1, KIF14, ARRB1, PARK7, PSEN1, ARRB2, CORO1A, HIF1A, MECP2, CLN3, MDK, CCL2, PTK2B, SNCB, HRAS, SNCA, PRKCI, ANGPT1, WFS1, BDNF, NONO, F2R, SOD1, NR4A2, ADORA2A, AXL, CLCF1, BAX, KRAS, HYOU1, ADNP, NAIP, CPEB4, BCL2L1]
