GO:0075521;microtubule-dependent intracellular transport of viral material towards nucleus;8.0;1.0;0.875;9.628524252492122;87.41724673338683;9.777073627680469;0.0029257765777521132;0.875;[DYNLT1]
GO:0010629;negative regulation of gene expression;6.0;0.471430776349301;0.558835700764795;6.738152494595957;59.04642522059629;2.349334787147576;0.001976230713800692;0.44326540286011196;[ATF2, ZNF175, RPL3, RNH1, ZNF174, SERPINE2, RBPJ, MYC, ZC3H12A, DIP2A, VPS35, DDX17, ZNF282, DAPK1, SERPINF1, RFX3, ZNF12, DICER1, HCFC2, SND1, EID1, HOXB4, SERPING1, RPL29, RPL28, ATF4, CTBP1, MEPCE, SHOX2, BAZ2A, GATA3, ZNF24, HIF1A, GLG1, MTDH, PRDX5, HESX1, ZBTB7A, PPARGC1B, FZD1, HEXIM2, CREBBP, ZNF263, ZNF140, H3F3A, PLK1, EIF2AK3, NFATC3, UPF3A, EIF2AK4, NR2F6, DHFR, QARS, PKIA, TNFSF4, PKIG, ZNF136, EZH2, CPEB4, CDKN1C, ZNF254, BTG2, CDKN1A, SMG1, TCF25, PHF1, ID2B, TFCP2L1, SMG5, ING4, MECP2, NIPBL, TRIM6, ANXA7, CIC, JARID2, HAVCR2, UPF2, ZNF485, UPF1, HELLS, HSBP1, SIRT4, SIRT7, SIRT1, SIRT2, AES, NCOR2, ZEB2, NCOR1, PTRH2, MTF2, RARA, PPARD, ZNF350, NFIX, GPS2, BCLAF1, NSD1, ZNF589, ZNF345, RPL19, YTHDF3, NR1H2, SAMD4A, SAMD4B, NR1H3, GATAD2A, CENPF, FABP4, ZNFX1, NFIA, NFIB, NFIC, FOSB, LGR4, LIMS1, ZNF451, CCNT1, NAB1, GMNN, UBE2D3, UBP1, ZBTB20, CASC3, PARK7, AHR, YY1, EIF4ENIF1, SALL2, SCMH1, ZNF564, TLE4, RPS9, MAP2K1, IGFBP5, RPS7, ZBTB32, SARS, RPSA, MITF, RNF40, OLFM1, MORF4L1, ILF3, MRTO4, ZNF318, HAT1, ADNP, KHDRBS1, MAGEL2, MAX, SHC1, BCL2L12, SCRT2, BAG3, TPR, ZKSCAN3, SMYD2, EIF4EBP3, WDTC1, ESRRA, ZNF540, DR1, WFS1, ZBTB16, LSM5, NFKB1, QKI, LSM3, NFKB2, CDK9, CNOT4, DRAP1, CNOT6, DAB2, CNOT7, CDK5, YEATS2, CNOT1, SP3, BCL3, CNOT3, CDK2, ZNF658, NFE2L3, MDM2, CNOT8, CIITA, PIWIL4, PTPN22, PTBP1, SIN3A, ZNF649, HIF1AN, YAF2, NKX3-1, CR1, PEG3, RFC1, DIS3, ATRX, PAPD4, NRG1, ZFP90, PTBP2, DUSP22, TFDP2, TRAF6, RPL37A, LCOR, ETF1, BIRC6, EIF4E2, GAPDH, BIRC2, BIRC3, HDAC3, HDAC1, PLAG1, SRC, NLRC4, CXXC5, LRP8, PPM1F, DNAJB1, RBBP4, IFI16, U2AF2, DNAJB5, CCDC85B, DNAJB4, TP53INP1, CCL3, E2F1, SAP18, POLR2G, RBBP7, IGF2BP2, E2F6, E2F7, E2F8, IRX1, RNF20, SEMA4D, CNBP, RPL23A, PNRC1, PNRC2, TNRC6C, KLF5, TNRC6A, TRIM33, TNRC6B, TCERG1, APP, GFI1, EIF4A3, PPP2R2A, IKZF1, IKZF2, IKZF4, RPS15, RPS6KA5, SAP130, MAGOH, DPF2, TRIM24, CPNE1, EPC1, SOX8, TRIM27, LGALS9, SOX6, SFMBT1, SLC35C2, SFMBT2, RUNX2, THAP1, RUNX1, SFRP1, SFRP2, XRN1, THAP7, TRIB3, NAIP, FOXG1, RTF1, ZBTB5, FXR1, FXR2, DHX34, PDCD10, HIVEP1, A2M, BBS2, XRCC6, XRCC5, BCL11A, PARP10, RPS27, DCP1A, RCOR3, RBAK, CC2D1B, DCP1B, HBS1L, SUV39H1, NKAP, OTUD7B, BRCA1, PTPRK, C1QBP, SUFU, UIMC1, MLX, HRAS, GABPA, BBS4, TSC22D4, HBZ, ZHX2, PRMT2, TSC22D3, PPHLN1, SREBF2, NME1, NFX1, CSDE1, DEPDC1, DCP2, FOXC1, SP100, SATB2, PRICKLE1, RELA, ARNTL, PPP2CA, MNT, RXRA, MSX1, EXOSC3, DCPS, EXOSC1, DMRT1, NFYC, SORBS3, PEX14, PER2, PER1, GFI1B, HIST3H2A, NEDD4, CTNNB1, ZNF354A, PRDM5, ARID4A, PRDM1, UBE2Z, NR3C1, PAIP2B, WWC3, EP300, HIST1H2AD, HIST1H2AG, HIST1H2AB, CAST, FBXW11, ERN1, BRMS1, ZNF93, TBL1XR1, PSPC1, CCNE1, TIMELESS, MYADM, PPID, DDX6, TCF7, PSEN1, SUPT6H, CCNB1, NLRP7, DEAF1, SUDS3, BPTF, TFAP2A, SMAD2, PRNP, CBX6, UBE2I, PNPT1, POU2F1, CBX5, CBX4, CBX3, NONO, CAV1, PHF12, NFXL1, CNOT10, HELZ, EIF2S1, BMP6, DNAJC17, SMAD7, NR4A2, TDRD1, BMP2, DAP, PAN3, CAPRIN1, SKIV2L, PHF19, PICALM, USP36, THRB, THRA, YWHAB, CHD8, LDB2, FLCN, HIST1H1D, LRRFIP1, DACT1, KLF10, KLF11, KLF12, MKKS, H2AFY, NCBP1, EED, H2AFZ, ARID1A, ETV7, SFPQ, RBL1, THRAP3, EAPP, ZP3, MCPH1, ACVR1B, THBS1, MXI1, MTA2, MTA3, ZNF189, TCFL5, SNCA, SPEN, ATF7IP, TCF7L2, TAF7]
GO:0010508;positive regulation of autophagy;7.0;0.7192862368539868;0.710562483684194;9.040737587590003;216.89043707272492;5.132682728539097;0.007259127740103463;0.6134049986888465;[BECN1, LRSAM1, CALCOCO2, CLEC16A, PARK7, HIF1A, MTDH, FLCN, FYCO1, STK11, DHRSX, TP53INP2, TP53INP1, ZC3H12A, KIAA1324, MFN2, PIM2, TRIM65, TRIM21, UVRAG, BNIP3L, DAPK1, BAD, RIPK2, ATPIF1, TSC2, EIF2AK4, SIRT1, MID2, RAB3GAP2, ULK1, RAB3GAP1, C9orf72]
GO:0043161;proteasome-mediated ubiquitin-dependent protein catabolic process;9.0;0.7586651285174919;0.775573189439035;9.310070521373587;348.3589749790861;4.015022244900292;0.01165926138982685;0.6015690495021188;[CCNF, UBE2D3, BUB1B, UBE3A, PSMD8, PSMD7, PSMD4, PSMD2, CDC26, PSMD1, TRIM25, SKP2, C18orf25, FBXW4, RNF44, FBXO18, FBXW11, FBXW7, UBE2E1, UBE4A, KCTD2, YOD1, ARMC8, KCTD5, KCTD10, TBL1XR1, PLAA, ANAPC5, RBCK1, RNF121, KLHL15, UBR1, UBE2J2, ANAPC11, HSP90B1, ATXN3, CCNB1, COP1, C2orf40, BTBD3, BTBD2, UBE2I, UBE2B, WFS1, EDEM1, SIAH2, PLK1, ERLIN2, BTBD6, MARCH6, ABTB2, NSFL1C, ABTB1, RNF103, NPLOC4, CDC16, MDM2, RNF181, FBXL3, FBXL4, CCDC47, KIF14, ARRB1, ARRB2, TNFAIP1, TRIM9, SEC13, RAD23A, PPP2R5C, SIRT1, RAD23B, SIRT2, DDB1, PSMA6, PSMA4, PSMA1, UBE2R2, MAN1B1, BIRC2, RNF165, RNF34, DERL3, RNF38, DERL2, RNF6, RNF7, PSMB10, PSMA7, ARNTL, PCNP, PSMB6, AMN1, PPP2CB, FZR1, ZNRF2, PSMB4, PSMB5, RMND5A, PSMB1, UBQLN1, RFFL, LRRC29, AMFR, FBXL19, SYVN1, FBXL15, UBE2G1, FBXL16, FBXL13, PSMB9, KBTBD4, RNF145, ITCH, SPSB1, PSMC6, PSMC1, NEDD4, ERCC8, TRIM38, MAD2L1]
GO:0030218;erythrocyte differentiation;5.0;0.8436909121759173;0.712086467948879;9.117698628726131;22.675663695230284;5.885253329569843;7.589340571069517E-4;0.5912131408273906;[ALAS2, DYRK3, THRA, ATPIF1, CEBPG, ADAR, IKZF1, GATA3, ADD1, KLF1, SLC25A38, CASP3, SP3, KIT, FLVCR1, ACIN1, PKNOX1, JAK3, TRIM10, NFE2L1]
GO:0007219;Notch signaling pathway;6.0;0.7763722522362496;0.7113064387082693;8.866384200445225;26.50247477320489;4.99795013456894;8.87013979980389E-4;0.5787157149004503;[SPEN, GALNT11, APP, CREBBP, FOXC1, JAG1, MAML1, NOTCH2NL, PSEN2, NKAP, ADAM10, DTX2, PSEN1, RBPJ, MIB1, ITCH, BMP2, MDK, PERP, MYC, IL2RA, EP300, HES4]
GO:0010628;positive regulation of gene expression;6.0;0.4705935272257725;0.5584170762030307;6.666693530613812;58.797024432214236;2.2471302570788807;0.001967883493859682;0.43803865843940215;[ATF2, ZNF175, PID1, MAML1, ZNF292, GPATCH3, RBPJ, ELK1, MYC, ZXDC, ZC3H12A, VPS35, PKNOX1, IER5, IER2, CDK5RAP3, HOXA5, DDX17, MEF2B, SECISBP2, RFX3, PRKAB1, MED6, RFX4, HOXB4, PRKD2, ATF4, SHOX2, NOLC1, GATA3, ZNF24, HIF1A, C3, PLAC8, PPP3R1, HSPH1, RAD21, HOXC4, PPARGC1B, FZD1, ZNF143, CREBBP, WNT10A, AFAP1L2, JAG1, JUP, FZD5, PBX3, EIF2AK3, NFATC3, UPF3A, NFATC1, ERLIN2, EIF2AK4, AZU1, PRDX6, FLI1, SETX, MLLT11, MLLT10, TNFSF8, CDKN1C, ARF4, MYOM1, GMEB1, SETD3, ELL, TGFB1I1, PHF1, PRKAG1, HOXC13, MED16, WDR43, HOXC10, MED12, MECP2, NIPBL, ING2, TRIM6, SPIN1, TEAD2, ZNF485, RIPK2, SERPINB9, SIRT7, TMEM173, SIRT1, SIRT2, GNL3, NCOR2, ZEB2, NCOR1, MTF1, MTF2, RARA, PPARD, SF3B4, CDC123, ZNF350, NFIX, GPS2, EGFR, BCLAF1, NSD1, STAT4, PLAGL2, SF3B1, ZNF345, ZNF462, CDKN2B, GSN, YTHDF3, BRF1, MCRS1, NR1H2, ATAD2, SAMD4A, NR1H3, PSMC6, NFIA, NFIB, NFIC, PSMC1, PLP1, FOSB, AGRN, MIXL1, LGR4, LIMS1, CCNT2, NCF1, CCNT1, RORA, YEATS4, PARK7, AHR, YY1, SALL2, LAMP3, STK16, NFATC2IP, PIM2, HMGN3, ZNF564, MAP3K5, RPS9, MAP2K1, RPS7, F2R, MITF, GTF2F2, PIAS2, ARMCX3, OLFM1, ILF3, ZNF318, KHDRBS1, ENY2, MAX, SHC1, INSIG1, CREBL2, RLF, BCL2L12, MED30, UBR5, ZKSCAN3, DVL3, NDN, ESRRA, ZBTB17, DR1, ZBTB16, RFXANK, NFKB1, QKI, AICDA, NFKB2, CDK9, DRAP1, BCL9, CDK8, CXCL10, DAB2, CDK7, TFCP2, COPS5, CNOT7, SP1, MAFG, SP3, MAFF, BCL3, CDK2, NFE2L3, MDM2, RLN2, MNAT1, NFE2L1, CIITA, BMPR2, ONECUT2, PTEN, PTPN22, ARRB1, ARRB2, LBH, SIN3A, MDK, ZNF649, YAF2, NKX3-1, EIF5A, PPP1R12A, PEG3, DTX3L, RFC1, ITGA2, ATRX, ARNT, NRG1, ZFP90, TFDP1, TFDP2, POLR1B, TRAF6, ZNF516, POLR1E, MET, PPP1R15A, GTF2A2, HDAC3, HDAC1, WBP2, ROCK2, CEBPE, PLAG1, SRC, CEBPG, MLLT3, PPM1F, CLEC3B, ABLIM3, IFI16, U2AF2, TP53INP2, CCL5, TP53INP1, P2RY1, POLR2E, CCL3, E2F1, POLR2G, PCBD1, E2F7, POLR2K, E2F8, TBX1, RNF20, CNBP, FOXJ2, CDC5L, KLF1, P2RX7, KLF6, KLF5, ASXL2, APP, CCNK, CCNH, GFI1, EIF4A3, IKZF1, IKZF2, IKZF3, IKZF4, RPS6KA4, RPS6KA5, DPF2, TRIM24, HABP4, EPC1, SOX8, LGALS9, SOX6, ATXN7L3, FLT3LG, ANK3, RUNX2, RUNX1, SFRP1, SFRP2, KARS, IL23A, PAXIP1, RTF1, FXR1, FXR2, DHX34, PDCD10, HLTF, SCAP, ZBED1, BANP, SRPK2, XBP1, XRCC6, EGR2, EAF2, MICAL2, TRERF1, STAG1, CD40, BRCA1, AATF, PPP3CB, SERP1, C1QBP, HYAL2, SH3PXD2B, MLX, TMED2, CTSH, KIF1B, HRAS, GABPA, IL10, SEC13, PRMT2, NCOA6, PPRC1, SUPT3H, SREBF2, GAL, TFEC, KIT, MAPRE3, NCOA7, FOXC1, SP100, SATB2, HEATR1, RELA, ARNTL, SERTAD3, RXRA, SERTAD2, LMNA, GPBP1L1, MSX1, CD74, NFYA, DMRT1, NFYC, GRHL1, BATF, PER1, TTC5, CAMK4, MARS, CTNNB1, F2RL1, CAMK1, RAB3GAP1, CD86, CRTC2, CD80, FHOD1, ARID4A, UBE3A, PRDM1, NR3C1, EP300, SLC30A9, FBXW11, LMO2, ERN1, PRPF6, TBL1XR1, CCNE1, PSEN1, SUPT6H, CCNB1, DEAF1, NLRP3, CAMTA1, TASP1, RIPK1, CYTL1, BPTF, TFAP2A, SMAD2, POU2F1, RHBDD1, CAV1, MSN, BMP6, SMAD7, NFKBIA, NR4A2, AHI1, IL6, BMP2, IL7R, PHF19, PICALM, EDA, THRB, THRA, CHD8, CHD7, ADAR, DDX41, LDB2, PKD2, CKS1B, RBM3, FLCN, NUP62, ARHGEF11, MKL2, KLF10, NAT8B, TBP, KLF13, RBM15, H2AFY, NCBP1, H2AFZ, MKL1, SENP2, SAFB, ARID1A, TGFBR1, DNM2, ACTA2, CREB3, SFPQ, RBL1, PSRC1, ELF4, IRF4, THRAP3, MYH9, EAPP, ZP3, POLDIP3, RNF6, TAF1L, ACVR1B, THBS1, MAPK7, TAF1A, PTK2B, MTA2, ATF7IP, RBM38, TCF7L2, CHURC1, TAF15, EGF, DTNBP1, ARID3B, DEK, USF2, POMC, CD4, MEIS1, TNIP1, TNIP2, TNIP3, RPS6KB2, TAF7, KRAS, FAM98A, TAF4, SSBP3]
GO:0010506;regulation of autophagy;6.0;0.6260725219892441;0.6361565735847665;8.273978589686811;43.35793677134884;4.08334148887777;0.001451151124127319;0.5319425862261522;[USP36, LRSAM1, CALCOCO2, WDR41, PTPN22, PARK7, ADRA1A, FLCN, FYCO1, STK11, HERC1, CASP3, LAMP3, ZC3H12A, LEPR, CASP1, EP300, VPS35, CAPN1, PIM2, USP30, TRIM65, TRIM21, RAB8A, BNIP3L, DAPK1, FBXW7, RIPK2, VPS13C, DAPK2, ATPIF1, TSC2, SIRT1, SIRT2, MID2, SREBF2, ERN1, CTTN, FEZ1, FEZ2, EXOC4, CHMP4B, ULK2, ULK1, DEPDC5, MET, GAPDH, EXOC1, C9orf72, USP13, BECN1, RAB1B, CLEC16A, VPS26A, VPS26B, HIF1A, RASIP1, MTDH, MTM1, SCFD1, DHRSX, IFI16, TP53INP2, TP53INP1, KIAA1324, ATP6V0A2, ABL1, ZKSCAN3, MFN2, ATP6V1H, ZKSCAN4, ATP6V0E2, ATP6V1C1, SNCA, MCL1, CTSA, UVRAG, XBP1, FZD5, BAD, EIF2AK4, TPCN2, DAP, CDK5, RHEB, NEDD4, RAB3GAP2, ATP13A2, EIF4G2, RAB3GAP1]
GO:0030330;DNA damage response, signal transduction by p53 class mediator;7.0;0.8933024483968273;0.7975705894556142;9.4949928598676;85.94894796857642;5.407625775213448;0.0028766339394770053;0.627465598881932;[BTG2, CDKN1A, SP100, PCNA, PAXIP1, BRCA1, ING4, CCNB1, E2F1, CASP2, EP300, NBN, GTSE1, E2F7, E2F8, ATRX, CNOT10, CDC25C, BATF, CNOT4, CNOT6, TFDP1, CNOT7, TFDP2, CNOT1, BCL3, CNOT3, CDK2, MDM2, BAX, CNOT8]
GO:0034138;toll-like receptor 3 signaling pathway;12.0;1.0;0.9481203125901445;9.628524252492122;412.6549923027037;7.474488534686424;0.013811191226989502;0.8303660038532719;[COLEC12, CASP8, TNIP2, UNC93B1, RIPK1, HAVCR2]
GO:0010745;negative regulation of macrophage derived foam cell differentiation;6.0;1.0;0.8231203125901445;9.628524252492122;114.21841186311113;7.212124270218933;0.0038227874551613377;0.6919486831672181;[NFKBIA, ABCA1, CETP, ITGB3, NR1H2, NR1H3, ITGAV]
GO:2000562;negative regulation of CD4-positive, alpha-beta T cell proliferation;11.0;1.0;0.9324289523296623;9.628524252492122;1433.7336516231012;8.390779266560578;0.04798577504331058;0.8615337942327104;[TWSG1, LGALS9]
GO:0031664;regulation of lipopolysaccharide-mediated signaling pathway;6.0;0.8653626801206646;0.7558016526504768;9.461470167828956;82.5062356598439;6.599019797332524;0.002761409456743651;0.6605944919115335;[TRIM5, TRAF6, TNFAIP3, PRKCA, PRDM1, LILRA2, SASH1, BMP6, LTF]
GO:0032753;positive regulation of interleukin-4 production;6.0;0.9326813400603323;0.7894609826203107;9.523163736834295;64.94897299966192;6.686031174322154;0.0021737836760178982;0.665044257777226;[CD86, IRF4, TNFSF4, RARA, NLRP3, GATA3, LGALS9, ZP3, HAVCR2]
GO:2000563;positive regulation of CD4-positive, alpha-beta T cell proliferation;11.0;1.0;0.9324289523296623;9.628524252492122;1383.791516303458;8.390779266560578;0.04631425671916583;0.8615337942327104;[LGALS9]
GO:0001919;regulation of receptor recycling;5.0;0.8933024483968273;0.736892236059334;9.405380701177911;51.11450039726385;6.641579411751319;0.0017107563282326406;0.6298916918429109;[ANXA2, PCSK9, PSEN1, SNCA, CHMP5]
GO:0030336;negative regulation of cell migration;7.0;0.5846489169746516;0.6432438237445264;8.20713857156096;158.04059951544355;4.3090134865453384;0.00528947663847651;0.5712825153487487;[CLIC4, MCTP1, PTEN, MIA3, WASL, PTPRK, MECP2, FLCN, SPRED1, ADORA3, HYAL2, ARHGDIB, DAG1, TIMP1, IGFBP5, SERPINF1, IGFBP3, NRG1, VASH1, RHOB, BCR, NISCH, SFRP1, SFRP2, ADAM15, NOV, EPHA1, PHLDB2, VCL, PFN2, PPARD, PTGER4, SP100, LRP1, ABHD6, THBS1, PBLD, ABR, RRAS, TBXA2R, PDCD10, TP53INP1, CCL2, SRGAP2, SRGAP1, CLASP1, RNF20, STARD13, JAG1, JUP, IDH2, SMAD7, BST2, STK24, DLC1, DLG5, NF1, CCL28]
GO:0071639;positive regulation of monocyte chemotactic protein-1 production;7.0;1.0;0.8509193652572005;9.628524252492122;88.62106486279957;7.474488534686424;0.0029660672871775788;0.7331650565203278;[LGALS9, AGER]
GO:0033280;response to vitamin D;7.0;0.9326813400603323;0.8172600352873667;9.548481544818586;74.55580141320215;6.375876246018314;0.002495315577434836;0.6769819729871445;[CDKN2D, CXCL10, CD4, SFRP1, IL15, ABCB4, TRIM25, PTGS2, AQP3, GDAP1, TPCN2]
GO:0009615;response to virus;5.0;0.7436939687323844;0.6620879962271125;8.801845679307654;27.267803904038782;4.174954806800768;9.126288572378991E-4;0.503748394835965;[IFITM3, RTP4, SPON2, ZNF175, CD40, CXCL9, FCN3, ADAR, DDX41, IFIT1, LYST, IFIT3, IFI44L, OASL, HERC5, TRIM6, TRIM5, HYAL2, CFL1, STMN1, ZC3H12A, AP1S1, TRIM25, IL12A, BANF1, PIM2, LGALS9, LGALS8, IKBKE, IFNAR2, DDX17, BNIP3L, DTX3L, RSAD2, TMEM173, UNC13D, ACTA2, ILF3, SLFN11, OAS1, IL23A, OAS2, OAS3, DDIT4, TLR8, TLR7, XPR1, EXOC1, TRIM56, BECN1, SRC, UNC93B1, ZC3HAV1, GATA3, SAMHD1, RELA, IFI16, CCL5, NLRP3, CCL19, IVNS1ABP, APOBEC3F, APOBEC3H, BAD, MX2, MX1, IFI44, ISG15, EIF2AK4, AZU1, AICDA, ISG20, BST2, CXCL10, ITCH, IL6, CDK6, CNOT7, GPAM, POLR3B, POLR3C, TNFSF4, BCL3, POLR3E, POLR3F, F2RL1, SERINC3, CCDC130, LSM14A, APOBEC3A, BCL2L1]
GO:0006469;negative regulation of protein kinase activity;10.0;0.6835726970475526;0.7570273603846966;9.223059144383958;1097.0598301796;4.243684138952949;0.03671760522636433;0.6322632160784685;[CDKN1C, ERRFI1, CDKN1A, GMFB, PTEN, TESK1, PRKAG2, TNFAIP3, CIB1, PTPN22, ADAR, PARK7, IPO7, DUSP14, IGF1R, PREX1, SPRED1, RGS2, CASP3, HYAL2, SMPD1, NUP62, TRIM27, CDK5RAP3, DUSP4, DUSP5, DUSP2, H2AFY, PAQR3, PRKCD, TSC2, GP1BA, SIRT1, MAPK8IP1, DUSP22, SFRP1, SFRP2, LATS2, ADORA2A, TRIB3, EPHA1, CHMP6, VPS25, GPS1, GPS2, MLLT1, PSEN1, PPM1F, PPP2CA, SOCS2, MAPK7, STK38, ABL1, SH3BP5, PAK2, SOCS4, SOCS5, CDKN2D, HEXIM2, CDKN2B, CDKN2C, GADD45B, CAV1, PLK1, DTNBP1, CDK6, SH3BP5L, FABP4, QARS, GNAQ, PKIA, PPP1R1C, NF1, TAF7, FGFR1OP, CRIPAK, SPRY1, PTPN6, PKIG]
GO:0000122;negative regulation of transcription by RNA polymerase II;11.0;0.6073376606709605;0.7360977826651425;8.793202583151634;1836.9481969605868;3.0544438328250214;0.0614810030062249;0.5886333519864981;[TCERG1, ATF2, ZNF175, ZNF174, GFI1, IKZF2, RBPJ, MYC, SAP130, EPC1, SOX8, TRIM27, SOX6, DICER1, HCFC2, THAP1, RUNX1, EID1, HOXB4, TRIB3, CTBP1, FOXG1, MEPCE, SHOX2, RTF1, GATA3, ZBTB5, MTDH, HIVEP1, HESX1, ZBTB7A, HEXIM2, CREBBP, ZNF263, ZNF140, BCL11A, PLK1, NFATC3, NR2F6, PKIA, RCOR3, PKIG, ZNF136, EZH2, CC2D1B, ZNF254, BTG2, TCF25, SUV39H1, NKAP, OTUD7B, TFCP2L1, MECP2, NIPBL, C1QBP, SUFU, MLX, CIC, JARID2, GABPA, HBZ, ZHX2, HSBP1, TSC22D3, SIRT7, SIRT1, SIRT2, SREBF2, AES, NCOR2, ZEB2, NCOR1, NFX1, MTF2, RARA, PPARD, FOXC1, SP100, ZNF350, NFIX, SATB2, GPS2, RELA, MNT, RXRA, NSD1, MSX1, ZNF589, ZNF345, DMRT1, NR1H2, NR1H3, SORBS3, GATAD2A, PER2, PER1, GFI1B, NFIA, NFIB, NFIC, NEDD4, FOSB, CTNNB1, ZNF354A, ZNF451, UBE2D3, PRDM5, ZBTB20, PRDM1, NR3C1, YY1, SALL2, WWC3, EP300, ZNF564, TLE4, ZBTB32, SARS, MITF, BRMS1, TBL1XR1, CCNE1, TIMELESS, PPID, MAX, TCF7, PSEN1, SCRT2, BAG3, DEAF1, TPR, ZKSCAN3, SMYD2, SUDS3, BPTF, WDTC1, TFAP2A, ESRRA, SMAD2, DR1, CBX6, UBE2I, CBX5, CBX4, WFS1, CAV1, ZBTB16, PHF12, NFXL1, NFKB1, BMP6, DNAJC17, SMAD7, NFKB2, NR4A2, DRAP1, BMP2, CNOT7, YEATS2, CNOT1, SP3, CDK2, NFE2L3, MDM2, CIITA, THRB, THRA, CHD8, LDB2, FLCN, SIN3A, ZNF649, HIST1H1D, LRRFIP1, HIF1AN, DACT1, KLF10, KLF11, KLF12, PEG3, RFC1, H2AFY, EED, ATRX, ARID1A, ZFP90, DUSP22, ETV7, SFPQ, RBL1, TRAF6, LCOR, EAPP, MCPH1, HDAC3, HDAC1, CXXC5, LRP8, DNAJB1, IFI16, DNAJB5, DNAJB4, MXI1, E2F1, RBBP7, MTA2, E2F6, MTA3, E2F7, ZNF189, E2F8, TCFL5, SNCA, IRX1, SPEN, ATF7IP, TCF7L2, SEMA4D, CNBP, KLF5, TAF7, TRIM33]
GO:0030449;regulation of complement activation;8.0;0.6873818243518346;0.7186909121759173;9.298282565621545;245.7676390307622;5.076593261888053;0.008225621701844479;0.6346172154986847;[C1QA, CR2, CR1, CFH, PROS1, CFI, C2, C3, C1QBP, SUSD4, SERPING1, A2M, CFB, C1QC]
GO:0032508;DNA duplex unwinding;7.0;0.7980440201809971;0.7499413753476991;9.223059144383958;23.726073882073138;5.734022359845919;7.940903407527885E-4;0.64415753539903;[XRCC6, ANXA1, FBXO18, MCM7, XRCC5, CHD8, GINS4, ATRX, CHD1, GTF2H4, SETX, WRN, RAD50, RAD51, POT1, ASCC3, MCM6, NBN, MCM2]
GO:0010951;negative regulation of endopeptidase activity;10.0;0.7671156992804218;0.7987988615011312;9.446202695698167;500.3238742612354;4.2676852910524925;0.016745389809270216;0.6334906361130068;[SERPINA3, APP, TNFRSF6B, ARL6IP1, SERPINE2, PROS1, SERPINA10, WFDC1, ARRB1, PARK7, ARRB2, UBE2Z, AQP1, LAMP3, TIMP2, TIMP1, CAST, SERPINB1, CR1, CSNK2A1, SPINK8, SERPINF1, PLAUR, SERPINB9, SERPINB6, SFRP2, ADORA2A, SERPING1, BIRC6, GAPDH, NAIP, CD44, BIRC2, BIRC3, LTF, CRB2, CSTB, ITIH4, CSTA, ITIH2, RNF34, LXN, SRC, IFI6, NLRC4, TFPI, PTGS2, THBS1, C3, BCL2L12, PRDX5, IFI16, NLRP7, RFFL, A2M, PAK2, SNCA, CDKN2D, AMBP, TNFSF14, SIAH2, TNFRSF10B, TNFRSF10A, DHCR24, VIL1, BST2, COL7A1, MDM2, PICALM]
GO:0051902;negative regulation of mitochondrial depolarization;8.0;1.0;0.875;9.628524252492122;107.5075323722012;7.8311634786251565;0.003598180358000013;0.7754860644832351;[HSH2D, SRC, IFI6]
GO:0070306;lens fiber cell differentiation;5.0;1.0;0.7902410118609202;9.628524252492122;24.20171999872632;7.212124270218933;8.100097882234571E-4;0.659069382437994;[FZR1, TDRD7]
GO:0071636;positive regulation of transforming growth factor beta production;6.0;0.7980440201809971;0.722142322680643;9.34084218004034;65.64212018022187;6.943860283624253;0.0021969826883592772;0.6782296504172152;[ATF2, ATP6AP2, LGALS9, PTGS2, THBS1]
GO:0006351;transcription, DNA-templated;9.0;0.5708408884191841;0.6816610693898811;8.449869256150476;581.393741231429;1.9872050686257638;0.019458725298619164;0.49786638480429696;[ATF2, ZNF175, ZNF174, ZNF292, GPATCH3, ELK1, MYC, ZXDC, ZC3H12A, PKNOX1, IER5, NFRKB, IER2, HOXA5, DDX17, ZNF18, SAP30BP, MEF2B, CSNK2A1, ZNF282, DNTTIP2, RFX3, RFX1, ZNF12, ZNF14, SND1, EID1, EWSR1, RFX4, HOXB4, VPS25, ASF1B, SF1, ATF4, ZSCAN29, ZNF276, ZNF395, ZNF274, ZNF394, CTBP1, ZNF20, CDCA7, PRDM15, BAZ2A, ZNF23, GATA3, ZNF24, ZNF25, HIF1A, RAD21, HESX1, ALX3, HOXC4, GTF2IRD2B, ZBTB7A, PPARGC1B, ZNF264, ZNF143, HEXIM2, ZNF263, ZNF383, HACE1, ZNF140, ZNF260, PBX3, NFATC3, IRF2BP1, IRF2BP2, NFATC1, ZNF35, FLI1, SOX30, MLLT10, ZNF30, ZNF136, EZH2, ZNF134, PHF3, ZNF254, SETD5, BTG2, GMEB1, SETD3, ELL, ZNF250, TCF25, TGFB1I1, PHF1, ATF7IP2, HOXC13, TFCP2L1, MED16, WDR43, HOXC10, MECP2, NIPBL, CHAF1B, ING2, SPIN1, CIC, JARID2, LIN52, ZNF486, ZNF485, BRD3, HELLS, BATF2, BAZ1A, SIRT7, SIRT1, MED29, SIRT2, MED28, AES, NCOR2, ZEB2, NCOR1, MTF1, MED20, ZNF358, ZNF234, PPARD, ZNF230, ZNF350, NFIX, GPS2, SPTY2D1, ZNF69, BCLAF1, NSD1, STAT4, PLAGL2, ZNF347, ZNF226, ZNF345, DEDD, ZNF223, ZNF101, ZNF222, ZNF343, ZNF462, ZNF341, ZNF583, ZNF581, BRF1, MCRS1, ATAD2, SAMD4B, ZNF77, GTF2H2, ZNF79, GTF2H4, GATAD2A, ZNF33A, TTLL5, NFIA, NFIB, NFIC, FOSB, PKN2, ZNF699, ZNF213, ZNF696, MIXL1, ZNF212, ZNF331, ZNF451, CCNT2, CCNT1, ZBTB25, NAB1, UBP1, ZBTB20, YEATS4, ZBTB22, AHR, BZW1, YY1, SALL2, STK16, SCMH1, ZNF326, ZNF688, MAP3K9, ZFP37, ZNF564, GTF2I, ZNF200, ZNF442, TLE4, ZNF441, ZNF562, ZNF561, ZNF680, ZBTB32, SARS, MITF, GTF2F2, PIAS2, MORF4L1, ILF3, MAK, ZNF318, ZNF557, ADNP, ZNF554, ZNF550, KHDRBS1, MAGEL2, ENY2, KHDRBS3, MAX, CREBL2, RLF, FHIT, GTF2E1, GTF2E2, ATXN3, SCRT2, ZNF429, ZNF549, ZNF548, ZKSCAN3, SMYD2, NDN, ZKSCAN5, ZKSCAN4, ZNF544, ZNF302, ZNF786, ZNF543, ZNF785, ZKSCAN1, TRAPPC2, ZNF540, ZBTB17, DR1, ZNF658B, ZBTB16, RFXANK, NFKB1, NFKB2, CDK9, DRAP1, CNOT6, IRAK1BP1, CDK7, TFCP2, COPS5, CNOT7, CNOT1, SP1, SP4, MAFG, SP3, MAFF, BCL3, CNOT3, ZFP64, ZNF658, NFE2L3, PIR, ZNF416, ZNF415, ZNF777, ZNF655, CNOT8, TMEM18, MNAT1, ZNF654, ZNF532, ZNF410, NFE2L1, ZNF652, CIITA, BMPR2, ONECUT2, CDCA7L, ARRB1, ARRB2, LBH, SIN3A, ZNF407, ZNF649, DMRTB1, ZNF768, ZNF525, ZNF524, ZNF766, HIF1AN, ZNF644, YAF2, NKX3-1, ZNF761, RFC1, ATRX, ARNT, ZFP90, TFDP1, ZNF519, TFDP2, POLR1B, ZNF638, ZNF516, LCOR, ZNF511, ZNF630, FOXD4L1, BIRC2, GTF3C1, GTF2A1, SMARCD2, GTF2A2, HDAC3, HDAC1, WBP2, CEBPE, PLAG1, CEBPG, ZBTB43, MLLT1, CXXC5, MLLT3, ZBTB40, ABLIM3, RBBP4, IFI16, POLR2B, RBBP5, CCDC85B, TP53INP2, TP53INP1, POLR2E, E2F1, SAP18, POLR2G, PCBD1, ZNF502, ASCC3, RBBP7, POLR2I, E2F6, E2F7, POLR2K, E2F8, TBX1, POLR2J3, ASCC1, CNBP, FOXJ2, CDC5L, PNRC1, PNRC2, KLF1, KLF6, KLF5, POLR3B, POLR3C, POLR3E, ASXL2, POLR3F, MNDA, ZNF611, TRIM33, TCERG1, CCNK, CCNH, GFI1, JMJD1C, IKZF1, IKZF2, IKZF3, IKZF4, UBE2L3, SAP130, DPF2, TRIM24, CPNE1, HABP4, EPC1, SOX8, EPC2, TRIM27, ZNF600, SOX6, ATXN7L3, ZFP1, SP110, SFMBT1, PTOV1, THAP1, RUNX1, THAP7, BTK, TRIB3, BCORL1, PAXIP1, FOXG1, MYCBP2, RTF1, RPAP1, ZBTB5, ZBTB3, COMMD8, COMMD9, HLTF, HIVEP1, ZBED1, ZNF701, HIVEP2, BANP, XBP1, XRCC6, EGR2, SETDB1, XRCC5, BCL11A, INTS3, EAF2, NMI, TRERF1, STAG1, DMRTC1, ZNF813, INTS4, INTS7, INTS6, RCOR3, RBAK, INTS8, CC2D1B, INTS12, HIP1, SUV39H1, INTS10, NKAP, BRCA1, WASL, TFB1M, ZMYM2, SCML1, SCML4, C1QBP, HYAL2, ZMYM5, UIMC1, MLX, GABPA, ACAD8, TSC22D4, ZHX2, TSC22D1, COMMD2, COMMD3, COMMD1, PPHLN1, PPRC1, ZFX, SUPT3H, SREBF2, NFX1, TFEC, DEPDC1, NCOA7, VGLL4, FOXC1, SP100, MYCBP, SATB2, HEATR1, ZNF2, ZNF3, RELA, ARNTL, SERTAD3, MNT, SERTAD2, TCEAL3, GPBP1L1, MSX1, ZNF585A, NFYA, DMRT1, NFYC, GRHL1, BATF, PER2, PER1, GFI1B, MARS, CTNNB1, ZNF354A, CRTC2, PRDM5, ARID4A, PRDM1, NR3C1, EP300, SLC30A9, LMO2, ERN1, SPOCD1, BRMS1, ZNF93, TBL1XR1, PSPC1, TIMELESS, TCF7, SUPT6H, TAF5L, DEAF1, NLRP3, CAMTA1, SUDS3, BPTF, TFAP2A, IVNS1ABP, SMAD2, CBX6, POU2F1, CBX4, CBX3, NONO, PHF12, PHF11, NFXL1, CNOT10, DNAJC17, SMAD7, NR4A2, BRWD1, ZSCAN2, PHF19, NFKBIB, PHTF2, THRB, THRA, CHD9, CHD8, CHD7, HMGB3, CHD1, AFF4, SNAPC5, NUP62, NFKBIZ, LRRFIP1, IFT57, SCYL1, MKL2, KLF10, KLF11, KLF12, TBP, KLF13, NCBP1, EED, BUD31, MKL1, DDX54, SAFB, ARID1A, ETV7, CREB3, SFPQ, RBL1, ELF4, IRF4, ITGB3BP, LTF, TAF1L, TFPT, FAM120B, TAF1A, MXI1, ZNF189, TCFL5, ZNF286A, HES4, SPEN, ATF7IP, TCF7L2, CHURC1, TAF15, TAF12, EYA2, TAF13, ZNF180, ARID3B, DEK, USF2, MAPK13, MEIS1, TNIP2, TBX10, TAF7, TAF5, TAF4, SSBP3]
GO:0050709;negative regulation of protein secretion;8.0;0.6493065804076676;0.6996532902038338;8.749274792298316;381.9718045319581;5.058574756385375;0.01278425254537885;0.6336957482893315;[PTGER4, ENY2, PPP1R11, PTPN22, RAB11FIP1, NLRP7, TMSB4X, ZC3H12A, NLRP3, PIM3, TRIM27, RAB11FIP5, IL10, JAGN1, ANXA1, ANGPT1, RSAD2, TNFRSF9, RHBDF2, IDH2, F2R, SIRT4, NR1H3, SYTL4, NLRP12, SFRP1, NOV, TLR8, F2RL1, GHRL, FCGR2B, LGR4]
GO:0044387;negative regulation of protein kinase activity by regulation of protein phosphorylation;11.0;1.0;0.9324289523296623;9.628524252492122;1099.13927172128;7.697632086000634;0.03678720226338847;0.8260862151842345;[ADAR, CDK5RAP3, PPM1F]
GO:0007565;female pregnancy;3.0;1.0;0.6981203125901445;9.628524252492122;32.8060485501291;5.299736813202263;0.0010979889214459554;0.4691490996802742;[CLIC5, OXTR, SLC2A1, TFCP2L1, COMT, ADIPOR2, CRHR1, THBD, NPPA, LGALS9, SLC38A2, ABCC2, AMBP, IGFBP5, SPHK2, ITGA2, CAD, IGFBP2, LNPEP, ADRA2C, BYSL, PNOC, RARA, RLN2, FOSB, KRAS, MAGED2, UPRT]
