id	name	nbGenes	ICSeco	ICZhou	ICSanchez	ICMazandu
GO:0050789	regulation of biological process	1748	0.09	0.17	1.80	4.47
GO:0050794	regulation of cellular process	1665	0.12	0.26	2.47	7.96
GO:0044237	cellular metabolic process	1515	0.16	0.21	2.71	13.80
GO:0031323	regulation of cellular metabolic process	1054	0.22	0.36	4.01	22.77
GO:0016043	cellular component organization	779	0.28	0.26	3.74	11.45
GO:0019538	protein metabolic process	701	0.31	0.41	4.91	44.77
GO:0051252	regulation of RNA metabolic process	668	0.37	0.51	6.06	70.58
GO:0010557	positive regulation of macromolecule biosynthetic process	316	0.45	0.55	6.62	113.59
GO:0016070	RNA metabolic process	593	0.39	0.52	6.45	112.25
GO:0006259	DNA metabolic process	163	0.45	0.55	7.12	145.26
GO:0006378	mRNA polyadenylation	9	0.93	0.88	9.58	472.44
GO:0007165	signal transduction	688	0.36	0.43	5.06	19.43
GO:0048583	regulation of response to stimulus	687	0.25	0.32	3.72	7.96
GO:0044267	cellular protein metabolic process	607	0.34	0.46	5.57	80.87
GO:0009966	regulation of signal transduction	503	0.33	0.45	5.35	37.59
GO:0031324	negative regulation of cellular metabolic process	430	0.34	0.46	5.46	80.35
GO:0006996	organelle organization	392	0.39	0.39	5.17	14.95
GO:0048869	cellular developmental process	357	0.32	0.29	4.16	13.85
GO:0010628	positive regulation of gene expression	335	0.47	0.56	6.67	58.80
GO:0046907	intracellular transport	335	0.46	0.48	6.38	29.65
GO:0033554	cellular response to stress	319	0.44	0.42	6.05	25.47
GO:0051049	regulation of transport	309	0.31	0.40	4.67	10.45
GO:1901575	organic substance catabolic process	305	0.30	0.35	4.26	18.93
GO:0065003	protein-containing complex assembly	290	0.45	0.48	6.06	36.47
GO:0000390	spliceosomal complex disassembly	2	1.00	0.82	9.63	58.05
GO:0015031	protein transport	284	0.48	0.59	6.99	54.46
GO:0001932	regulation of protein phosphorylation	251	0.50	0.62	7.64	109.03
GO:0071310	cellular response to organic substance	238	0.44	0.47	5.95	41.66
GO:0009057	macromolecule catabolic process	202	0.48	0.49	6.53	35.57
GO:0009968	negative regulation of signal transduction	202	0.44	0.54	6.68	140.65
GO:0019637	organophosphate metabolic process	154	0.37	0.43	5.66	31.07
GO:0045055	regulated exocytosis	144	0.69	0.69	8.57	38.47
GO:0098542	defense response to other organism	84	0.66	0.62	8.42	39.21
GO:0006520	cellular amino acid metabolic process	50	0.41	0.53	6.53	77.81
GO:0000956	nuclear-transcribed mRNA catabolic process	46	0.69	0.74	9.30	714.77
GO:0031334	positive regulation of protein complex assembly	45	0.61	0.63	8.09	105.22
GO:0009108	coenzyme biosynthetic process	41	0.54	0.56	7.33	78.12
GO:0019886	antigen processing and presentation of exogenous peptide antigen via MHC class II	36	1.00	0.79	9.63	42.20
GO:0045766	positive regulation of angiogenesis	31	0.81	0.76	9.30	134.49
GO:0072659	protein localization to plasma membrane	29	0.79	0.72	9.26	65.43
GO:0060271	cilium assembly	28	0.87	0.76	9.41	137.68
GO:0000086	G2/M transition of mitotic cell cycle	28	1.00	0.79	9.63	43.45
GO:0046718	viral entry into host cell	26	0.77	0.73	8.94	28.37
GO:0050852	T cell receptor signaling pathway	25	1.00	0.92	9.63	219.43
GO:0010595	positive regulation of endothelial cell migration	23	0.83	0.81	9.49	298.63
GO:0006977	DNA damage response, signal transduction by p53 class mediator resulting in cell cycle arrest	20	1.00	0.93	9.63	888.12
GO:0007409	axonogenesis	18	0.69	0.72	8.67	64.61
GO:0030183	B cell differentiation	18	0.73	0.69	9.02	64.36
GO:0030148	sphingolipid biosynthetic process	18	0.69	0.70	8.99	238.83
GO:0032869	cellular response to insulin stimulus	14	1.00	0.88	9.63	462.70
GO:0007080	mitotic metaphase plate congression	14	1.00	0.85	9.63	61.63
GO:0001938	positive regulation of endothelial cell proliferation	14	0.89	0.80	9.46	87.31
GO:0045540	regulation of cholesterol biosynthetic process	13	0.89	0.84	9.49	116.99
GO:0006904	vesicle docking involved in exocytosis	11	0.89	0.77	9.43	32.65
GO:0048704	embryonic skeletal system morphogenesis	11	0.87	0.72	9.38	45.49
GO:0072678	T cell migration	10	0.71	0.71	8.88	30.24
GO:0060236	regulation of mitotic spindle organization	8	0.80	0.80	9.36	71.51
GO:0007202	activation of phospholipase C activity	7	1.00	0.90	9.63	83.74
GO:0009972	cytidine deamination	5	1.00	0.93	9.63	2918.46
GO:0048169	regulation of long-term neuronal synaptic plasticity	5	0.89	0.84	9.46	42.76
GO:0060213	positive regulation of nuclear-transcribed mRNA poly(A) tail shortening	5	1.00	0.93	9.63	968.14
GO:0035195	gene silencing by miRNA	5	1.00	0.92	9.63	181.23
GO:0061154	endothelial tube morphogenesis	4	0.83	0.74	9.31	48.80
GO:0031065	positive regulation of histone deacetylation	4	0.89	0.86	9.57	1219.90
GO:0043923	positive regulation by host of viral transcription	4	1.00	0.93	9.63	272.30
GO:0051684	maintenance of Golgi location	3	1.00	0.82	9.63	40.06
GO:1901098	positive regulation of autophagosome maturation	3	1.00	0.90	9.63	490.40
GO:0045869	negative regulation of single stranded viral RNA replication via double stranded DNA intermediate	3	1.00	0.90	9.63	106.49
GO:0098969	neurotransmitter receptor transport to postsynaptic membrane	3	0.93	0.93	9.60	400.33
GO:0018146	keratan sulfate biosynthetic process	3	1.00	0.88	9.63	415.41
GO:0090241	negative regulation of histone H4 acetylation	2	0.93	0.91	9.60	1490.32
GO:2001271	negative regulation of cysteine-type endopeptidase activity involved in execution phase of apoptosis	2	1.00	0.96	9.63	947.59
GO:0034213	quinolinate catabolic process	1	1.00	0.88	9.63	742.15
GO:0070829	heterochromatin maintenance	1	0.89	0.74	9.51	53.16
GO:0044571	[2Fe-2S] cluster assembly	1	1.00	0.82	9.63	63.39
