id	name	nbGenes	ICSeco	ICZhou	ICSanchez	ICMazandu
GO:0008150	biological_process	1913	0.00	0.00	0.00	0.00
GO:0044093	positive regulation of molecular function	333	0.43	0.41	5.23	6.77
GO:0051091	positive regulation of DNA binding transcription factor activity	54	0.81	0.84	9.43	277.83
GO:0050789	regulation of biological process	1418	0.09	0.17	1.80	4.47
GO:2000650	negative regulation of sodium ion transmembrane transporter activity	3	0.83	0.83	9.46	676.30
GO:0030335	positive regulation of cell migration	139	0.58	0.64	8.22	157.26
