id	name	nbGenes	ICSeco	ICZhou	ICSanchez	ICMazandu
GO:0008150	biological_process	2054	0.00	0.00	0.00	0.00
GO:0002687	positive regulation of leukocyte migration	61	0.66	0.71	8.96	238.70
GO:0007257	activation of JUN kinase activity	8	1.00	0.98	9.63	8640.55
GO:0090074	negative regulation of protein homodimerization activity	2	1.00	0.82	9.63	47.53
GO:0050789	regulation of biological process	1531	0.09	0.17	1.80	4.47
GO:0046718	viral entry into host cell	25	0.77	0.73	8.94	28.37
GO:0009308	amine metabolic process	9	0.53	0.51	6.96	23.64
