ID;Term;Depth;IC Nuno;IC zhou;IC sanchez;IC resnik;IC RZ;IC Rnormalized;IC Nuno org;Annotated Genes Set number
GO:0016525;negative regulation of angiogenesis;8.0;0.811012628672052;0.780506314336026;9.32314260294094;151.1079732353669;5.192106149009898;0.005057447875840929;0.6405245499179943;[SPARC, SERPINE1, FASLG, PRL, HHEX, STAB1, EMILIN1, HOXA5, CCR2, SEMA6A, HSPG2, DCN, COL4A2, HGS, CX3CR1, THBS2, THBS1, E2F2, SEMA4A, TGFB2, STAT1, PLK2, TIE1, KLF4, SULF1, PML, CXCL10, TEK, PF4]
GO:0060760;positive regulation of response to cytokine stimulus;5.0;0.6997970393407541;0.6401395315312973;8.438940185618286;40.71357550929856;5.825829909099042;0.0013626467324571242;0.5881742243410422;[TXK, GFI1, TAF9, TREM2, IFIH1, CASP1, CD300LF, ZBP1, CD74, MED1, EDN1, IL1R1, DDX58, RIPK2, PARP9, MMP12, IRF7, TLR4, TLR2]
GO:0050717;positive regulation of interleukin-1 alpha secretion;11.0;1.0;0.9324289523296623;9.628524252492122;998.8167007681584;8.390779266560578;0.033429496098039586;0.8615337942327104;[CASP1]
GO:0050718;positive regulation of interleukin-1 beta secretion;11.0;1.0;0.9324289523296623;9.628524252492122;998.8167007681584;6.518977089658987;0.033429496098039586;0.7658097438582601;[ORM1, FZD5, RIPK2, NOD2, PYCARD, NLRP12, AIM2, CASP1, TLR8, NLRP3, CCL19, TLR4]
GO:0015031;protein transport;7.0;0.4793097133439409;0.590574221929171;6.989466922876863;54.45792783373929;2.578890050578526;0.0018226578356421344;0.4828039223744382;[, NUP107, TFRC, AKT1, WLS, ZFYVE16, GATA3, LYN, ABCA1, COL1A1, SRP9, MMP12, CENPF, SNX17, GOPC, NCF1, CSE1L, KPNA2, AP2M1, ADCYAP1, ACAP1, SLC27A2, LIN7A, EVI5, ARRB1, ARRB2, TNFSF13B, ITGAV, ITGB6, ARL4C, LCP2, LRP1, LRP2, SEC63, GOLPH3L, HNF1B, ACTN4, KIF20A, MSR1, EGR2, POLA2, TF, CD24, CD3G, PCSK5, AKAP12, CCR7, CD36, SYK, NAPA, HSD17B4, STX11, CD74, AKR1C3, NEDD4, FKBP1B, RAMP1, SCARB2, ZFAND6, CARD11, ECT2, NUP155, NASP, PLEK, NUP62, YWHAH, NUP133, TBC1D8, TBC1D9, CHI3L1, NUP54, MX2, NUP35, RAN, PHB2, AP1S2, HOMER3, CUBN, PRKCB, NUP85, S100A12, NUP88, EHD3, DENND1B, ANXA1, EXOC1, CCL19, NR1H4, TNF, CLU, LAMP2, TAP1, RAB32, RAB31, CALCRL, SLC15A3, DAB2, BCL6, BCL3, CCDC22, PLEKHF2, TLK1, NLGN1, UNC93B1, VPS4B, NLRC4, NOD2, RAB21, PML, VPS41, IL1RN, IFIT1, ARFIP1, STXBP2, AHCTF1, TRAM2, XPO1, TMED6, STRADB, ZDHHC17, RAB33B, TLR6, TLR4, TLR2, RANBP2, RANBP1, LILRB1, RANBP6, CD40LG, F2RL1, NUPL2, STEAP3, GOLT1B, TSC2, ATP1B1, HGS, COPB2, SUCNR1, LTBP2, NLRP3, TGFB1, LRP1B, NFKBIA, TBCK, KIF18A, DNM2, AIM2, IFNG, EHHADH, HSPD1]
GO:1901740;negative regulation of myoblast fusion;9.0;1.0;0.896240625180289;9.628524252492122;353.26084893783826;8.67846133901236;0.011823322699826135;0.8400575416471059;[CXCL10]
GO:0009597;detection of virus;6.0;1.0;0.8231203125901445;9.628524252492122;28.654098265158677;8.16763571524637;9.59026881920657E-4;0.7408135829017477;[IFIH1, DDX58, SERINC5]
GO:0045444;fat cell differentiation;4.0;0.8653626801206646;0.6826813400603323;9.292052015870908;21.066225782797595;5.171903441692378;7.050676185779127E-4;0.5144913825262545;[STEAP4, FFAR2, MED1, GPX1, SIRT1, PLCB1, CEBPA, CEBPB, RETN, ADRB2, PTGS2, FOXO1, PRDM16, EGR2, LAMB3, NOC3L, KLF4, PSMB8, NR4A2, NR4A1, ALDH6A1, LRG1, NR4A3]
GO:0051091;positive regulation of DNA binding transcription factor activity;11.0;0.811012628672052;0.8379352666656883;9.431813958246067;277.8307104044464;4.2636448815154875;0.00929874384583087;0.650471949850128;[CSF3, PHB2, TNF, CLU, ICAM1, PYCARD, AKT1, TNFSF11, TRIM25, PRKCH, PRKCB, BTK, PRKCQ, ADAM8, S100A9, S100A8, CARD11, BEX1, TNFRSF11A, PRKCZ, NHLH2, NLRP3, S100A12, FZD1, TGFB1, FZD2, JUP, EIF2AK2, NFKB1, NFKB2, FOSL1, IL6, COPS5, JMY, MYD88, CD40, ITGB2, CD36, IL10, MYOCD, EDN1, CHUK, ANXA3, DDX58, RIPK2, NFAM1, IL18, IRAK3, TRAF1, GREM1, PSMA6, AIM2, IL1B, KIT, HCLS1, TLR6, TLR4, LTF, TLR2, NLRC4, NOD2, CD40LG]
GO:0032091;negative regulation of protein binding;5.0;0.6997970393407541;0.6401395315312973;8.48339194818912;32.716075545242866;5.171903441692378;0.0010949776059428606;0.5547323943871747;[LRRK2, CTSZ, ARRB2, IFIT1, IFIT2, RUVBL2, STMN1, AKT1, IL10, ITGA4, PRKCD, NOG, AES, SLPI, MET, LEF1, ADRB2, AURKB, AURKA, EPB41L5, CCL23, CAV1, EIF2S1, PPP1CA, DAB2, ID1, CAMK1]
GO:0010819;regulation of T cell chemotaxis;10.0;0.9326813400603323;0.8815816818910864;9.574457031221845;194.94068539511468;7.292166977892469;0.006524489304947852;0.7881627702307852;[CXCL10, TNFSF14, CCL5, XCL2, XCL1, CXCL13, CCR2]
GO:0051882;mitochondrial depolarization;5.0;1.0;0.7902410118609202;9.628524252492122;25.75696197398942;8.67846133901236;8.620623375086068E-4;0.7340579283277371;[CASP1]
GO:0002479;antigen processing and presentation of exogenous peptide antigen via MHC class I, TAP-dependent;6.0;1.0;0.8231203125901445;9.628524252492122;33.24930607151726;6.518977089658987;0.0011128243517809471;0.6565011041187423;[CHUK, ITGB5, HLA-B, TAP1, HLA-C, HLA-A, HLA-F, HLA-G, HLA-E, ITGAV, CD36, FCGR1A, FCGR1B]
GO:0010818;T cell chemotaxis;8.0;0.8436909121759173;0.7968454560879586;9.446202695698167;127.60944988880927;7.292166977892469;0.004270973446729658;0.747921758369865;[CXCL10, CXCL9, CXCL11, CXCR3, PIK3CD, DEFA1, CXCL16, CCR2]
GO:0032725;positive regulation of granulocyte macrophage colony-stimulating factor production;6.0;0.9326813400603323;0.7894609826203107;9.523163736834295;64.94897299966192;7.212124270218933;0.0021737836760178982;0.6919486831672181;[SYK, IL23A, DDX58, CD80, IL1B, IL18, RASGRP1]
GO:0001666;response to hypoxia;5.0;0.811012628672052;0.6957473261969462;9.117698628726131;21.16160540946;4.1860866471696125;7.082598888462125E-4;0.5043176776701113;[MPL, RORA, PHB2, ETS1, SLC8A1, LOXL2, AQP1, ICAM1, EDNRA, PLAU, MYB, AKT1, POSTN, PRKCE, ACTN4, ATP1B1, CLDN3, ADAM8, ABCB4, PSEN2, TWIST1, DPP4, CCNB1, BRIP1, HMOX1, EGR1, TGFB2, TGFB1, VCAM1, CAV1, NR4A2, BMP2, CXCL12, BCL2, NOX4, CD24, SUV39H2, ALAS2, CDKN1B, SUV39H1, ADM, ALAD, CASP1, CD38, MYOCD, ADSL, EDN1, KCND2, MMP2, AGTRAP, SIRT1, CBFA2T3, TGFBR3, CCNA2, IL1B, LTA, BIRC2, TLR2, CXCR4, KCNA5, PTGS2, THBS1, ASCL2, CST3, PAK1, E2F1, PML, FABP1, TEK]
GO:0030308;negative regulation of cell growth;6.0;0.6913464685778243;0.6687935468790567;8.673012807464685;80.89021177018715;4.623782033182691;0.0027073225914839173;0.5595807407949613;[CDA, NRP1, SEMA5B, CDKN1A, CDKN1B, ARHGAP4, TCHP, PPP2R1A, HNF4A, TNR, SEMA6A, DCC, SIRT1, GREM1, PSRC1, SFRP2, NDUFS3, FBP1, RNF6, PAK1, FRZB, SPP1, APBB1, SEMA4A, TGFB2, TGFB1, CDKN2C, CDKN2A, SEMA4B, INHBA, PML, BST2, BCL6, BCL2, SIPA1]
GO:0002636;positive regulation of germinal center formation;8.0;1.0;0.875;9.628524252492122;213.8757386662325;8.67846133901236;0.007158228497490581;0.8188169164668168;[TNFSF13B]
GO:0051607;defense response to virus;6.0;0.8653626801206646;0.7558016526504768;9.485423408851448;78.89111305633469;4.573066940603674;0.0026404145566033123;0.5569871686019774;[IFITM1, PRF1, ADARB1, IFIT1, IFIT3, IFIT2, PYCARD, HERC5, DHX58, TRIM25, IFNA14, RSAD2, IFNA16, RNASE6, RNASE2, IL23A, IFNA10, DDX60, NLRP3, IFNA21, EIF2AK2, ISG15, AZU1, DEFA1, BST2, CXCL10, IL6, PTPRC, BCL2, SERINC5, APOBEC3A, APOBEC3B, IFNA5, IFNA4, IFNA7, CXCL9, CD40, IFNA2, IFNA8, OASL, IFIH1, DDX58, PARP9, PLSCR1, IFNG, OAS1, OAS3, IRF7, TLR8, TLR7, ZMYND11, EXOC1, UNC93B1, SAMHD1, IL33, STAT1, MX2, CARD9, LILRB1, PML, F2RL1]
GO:0019885;antigen processing and presentation of endogenous peptide antigen via MHC class I;5.0;0.8436909121759173;0.712086467948879;9.271849308553389;32.556158890958;7.8311634786251565;0.0010896253394395913;0.6907270763441554;[TAP1]
GO:0006919;activation of cysteine-type endopeptidase activity involved in apoptotic process;13.0;0.9326813400603323;0.9288956347978027;9.604426700913061;734.4853933519539;5.322726331426962;0.024582565121551242;0.7347594368888992;[FASLG, TNF, PYCARD, CASP1, CTSH, F2R, F3, IFI27, LCK, S100A9, S100A8, NLRC4, HSPD1, NLRP3, SNCA, CASP8AP2, TNFRSF10B, HSPE1, PML, NLRP12, P2RX1, DLC1]
GO:0010499;proteasomal ubiquitin-independent protein catabolic process;8.0;1.0;0.875;9.628524252492122;190.80819184730524;6.518977089658987;0.006386178464905405;0.7083807915285978;[PSMB10, PSMB8, PSMA5, PSMA6, PSMA3, PSMA4, PSMA2]
GO:0032480;negative regulation of type I interferon production;6.0;0.7980440201809971;0.722142322680643;9.186691500213083;65.25422870398782;6.015873511986907;0.002184000309729388;0.6307723637598831;[TNFAIP3, NLRC3, RELB, PYCARD, IFIH1, HERC5, DHX58, TRIM25, HAVCR2, IL10, DDX58, LILRB1, ISG15]
GO:0045859;regulation of protein kinase activity;9.0;0.5608425510848448;0.6766619007227115;8.333797084897721;159.5555227474585;3.0974744418360864;0.005340179755709658;0.5546456121830788;[, ADARB1, AKT1, PROK2, PRKACB, PRKCD, PRKAR1B, FPR1, PDGFA, THY1, IQGAP3, PRKCZ, FLRT2, PRKAR2B, PDGFD, PDGFC, S100A12, SFN, NCKAP1L, ELANE, LYN, ACE, FZD5, PLK1, FZD8, EIF2AK2, CDC6, AZU1, NR2F2, PKIA, NOX4, PKIG, EZH2, CDKN1A, CDKN1B, LRRC4, DUSP2, DUSP3, DUSP1, RIPK2, BGN, EMP2, SIRT1, DUSP6, CKS2, LRRC19, EGFR, NTF3, CCL19, CDKN2C, CCL21, CDKN2A, GTF2H1, ELP4, CENPE, PKN1, CDKN3, CCNT2, NCF1, TNF, CLU, PYCARD, MAP3K8, MEN1, MAP2K2, CISH, F2R, CDC25C, CDC25A, ADCYAP1, ADAM9, ADAM8, CSF1R, BLM, TNFRSF11A, PKMYT1, SOCS2, DRD4, MAP2K6, TNFRSF10B, CXCL10, PTPRC, CDK6, CDK4, CDK1, CSPG4, LAT, MAP3K11, LRRK2, ITGB3, PTPN22, ARRB1, CYR61, HHEX, DUSP10, LCP2, CEBPA, NOD2, CCL5, FYN, CSK, PTPN6, IL1RN, CCNH, CCNF, CCNC, HERC5, TCL1A, PPP2R1A, TNFSF11, EPHB2, ACSL1, SLC11A1, PAQR3, MIF, EREG, SFRP2, IL23A, TRIB1, TGFA, PIK3R5, EGR1, GADD45B, IGF1, PTK2, TPX2, CALM3, CD24, CD40, KIF14, RAC2, CCR7, MAP4K1, EDN1, SYK, STRADB, IL18, GP1BA, CEACAM1, MDFIC, IL1B, KIT, TLR6, TLR4, CXCR4, PAK1, CD74, PODN, CD40LG, CAMK1, CCND2, IL6R, PDGFRB, CD300A, TSC2, CCNE2, HGS, CCNE1, CALCA, C5AR1, ADRB2, RASGRP1, CCNB2, CCNB1, STAP1, CLSPN, ECT2, TGFB2, TGFB1, CAV1, GH1, BMP2, GNAQ, TNFAIP3, CKS1B, GHR, GRM5, LRRTM4, NUP62, MYOCD, IRAK3, DCN, FGR, CCNA2, GREM1, PSRC1, IFNG, CHI3L1, PDE5A, LTF, THBS1, SNCA, EGF, MAPK14, CD4]
GO:0007186;G-protein coupled receptor signaling pathway;5.0;0.5508212674310002;0.5656516455764204;7.20077601654407;23.17027026302992;2.605416804911955;7.75488093814194E-4;0.4234821484283897;[MRGPRF, EDNRA, EDNRB, GPR171, C3AR1, AKT1, PROK2, HOMER3, PRKACB, PTGDR, TAS2R10, TAS2R13, TAAR2, TRHR, EREG, TIAM2, SFRP4, ADCY9, SFRP2, AGTR1, FPR1, FPR3, FPR2, PIK3R5, C3, GNG10, OR7D2, CCR10, CCR1, ABCA1, FZD1, GPR15, FZD2, FZD5, OR2J2, FZD8, AZU1, NMBR, PPBP, GNG11, MARCO, PNOC, CALM3, OR7C2, GPR18, GPR19, GPR25, GABRB1, GRIK3, ADM, CD3E, AKAP12, CCR9, RAC2, FFAR2, CCR7, CCR6, CCR5, CCR3, CCR2, EDN1, GPR37, ANXA1, GPR35, RHOG, GPBAR1, TACR3, AGTRAP, PTH2R, GP1BA, AVPR1A, SORCS3, RHOC, VAV1, MC3R, PLCB1, CCL13, PTGER2, PTAFR, CXCR5, CXCR4, CXCR6, GNAI1, GNAI2, FGD3, FGD4, CXCR1, FRZB, NPY, CXCR3, CXCR2, FLNA, CCL19, GABRE, CCL18, GPR157, P2RY13, GABBR1, CCL23, CCL21, SORT1, GABRA5, CCL20, P2RY14, AKR1C3, GPR6, F2RL1, RAMP1, LGR4, F2RL3, PF4, CHRM2, FCN1, CHRM1, CELSR1, CXCL13, CXCL16, RGS1, CCRL2, PDGFRB, CD97, GHSR, LHCGR, CISH, SPNS3, APLP2, F2R, NPY1R, DGKZ, PDGFRL, ADCYAP1, SPNS1, OR2C3, GNAZ, CALCA, SUCNR1, CALCRL, GPR87, C5AR1, GPR85, ITPR3, GPR84, ADRB2, GPR82, HRH4, PSAP, ECT2, DRD4, HTR1E, CAV1, GPR98, CXCL10, CXCL11, CXCL12, GNB2, GNAQ, OR7E24, TAS2R7, CXCL6, GPSM2, CXCL9, OR1G1, PLEK, CXCL1, ARRB1, ARRB2, CXCL3, CXCL2, CXCL5, LTB4R, GRM5, CA2, PDE4B, PTGIR, ARHGEF12, PDE4D, GLP2R, OR2H1, XCL2, XCL1, CX3CR1, LRP1, OR1E1, P2RY6, GNA15, CCL8, PLN, CCL7, CNR1, P2RY2, OR2W1, CCL5, GNG7, CCL4, S1PR1, CCL2, S1PR3, OR12D3, CCL1, S1PR5, SLC12A2, TSHR, OR11A1, PTPN6]
GO:0090026;positive regulation of monocyte chemotaxis;10.0;1.0;0.9152410118609203;9.628524252492122;859.35541097108;6.8867018697843045;0.028761852235543582;0.7674272657460779;[CCR1, CXCL10, CXCL12, CCL5, SERPINE1, CCL1, FPR2, S100A14, PLA2G7, AIF1, CCR2]
GO:0032481;positive regulation of type I interferon production;6.0;0.811012628672052;0.7286266269261705;9.260799472366804;65.23665507211369;5.618190544320798;0.002183412136085803;0.610434838299289;[HMGB2, PTPN22, IFIH1, DHX58, ZBP1, CHUK, SYK, DDX58, RIPK2, MMP12, IRF7, TLR8, TLR7, TLR4, TLR2, PRKDC, HSPD1, PLCG2, CD14, STAT1, NFKB1, NFKB2, MYD88]
GO:0043312;neutrophil degranulation;9.0;1.0;0.896240625180289;9.628524252492122;132.80263134205524;3.603287523778533;0.004444784556409926;0.5805129167163294;[CDA, CYFIP1, ABCA13, PSMD3, C3AR1, PRSS3, PGLYRP1, PRKCD, RNASE3, RNASE2, BIN2, PADI2, CFD, FPR1, FPR2, CFP, GNS, C3, S100A12, NCKAP1L, ELANE, S100A11, JUP, FUCA1, AZU1, LYZ, TCN1, ARHGAP9, SIGLEC9, SERPINA1, PYGL, TIMP2, OLR1, ANXA3, ARG1, NFAM1, PSMA5, PSMA2, SERPINB10, GRN, PTAFR, NRAS, ALOX5, METTL7A, GSN, AGL, LRG1, SLCO4C1, PSMC2, SIGLEC5, ATP8A1, HP, APEH, PYCARD, CLEC5A, LAMP2, CD177, OLFM4, CLEC4D, RAB31, ADAM8, SLC27A2, S100A9, S100A8, BRI3, HVCN1, GPR84, PSAP, TXNDC5, ATP8B4, DEFA4, DEFA1, NFKB1, PTPRC, LCN2, HPSE, ITGAM, ITGB2, ITGAL, FCAR, ALAD, FCGR3B, GM2A, ITGAX, ITGAV, DSP, CR1, NDUFC2, TNFRSF1B, NPC2, PECAM1, BPI, ACPP, FGL2, TTR, CPPED1, FCGR2A, P2RX1, IMPDH2, PTPN6, MNDA, FOLR3, LGALS3, ANPEP, SLC11A1, MIF, CHIT1, SLPI, CRISPLD2, STXBP2, MGST1, CD14, PRG2, NBEAL2, PPBP, BST2, BST1, VNN1, ORM1, CTSZ, CTSS, GLIPR1, CTSH, CTSG, CD36, SPTAN1, CTSD, CAMP, CD33, CTSB, CD53, CCT2, FCER1G, MME, GAA, RHOG, CEACAM1, CEACAM6, CEACAM8, TLR2, LILRA3, CST3, CXCR1, CXCR2, CD58, CCT8, GCA, LILRB2, LILRB3, QPCT, CD68, FCN1, MPO, PLAU, SIRPA, CD97, CHRNB4, CD93, CD300A, CYBB, OSCAR, DOK3, TYROBP, PRTN3, VCL, PSMD14, C5AR1, MGAM, HSPA6, GGH, SELL, MS4A3, TNFAIP6, CRISP3, CXCL1, SIRPB1, HK3, PLAUR, MMP8, MMP9, FGR, CHI3L1, DOCK2, LTF, CLEC12A, RETN, MAPK14, S100P, PTX3]
GO:0043950;positive regulation of cAMP-mediated signaling;8.0;0.8436909121759173;0.7968454560879586;9.517298617381897;239.5163045814748;6.686031174322154;0.008016395163662574;0.7169239451870815;[CXCL10, ADCYAP1, CXCL9, CXCL11, PF4]
GO:1904469;positive regulation of tumor necrosis factor secretion;10.0;1.0;0.9152410118609203;9.628524252492122;775.9675723657698;7.292166977892469;0.025970936321606315;0.7881627702307852;[IFIH1, ORM1, FZD5, DDX58, LRRK2, HAVCR2]
GO:0042102;positive regulation of T cell proliferation;9.0;0.7763722522362496;0.7844267512984139;9.424925297250882;564.8543510249671;5.212725436212633;0.018905166792893686;0.6628196464047262;[CD86, TFRC, CD80, CD3E, TNFSF13B, PYCARD, IL6R, JAK3, ICOSLG, CCR2, HLA-DPA1, HAVCR2, ANXA1, SYK, RIPK2, IL15, IL18, PDCD1LG2, HLA-E, ZAP70, IL23A, IL1B, XCL1, PRKCQ, CARD11, CD274, BLM, HHLA2, EBI3, CD1D, CORO1A, AIF1, HLA-DMB, CCL5, NCKAP1L, CCL19, IL12RB1, VCAM1, LILRB2, IGF1, CD4, IL6, CD40LG, PTPRC, CD6, DNAJA3, IL2RA, CD28, HLA-DPB1, CD24]
GO:0061844;antimicrobial humoral immune response mediated by antimicrobial peptide;6.0;1.0;0.8231203125901445;9.628524252492122;44.28377145688295;5.682729065458369;0.0014821379778550245;0.6137353412716126;[CXCL6, CCL13, CXCL9, HIST1H2BK, CXCL1, CXCL13, CXCL3, CXCL2, CXCL5, GNLY, S100A12, PGLYRP1, CAMP, DEFA4, RNASE6, RNASE3, DEFA1, PPBP, CXCL10, CXCL11, S100A9, LTF, PF4]
GO:2000406;positive regulation of T cell migration;10.0;0.7980440201809971;0.8142630219514189;9.461470167828956;351.7821234142529;6.518977089658987;0.011773831087318304;0.7486218033895181;[TNFSF14, CCL21, ITGA4, CCL20, CXCL13, AIF1, PYCARD, CXCL10, CXCL12, CCL5, XCL2, XCL1, ADAM8, CCR2]
GO:1901509;regulation of endothelial tube morphogenesis;6.0;0.8933024483968273;0.7697715367885581;9.405380701177911;45.7200117395938;8.390779266560578;0.0015302076475850206;0.7522251544931926;[CXCL10, ADAMTS12]
GO:0032757;positive regulation of interleukin-8 production;6.0;0.8933024483968273;0.7697715367885581;9.427853557029971;65.23665507211369;5.948432231191374;0.002183412136085803;0.6273234135236593;[FCN1, SERPINE1, NOD2, TNF, PYCARD, FFAR2, CD58, CD14, ELANE, DDX58, F2R, TLR1, CD2, IL1B, TLR8, F2RL1, TLR7, TLR5, TLR4, CD244, TLR2]
GO:0043161;proteasome-mediated ubiquitin-dependent protein catabolic process;9.0;0.7586651285174919;0.775573189439035;9.310070521373587;348.3589749790861;4.015022244900292;0.01165926138982685;0.6015690495021188;[, CCNF, CDC20, CDC23, TRIM25, SKP2, CDC34, NEDD4L, ANAPC10, PLK1, KIF14, SIRT1, PSMA5, PSMA6, PSMA3, PSMA4, PSMA2, DERL3, PCNP, PSMB8, PSMC6, NEDD4, PSMC2, MAD2L1, BUB1B, PTTG1, PSMD14, UBR1, CCNB1, WFS1, UBE2C, UBE2S, CDK1, ARRB1, ARRB2, BIRC2, RNF6, AURKB, PSMB10, AURKA, ZNRF1, TBX21, RNF24, PML]
GO:0033209;tumor necrosis factor-mediated signaling pathway;7.0;0.8933024483968273;0.7975705894556142;9.510741216835738;30.19135422731818;5.395046993006588;0.00101047745553359;0.6268223193749;[CD40, TNFRSF13B, TNF, TNFSF13B, PYCARD, TNFSF11, TNFRSF4, CHUK, TNFRSF18, TNFRSF1B, AIM2, LTA, LTB, BIRC2, BIRC3, TNFRSF11A, TNFRSF17, TNFSF14, STAT1, TNFSF12, TNFRSF9, TNFSF13, TNFRSF10C, TNFRSF10B, NFKBIA, CD40LG, CD27, LTBR]
GO:0032956;regulation of actin cytoskeleton organization;7.0;0.559792591703537;0.630815661108969;7.718981747607684;34.11626247365944;3.9689311377000256;0.0011418406023505395;0.553890688213353;[CYFIP1, CSF3, CELSR1, F11R, CTGF, ICAM1, PYCARD, EPS8, ARHGDIA, STMN1, ARHGDIB, ARFIP1, PDGFRB, TMOD1, PDGFRA, MEF2C, PRKCE, TPM1, PRKCD, PFN1, EPHA3, CSF1R, TACSTD2, PDGFA, CORO1A, SPTA1, STAP1, NCKAP1L, VASP, TGFB1, VIL1, BST2, BST1, CXCL12, FES, JMY, ID1, NOX4, NRP1, PLEK, LMOD1, ARHGEF10L, ARHGAP6, CCR7, SPTAN1, EDN1, RHOG, RHOH, ARAP1, RHOC, SPTB, CIT, HCK, TMEFF2, HCLS1, RHOU, SHANK3, MET, LRP1, SYNPO2, CAPG, PAK1, NTF3, S1PR1, EPS8L1, FLNA, EPS8L3, JAM3, GSN, CCL21, DLC1, F2RL1, TEK]
GO:0071360;cellular response to exogenous dsRNA;7.0;1.0;0.8509193652572005;9.628524252492122;172.52541059605554;7.069023426578259;0.005774270229860956;0.7124295520356204;[COLEC12, IFIH1, DDX58, CAV1, IFIT1]
GO:0045662;negative regulation of myoblast differentiation;6.0;0.9326813400603323;0.7894609826203107;9.541512875502493;114.62387697121986;6.518977089658987;0.0038363580074348307;0.6565011041187423;[TGFB1, IL18, DLL1, TNF, CXCL10]
GO:0030816;positive regulation of cAMP metabolic process;10.0;0.8259837884571596;0.8282329060895002;9.526741558182179;1396.5025295312637;6.139487467954083;0.04673968289273128;0.7292146864874571;[CXCL10, LHCGR, CXCL9, CXCL11, TIMP2, ADM, CALM3, RAMP1, TSHR, PF4]
GO:0010506;regulation of autophagy;6.0;0.6260725219892441;0.6361565735847665;8.273978589686811;43.35793677134884;4.08334148887777;0.001451151124127319;0.5319425862261522;[KDR, AKT1, DAPK1, RRAGD, HMOX1, FZD5, PLK2, PTK2, RIPK2, SIRT1, RAB33B, EXOC1, NEDD4, SESN3, LAMP3, TSC2, ADRB2, FOXO1, PSAP, OSBPL7, BCL2, PLEKHF1, LRRK2, PTPN22, CASP1, DCN, IFNG, MET, DRAM1, SNCA, PIKFYVE]
GO:0050727;regulation of inflammatory response;6.0;0.5272636092234699;0.5867521172018795;7.400047131651798;31.586589572713706;3.8007227183825356;0.00105717472691369;0.517489449159909;[SERPINE1, EDNRB, C3AR1, TNFSF11, PGLYRP1, IL1R1, IL1R2, PRKCD, IL23A, BTK, AGTR1, IGKV4-1, SERPING1, CFB, CFH, CFI, GATA3, ADAMTS12, CFP, PLA2G7, C2, C3, C7, CD19, S100A12, A2M, ELANE, LYN, BST1, CD28, PBK, FFAR2, CCR7, CCR2, IL10, ANXA1, FCER1G, IL15, IL18, IL17RB, PSMA6, HCK, IL1B, TLR10, TLR7, TLR6, TLR4, IGLV3-19, TLR2, C1QB, C1QA, PTGS2, EGFR, NT5E, IGKC, CCL18, IL33, CCL23, IGKV1-5, NR1H4, OSM, NLRP12, ZYX, IL17A, C1QC, PROS1, RORA, TNF, CLU, ETS1, CDH5, IGHG1, TGM2, GHSR, ADCYAP1, FANCD2, ADAM8, S100A9, S100A8, SUCNR1, CALCRL, C5AR1, TNFRSF11A, SBNO2, IGLV1-44, NLRP3, SELE, NFKB1, NFKBIA, IL6, BCL6, IGLV2-23, IGKV3-20, MYD88, TNFAIP6, TNFAIP3, DUSP10, CASP1, CR2, CR1, GPX1, TNFRSF1B, LTA, XCL1, BIRC2, BIRC3, C1S, C1R, NLRC3, IGHV3-48, NOD2, USP18, CNR1, CCL5, CCL4, SNCA, MAPK14, KLF4, MAPK13, CD6, IL2RA, TEK, FCGR2B]
GO:0030890;positive regulation of B cell proliferation;9.0;1.0;0.896240625180289;9.628524252492122;506.1565706318756;6.063501560976162;0.016940604907709607;0.706328376990269;[CDKN1A, CD40, TFRC, TNFSF13B, CD38, NCKAP1L, TNFRSF4, CD74, MEF2C, FCRL3, MIF, MSH6, BST1, PTPRC, BCL6, BCL2, CARD11, CD320]
GO:0035549;positive regulation of interferon-beta secretion;10.0;1.0;0.9152410118609203;9.628524252492122;774.0580298608876;8.390779266560578;0.025907025652444588;0.8443458537639685;[IFIH1, DDX58]
GO:0010469;regulation of signaling receptor activity;6.0;0.5916390046238794;0.6189398149020842;7.95454781892045;48.619731222684926;3.470798340732454;0.0016272586491059737;0.5006171011438312;[IL1RN, CSF3, CSF2, NCF1, SERPINE1, CXCL13, TNF, CTGF, CXCL16, FGF5, EFEMP1, PLAU, VSTM1, TNFSF11, FAM3D, EPHB2, PHLDA2, MED1, MEF2C, IFNA14, IFNA16, DAPK1, PRKCE, PRKCD, FLT3LG, MIF, EREG, BTC, ADCYAP1, SFRP2, IL23A, NBL1, IFNA10, CALCA, EBI3, TGFA, PDGFA, ADRB2, PDGFD, PDGFC, IFNA21, TGFB2, TGFB1, JAG1, TNFSF14, TNFSF12, TNFSF13, LIF, INHBA, PPBP, IGF1, GH1, CXCL10, CXCL11, IL6, BMP2, CXCL12, PNOC, OGN, CD320, FBN1, IFNA5, IFNA4, NRP1, CXCL6, IFNA7, CXCL9, IFNA2, SECTM1, CXCL1, FASLG, ADM, PRL, CXCL3, IFNA8, CXCL2, CXCL5, TNFSF13B, TIMP1, TNFSF12-TNFSF13, IL10, EDN1, IL15, PDE4D, NOG, IL18, GREM1, IL1A, IFNG, IL1B, LTA, XCL2, XCL1, LTB, SHANK3, HBEGF, CCL13, NLGN1, GRN, CLEC12B, RETN, TYMP, CCL8, TTR, GPNMB, CCL7, CCL5, NPY, CCL4, NTF3, SPP1, CCL2, CCL1, CCL19, CCL18, IL32, CMTM8, IL33, CCL23, CCL21, EGF, CCL20, OSM, KITLG, CD40LG, CMTM2, FCGR2B, PF4, IL17A]
GO:0030334;regulation of cell migration;6.0;0.4770562410916853;0.5616484331359872;7.1128459440373675;36.74126027361157;3.1319826581748256;0.0012296969163702938;0.48329005138129355;[SERPINE1, ADARB1, MYLK, DPYSL3, C3AR1, AKT1, CYP1B1, HOXA7, MEF2C, PRKCE, PADI2, PDGFA, FPR2, GATA3, THY1, PLA2G7, EPB41L5, KLRK1, FLRT2, PDGFD, PDGFC, HMOX1, NCKAP1L, S100A14, PLCG1, ELANE, LYN, JUN, JAG1, ACE, HACE1, JUP, PLK2, FN1, NR2F2, COL1A1, NOX4, SNAI2, GPR18, ARHGAP4, MMP28, TIMP1, ANXA1, ANXA3, EMP2, SIRT1, F3, TMEFF2, PLCB1, HBEGF, ENG, PTAFR, PTGS2, EGFR, GPNMB, NTF3, FLNA, CCL19, JAM3, CCL21, CCL20, SULF1, COL3A1, PF4, SEMA5B, PLXND1, ATP8A1, ITGA2B, CXCL13, TNF, SLC8A1, CXCL16, PYCARD, DACH1, PHLDA2, SEMA6A, IGFBP5, IGFBP3, F2R, TPM1, ADAM9, ADAM8, CD274, CSF1R, CD151, TACSTD2, CORO1A, CXCL10, CXCL11, DAB2, CXCL12, PTPRC, BCL2, PLXNB2, ITGB3, PIK3CD, PIK3C2A, CYR61, SYNE2, DUSP10, EMILIN1, ITGAV, ITGA4, TNFRSF18, XCL2, XCL1, ITGA5, MET, CX3CR1, LRP1, P2RY6, CCL8, CCL7, CCL5, CCL4, CCL2, CCL1, SEMA4A, SEMA4B, TIE1, KLF4, IL1RN, IFITM1, SPARC, ICAM1, LGALS3, KDR, IL1R1, ACTN4, MIF, SFRP2, IL23A, PFN1, TRIB1, KIF20B, NBL1, EPHA2, RRAS, CCR1, TNFSF14, PPBP, IGF1, PTK2, BST2, BST1, NRP1, PTPRR, NRP2, ECM1, CD40, KIF14, PTPRK, EPB41L4B, RAC2, CTSH, CCR7, CCR6, CCR2, EDN1, NOG, GAB1, RHOC, IL1A, CEACAM1, CEACAM6, IL1B, KIT, SGK1, SP100, AIF1, GNAI2, PAK1, CXCR3, CXCR2, PDPN, MPP1, CD74, IL33, PODN, DLC1, F2RL1, ETS1, PLAU, ARHGDIB, IL6R, PDGFRB, PDGFRA, POSTN, CD300A, VCL, C5AR1, STAP1, TGFB2, TGFB1, SELP, VIL1, IL6, BMP2, NR4A3, DOCK5, CXCL6, CXCL9, DOCK4, MCTP1, TNFAIP6, LAMC2, CXCL1, CXCL3, CXCL2, CXCL5, MYOCD, DDX58, ARAP3, MMP9, DCN, FGR, GREM1, IFNG, LAMA2, LAMA4, LAMA3, LEF1, THBS1, S1PR1, EGF, LAMB1, MAPK14, SOD2, RPS6KB1, TEK]
GO:0052548;regulation of endopeptidase activity;8.0;0.657518819034173;0.7037594095170865;8.935377071932177;60.84394611095035;3.7831122003739;0.0020363921203370686;0.5684685338598301;[SERPINE1, SPINT2, AQP1, RPS6KA1, AKT1, SOX7, DAPK1, POR, SFRP2, SPINT1, SLPI, IFI27, SERPING1, NAIP, C3, SFN, A2M, LYN, TNFSF14, BST2, CD27, SERPINA1, TIMP2, CTSH, TIMP3, TIMP1, SERPINB2, RIPK2, SERPINB9, SIRT1, F3, PAX2, PSMA3, SERPINB10, CSTA, IFI6, PTGS2, CST7, CST3, PERP, CASP8AP2, GSN, PSMB8, FABP1, NLRP12, DLC1, PROS1, TNF, CTGF, PYCARD, PTTG1, LAMP3, APLP2, F2R, S100A9, S100A8, PSMD14, NLRP3, TNFRSF10C, CRIM1, TNFRSF10B, DHCR24, VIL1, TNFAIP8, FASLG, ARRB1, ARRB2, CYR61, CASP1, CR1, GPX1, PLAUR, TNFRSF1B, MMP9, AIM2, ASPH, LCK, COL6A3, BIRC5, BIRC2, LTF, BIRC3, LEF1, NLRC4, THBS1, HSPD1, SPOCK2, SPOCK3, FYN, SNCA, HSPE1, KLF4, PML, P2RX1]
GO:0030336;negative regulation of cell migration;7.0;0.5846489169746516;0.6432438237445264;8.20713857156096;158.04059951544355;4.3090134865453384;0.00528947663847651;0.5712825153487487;[IL1RN, IFITM1, SERPINE1, ADARB1, CXCL13, DACH1, ARHGDIB, DPYSL3, CYP1B1, HOXA7, MEF2C, IGFBP5, CD300A, IGFBP3, TPM1, MIF, SFRP2, PADI2, TRIB1, NBL1, VCL, TACSTD2, THY1, KLRK1, RRAS, STAP1, HMOX1, TGFB1, JAG1, JUP, NR2F2, BST2, CXCL12, BCL2, GPR18, PTPRR, MCTP1, PTPRK, ARHGAP4, DUSP10, MMP28, EMILIN1, TIMP1, MYOCD, NOG, ARAP3, DCN, GREM1, TMEFF2, PLCB1, ENG, CX3CR1, SP100, LRP1, THBS1, AIF1, CCL2, IL33, CCL21, TIE1, PODN, KLF4, SULF1, COL3A1, DLC1]
GO:0033280;response to vitamin D;7.0;0.9326813400603323;0.8172600352873667;9.548481544818586;74.55580141320215;6.375876246018314;0.002495315577434836;0.6769819729871445;[TGFB1, IL15, ABCB4, TNC, PTGS2, CXCL10, CD4, IL1B, SPP1, ALPL, TRIM25]
GO:1903265;positive regulation of tumor necrosis factor-mediated signaling pathway;8.0;1.0;0.875;9.628524252492122;305.68887294206377;7.57984905034425;0.01023113147524637;0.7626338329336335;[CASP1]
GO:0060340;positive regulation of type I interferon-mediated signaling pathway;8.0;1.0;0.875;9.628524252492122;527.9279232538245;7.379178354882098;0.017669272487020958;0.7523715242355574;[MMP12, ZBP1, IRF7]
