GO:0008284;positive regulation of cell proliferation;5.0;0.5587538620495764;0.5696179428857084;7.270369308343265;43.45254999490143;2.9881018846882994;0.0014543177435732513;0.44305268120482816;[PID1, TFRC, MYB, HOXA3, AKT1, PROK2, MED1, MEF2C, PRKCH, CLDN7, AGTR1, PRKCQ, ATF3, HHLA2, PRKDC, PDGFA, IQGAP3, GATA1, PRKCZ, PDGFD, PDGFC, HMOX1, NCKAP1L, PLCG1, ELANE, LYN, MCTS1, JUN, FN1, CDC7, CDC6, FOSL2, FOSL1, NOX1, CDKN1A, CDKN1B, ADM, HOXC10, TIMP1, JAK3, HLA-DPA1, HAVCR2, ANXA1, ARG1, RIPK2, FCRL3, EMP2, SIRT1, F3, PAX2, MMP12, RARA, HCLS1, HBEGF, PTAFR, KCNA5, PTGS2, EGFR, NRAS, HLA-DMB, EPCAM, NTF3, FLNA, CCL19, IL12RB1, IL12RB2, STAT1, LRG1, HLA-DPB1, CSF3, CHRM1, CSF2, TNC, TNF, CTGF, FGF5, PYCARD, CDH3, TNFRSF4, PPP1R16B, IGFBP5, F2R, MSH6, ADCYAP1, CD274, CSF1R, BLM, DNMT1, CALCRL, TNFRSF11A, CORO1A, NACC2, CXCL10, CXCL12, PTPRC, CDK6, BCL6, CDK4, CDK2, CDK1, BCL2, HPSE, BCL2L1, ITGB3, FASLG, ARRB1, FOXM1, CYR61, TNFSF13B, LBH, ITGAV, ITGA4, ASPM, XCL1, BIRC5, CX3CR1, HDAC2, SMARCD3, TTK, LRP2, NOD2, CCL5, E2F1, CTHRC1, PRRX1, PML, KLF5, PRC1, DNAJA3, IL2RA, PTPN6, CCNF, AQP1, CDC20, TCL1A, EDNRB, KDR, SKP2, TNS3, ICOSLG, SOX4, TIPIN, FLT3LG, MIF, RUNX2, EREG, HLA-E, BTC, SFRP2, IL23A, KIF20B, EBI3, TGFA, TWIST1, CD1D, PKHD1, SLAMF1, EGR1, EGR3, TNFSF12, TNFSF13, LIF, IGF1, PTK2, BST1, ID1, CD28, CD24, CD320, NRP1, NRP2, ECM1, CD40, CTSZ, KIF14, PRL, CD3E, BMI1, ESM1, RAC2, CTSH, CD38, CCR3, CCR2, IL10, EDN1, SYK, IL15, NOG, RHOG, IL18, PDCD1LG2, AVPR1A, GAB2, NME1, HCK, CEACAM6, IL1B, KIT, YAP1, AIF1, GNAI2, CST3, PURA, PAK1, CXCR2, CD74, CDX2, OSM, AKR1C3, LILRB2, KITLG, CD40LG, CD86, CD80, SIRPG, MPL, IHH, ETS1, CCND2, IL6R, TGM2, PDGFRB, GHSR, PDGFRA, MATK, CCNE2, CCNE1, PRTN3, CARD11, C5AR1, HTRA1, LTBP3, DPP4, CCNB2, CCNB1, TGFB2, TGFB1, VCAM1, CAV2, NR4A1, IL6, BMP2, LIN28A, NR4A3, IL7R, HMGB2, TNFAIP3, LAMC2, LAMC1, CXCL5, MYOCD, MMP2, GLP2R, TBC1D8, MMP9, TGFBR3, CCNA2, GREM1, ZAP70, IFNG, NDUFS4, LTA, LTF, LEF1, DLL1, THBS1, HLX, S1PR1, S1PR3, EGF, LAMB1, MAPK14, MEIS2, TSHR, CD4, CD6, RPS6KB1, TEK]
GO:0043123;positive regulation of I-kappaB kinase/NF-kappaB signaling;8.0;0.8933024483968273;0.8216512241984136;9.517298617381897;239.11083947336738;4.629579150867016;0.008002824611389124;0.6117568930727868;[IL1RN, GOLT1B, TNF, LGALS1, AKT1, TNFSF11, TRIM25, WLS, TGM2, PRKCB, PRKCE, F2R, CARD11, S100A12, HMOX1, ECT2, NDFIP2, PLK2, TNFRSF10B, BST2, CCDC22, MYD88, ECM1, CD40, SECTM1, FASLG, NUP62, CASP1, CCR7, CD36, CHUK, RIPK2, RHOC, ZDHHC17, IL1B, TLR6, BIRC2, LTF, BIRC3, NOD2, FLNA, FYN, CCL19, CD74, CCL21, CARD9, CD4, F2RL1, LTBR]
GO:0045944;positive regulation of transcription by RNA polymerase II;11.0;0.5461734764479651;0.7055156905536448;8.363590748376499;1463.8556817380634;2.718315475161805;0.048993932283191266;0.5714437321440341;[EHF, PID1, SPI1, SERPINE1, SPIB, MYB, HOXA3, AKT1, HOXA2, HOXA7, JUNB, HOXA5, MEF2A, MED1, MEF2C, HOXB9, HOXB4, HOXB3, HOXB2, MAML3, HOXB7, ATF3, HOXB5, PRKDC, GATA3, GATA1, RAD21, NKX2-3, JUN, JAG1, JUP, FZD5, FZD8, FOSL2, FOSL1, HOXC10, DLGAP5, RIPK2, PAX5, FOS, SIRT1, PAX2, MMP12, PLSCR1, ZEB1, TAL1, RARA, HCLS1, ENG, NR1I2, EGFR, EPCAM, STAT4, STAT1, NR1H2, ATAD2, NR1H4, GTF2H1, POU4F1, PSMC6, PSMC2, FOSB, PF4, CSF3, CCNT2, PLXND1, RORA, TNF, RUVBL2, MEN1, ADCYAP1, FOXO1, SBNO2, NFKB1, NFKB2, CXCL10, COPS5, MAFB, MAFF, BCL3, SP3, CIITA, ARRB1, FOXM1, CYR61, HHEX, PPP1R12A, CHUK, PEG3, TFDP1, MET, CEBPA, CEBPB, HDAC2, CEBPD, CEBPE, UHRF1, NOD2, ABLIM3, E2F1, E2F2, E2F5, E2F7, E2F8, PRRX1, KLF4, PML, KLF1, KLF6, KLF5, POU2AF1, CCNH, GFI1, CCNC, IKZF1, RPS6KA1, TNFSF11, DPF3, SOX4, SLC11A1, EBF1, FLT3LG, HNF1B, RUNX2, SFRP2, IL23A, BEX1, TXK, TWIST1, NHLH2, EGR1, EGR2, EGR3, BCL11B, LIF, IGF1, CD28, TOP2A, CD40, HNF4G, PRL, BRCA1, CD3D, HNF4A, IL10, EDN1, NOG, IL18, RGMA, IL1A, IL1B, TFEC, TLR4, TLR2, YAP1, SATB2, RELB, RXRA, APBB1, IL33, CDX1, OSM, LILRB1, GRHL2, F2RL1, CAMK1, FOXA3, IL17A, FOXA2, IHH, ARID4A, ARID4B, ETS1, HOXA10, EOMES, LMO2, ADRB2, NLRP3, TGFB2, TGFB1, VDR, HMGA1, INHBA, NR4A2, NFKBIA, NR4A1, IL6, BMP2, NR4A3, TCF4, HMGB2, SLC40A1, ARHGEF10L, MYBL2, MYBL1, MYOCD, KLF13, DDX58, CKAP2, ETV1, DCN, GREM1, RBL1, ELF3, IRF7, IRF8, TAF9, LEF1, DLL1, S1PR1, LUM, MAPK14, MEIS2, MEIS1, TNIP3, RBMX]
GO:0043687;post-translational protein modification;7.0;0.6467165523344657;0.6742776414244334;8.507933057105237;151.15475272427284;3.8799197600437285;0.005059013543235805;0.5493386422205575;[CCNF, LGALS1, PSMD3, SKP2, ESCO2, MXRA8, SPARCL1, SDC2, C3, FN1, TF, SERPINA1, TIMP1, F5, PSMA5, PSMA6, PSMA3, PSMA4, PSMA2, FAM20C, FSTL1, CST3, SPP1, PSMB8, PSMC6, PSMC2, NUCB1, DSCC1, TNC, MEN1, IGFBP5, CISH, APLP2, IGFBP3, FBXW2, PSMD14, CUL5, SOCS2, IGFBP7, NAE1, WFS1, IL6, COPS5, UBA3, CCDC22, UBE2M, FBN1, LAMC1, CYR61, VCAN, DTL, PSMB10, LAMB2, LAMB1]
GO:0034605;cellular response to heat;5.0;0.8436909121759173;0.712086467948879;9.260799472366804;50.43140892920004;5.666199763507158;0.0016878938715389536;0.5800107312719123;[CDKN1A, HDAC2, PTGS2, THBS1, HMOX1, LYN, HSPA6, MYOF, EIF2S1, CXCL10, IL1A, TFEC]
GO:2000778;positive regulation of interleukin-6 secretion;10.0;1.0;0.9152410118609203;9.628524252492122;618.0674169630446;6.599019797332524;0.02068616022119099;0.7527151911823093;[DDX58, F2R, TWIST1, PYCARD, IFIH1, IL1B, TLR8, F2RL1, IL17A]
GO:0019221;cytokine-mediated signaling pathway;6.0;0.6039883530135606;0.6251144890969248;7.604142487995313;26.50247477320489;3.309374901576116;8.87013979980389E-4;0.49236189895841853;[AKT1, JUNB, PRKCD, FPR1, GATA3, FLRT2, HMOX1, HLA-DQA2, HLA-DQA1, HLA-DRB4, FN1, COL1A2, HLA-DRB1, CDKN1A, LRRC4, TIMP1, JAK3, HLA-DPA1, ANXA1, SERPINB2, IFNGR1, GPR35, RIPK2, IFNGR2, BGN, FOS, SIRT1, F3, FCER2, ZEB1, PLCB1, HLA-DQB1, CCL13, LRRC19, PTAFR, PTGS2, ALOX5, STAT4, CCL19, CCL18, IL12RB1, IL12RB2, CCL23, CCL21, CCL20, STAT1, IL10RA, PSMB8, HLA-DPB1, PF4, CSF3, CSF3R, CSF2, F13A1, IL5RA, RORA, CXCL13, TNF, PYCARD, IGHG1, MAP3K8, IL13RA2, TNFRSF4, IL13RA1, IFNA14, CISH, IFNA16, IFNA10, CSF1R, TNFRSF11A, FOXO1, SOCS2, TNFRSF17, CD300LF, IFNA21, TNFRSF9, TNFRSF10C, TNFRSF10B, NFKB1, CXCL10, CXCL11, CXCL12, BCL6, LCN2, BCL2, HLA-DRA, MYD88, BCL2L1, CIITA, ITGAM, ITGB2, PIK3CD, FASLG, TNFSF13B, ITGAX, CHUK, TNFRSF18, TNFRSF1B, IL3RA, XCL2, XCL1, BIRC5, LCP1, BIRC2, BIRC3, CX3CR1, CEBPA, CEBPD, NOD2, IL2RG, CCL8, CCL7, CCL5, CCL4, IL21R, CCL2, CCL1, FYN, FCGR1A, FCGR1B, PML, KLF6, IL2RA, IL2RB, PTPN6, IL1RN, IFITM1, IFI30, IFIT1, IFIT3, IFIT2, ICAM1, TNFSF11, TRIM25, IL15RA, RSAD2, ACSL1, IL1R1, IL1R2, HLA-B, FLT3LG, HLA-C, MIF, HLA-A, HLA-F, HLA-G, EREG, HLA-E, IFI27, IL23A, EBI3, TWIST1, INPP5D, CCR10, CCR1, EGR1, TNFSF14, TNFSF12, TNFSF13, LIF, PPBP, BST2, SDC1, CD27, IFNA5, IFNA4, IFNA7, CD40, TNFRSF13B, IFNA2, IFNA8, CCR9, CCR7, CCR6, CD36, CCR5, CCR3, CCR2, IL10, SYK, IL15, IL18, GP1BA, GAB2, IL17RB, VAV1, HCK, IL1A, CEACAM1, IL1B, KIT, RHOU, SP100, CXCR5, IFI6, CXCR4, CXCR6, CXCR1, CXCR3, CXCR2, IL32, CD74, IL33, OSM, PODN, CD40LG, IL18R1, IL17A, CD86, CD80, MPL, IL18RAP, CCRL2, IL6R, PRTN3, CSF2RB, CSF2RA, TGFB1, VCAM1, ISG15, NFKBIA, IL6, IL7R, CXCL6, CXCL9, CXCL1, CXCL3, CXCL2, CXCL5, OASL, LMNB1, GHR, LRRTM4, CASP1, MMP1, MMP2, IRAK3, MMP9, DCN, AIM2, IFNG, OAS1, OAS3, LTA, IRF7, IRF8, LTB, CAMK2D, SAMHD1, S1PR1, NCAM1, MX2, SOD2, CD4, LTBR]
GO:0002737;negative regulation of plasmacytoid dendritic cell cytokine production;9.0;1.0;0.896240625180289;9.628524252492122;463.4470243338501;9.777073627680469;0.01551115482921088;0.896240625180289;[BST2]
GO:1990668;vesicle fusion with endoplasmic reticulum-Golgi intermediate compartment (ERGIC) membrane;7.0;0.8933024483968273;0.7975705894556142;9.461470167828956;65.8060249050737;7.9853141584524145;0.0022024684319953925;0.7592887026755414;[TAP1]
GO:0010951;negative regulation of endopeptidase activity;10.0;0.7671156992804218;0.7987988615011312;9.446202695698167;500.3238742612354;4.2676852910524925;0.016745389809270216;0.6334906361130068;[PROS1, SERPINE1, SPINT2, AQP1, PTTG1, LAMP3, RPS6KA1, AKT1, APLP2, POR, SFRP2, SPINT1, SLPI, SERPING1, NAIP, C3, SFN, A2M, TNFSF14, TNFRSF10C, CRIM1, TNFRSF10B, DHCR24, VIL1, BST2, CD27, TNFAIP8, SERPINA1, ARRB1, ARRB2, TIMP2, TIMP3, TIMP1, CR1, SERPINB2, GPX1, PLAUR, SERPINB9, TNFRSF1B, MMP9, PAX2, COL6A3, BIRC5, BIRC2, LTF, BIRC3, SERPINB10, CSTA, LEF1, IFI6, NLRC4, PTGS2, CST7, THBS1, CST3, SPOCK2, SPOCK3, SNCA, KLF4, FABP1]
GO:0045071;negative regulation of viral genome replication;8.0;0.8933024483968273;0.8216512241984136;9.474373572664863;85.23964546052278;5.8067817141283475;0.0028528942228632634;0.6719590869034888;[IFITM1, IFIT1, TNF, OASL, CCL5, RSAD2, EIF2AK2, ISG15, BST2, PLSCR1, SLPI, OAS1, OAS3, APOBEC3A, LTF]
GO:0035457;cellular response to interferon-alpha;6.0;1.0;0.8231203125901445;9.628524252492122;81.6500655361772;7.474488534686424;0.0027327542132076126;0.7053660038532718;[GATA3, IFIT3, IFIT2]
GO:0016579;protein deubiquitination;9.0;0.7307253602413294;0.7616033053009538;9.151600180401813;202.59641706362558;4.174954806800768;0.0067807197541817285;0.6097480081553338;[CDC20, RUVBL1, PSMD3, SKP2, CDC25A, CFTR, PSMD14, ADRB2, GATA3, NLRP3, CLSPN, BARD1, NFKBIA, COPS5, CDK1, TNFAIP3, BRCA1, ARRB2, IFIH1, DDX58, ACTL6A, PSMA5, CCNA2, PSMA6, PSMA3, PSMA4, PSMA2, BIRC2, BIRC3, USP18, FAM105A, PSMB10, USP1, IL33, USP9Y, PSMB8, PSMC6, TNIP3, PSMC2, EIF3F]
GO:1901253;negative regulation of intracellular transport of viral material;8.0;1.0;0.875;9.628524252492122;128.34822619036495;9.083926447120524;0.004295699624687222;0.839552420951524;[BST2]
GO:0031295;T cell costimulation;9.0;0.9326813400603323;0.8625812952104552;9.587702257971866;354.8971974647038;5.845247994956144;0.011878089812402261;0.6951668794741764;[CD86, CD274, HHLA2, CD80, CD3E, TNFSF13B, DPP4, PAK1, KLRK1, LGALS1, GRAP2, BTLA, AKT1, CTLA4, FYN, CSK, MAP3K8, CCL19, ICOS, ICOSLG, LYN, TNFSF14, CCL21, CAV1, PDCD1LG2, VAV1, CD40LG, LCK, CD5, CD28, PTPN6, CD24, CARD11]
GO:0033198;response to ATP;6.0;0.9326813400603323;0.7894609826203107;9.56398573135455;115.93137747960115;6.375876246018314;0.0038801188727762915;0.6491829203200885;[TRPC3, PTGS2, SLC8A1, P2RX5, SELL, P2RX1, IL1B, CASP1]
GO:0031296;B cell costimulation;9.0;1.0;0.896240625180289;9.628524252492122;298.24063740046915;8.67846133901236;0.009981845734645991;0.8400575416471059;[CD320, TNFSF13B]
GO:0060338;regulation of type I interferon-mediated signaling pathway;7.0;0.8653626801206646;0.7836007053175329;9.503361109538115;103.51609522721039;6.481236761676141;0.003464590548817385;0.6823701146576509;[ZBP1, USP18, MMP12, IRF7, PTPN6]
GO:0048305;immunoglobulin secretion;9.0;0.9326813400603323;0.8625812952104552;9.571365838652174;133.331941423656;8.390779266560578;0.004462500088492957;0.8253454670833372;[CD40LG, TNFSF13B]
GO:1902741;positive regulation of interferon-alpha secretion;10.0;1.0;0.9152410118609203;9.628524252492122;774.0580298608876;7.8311634786251565;0.025907025652444588;0.8157270763441555;[MMP12, IFIH1, CHUK, DDX58]
GO:0051281;positive regulation of release of sequestered calcium ion into cytosol;13.0;0.8933024483968273;0.9092061889660501;9.585964638073326;905.0686146861244;6.139487467954083;0.03029183202467376;0.7765286393941734;[CXCL9, TRPC1, F2R, THY1, CXCL10, CXCL11, JPH2, CD19, XCL1, CALM3, PLCG1, F2RL3, SNCA]
GO:0002230;positive regulation of defense response to virus by host;8.0;1.0;0.875;9.628524252492122;73.08237040089334;6.599019797332524;0.0024460011674546805;0.712474179321389;[DDX58, STAT1, LILRB1, PARP9, AIM2, IL23A, IL12RB1]
GO:0046967;cytosol to ER transport;5.0;1.0;0.7902410118609202;9.628524252492122;33.20429938101479;9.083926447120524;0.0011113180183532213;0.7547934328124444;[TAP1]
GO:0001782;B cell homeostasis;7.0;0.9326813400603323;0.8172600352873667;9.510741216835738;22.00128503895464;6.599019797332524;7.363632103827933E-4;0.6883935445785896;[LYN, MEF2C, TNFRSF13B, TNFAIP3, TNFSF13B, BCL2, NCKAP1L, PKN1]
GO:0060337;type I interferon signaling pathway;7.0;1.0;0.8509193652572005;9.628524252492122;30.19135422731818;5.587418885654044;0.00101047745553359;0.6366602269110988;[IFNA5, IFNA4, IFNA7, SP100, IFITM1, IFNA2, IFI6, SAMHD1, IFIT1, IFNA8, IFIT3, IFIT2, OASL, IFNA21, EGR1, IFNA14, RSAD2, IFNA16, STAT1, MX2, HLA-B, HLA-C, ISG15, HLA-A, HLA-F, HLA-G, PSMB8, HLA-E, BST2, IFI27, OAS1, OAS3, IRF7, IRF8, MYD88, IFNA10]
GO:0006511;ubiquitin-dependent protein catabolic process;8.0;0.7369933605727446;0.7434966802863723;9.190269321560967;156.4521708431119;3.582668236575797;0.005236313360306564;0.5582178202295975;[, CCNF, CDC20, CDC23, PSMD3, TRIM25, SKP2, CDC34, NEDD4L, ANAPC10, HACE1, PLK1, TGFB1I1, KIF14, SIRT1, PSMA5, PSMA6, RNF144B, PSMA3, PSMA4, PSMA2, DERL3, PCNP, USP1, RANBP2, RANBP1, USP9Y, PSMB8, PSMC6, NEDD4, PSMC2, MAD2L1, BUB1B, PTTG1, RNF43, PSMD14, CUL5, UBR1, CCNB1, WFS1, UBE2C, UBE2S, CDK1, ARRB1, ARRB2, DTL, BIRC2, UHRF1, VPS4B, RNF6, USP18, AURKB, PSMB10, AURKA, ZNRF1, TBX21, RNF24, PML]
GO:0007517;muscle organ development;4.0;0.7763722522362496;0.6381861261181248;8.753055515138222;27.682183388997124;5.085725745451326;9.264977656821302E-4;0.5100842511328143;[ACHE, TAGLN, LAMA2, TWIST1, AEBP1, SGCE, BASP1, DMD, MEF2A, MEF2C, EGR3, ETV1, IGF1, SIRT1, CXCL10, CENPF, ITGA7, COL6A3, HBEGF]
GO:0071260;cellular response to mechanical stimulus;5.0;1.0;0.7902410118609202;9.628524252492122;56.1235610070294;5.420364800990877;0.00187840507897962;0.5674387198563348;[CD40, AQP1, CHEK1, CASP1, AKT1, CASP2, IL1B, TLR8, TLR7, TLR5, TLR4, ENG, PTGS2, EGFR, KCNJ2, CASP8AP2, TGFB1, TNFSF14, TNFRSF10B, NFKB1, COL1A1, LTBR, MYD88]
GO:0071222;cellular response to lipopolysaccharide;6.0;1.0;0.8231203125901445;9.628524252492122;237.99812851129587;4.786641040901733;0.007965583176863442;0.5679093580234316;[CD86, CXCL6, CXCL9, CD40, IL1RN, CSF3, CSF2, CD80, GFI1, SERPINE1, HMGB2, TNFAIP3, CXCL1, CXCL13, CXCL3, CXCL2, CXCL5, ICAM1, PYCARD, EDNRB, PDE4B, CASP1, CTSG, CD36, CCR5, HAVCR2, IL10, GHSR, MEF2C, ARG1, PDE4D, CD180, PDCD1LG2, TNFRSF1B, IL1B, RARA, ADAM9, IRF8, TLR4, CX3CR1, CD274, CEBPB, CEBPE, SBNO2, KLRK1, STAP1, NLRP3, CCL2, CD14, ABCA1, CCL20, NR1H2, DEFA4, NR1H4, LILRB1, DEFA1, LILRB2, PPBP, MAPK14, NFKB1, CXCL10, CXCL11, IL6, CDK4, TNIP3, PF4]
GO:0045087;innate immune response;4.0;0.6799073451904818;0.5899536725952409;8.162187183698695;26.470038109745843;3.422703586883119;8.859283540455166E-4;0.42503722060519694;[, CLEC10A, ADARB1, SLA2, HERC5, LGALS3, TRBC1, DHX58, TRIM25, PGLYRP1, RNASE6, RNASE3, MIF, HLA-E, SLPI, IL23A, BTK, SERPING1, PADI4, TRIM10, NAIP, CFB, CFD, CFH, PRKDC, TXK, CFI, GATA3, CD1D, CFP, LY9, C2, C3, KLRK1, C7, SLAMF7, S100A12, CD14, IGHA1, SLAMF1, LYN, SIGLEC16, KIR2DS1, KIR2DS2, SH2D1A, KIR2DS4, KIR2DS5, EIF2AK2, PTK2, BST2, MARCO, VNN1, APOBEC3A, APOBEC3B, IFNA5, IFNA4, IGHM, ITK, IFNA7, IFNA2, IFNA8, IFIH1, JAK3, CAMP, HAVCR2, ANXA1, FCER1G, SYK, ARG1, RIPK2, IL18, PARP9, TLR1, HCK, IGHD, TLR8, TLR10, TLR7, TLR6, TLR5, TLR4, TLR2, C1QB, C1QA, LILRA2, LILRA5, RELB, IGKC, CARD9, NR1H4, KIR3DL1, IGLL5, F2RL1, LGR4, C1QC, FCN1, NCF1, NCF2, SLA, CLU, PYCARD, IGHG1, GRAP2, CLEC5A, CD177, ZBP1, IFNA14, IFNA16, CD180, MATK, CYBB, CLEC4A, CLEC4D, TYROBP, CLEC4E, S100A9, S100A8, IFNA10, BLK, CSF1R, LY96, DDX60, CORO1A, CLEC7A, NLRP3, IFNA21, TGFB1, DEFA4, LY86, DEFA1, BMX, NFKB1, NFKB2, FES, LCN2, KLRD1, SERINC5, ITGAM, KIR3DS1, CRISP3, HMGB2, PIK3CD, TREM2, TREM1, SIRPB1, PSTPIP1, CR2, CR1, CHUK, DDX58, FGR, ZAP70, AIM2, LCK, IRF7, LTF, COLEC12, C1S, UNC93B1, C1R, HIST1H2BK, IGHV3-48, NLRC4, NOD2, FYN, CSK, MX2, GZMB, PML, GZMM, CD6, PTX3, PTPN6, CD244]
GO:0070098;chemokine-mediated signaling pathway;7.0;0.7307253602413294;0.7162820453778652;8.999915593069748;30.19135422731818;5.459585514144159;0.00101047745553359;0.6301228223472235;[CX3CR1, CXCL6, CCL13, CXCL9, CXCR5, MPL, CXCR4, CXCL1, CXCR6, CXCL13, CXCL3, CXCL2, CXCL5, CCL8, CXCR1, CCL7, CCL5, CXCR3, CXCR2, CCRL2, CCL4, CCR9, CCL2, CCL1, CCR7, CCR6, CCL19, CCR5, CCL18, CCR10, CCR3, CCR2, CCR1, CCL23, CCL21, CCL20, GPR35, PPBP, CXCL10, CXCL11, CXCL12, XCL2, XCL1, PF4]
GO:0043065;positive regulation of apoptotic process;7.0;0.5587538620495764;0.6302962962819887;7.806911820114386;80.91235068524658;3.3969510907807043;0.0027080635610472266;0.5246396020141064;[MYB, AKT1, CYP1B1, HOXA5, MEF2C, DAPK1, PRKCD, ATF3, PRKDC, HMOX1, SFN, PLCG1, BARD1, LYN, JUN, FOSL1, NOX4, NOX1, SRPX, ADM, CTLA4, TIMP3, ANXA1, DUSP1, RIPK2, PAWR, SIRT1, F3, DUSP6, AES, PTGS2, FGD3, FGD4, FRZB, CASP8AP2, GSN, BIK, CDKN2A, G0S2, POU4F1, TNF, CTGF, PYCARD, IGFBP3, F2R, MELK, MAL, ADAM8, S100A9, S100A8, CD274, FOXO1, NACC2, MAP2K6, TNFRSF10B, BCL6, CDK4, BCL2, MAP3K11, BCL2L1, PLEKHF1, PIK3CD, FASLG, ARRB1, ARRB2, CYR61, ITGA4, TFDP1, LCK, NLRC4, CCL5, E2F1, CCL2, GZMA, GZMB, PML, P2RX1, MNDA, IFIT2, PPP2R1A, CHEK2, SOX7, SOX4, TIAM2, SFRP4, SFRP2, CDC34, IFI27, SIK1, INPP5D, TP53BP2, GADD45B, TNFSF12, ITM2C, TOP2A, CD40, CTSZ, CTSH, IL10, VAV1, IL1B, CXCR2, CTNNA1, APBB1, SORT1, AKR1C3, LILRB1, PPP1CA, NLRP12, CD40LG, FAP, DLC1, TGM2, PDGFRB, NLRP3, ECT2, TGFB2, TGFB1, VDR, CAV1, INHBA, EIF2S1, IL6, BMP2, NR4A3, JMY, NFKBID, UBE2M, TNFAIP8, CASP1, CASP2, MYBL2, YWHAH, ARHGEF12, PLAUR, MMP9, DNM2, IFNG, LTA, CAMK2D, BCL2A1, THBS1, HSPD1, CNR1, SNCA, HSPE1, SOD2, LTBR]
GO:0030593;neutrophil chemotaxis;9.0;1.0;0.896240625180289;9.628524252492122;130.2972973825895;5.382624473008031;0.004360933283440787;0.671508291047556;[CXCL6, CCL13, CXCL9, IL1RN, CSF3R, C5AR1, ITGB2, PIK3CD, CXCL1, CXCL13, CXCL3, CXCL2, CXCL5, LGALS3, CCL8, CXCR1, CCL7, CCL5, CXCR2, CCL4, PDE4B, CCL2, S100A12, CCL1, NCKAP1L, CCL19, CCL18, CCL23, TGFB2, CXADR, FCER1G, SYK, CCL21, CCL20, PDE4D, PPBP, VAV1, CXCL10, CXCL11, IL1B, XCL2, XCL1, S100A9, S100A8, PF4, ITGA9]
GO:0039529;RIG-I signaling pathway;13.0;1.0;0.9625549647676366;9.628524252492122;557.6110095859297;9.083926447120524;0.018662738673513177;0.9271073857191605;[DDX58]
GO:0016540;protein autoprocessing;7.0;1.0;0.8509193652572005;9.628524252492122;102.5832240862455;7.138016298065211;0.00343336819125881;0.7159578506919597;[CASP1, TMPRSS2]
GO:0071346;cellular response to interferon-gamma;6.0;1.0;0.8231203125901445;9.628524252492122;81.6500655361772;5.266214121163619;0.0027327542132076126;0.5924347476504533;[CASP1, HLA-DPA1, EDN1, DAPK1, KIF16B, XCL2, XCL1, IRF8, TLR4, TLR2, CCL13, STXBP2, AIF1, CCL8, CCL7, CCL5, CCL4, CCL2, CCL1, CD58, CCL19, CCL18, IL12RB1, CCL23, GSN, CCL21, CCL20, STAT1, RPS6KB1, ZYX]
