id	name	nbGenes	ICSeco	ICZhou	ICSanchez	ICMazandu
GO:0044237	cellular metabolic process	1202	0.16	0.21	2.71	13.80
GO:0031323	regulation of cellular metabolic process	816	0.22	0.36	4.01	22.77
GO:0048522	positive regulation of cellular process	681	0.24	0.37	3.90	23.85
GO:0006139	nucleobase-containing compound metabolic process	625	0.29	0.40	5.40	96.28
GO:0072527	pyrimidine-containing compound metabolic process	16	0.52	0.51	7.55	90.26
GO:0010468	regulation of gene expression	600	0.35	0.46	5.09	13.73
GO:0048523	negative regulation of cellular process	597	0.24	0.37	3.90	23.93
GO:0019538	protein metabolic process	558	0.31	0.41	4.91	44.77
GO:0007165	signal transduction	511	0.36	0.43	5.06	19.43
GO:0045454	cell redox homeostasis	6	1.00	0.79	9.63	31.94
GO:0043401	steroid hormone mediated signaling pathway	19	0.75	0.70	8.80	25.74
GO:0030091	protein repair	2	0.80	0.72	9.22	83.35
GO:0044267	cellular protein metabolic process	493	0.34	0.46	5.57	80.87
GO:0020027	hemoglobin metabolic process	1	0.89	0.74	9.46	80.87
GO:0006355	regulation of transcription, DNA-templated	477	0.40	0.60	6.84	245.35
GO:0034654	nucleobase-containing compound biosynthetic process	413	0.40	0.49	6.85	317.02
GO:0051716	cellular response to stimulus	408	0.35	0.30	4.36	13.53
GO:0009966	regulation of signal transduction	381	0.33	0.45	5.35	37.59
GO:0032268	regulation of cellular protein metabolic process	378	0.37	0.51	6.13	70.76
GO:0051128	regulation of cellular component organization	365	0.30	0.40	4.57	12.04
GO:0006996	organelle organization	326	0.39	0.39	5.17	14.95
GO:0046907	intracellular transport	284	0.46	0.48	6.38	29.65
GO:0031328	positive regulation of cellular biosynthetic process	262	0.41	0.53	6.32	170.14
GO:0044248	cellular catabolic process	256	0.31	0.36	4.57	26.23
GO:0010033	response to organic substance	252	0.35	0.37	4.75	9.28
GO:0015031	protein transport	242	0.48	0.59	6.99	54.46
GO:0060341	regulation of cellular localization	133	0.40	0.45	5.64	10.45
GO:0051049	regulation of transport	241	0.31	0.40	4.67	10.45
GO:0051247	positive regulation of protein metabolic process	238	0.44	0.54	6.72	129.04
GO:0065003	protein-containing complex assembly	237	0.45	0.48	6.06	36.47
GO:0042981	regulation of apoptotic process	208	0.45	0.55	6.60	16.23
GO:0033043	regulation of organelle organization	207	0.36	0.47	5.49	15.89
GO:0043085	positive regulation of catalytic activity	205	0.48	0.49	6.15	18.32
GO:0009967	positive regulation of signal transduction	201	0.44	0.54	6.71	140.23
GO:0051240	positive regulation of multicellular organismal process	200	0.35	0.42	4.98	23.60
GO:2000113	negative regulation of cellular macromolecule biosynthetic process	188	0.50	0.60	7.60	369.32
GO:0051130	positive regulation of cellular component organization	185	0.42	0.50	5.95	43.84
GO:0071310	cellular response to organic substance	173	0.44	0.47	5.95	41.66
GO:0010923	negative regulation of phosphatase activity	15	0.79	0.79	9.36	265.75
GO:0032269	negative regulation of cellular protein metabolic process	164	0.47	0.59	7.45	289.39
GO:0030154	cell differentiation	170	0.39	0.39	5.18	16.68
GO:0031401	positive regulation of protein modification process	170	0.51	0.63	7.86	366.05
GO:0010033	response to organic substance	252	0.35	0.37	4.75	9.28
GO:0042493	response to drug	79	0.47	0.43	5.84	9.28
GO:0009636	response to toxic substance	42	0.58	0.49	6.94	9.28
GO:1901700	response to oxygen-containing compound	166	0.39	0.39	5.14	9.28
GO:0009968	negative regulation of signal transduction	162	0.44	0.54	6.68	140.65
GO:0045937	positive regulation of phosphate metabolic process	148	0.51	0.60	7.47	145.91
GO:0034613	cellular protein localization	143	0.45	0.48	6.33	26.83
GO:1901566	organonitrogen compound biosynthetic process	129	0.37	0.43	5.45	46.74
GO:0019637	organophosphate metabolic process	128	0.37	0.43	5.66	31.07
GO:0051241	negative regulation of multicellular organismal process	124	0.35	0.42	4.99	23.69
GO:0051241	negative regulation of multicellular organismal process	124	0.35	0.42	4.99	23.69
GO:0019752	carboxylic acid metabolic process	117	0.32	0.45	5.31	42.50
GO:0044255	cellular lipid metabolic process	117	0.38	0.44	5.89	38.02
GO:0044255	cellular lipid metabolic process	117	0.38	0.44	5.89	38.02
GO:0045597	positive regulation of cell differentiation	104	0.45	0.51	6.57	82.53
GO:0045667	regulation of osteoblast differentiation	13	0.83	0.70	9.41	40.23
GO:0043068	positive regulation of programmed cell death	105	0.54	0.60	7.55	59.39
GO:1901216	positive regulation of neuron death	14	0.81	0.73	9.26	58.38
GO:0031400	negative regulation of protein modification process	104	0.53	0.64	7.94	366.95
GO:0043207	response to external biotic stimulus	98	0.41	0.40	5.91	16.64
GO:0002274	myeloid leukocyte activation	95	0.68	0.59	8.67	18.06
GO:0032101	regulation of response to external stimulus	95	0.40	0.45	5.60	11.65
GO:0045786	negative regulation of cell cycle	95	0.51	0.54	7.10	42.35
GO:1903827	regulation of cellular protein localization	90	0.48	0.53	6.86	25.72
GO:0055086	nucleobase-containing small molecule metabolic process	90	0.38	0.48	6.63	107.58
GO:0034220	ion transmembrane transport	90	0.45	0.51	6.18	26.33
GO:1901990	regulation of mitotic cell cycle phase transition	83	0.61	0.66	8.15	36.35
GO:1903530	regulation of secretion by cell	83	0.44	0.54	6.38	28.69
GO:0051960	regulation of nervous system development	81	0.45	0.52	6.58	27.38
GO:0002685	regulation of leukocyte migration	27	0.56	0.63	8.17	50.83
GO:0030335	positive regulation of cell migration	72	0.58	0.64	8.22	157.26
GO:0006893	Golgi to plasma membrane transport	10	0.89	0.80	9.51	32.11
GO:0006897	endocytosis	69	0.63	0.61	8.09	26.36
GO:0006893	Golgi to plasma membrane transport	10	0.89	0.80	9.51	32.11
GO:0006897	endocytosis	69	0.63	0.61	8.09	26.36
GO:1900223	positive regulation of amyloid-beta clearance	2	1.00	0.79	9.63	41.04
GO:0001819	positive regulation of cytokine production	74	0.51	0.54	6.97	44.26
GO:0070925	organelle assembly	76	0.61	0.55	7.53	37.31
GO:0045087	innate immune response	72	0.68	0.59	8.16	26.47
GO:0002764	immune response-regulating signaling pathway	70	0.59	0.58	7.89	48.80
GO:0000226	microtubule cytoskeleton organization	63	0.58	0.58	7.66	30.31
GO:0031023	microtubule organizing center organization	12	0.73	0.56	8.47	24.42
GO:0016477	cell migration	68	0.47	0.48	6.31	17.13
GO:0048468	cell development	68	0.51	0.45	6.51	28.42
GO:0009117	nucleotide metabolic process	68	0.44	0.57	7.31	170.44
GO:0051707	response to other organism	68	0.42	0.46	6.41	24.63
GO:0034655	nucleobase-containing compound catabolic process	68	0.48	0.53	7.63	314.02
GO:0061024	membrane organization	67	0.47	0.43	6.06	14.95
GO:0051346	negative regulation of hydrolase activity	66	0.57	0.58	7.50	33.09
GO:0045088	regulation of innate immune response	65	0.47	0.56	6.78	42.47
GO:0003006	developmental process involved in reproduction	62	0.43	0.34	5.07	14.49
GO:0043161	proteasome-mediated ubiquitin-dependent protein catabolic process	60	0.76	0.78	9.31	348.36
GO:0050863	regulation of T cell activation	58	0.52	0.61	7.60	29.19
GO:1903706	regulation of hemopoiesis	57	0.50	0.54	7.23	38.17
GO:0006091	generation of precursor metabolites and energy	57	0.53	0.46	6.54	17.52
GO:0071214	cellular response to abiotic stimulus	56	0.59	0.54	7.66	24.78
GO:0001558	regulation of cell growth	55	0.58	0.58	7.66	26.25
GO:0071417	cellular response to organonitrogen compound	54	0.53	0.56	7.37	128.53
GO:0030003	cellular cation homeostasis	54	0.57	0.63	8.00	68.30
GO:0000902	cell morphogenesis	28	0.63	0.56	7.92	43.26
GO:0048812	neuron projection morphogenesis	28	0.65	0.68	8.50	63.00
GO:0071396	cellular response to lipid	51	0.60	0.59	7.70	61.75
GO:0044772	mitotic cell cycle phase transition	51	0.84	0.67	9.04	28.43
GO:0006518	peptide metabolic process	50	0.56	0.57	7.65	56.97
GO:0046394	carboxylic acid biosynthetic process	49	0.44	0.54	6.80	162.02
GO:0030036	actin cytoskeleton organization	48	0.63	0.61	8.05	29.61
GO:0030100	regulation of endocytosis	46	0.59	0.62	8.15	44.91
GO:0034976	response to endoplasmic reticulum stress	45	0.68	0.59	8.28	29.00
GO:0006650	glycerophospholipid metabolic process	44	0.59	0.62	8.12	144.72
GO:0015711	organic anion transport	43	0.43	0.54	6.27	28.20
GO:0032535	regulation of cellular component size	43	0.60	0.55	7.84	25.54
GO:0050870	positive regulation of T cell activation	41	0.63	0.69	8.78	216.07
GO:0001666	response to hypoxia	40	0.81	0.70	9.12	21.16
GO:0030031	cell projection assembly	36	0.67	0.59	8.12	35.52
GO:0043434	response to peptide hormone	35	0.67	0.66	8.71	71.33
GO:0019886	antigen processing and presentation of exogenous peptide antigen via MHC class II	34	1.00	0.79	9.63	42.20
GO:0017157	regulation of exocytosis	34	0.59	0.65	8.02	60.10
GO:0045666	positive regulation of neuron differentiation	33	0.62	0.68	8.71	337.32
GO:0016042	lipid catabolic process	33	0.51	0.51	6.88	43.15
GO:0005996	monosaccharide metabolic process	32	0.51	0.51	7.00	29.98
GO:0009152	purine ribonucleotide biosynthetic process	31	0.63	0.73	9.03	3100.80
GO:0050804	modulation of chemical synaptic transmission	30	0.52	0.58	7.24	27.32
GO:0007275	multicellular organism development	30	0.70	0.55	8.18	19.32
GO:0120032	regulation of plasma membrane bounded cell projection assembly	30	0.63	0.67	8.36	49.28
GO:0010952	positive regulation of peptidase activity	30	0.71	0.75	9.38	435.08
GO:0008064	regulation of actin polymerization or depolymerization	29	0.67	0.73	9.05	119.89
GO:0000302	response to reactive oxygen species	29	0.71	0.60	8.78	25.34
GO:0048608	reproductive structure development	29	0.61	0.50	7.37	31.35
GO:2000146	negative regulation of cell motility	29	0.58	0.61	8.02	116.39
GO:0031669	cellular response to nutrient levels	28	0.55	0.57	7.65	58.45
GO:0140056	organelle localization by membrane tethering	26	0.73	0.62	8.53	19.19
GO:0048589	developmental growth	26	0.55	0.40	6.36	12.22
GO:0090316	positive regulation of intracellular protein transport	26	0.71	0.73	9.11	289.79
GO:0071248	cellular response to metal ion	25	0.70	0.64	8.46	59.28
GO:0006869	lipid transport	24	0.55	0.57	7.06	14.73
GO:0051100	negative regulation of binding	22	0.62	0.56	7.57	18.50
GO:0034329	cell junction assembly	22	0.71	0.61	8.53	35.01
GO:0034614	cellular response to reactive oxygen species	21	0.77	0.67	9.20	144.09
GO:0016241	regulation of macroautophagy	21	0.67	0.69	8.61	45.30
GO:0016125	sterol metabolic process	21	0.71	0.64	8.71	52.06
GO:0007268	chemical synaptic transmission	21	0.74	0.72	8.66	23.17
GO:0002576	platelet degranulation	20	1.00	0.88	9.63	39.86
GO:0050729	positive regulation of inflammatory response	20	0.66	0.68	8.59	125.85
GO:0050715	positive regulation of cytokine secretion	20	0.69	0.74	9.07	549.48
GO:0009306	protein secretion	20	0.57	0.66	7.92	130.29
GO:0044703	multi-organism reproductive process	19	0.69	0.47	7.64	14.23
GO:0033198	response to ATP	5	0.93	0.79	9.56	115.93
GO:0033273	response to vitamin	14	0.67	0.66	8.44	22.82
GO:0007611	learning or memory	18	0.70	0.64	8.38	19.74
GO:0035239	tube morphogenesis	18	0.56	0.48	6.58	10.94
GO:0046718	viral entry into host cell	17	0.77	0.73	8.94	28.37
GO:0030217	T cell differentiation	17	0.66	0.65	8.68	65.05
GO:1903169	regulation of calcium ion transmembrane transport	17	0.63	0.69	8.50	58.21
GO:0042177	negative regulation of protein catabolic process	17	0.71	0.71	9.11	231.82
GO:0046651	lymphocyte proliferation	16	0.69	0.63	8.73	28.26
GO:0030854	positive regulation of granulocyte differentiation	1	0.87	0.83	9.51	841.29
GO:0045621	positive regulation of lymphocyte differentiation	16	0.67	0.71	9.10	508.22
GO:0010977	negative regulation of neuron projection development	16	0.68	0.73	9.14	494.13
GO:0044262	cellular carbohydrate metabolic process	15	0.46	0.48	6.72	38.14
GO:1900371	regulation of purine nucleotide biosynthetic process	15	0.64	0.71	8.94	257.37
GO:0048469	cell maturation	14	0.70	0.55	8.24	25.22
GO:0051492	regulation of stress fiber assembly	14	0.89	0.86	9.49	106.76
GO:0051341	regulation of oxidoreductase activity	14	0.58	0.54	7.59	19.99
GO:0072384	organelle transport along microtubule	14	0.68	0.69	8.94	89.06
GO:0002709	regulation of T cell mediated immunity	13	0.65	0.67	8.73	46.32
GO:0043300	regulation of leukocyte degranulation	13	0.68	0.74	8.94	77.23
GO:0002573	myeloid leukocyte differentiation	12	0.74	0.66	8.74	45.13
GO:1903901	negative regulation of viral life cycle	12	0.76	0.73	9.04	63.59
GO:1900026	positive regulation of substrate adhesion-dependent cell spreading	12	1.00	0.88	9.63	350.52
GO:0030198	extracellular matrix organization	12	0.68	0.59	8.24	16.90
GO:0009749	response to glucose	12	0.89	0.80	9.41	32.96
GO:2000379	positive regulation of reactive oxygen species metabolic process	12	0.78	0.71	9.25	112.72
GO:0055072	iron ion homeostasis	11	0.81	0.80	9.29	38.23
GO:0042130	negative regulation of T cell proliferation	10	0.78	0.78	9.42	581.93
GO:0006986	response to unfolded protein	10	0.87	0.72	9.34	23.96
GO:0001776	leukocyte homeostasis	10	0.75	0.67	8.65	18.82
GO:0031623	receptor internalization	10	0.72	0.71	9.20	64.85
GO:0007595	lactation	9	1.00	0.82	9.63	25.96
GO:0031175	neuron projection development	9	0.68	0.63	8.33	18.96
GO:0051402	neuron apoptotic process	9	0.83	0.70	9.02	23.44
GO:1990138	neuron projection extension	8	0.81	0.66	9.22	50.60
GO:0061621	canonical glycolysis	8	1.00	0.99	9.63	17318.20
GO:0019048	modulation by virus of host morphology or physiology	8	0.52	0.58	7.27	41.65
GO:0016239	positive regulation of macroautophagy	8	0.77	0.76	9.24	266.07
GO:0010569	regulation of double-strand break repair via homologous recombination	7	0.84	0.82	9.52	184.48
GO:0045616	regulation of keratinocyte differentiation	7	0.83	0.76	9.46	71.49
GO:0045907	positive regulation of vasoconstriction	6	0.89	0.82	9.58	103.52
GO:0090303	positive regulation of wound healing	6	0.70	0.70	8.75	62.35
GO:0001657	ureteric bud development	5	1.00	0.88	9.63	36.92
GO:0048538	thymus development	5	1.00	0.79	9.63	35.89
GO:0048701	embryonic cranial skeleton morphogenesis	5	1.00	0.82	9.63	46.18
GO:0033630	positive regulation of cell adhesion mediated by integrin	5	0.93	0.76	9.49	34.62
GO:0060071	Wnt signaling pathway, planar cell polarity pathway	5	0.74	0.77	9.09	99.04
GO:0050808	synapse organization	5	0.70	0.55	8.12	14.95
GO:0006744	ubiquinone biosynthetic process	5	0.83	0.76	9.41	357.54
GO:0071404	cellular response to low-density lipoprotein particle stimulus	5	1.00	0.82	9.63	56.75
GO:0034105	positive regulation of tissue remodeling	5	0.78	0.68	9.09	42.29
GO:0090050	positive regulation of cell migration involved in sprouting angiogenesis	4	1.00	0.93	9.63	645.24
GO:0060043	regulation of cardiac muscle cell proliferation	4	0.89	0.84	9.52	128.60
GO:0098815	modulation of excitatory postsynaptic potential	4	0.79	0.74	9.39	100.66
GO:0030042	actin filament depolymerization	4	0.93	0.82	9.55	62.22
GO:0043371	negative regulation of CD4-positive, alpha-beta T cell differentiation	4	0.80	0.83	9.54	1833.42
GO:0071801	regulation of podosome assembly	4	0.89	0.80	9.43	64.45
GO:0042744	hydrogen peroxide catabolic process	4	0.93	0.79	9.56	235.80
GO:0035176	social behavior	4	1.00	0.70	9.63	22.58
GO:0006068	ethanol catabolic process	3	1.00	0.85	9.63	292.84
GO:0070236	negative regulation of activation-induced cell death of T cells	3	1.00	0.93	9.63	227.77
GO:0015677	copper ion import	3	0.89	0.84	9.43	21.37
GO:2000643	positive regulation of early endosome to late endosome transport	3	1.00	0.88	9.63	187.58
GO:0042246	tissue regeneration	3	0.76	0.63	8.94	42.89
GO:0030049	muscle filament sliding	3	1.00	0.82	9.63	20.96
GO:0042220	response to cocaine	3	0.93	0.79	9.55	106.25
GO:0090330	regulation of platelet aggregation	3	0.83	0.81	9.53	97.24
GO:0120033	negative regulation of plasma membrane bounded cell projection assembly	3	0.75	0.75	9.09	119.20
GO:1901017	negative regulation of potassium ion transmembrane transporter activity	3	0.79	0.81	9.42	728.71
GO:0051895	negative regulation of focal adhesion assembly	3	1.00	0.88	9.63	270.76
GO:0034115	negative regulation of heterotypic cell-cell adhesion	2	1.00	0.88	9.63	130.13
GO:0090237	regulation of arachidonic acid secretion	2	0.89	0.84	9.49	83.14
GO:0003417	growth plate cartilage development	2	1.00	0.82	9.63	33.90
GO:0002554	serotonin secretion by platelet	2	1.00	0.92	9.63	131.65
GO:0035810	positive regulation of urine volume	2	0.93	0.76	9.51	23.90
GO:0030214	hyaluronan catabolic process	2	1.00	0.88	9.63	501.28
GO:0007628	adult walking behavior	2	1.00	0.75	9.63	34.94
GO:0030853	negative regulation of granulocyte differentiation	2	0.87	0.83	9.51	843.04
GO:0070295	renal water absorption	2	0.93	0.82	9.54	39.40
GO:0055010	ventricular cardiac muscle tissue morphogenesis	2	0.79	0.72	9.12	15.29
GO:0034184	positive regulation of maintenance of mitotic sister chromatid cohesion	2	0.87	0.87	9.54	1023.09
GO:2000483	negative regulation of interleukin-8 secretion	2	1.00	0.92	9.63	753.97
GO:0019064	fusion of virus membrane with host plasma membrane	2	0.93	0.82	9.54	56.73
GO:0019695	choline metabolic process	2	0.81	0.70	9.25	54.91
GO:0007016	cytoskeletal anchoring at plasma membrane	2	1.00	0.82	9.63	66.89
GO:2000651	positive regulation of sodium ion transmembrane transporter activity	2	0.83	0.83	9.46	676.01
GO:0001696	gastric acid secretion	1	0.87	0.76	9.34	27.79
GO:0046323	glucose import	1	0.89	0.86	9.46	38.21
GO:0045475	locomotor rhythm	1	1.00	0.75	9.63	28.71
GO:2000310	regulation of NMDA receptor activity	1	0.89	0.84	9.54	200.75
GO:0033004	negative regulation of mast cell activation	1	0.87	0.78	9.55	126.92
GO:0031076	embryonic camera-type eye development	1	1.00	0.85	9.63	37.01
GO:1903917	positive regulation of endoplasmic reticulum stress-induced eIF2 alpha dephosphorylation	1	1.00	0.92	9.63	1202.23
GO:0051295	establishment of meiotic spindle localization	1	0.93	0.82	9.58	112.08
GO:0002924	negative regulation of humoral immune response mediated by circulating immunoglobulin	1	0.89	0.86	9.59	509.00
GO:1904681	response to 3-methylcholanthrene	1	0.93	0.79	9.49	32.41
GO:0006580	ethanolamine metabolic process	1	0.89	0.82	9.52	154.05
GO:0014891	striated muscle atrophy	1	0.89	0.77	9.41	39.63
GO:0035116	embryonic hindlimb morphogenesis	1	1.00	0.82	9.63	58.81
GO:0048642	negative regulation of skeletal muscle tissue development	1	0.79	0.77	9.31	215.72
GO:0010020	chloroplast fission	1	1.00	0.82	9.63	42.36
GO:0031394	positive regulation of prostaglandin biosynthetic process	1	0.93	0.88	9.59	954.14
GO:0097187	dentinogenesis	1	1.00	0.82	9.63	26.74
GO:0060179	male mating behavior	1	0.76	0.67	8.71	21.24
GO:0085032	modulation by symbiont of host I-kappaB kinase/NF-kappaB cascade	1	0.93	0.84	9.58	107.53
GO:0061052	negative regulation of cell growth involved in cardiac muscle cell development	1	1.00	0.92	9.63	1870.60
GO:1904719	positive regulation of AMPA glutamate receptor clustering	1	1.00	0.92	9.63	255.30
GO:0051873	killing by host of symbiont cells	1	0.81	0.76	9.45	141.48
GO:0045198	establishment of epithelial cell apical/basal polarity	1	0.89	0.77	9.51	84.75
GO:0052501	positive regulation by organism of apoptotic process in other organism involved in symbiotic interaction	1	0.84	0.84	9.60	492.85
GO:0036496	regulation of translational initiation by eIF2 alpha dephosphorylation	1	0.93	0.88	9.61	674.63
