id	name	nbGenes	ICSeco	ICZhou	ICSanchez	ICMazandu
GO:0048523	negative regulation of cellular process	309	0.24	0.37	3.90	23.93
GO:0043312	neutrophil degranulation	114	1.00	0.90	9.63	132.80
GO:0065003	protein-containing complex assembly	98	0.45	0.48	6.06	36.47
GO:0009615	response to virus	38	0.74	0.66	8.80	27.27
GO:1903829	positive regulation of cellular protein localization	28	0.60	0.62	7.80	40.87
GO:2000573	positive regulation of DNA biosynthetic process	13	0.80	0.77	9.43	748.29
GO:1904874	positive regulation of telomerase RNA localization to Cajal body	8	1.00	0.79	9.63	22.95
GO:0051086	chaperone mediated protein folding independent of cofactor	1	1.00	0.79	9.63	21.14
