id	name	nbGenes	ICSeco	ICZhou	ICSanchez	ICMazandu
GO:0050896	response to stimulus	575	0.25	0.12	2.65	3.37
GO:0048523	negative regulation of cellular process	509	0.24	0.37	3.90	23.93
GO:0031324	negative regulation of cellular metabolic process	256	0.34	0.46	5.46	80.35
GO:0010941	regulation of cell death	231	0.43	0.47	6.10	12.04
GO:0035556	intracellular signal transduction	223	0.51	0.55	6.92	23.17
GO:0001932	regulation of protein phosphorylation	221	0.50	0.62	7.64	109.03
GO:0010628	positive regulation of gene expression	211	0.47	0.56	6.67	58.80
GO:0051181	cofactor transport	10	0.59	0.55	7.28	10.99
GO:0071702	organic substance transport	194	0.33	0.41	4.62	10.99
GO:0045055	regulated exocytosis	181	0.69	0.69	8.57	38.47
GO:0050778	positive regulation of immune response	178	0.46	0.52	6.76	78.39
GO:0065003	protein-containing complex assembly	178	0.45	0.48	6.06	36.47
GO:0019221	cytokine-mediated signaling pathway	165	0.60	0.63	7.60	26.50
GO:0032774	RNA biosynthetic process	159	0.53	0.62	8.04	473.34
GO:0033993	response to lipid	152	0.53	0.51	6.86	13.32
GO:0008104	protein localization	145	0.40	0.40	5.07	7.46
GO:0030155	regulation of cell adhesion	144	0.48	0.44	5.95	7.96
GO:0001678	cellular glucose homeostasis	9	0.93	0.82	9.53	49.18
GO:0050801	ion homeostasis	133	0.50	0.54	6.88	13.14
GO:0010243	response to organonitrogen compound	133	0.45	0.48	6.23	25.43
GO:0001818	negative regulation of cytokine production	56	0.51	0.55	7.03	44.36
GO:0001819	positive regulation of cytokine production	101	0.51	0.54	6.97	44.26
GO:0050900	leukocyte migration	127	0.60	0.59	8.02	26.94
GO:0006812	cation transport	123	0.45	0.51	6.21	12.09
GO:0006468	protein phosphorylation	119	0.57	0.64	8.18	177.76
GO:0008285	negative regulation of cell proliferation	116	0.56	0.57	7.31	43.61
GO:0001819	positive regulation of cytokine production	101	0.51	0.54	6.97	44.26
GO:0001819	positive regulation of cytokine production	101	0.51	0.54	6.97	44.26
GO:0015672	monovalent inorganic cation transport	63	0.67	0.66	8.33	15.42
GO:0006816	calcium ion transport	39	0.67	0.71	8.69	35.67
GO:0002237	response to molecule of bacterial origin	96	0.69	0.59	8.74	31.75
GO:0002237	response to molecule of bacterial origin	96	0.69	0.59	8.74	31.75
GO:0016046	detection of fungus	1	0.87	0.76	9.47	96.01
GO:0098662	inorganic cation transmembrane transport	82	0.58	0.64	7.91	76.35
GO:1902476	chloride transmembrane transport	17	1.00	0.88	9.63	110.52
GO:0015711	organic anion transport	64	0.43	0.54	6.27	28.20
GO:0006897	endocytosis	72	0.63	0.61	8.09	26.36
GO:0051090	regulation of DNA binding transcription factor activity	65	0.72	0.77	9.22	255.34
GO:0035690	cellular response to drug	53	0.56	0.53	7.02	41.91
GO:0042542	response to hydrogen peroxide	27	0.93	0.76	9.54	79.29
GO:0019932	second-messenger-mediated signaling	54	0.65	0.65	8.32	26.43
GO:0090066	regulation of anatomical structure size	51	0.53	0.46	6.45	8.64
GO:0097190	apoptotic signaling pathway	50	0.70	0.64	8.53	23.17
GO:0032386	regulation of intracellular transport	47	0.49	0.53	6.90	27.75
GO:0071214	cellular response to abiotic stimulus	45	0.59	0.54	7.66	24.78
GO:0001666	response to hypoxia	44	0.81	0.70	9.12	21.16
GO:0050878	regulation of body fluid levels	44	0.58	0.49	7.01	8.64
GO:1904062	regulation of cation transmembrane transport	43	0.49	0.59	7.03	34.83
GO:0000902	cell morphogenesis	38	0.63	0.56	7.92	43.26
GO:0045766	positive regulation of angiogenesis	37	0.81	0.76	9.30	134.49
GO:0001505	regulation of neurotransmitter levels	36	0.49	0.44	5.98	8.64
GO:0043123	positive regulation of I-kappaB kinase/NF-kappaB signaling	34	0.89	0.82	9.52	239.11
GO:0050729	positive regulation of inflammatory response	34	0.66	0.68	8.59	125.85
GO:0048660	regulation of smooth muscle cell proliferation	32	0.83	0.70	9.29	15.51
GO:0006520	cellular amino acid metabolic process	32	0.41	0.53	6.53	77.81
GO:0016579	protein deubiquitination	25	0.73	0.76	9.15	202.60
GO:0002224	toll-like receptor signaling pathway	24	0.68	0.77	9.04	409.66
GO:0002718	regulation of cytokine production involved in immune response	24	0.64	0.64	8.53	57.07
GO:0071346	cellular response to interferon-gamma	23	1.00	0.82	9.63	81.65
GO:0071248	cellular response to metal ion	23	0.70	0.64	8.46	59.28
GO:0009152	purine ribonucleotide biosynthetic process	22	0.63	0.73	9.03	3100.80
GO:0050764	regulation of phagocytosis	22	0.69	0.69	9.05	47.10
GO:0015893	drug transport	22	0.50	0.50	6.29	10.99
GO:0030177	positive regulation of Wnt signaling pathway	21	0.73	0.72	9.04	188.45
GO:0043524	negative regulation of neuron apoptotic process	19	0.79	0.77	9.25	179.63
GO:0010506	regulation of autophagy	18	0.63	0.64	8.27	43.36
GO:0051341	regulation of oxidoreductase activity	18	0.58	0.54	7.59	19.99
GO:0050663	cytokine secretion	18	0.61	0.70	8.23	133.33
GO:1901222	regulation of NIK/NF-kappaB signaling	18	0.84	0.77	9.34	45.07
GO:0055076	transition metal ion homeostasis	17	0.69	0.72	8.83	36.15
GO:0015850	organic hydroxy compound transport	17	0.54	0.56	6.98	14.73
GO:0031663	lipopolysaccharide-mediated signaling pathway	16	1.00	0.82	9.63	26.50
GO:0048146	positive regulation of fibroblast proliferation	16	0.89	0.77	9.43	63.75
GO:0002027	regulation of heart rate	16	0.70	0.70	8.71	26.87
GO:0034121	regulation of toll-like receptor signaling pathway	15	0.61	0.66	8.32	87.36
GO:0007043	cell-cell junction assembly	15	0.75	0.67	8.82	53.94
GO:0043401	steroid hormone mediated signaling pathway	14	0.75	0.70	8.80	25.74
GO:1900407	regulation of cellular response to oxidative stress	14	0.65	0.65	9.00	44.96
GO:0007416	synapse assembly	12	0.84	0.67	9.12	35.85
GO:0022600	digestive system process	12	0.69	0.54	7.78	9.78
GO:0007249	I-kappaB kinase/NF-kappaB signaling	12	1.00	0.82	9.63	26.43
GO:0050706	regulation of interleukin-1 beta secretion	10	0.89	0.86	9.53	155.13
GO:0061515	myeloid cell development	10	0.81	0.66	9.02	32.15
GO:0032570	response to progesterone	10	0.93	0.79	9.55	105.99
GO:0032753	positive regulation of interleukin-4 production	9	0.93	0.79	9.52	64.95
GO:0001774	microglial cell activation	9	0.93	0.79	9.51	31.20
GO:0043032	positive regulation of macrophage activation	8	0.93	0.82	9.55	126.60
GO:1902042	negative regulation of extrinsic apoptotic signaling pathway via death domain receptors	8	0.93	0.88	9.59	425.74
GO:0055094	response to lipoprotein particle	8	0.87	0.72	9.27	38.33
GO:0006641	triglyceride metabolic process	8	0.84	0.77	9.32	85.59
GO:0006778	porphyrin-containing compound metabolic process	8	0.62	0.60	8.53	104.51
GO:0051770	positive regulation of nitric-oxide synthase biosynthetic process	8	1.00	0.85	9.63	147.29
GO:0006691	leukotriene metabolic process	7	0.76	0.73	9.19	59.93
GO:0034605	cellular response to heat	7	0.84	0.71	9.26	50.43
GO:0097421	liver regeneration	6	1.00	0.82	9.63	47.22
GO:0031670	cellular response to nutrient	6	0.62	0.63	8.51	111.40
GO:0035094	response to nicotine	6	0.93	0.72	9.45	26.17
GO:0046697	decidualization	6	1.00	0.75	9.63	34.68
GO:0030194	positive regulation of blood coagulation	6	0.77	0.76	9.34	205.45
GO:0032781	positive regulation of ATPase activity	6	0.75	0.70	8.78	51.42
GO:0042832	defense response to protozoan	6	0.93	0.79	9.54	69.65
GO:0042953	lipoprotein transport	6	1.00	0.88	9.63	68.45
GO:0010744	positive regulation of macrophage derived foam cell differentiation	5	1.00	0.82	9.63	113.86
GO:0044130	negative regulation of growth of symbiont in host	5	1.00	0.85	9.63	102.69
GO:0043392	negative regulation of DNA binding	5	0.76	0.67	8.87	32.53
GO:0086009	membrane repolarization	5	0.76	0.70	9.16	39.58
GO:1904036	negative regulation of epithelial cell apoptotic process	5	0.79	0.77	9.15	105.53
GO:0002606	positive regulation of dendritic cell antigen processing and presentation	5	0.89	0.77	9.43	55.29
GO:0042359	vitamin D metabolic process	4	0.78	0.68	9.19	64.81
GO:0071447	cellular response to hydroperoxide	4	0.87	0.72	9.49	143.11
GO:0086064	cell communication by electrical coupling involved in cardiac conduction	4	0.83	0.66	8.94	22.01
GO:0019755	one-carbon compound transport	4	0.79	0.68	9.04	14.73
GO:0010656	negative regulation of muscle cell apoptotic process	4	0.84	0.80	9.49	104.61
GO:0002479	antigen processing and presentation of exogenous peptide antigen via MHC class I, TAP-dependent	4	1.00	0.82	9.63	33.25
GO:0009437	carnitine metabolic process	4	0.87	0.72	9.37	68.67
GO:0007252	I-kappaB phosphorylation	4	1.00	0.88	9.63	180.75
GO:0032736	positive regulation of interleukin-13 production	3	0.89	0.77	9.43	65.24
GO:0002674	negative regulation of acute inflammatory response	3	0.74	0.74	9.13	164.84
GO:0032754	positive regulation of interleukin-5 production	3	0.89	0.77	9.43	65.24
GO:2000310	regulation of NMDA receptor activity	3	0.89	0.84	9.54	200.75
GO:0060307	regulation of ventricular cardiac muscle cell membrane repolarization	3	0.81	0.80	9.47	48.26
GO:0048699	generation of neurons	3	0.93	0.76	9.47	21.76
GO:0072531	pyrimidine-containing compound transmembrane transport	3	0.79	0.68	9.18	43.70
GO:1900227	positive regulation of NLRP3 inflammasome complex assembly	3	1.00	0.85	9.63	140.38
GO:0051964	negative regulation of synapse assembly	3	0.83	0.76	9.44	219.30
GO:0002369	T cell cytokine production	3	0.87	0.76	9.49	52.63
GO:0002309	T cell proliferation involved in immune response	2	0.87	0.78	9.52	137.08
GO:2000334	positive regulation of blood microparticle formation	2	0.93	0.79	9.55	107.44
GO:0045454	cell redox homeostasis	2	1.00	0.79	9.63	31.94
GO:0038183	bile acid signaling pathway	2	0.89	0.74	9.34	23.17
GO:0048714	positive regulation of oligodendrocyte differentiation	2	1.00	0.92	9.63	471.69
GO:0046415	urate metabolic process	2	0.89	0.74	9.49	153.84
GO:0034395	regulation of transcription from RNA polymerase II promoter in response to iron	2	0.89	0.88	9.53	252.65
GO:0010248	establishment or maintenance of transmembrane electrochemical gradient	2	1.00	0.82	9.63	27.94
GO:0051156	glucose 6-phosphate metabolic process	2	0.87	0.72	9.34	72.83
GO:1990000	amyloid fibril formation	2	1.00	0.79	9.63	65.11
GO:0046835	carbohydrate phosphorylation	2	0.93	0.79	9.54	67.31
GO:1903974	positive regulation of cellular response to macrophage colony-stimulating factor stimulus	2	0.93	0.82	9.55	111.62
GO:0015851	nucleobase transport	2	0.72	0.65	8.78	29.45
GO:0010886	positive regulation of cholesterol storage	2	1.00	0.85	9.63	69.45
GO:0006833	water transport	2	0.81	0.70	9.04	11.68
GO:0000160	phosphorelay signal transduction system	2	0.84	0.74	9.27	26.43
GO:0070839	divalent metal ion export	2	0.89	0.82	9.43	35.67
GO:0043619	regulation of transcription from RNA polymerase II promoter in response to oxidative stress	1	0.81	0.85	9.52	532.70
GO:0060058	positive regulation of apoptotic process involved in mammary gland involution	1	1.00	0.92	9.63	328.43
GO:0032741	positive regulation of interleukin-18 production	1	0.93	0.79	9.52	64.95
GO:0060745	mammary gland branching involved in pregnancy	1	1.00	0.88	9.63	86.12
GO:0045342	MHC class II biosynthetic process	1	1.00	0.79	9.63	39.16
GO:0000821	regulation of arginine metabolic process	1	0.78	0.76	9.30	103.95
GO:0085018	maintenance of symbiont-containing vacuole by host	1	1.00	0.82	9.63	26.84
GO:0032707	negative regulation of interleukin-23 production	1	0.93	0.79	9.52	64.97
GO:0015837	amine transport	1	0.78	0.68	9.02	29.45
GO:0032289	central nervous system myelin formation	1	1.00	0.82	9.63	33.54
GO:0015707	nitrite transport	1	1.00	0.85	9.63	31.19
GO:0070561	vitamin D receptor signaling pathway	1	1.00	0.82	9.63	25.57
GO:0030950	establishment or maintenance of actin cytoskeleton polarity	1	1.00	0.82	9.63	64.11
GO:0014806	smooth muscle hyperplasia	1	1.00	0.82	9.63	38.94
GO:0044546	NLRP3 inflammasome complex assembly	1	1.00	0.82	9.63	44.52
GO:0045618	positive regulation of keratinocyte differentiation	1	0.93	0.84	9.58	360.60
GO:0035635	entry of bacterium into host cell	1	1.00	0.85	9.63	28.37
GO:0055096	low-density lipoprotein particle mediated signaling	1	1.00	0.82	9.63	23.86
GO:0046878	positive regulation of saliva secretion	1	1.00	0.85	9.63	141.11
GO:0071243	cellular response to arsenic-containing substance	1	0.87	0.68	9.38	38.72
GO:1902311	regulation of copper ion transmembrane transport	1	0.89	0.82	9.45	56.27
